[
  {
    "question": "When is the Spring Carnival taking place at Carnegie Mellon University?",
    "context": [
      "Contact alumni-house@andrew.cmu.edu. With more than 33,000 alumni, parents, faculty, staff, students and friends in the region, the Pittsburgh network is the largest regional network of the Carnegie Mellon University Alumni Association. Event registrations close April 8th at 10:00 AM EDT. Free. PHL - Women\u2019s History Month Dinner in Philly. March 10, 2025, 7:00pm - 8:00pm EDT. Osteria Philly, 640 N Broad St, Philadelphia, Pennsylvania 19130. Join the CMU Philadelphia Network for an intimate dinner to celebrate Women\u2019s History Month. Come reconnect with your former classmates and meet new friends over a delicious Neapolitan pizza dinner. We look forward to seeing you! Space is limited due to venue capacity restrictions, so register today. Registration is required for attendance and walk-ins are NOT permitted. Questions? Contact alumni-house@andrew.cmu.edu. There are over 4,200 alumni, students, parents and friends in the Philadelphia Network throughout Montgomery, Philadelphia, Chester, Bucks and Delaware counties. Event registrations closed March 6th at 11:59 PM EST. $30.00 per person. NYC - Spring Carnival Kickoff Happy Hour. April 3, 2025, 6:30pm - 8:30pm EDT. TALEA Beer Co. Penn District, 160 W 32nd St, New York, New York 10001. Can't make it to Pittsburgh for Carnival? Don't worry. The NY Metro Network has you covered. Join us for a special Kickoff Happy Hour at Talea Beer Co. Penn District. Show your Tartan Pride! We'll have door prizes and swag. We are so grateful to TALEA for hosting us. We hope that you will join us and consider showing your appreciation by purchasing from their menu featuring drafts, hazy beers or IPAs, sours, can pours, cocktails, non-alcoholic beverages, wines, ciders, or snacks. Questions? Contact alumni-house@andrew.cmu.edu. With over 13,000 alumni, parents, students and friends in the New York Metro area, the network is one of the largest regional networks for the Carnegie Mellon University Alumni Association. Event registrations close",
      "on Friday, January 28. PITTSBURGH, PA (January.",
      "(W. Track and Field) Carnegie Mellon Invitational. March 28, 2025. All Day. (W. Track and Field) Carnegie Mellon Invitational Add to my calendar. CMU Tartans logo Contact Info: Full Athletics Schedule. Ostara. March 20, 2025. All Day. On March 20, Wiccans and Neo-pagans celebrate Ostara, which occurs on the Spring Equinox. It is named after the Anglo-Saxon goddess, Eostre. Ostara rituals and gatherings focus on fertility, rebirth, and renewal. Add to my calendar. Libraries Workshop: Analyzing Scholarly Literature Using Bibliometrics. April 7, 2025.",
      "Session 2: July 23-27 at the University of Pittsburgh. Session 3: July 30- August 3 at CCAC/Northside Campus. Session 4: August 6-10 at Chatham University. Each daily session runs from 8:30 a.m.",
      "Know all the details before making your trip! 2025 FESTIVAL DATES: Friday, September 5 (4pm \u2013 11pm) Saturday, September 6 (11am \u2013 11pm) Sunday, September 7 (9am \u2013 5pm). FESTIVAL LOCATION:\n\nCarrie Blast Furnaces\n\n801 Carrie Furnace Blvd. Pittsburgh, PA 15218. Tickets. Tickets are date-specific. Purchasing tickets online in advance is highly recommended. Get yours today! Friday, September 5: $18 Super Early Bird (through 5/1/25) $20 Adults in Advance (through 9/3/25) $24 Adults at the Gate. Saturday, September 6: $20 Super Early Bird (through 5/1/25) $22 Adults in Advance (through 9/3/25) $26 Adults at the Gate. Sunday, September 7: $17 Super Early Bird (through 5/1/25) $18 Adults in Advance (through 9/3/25) $22 Adults at the Gate. Seniors (60+), Students, Public Safety/Military (retired or active), & Nurses (must show ID at gate) \u2022 $2 off current pricing. Children 12 and Under \u2022 FREE. Weekend Passes \u2022 $52 through 5/1/25, $60 through 9/3/25, $65 at the gate. Group discounts are available for groups of 20 or more! $10 \u201cHappy Hour\u201d Admission \u2022 Friday from 4 pm \u2013 6 pm (must enter event before 6:15 pm, available in person at gate only). $10 Admission \u2022 Friday from 6 pm \u2013 8 pm with College I.D. (in person at gate only)."
    ],
    "answer": "April 3, 2025",
    "reference_answer": "From April 3 to 5, 2025."
  },
  {
    "question": "When can students add or drop courses in the summer term according to the academic calendar?",
    "context": [
      "The Winter Break period is not included. Meal plan charges are adjusted weekly. Dine Express and Campus Express are assessed based upon actual use. There is no adjustment of the PAT bus fee or Student Activity fee. Financial Aid Adjustment Federal and institutional financial aid is adjusted on the same basis as tuition. A student earns 100% of his or her federal or institutional financial aid when 60% of the semester is completed. Student grants and non-federal outside scholarships are adjusted based upon the withdrawal policy of the agency awarding the funds. Undergraduate Course Meeting Policy Policy Statement No undergraduate classes, exams, academic, or artistic activities (including: extra help session, rehearsals, ROTC drill, make-up exams, etc.) are scheduled on weekdays between 4:50 p.m. and 6:50 p.m. Extra class time beyond those regularly scheduled must take place either before 4:50 p.m. or after 6:50 p.m. Undergraduate Course Meeting Procedure This policy is not intended to reduce the rigor or vigor of the academic or artistic programs, but to ensure that students have a period in which they are free to carry on co- curricular activities and athletics. Scheduling classes, exams, or other academic and artistic activities makes it very difficult for the students to meet these commitments. Since we are all concerned about the quality of life at the university, this time must be held for the students. In planning the academic course schedule, the University Registrar's Office will review all courses to ensure that no academic or artistic courses be scheduled in this period. In addition, any requests to schedule additional or makeup course meetings, review and/or study sessions, teaching assistant office hours, or other course-related meetings, must take place either before 4:50 p.m. or after 6:50 p.m. This includes meetings in all university spaces, not just within University Registrar's Office-controlled classrooms. 113",
      "should be advised to check with their individual colleges/departments/programs for details. The deadline to drop a mini-semester course is the last day of the second week of the mini-semester course. When a course is dropped by these deadlines, the course is removed and does not appear on the academic record. After the deadline to drop, students may withdraw from a course by accessing on-line registration by the end of the 10th week of class as noted in the academic calendar. After the deadline to drop, a W (withdrawal) grade is assigned and appears on the student's academic record. W grades do not apply to graduate students except in Tepper and MCS. Students may use a late drop voucher for a limited number of course drops after the deadline during the pursuit of their degree. This action must be taken through consultation with their academic advisor or associate dean. Details on the late drop",
      "Summer One & Mini-5 pass/no pass & withdrawal deadline. June 9, 2025. All Day. The Academic Calendar includes registration dates, class start dates, add/drop deadlines, exam dates, and more. Doctoral course-sections follow a separate academic calendar. Calendars for Heinz College, Tepper School of Business graduate courses, CMU-Africa, CMU-Australia, and CMU-Qatar can be found on The HUB Academic Calendar web page. Add to my calendar. Contact Info: Web: The HUB Academic Calendar Email: cmuregistrar@andrew.cmu.edu. Neurodivergence and the Accommodation Process. March 28, 2025.",
      "Final Examinations 1. All scheduled final examinations are held at the end of the semester during the university's official final examination period. Comprehensive final examinations are not required for each course, but are given at the option of the department or instructor. The reading day and weekend preceding the examination days shall never be used for examination purposes of any kind, unless a student opts to take a self- scheduled examination during this time. Non-comprehensive final examinations or final projects (but not both) are allowed during this final examination period only in courses that do not give a final comprehensive examination. 2. Instructors are expected to return all work assigned no later than the last regular day of classes in courses for which there is a final examination. In cases when this is not possible, an answer key, solution sets or equivalent feedback should be provided unless the final examination will not cover material in work that has not been returned. 44",
      "However, renewal contracts must conform with this policy. Retention of Student Work Policy The university reserves the right in all colleges to retain indefinitely any student work the faculty may select. All work not retained by the university must be claimed at the time specified on the bulletin boards (or other forms of communication) of the department concerned; otherwise, the work will be destroyed. Statute of Limitations \u2013 Master\u2019s Studies Students will complete all requirements for the master\u2019s degree within a maximum of seven years from original matriculation as a master\u2019s student, or less if required by a more restrictive department, school or college policy. Once this time-to-degree limit has lapsed, the person may resume work towards a master\u2019s degree only if newly admitted to a currently offered master\u2019s degree program under criteria determined by that program. Under extenuating circumstances, such as leave of absence, military or public service, family or parental leave, or temporary disability, a college/school may, upon the relevant department's recommendation and with the written approval of the dean (or designate), defer the lapse for a period commensurate with the duration of that interruption. Students who are pursuing the master\u2019s degree as part-time students for all semesters of their program, as approved by their program, may also appeal to their program or department for extension of the time to degree limit. 86"
    ],
    "answer": "June 9, 2025",
    "reference_answer": "According to the academic calendar, students can add or drop courses in the summer term until the specified date. (The context does not provide the exact date, so the answer is incomplete.)"
  },
  {
    "question": "When is the opening reception for the Derek Norman exhibition at Carnegie Mellon University?",
    "context": [
      "Family Weekend. October 3 - 4, 2025. All Day (until October 4). Family Weekend brings together Carnegie Mellon undergraduate and graduate students and their families and friends for a weekend of events that showcase the vibrancy of the campus experience. Family Weekend features academic welcomes, information sessions, campus tours, student performances and other events. Add to my calendar. Contact Info: family@andrew.cmu.edu Related Content: Family Weekend Website. Independence Day; University Closed & No Classes. July 4, 2025. All Day. The Academic Calendar includes registration dates, class start dates, add/drop deadlines, exam dates, and more. Doctoral course-sections follow a separate academic calendar. Calendars for Heinz College, Tepper School of Business graduate courses, CMU-Africa, CMU-Australia, and CMU-Qatar can be found on The HUB Academic Calendar web page. Add to my calendar. Contact Info: Web: The HUB Academic Calendar Email: cmuregistrar@andrew.cmu.edu. University Archives: Drop-in Hours. April 17, 2025. 10 a.m. - 4 p.m. University Archives, Hunt Library 2nd Floor Repeats weekly (to Apr 24). On Thursdays between 10 a.m. and 4 p.m., the University Archives is open to researchers and the CMU community. Drop in, check out the item of the week, explore our collections, or learn how to navigate our discovery tools. All levels of curiosity are welcomed! No appointment is needed on Thursdays. While appointments are unnecessary, we still recommend you contact us ahead of time about what you would like to look at, as not all collections are stored on-site. Add to my calendar. Contact Info: https://library.cmu.edu/distinctive-collections/university-archives. Uncommon Perfection: Illustrations by Derek Norman. April 21, 2025.",
      "on Friday, January 28. PITTSBURGH, PA (January.",
      "Continues through May 9. Hunt Institute for Botanical Documentation 5000 Forbes Ave., Pittsburgh Oakland. In celebration of the recent acquisition of over 200 artworks by Derek Norman, this exhibition highlights work created over the last three decades and reflects his lifelong interest in the beauty of nature. Join us Thursday, 13 March, 5:00-7:00 p.m.",
      "A Museum Experience Associate will orient you to our campus and help you purchase day-of tickets, if available. Tickets\n\n================================================================================",
      "Session 2: July 23-27 at the University of Pittsburgh. Session 3: July 30- August 3 at CCAC/Northside Campus. Session 4: August 6-10 at Chatham University. Each daily session runs from 8:30 a.m."
    ],
    "answer": "April 21, 2025.",
    "reference_answer": "The opening reception for the Derek Norman exhibition is on March 13, from 5-7 p.m."
  },
  {
    "question": "When is the EDIE Makeathon taking place?",
    "context": [
      "on Friday, January 28. PITTSBURGH, PA (January.",
      "Breakfast will be available at the concession stand starting at 7:00AM. After the race, there will be an award ceremony, many fun children\u2019s activities, charitable hair donations, dance performances, basket raffle & silent auction, and full concession stand of lunch items available for purchase. (If you are interested in donating your hair, please email RaceForGrace@reflectionsofgrace.org). Visit our merchandise gift store and awareness areas, which will be open throughout the day as well. 4128487201. Fundraisers. GET TICKETS $25-$30. https://www.reflectionsofgrace.org/index.php/events/race-for-grace. Tillman Honor Run. Sat., April 5, 9-11 a.m. Ohio Township Community Park Nature Center, 325 Nicholson Road, Sewickley Sewickley. Tillman Honor Runs celebrate and honor the legacy of ASU alum and Army Ranger Pat Tillman. This April, Tillman Honor Runs will be held in 38 cities around the U.S. The 4.2 mile fun runs are open to the public and provide support to the Tillman Scholars program. 4124153584.",
      "2025 - The Cleveland dance Project was founded by a Carnegie Mellon alum, Anna Cerveny. The dance showcase will feature short works by dozens of choreographers, and more than 150 local adult dancers from the beginner to the professional. You'll see dance styles including hip hop, contemporary, modern, musical theater, jazz, ballet, heels, and pom! Following the dance showcase, there will be an exclusive Meet & Greet for the Alumni Network with Anna. Questions? Contact alumni-house@andrew.cmu.edu. The Northeast Ohio Network has over 1,200 alumni, students, parents and friends in the region. Event registrations close April 11th at 11:59 PM EDT. $15.00 per person. PIT - March Cranberry Township Neighborhood Luncheon. March 21, 2025, 12:00pm - 1:30pm EDT. Juniper Grill - Cranberry, 2030 MacKenzie Way, Suite 800, Cranberry Township, Pennsylvania 16066. Join us for a monthly luncheon in Cranberry Township and network with other local alumni. This event is scheduled every third Friday of the month, so save the dates in your calendar. Registration is free, food and drink on your own. Questions?",
      "Event: First Full Squad Workout\n\nDate: Feb 22 (Sat)\n\nOpponent: Orioles (BAL)\n\nType: vs vs. Event:\n\nOutcome: W,\n\nDate: Feb 23 (Sun)\n\nOpponent: Twins (MIN)\n\nType: vs vs.",
      "THURSDAY, JULY 18\n\nSTANWIX ST. STAGE\n\nPerformance: 12:00\n\n1:00pm + Nick Guckert\n\nPerformance: 1:30\n\n2:30pm + Jay Wiley\n\nPerformance: 3:00 - 4:30pm + The Chris Casalinuovo Band\n\nPerformance: 5:00\n\n6:00pm + Casey Catone\n\nPerformance: 6:30 - 8:30pm + Mean Blue Planets\n\nPerformance: 9:00\n\n10:00pm + The Polkamaniacs\n\nSMITHFIELD ST. STAGE Performance: 12:00 - 1:00 pm + Melina Bowser feat. Dave Schmiech\n\nPerformance: 1:30 - 2:30 pm + Pickle Mafia\n\nPerformance: 3:00 - 4:00 pm + Pioneer Records - The Pit Crew\n\nPerformance: 4:30 - 5:30 pm + Caleb Kopta\n\nPerformance: 6:00 - 7:00 pm + Megan Paullet\n\nPerformance: 7:30 - 8:30 pm + Michael Christopher Band\n\nPerformance: 9:00 - 10:00 pm + The Conspiracy Theory\n\nFRIDAY, JULY 19\n\nSTANWIX ST. STAGE Performance: 12:00 - 1:00 pm + Kelley Jeanne\n\nPerformance: 1:30 - 2:30 pm + Elias Khouri\n\nPerformance: 3:00 - 4:00 pm + Echoes on Water\n\nPerformance: 4:30 - 5:30 pm + The Altered Egos\n\nPerformance: 6:00 - 7:00 pm + MASON. & Mr. Business\n\nPerformance: 7:30 - 8:30 pm + Full Fat\n\nPerformance: 9:00 - 10:00 pm + Franchise Band\n\nSMITHFIELD ST. STAGE Performance: 12:00 - 1:00 pm + Project Banjo\n\nPerformance: 1:30 - 2:30 pm + Max Rosen\n\nPerformance: 3:00 - 4:00 pm + Big Blitz\n\nPerformance: 4:30 - 5:30 pm + This-That & The Other Thing\n\nPerformance: 6:00 - 7:00 pm + Zinnia's Garden\n\nPerformance: 7:30 - 8:30 pm + Miss Freddye's Blues Band\n\nPerformance: 9:00\n\n10:00 pm + Pennsoulvanians\n\nSATURDAY, JULY 20\n\nSTANWIX ST. STAGE Performance: 12:00 - 1:00 pm + Anne Eliza\n\nPerformance: 1:30 - 2:30 pm + The Redlines\n\nPerformance: 3:00 - 4:00 pm + Paging Doctor Moon\n\nPerformance: 4:30\n\n5:30 pm + Chillhouse\n\nPerformance: 6:00 - 7:00 pm + Justin Fabus\n\nPerformance: 7:30 - 8:30 pm + The Appalachian Soul Man Aristotle Jones\n\nPerformance: 9:00 - 10:00 pm + Pickup Line\n\nSMITHFIELD ST. STAGE Performance: 12:00-1:00 pm + Jessica Bella Band\n\nPerformance: 1:30-2:30 pm + William Matheny\n\nPerformance: 3:00-4:00 pm + Pioneer Records - James the Seventh\n\nPerformance: 4:30"
    ],
    "answer": "Friday, January 28",
    "reference_answer": "The EDIE Makeathon is taking place on March 21 - 22, 2025."
  },
  {
    "question": "Who are the performers in the Carnegie Mellon Chamber Series: Schumann & Schubert event?",
    "context": [
      "Carnegie Mellon Chamber Series: Schumann & Schubert. Tue., April 1, 7:30-9:30 p.m. Carnegie Mellon University Kresge Theater, College of Fine Arts 5000 Forbes Ave, Pittsburgh Oakland. Carnegie Mellon Chamber Series: Schumann & Schubert The Carnegie Mellon University Chamber Series brings together members of the CMU Faculty and Pittsburgh Symphony Orchestra for outstanding music making in an intimate space. Program: Schumann Piano Quartet in E-flat major, op. 47 David McCarroll, violin David Harding, viola Angela Park, cello Dimitri Papadimitriou, piano Schubert String Quintet, D.956 David McCarroll, violin Marta Krechkovsky, violin David Harding, viola Anne Martindale Williams, cello Angela Park, cello Cost: Free and open to the public; Tickets required. 412-268-2383. Classical. GET TICKETS Free. https://www.eventbrite.com/e/carnegie-mellon-chamber-series-schumann-schubert-tickets-1013892117617?aff=oddtdtcreator. Kid's Books for Grown-Ups Bookclub. First Tuesday of every month, 10 a.m. Penguin Bookshop 417 \u00bd Beaver St., Sewickley Sewickley. 412-741-3838.",
      "Sullivan King: https://promowestlive.com/pittsburgh/stage-ae/2025/02/sullivan-king-chaos-will-bring-peace-2025-us-tour\n\nHippo Campus: https://promowestlive.com/pittsburgh/stage-ae/2025/02/hippo-campus-flood-tour\n\nBabyface Ray: https://promowestlive.com/pittsburgh/stage-ae/2025/02/babyface-ray-wavy-navy-university-tour\n\nLettuce + GZA: https://promowestlive.com/pittsburgh/stage-ae/2025/02/lettuce-gza\n\nDestroy Lonely: https://promowestlive.com/pittsburgh/stage-ae/2025/02/destroy-lonely-forever-tour2\n\nAlan Walker: https://promowestlive.com/pittsburgh/stage-ae/2025/02/alan-walker\n\nDonna the Buffalo: https://mrsmalls.com/events/donna-the-buffalo-3/\n\nDancing Queen: https://www.riverscasino.com/pittsburgh/entertainment/dancingqueen\n\nBoyz II Men: https://www.riverscasino.com/pittsburgh/entertainment/BoyzIIMen\n\nFather John Misty: https://promowestlive.com/pittsburgh/stage-ae/2025/02/father-john-misty2\n\nGeorge Thorogood: https://www.riverscasino.com/pittsburgh/entertainment/georgethorogood\n\nJoss Stone: https://librarymusichall.com/event/joss-stone\n\nVelveeta: https://www.riverscasino.com/pittsburgh/entertainment/velveeta\n\nAshley Cooke: https://promowestlive.com/pittsburgh/stage-ae/2025/03/ashley-cooke\n\nRon Pope: https://mrsmalls.com/events/ron-pope-neon-and-glass-world-tour-2025/\n\nTheo Von: https://www.axs.com/events/672531/theo-von-return-of-the-rat-tickets?skin=petersenevents\n\nMOE: https://mrsmalls.com/events/moe-circle-of-giants-tour/\n\nKraftwerk: https://promowestlive.com/pittsburgh/stage-ae/2025/03/kraftwerk-multimedia-tour-2025-50-years-of-autobahn\n\nCavalera: https://mrsmalls.com/events/cavalera-third-world-trilogy-tour/\n\nJeff Jimerson: https://www.riverscasino.com/pittsburgh/entertainment/jeffjimersonand\n\nEnjoy Wrestling: https://mrsmalls.com/events/dearly-beloved/\n\nNoah Thompson: https://crafthousepgh.com/noah-thompson-%E2%88%99-march-9-2025/\n\nSevendust: https://mrsmalls.com/events/sevendust/\n\nDaniel Donato: https://mrsmalls.com/events/daniel-donatos-cosmic-country/",
      "Title: Beethoven and Mahler Event_link: https://www.pittsburghsymphony.org//production/92965/beethoven-and-mahler Date: Fri, Jun  6 - Sun, Jun  8, 2025 Venue: Heinz Hall Organization: Pittsburgh Symphony Orchestra Categories: ['Classical', 'Live Music']\n\nTitle: PSO360: Alice Sara Ott, piano Event_link: https://www.pittsburghsymphony.org//production/93551/pso360-alice-sara-ott-piano Date: Sat, Jun  7, 2025 Venue: Heinz Hall Organization: Pittsburgh Symphony Orchestra Categories: ['Classical', 'Live Music']\n\nTitle: Rana Plays Mendelssohn\n\nEvent_link: https://www.pittsburghsymphony.org//production/92966/rana\n\nplays\n\nmendelssohn\n\nDate: Fri, Jun 13\n\nSun, Jun 15, 2025\n\nVenue: Heinz Hall\n\nOrganization: Pittsburgh Symphony Orchestra\n\nCategories: ['Classical', 'Live Music']\n\nTitle: Dolly Parton's Threads: My Songs in Symphony Event_link: https://www.pittsburghsymphony.org//production/98293/dolly-partons-threads-my-songs-in-symphony Date: Wed, Jun 18, 2025 Venue: Heinz Hall Organization: Pittsburgh Symphony Orchestra Categories: ['Live Music', 'Concert']\n\nTitle: Adam Ray is Dr. Phil Event_link: https://www.pittsburghsymphony.org//production/99241/adam-ray-is-dr-phil Date: Thu, Jun 19, 2025 Venue: Heinz Hall Organization: Drusky Entertainment Categories: ['Comedy']\n\nTitle: Kings of Soul\n\nEvent_link: https://www.pittsburghsymphony.org//production/93247/kings\n\nof\n\nsoul\n\nDate: Fri, Jun 20\n\nSun, Jun 22, 2025\n\nVenue: Heinz Hall\n\nOrganization: Pittsburgh Symphony Orchestra\n\nCategories: ['Live Music', 'Concert']\n\nTitle: The Lord of the Rings: The Fellowship of the Ring Event_link: https://www.pittsburghsymphony.org//production/94962/the-lord-of-the-rings-the-fellowship-of-the-ring Date: Fri, Jun 27 - Sun, Jun 29, 2025 Venue: Heinz Hall Organization: Pittsburgh Symphony Orchestra Categories: ['Live Music', 'Film']",
      "to 09:30 pm. Alumni Concert Hall, College of Fine Arts at 5000 Forbes Avenue Pittsburgh, Pennsylvania, United States, 15213. CMU Chorus & Singers Thomas W. Douglas , director Program: TBA Cost: Free and open to the public; Tickets required. School of Music Box Office 412-268-2383 412-268-2383. This is a free event!",
      "MAR 28 2025, 8:00 PM FRI. 15120, Pittsburgh, Pennsylvania, US. Carnegie of Homestead Music Hall. Prices from $85. Henry Cho."
    ],
    "answer": "members of the CMU Faculty and Pittsburgh Symphony Orchestra",
    "reference_answer": "The performers in the Carnegie Mellon Chamber Series: Schumann & Schubert event are David McCarroll (violin), David Harding (viola), Angela Park (cellist), and Dimitri Papadimitriou (pianist)."
  },
  {
    "question": "What is the purpose of the Academic Calendar web page at Carnegie Mellon University?",
    "context": [
      "Family Weekend. October 3 - 4, 2025. All Day (until October 4). Family Weekend brings together Carnegie Mellon undergraduate and graduate students and their families and friends for a weekend of events that showcase the vibrancy of the campus experience. Family Weekend features academic welcomes, information sessions, campus tours, student performances and other events. Add to my calendar. Contact Info: family@andrew.cmu.edu Related Content: Family Weekend Website. Independence Day; University Closed & No Classes. July 4, 2025. All Day. The Academic Calendar includes registration dates, class start dates, add/drop deadlines, exam dates, and more. Doctoral course-sections follow a separate academic calendar. Calendars for Heinz College, Tepper School of Business graduate courses, CMU-Africa, CMU-Australia, and CMU-Qatar can be found on The HUB Academic Calendar web page. Add to my calendar. Contact Info: Web: The HUB Academic Calendar Email: cmuregistrar@andrew.cmu.edu. University Archives: Drop-in Hours. April 17, 2025. 10 a.m. - 4 p.m. University Archives, Hunt Library 2nd Floor Repeats weekly (to Apr 24). On Thursdays between 10 a.m. and 4 p.m., the University Archives is open to researchers and the CMU community. Drop in, check out the item of the week, explore our collections, or learn how to navigate our discovery tools. All levels of curiosity are welcomed! No appointment is needed on Thursdays. While appointments are unnecessary, we still recommend you contact us ahead of time about what you would like to look at, as not all collections are stored on-site. Add to my calendar. Contact Info: https://library.cmu.edu/distinctive-collections/university-archives. Uncommon Perfection: Illustrations by Derek Norman. April 21, 2025.",
      "preparation, personal or course Web page publication, or other activity that can facilitate convenience or enhance productivity, to the extent that the activity is within the limits described by Responsible Sharing of Resources. Any personal use of computing resources related to operating a personal business or commercial enterprise is prohibited unless permission to do so has been specifically granted by the provost or the provost\u2019s designee. We do recognize the difficulty of distinguishing whether certain cases of \u201cpersonal use\u201d are allowable, such as activities that result in personal financial gain (e.g. checking stock prices online), relate to a commercial business (e.g. university-sponsored technology transfer efforts), or support (but do not constitute operating) a personal business (e.g. a student developing a business plan or a faculty member writing a report for a consulting engagement outside the university). In such cases, we rely on individuals to be responsible and judicious in the use of university\u2019s shared computing resources. In particular ensuring: \u2022 appropriate use of resources (e.g. any such work is completed outside of university time and does not utilize shared resources such as CPU cycles or network bandwidth to a degree that adversely impacts academic or research activities); \u2022 appropriate use of licenses (e.g. do not use software procured with academic use licenses for commercial applications or development, unless the license explicitly permits such use); \u2022 appropriate marketing (e.g. no creation of \u201c.com\u201d domains within Carnegie Mellon\u2019s \u201cedu\u201d domain, no advertising services and products using Carnegie Mellon email accounts, and no advertising using web pages on Carnegie Mellon servers (any server with a .CMU.EDU host name). In cases of questionable personal use of resources, you may contact it- help@andrew.cmu.edu to determine whether a particular activity is permissible. We reserve the right to restrict personal use of university",
      "You may then click bookmarks to go to specific points within The Word Student Handbook PDF. 4\n\nCarnegie Mellon Vision and Mission Vision Carnegie Mellon University will have a transformative impact on society through continual innovation in education, research, creativity, and entrepreneurship. Mission To create a transformative educational experience for students focused on deep disciplinary knowledge; problem solving; leadership, communication, and interpersonal skills; and personal health and well-being. To cultivate a transformative university community committed to (a) attracting and retaining diverse, world-class talent; (b) creating a collaborative environment open to the free exchange of ideas, where research, creativity, innovation, and entrepreneurship can flourish; and (c) ensuring individuals can achieve their full potential. To impact society in a transformative way \u2014 regionally, nationally, and globally \u2014 by engaging with partners outside the traditional borders of the university campus. 5\n\nCarnegie Mellon Code",
      "Official Events Calendar(opens in new window): https://events.cmu.edu/\n\nfacebook (opens in a new window): https://www.facebook.com/carnegiemellonu\n\ntwitter (opens in a new window): https://www.twitter.com/carnegiemellon\n\nlinkedin (opens in a new window): https://www.linkedin.com/edu/school?id=19232\n\nyoutube (opens in a new window): https://www.youtube.com/cmu\n\nrss (opens in a new window): https://www.cmu.edu/news/feeds/news.rss\n\ninstagram (opens in a new window): https://www.instagram.com/carnegiemellon/\n\nmore (opens in a new window): https://www.cmu.edu/social-media/",
      "Social Regulations Events that are in any way identified with Carnegie Mellon and are conducted by students or student organizations for purely social purposes are covered by the following regulations: \u2022 Any such event, whether on or off campus, must comply with city, state and federal laws. Carnegie Mellon accepts no responsibility for the direct supervision of the social activities engaged in by its students and student organizations. \u2022 Student organizations must submit this form to the Director of Student Leadership, Involvement and Civic Engagement for review and approval prior to any events being held during final examinations, during final examinations, on the night before any recess, or during any recess of more than three days duration. \u2022 It is expected that students will organize and conduct social activities in a responsible manner. \u2022 The university reserves the right to review the planning for social events requiring the use of university facilities and to establish special requirements as needed to ensure the well-being of all students. Last revised Spring 1998. Statement of Assurance Policy The Statement of Assurance must be placed in all graduate and undergraduate admissions publications and all other publications where such a statement is necessary or appropriate. Also, the Carnegie Mellon Writer's Style Guide gives detailed guidance on how to use the statement of assurance in campus-related publications. Carnegie Mellon University does not discriminate in admission, employment, or administration of its programs or activities on the basis of race, color, national origin, sex, handicap or disability, age, sexual orientation, gender identity, religion, creed, ancestry, belief, veteran status, or genetic information. Furthermore, Carnegie Mellon University does not discriminate and is required not to discriminate in violation of federal, state, or local laws or executive orders. Inquiries concerning the application of and compliance with this statement"
    ],
    "answer": "The Academic Calendar includes registration dates, class start dates, add/drop deadlines, exam dates, and more.",
    "reference_answer": "The Academic Calendar web page provides access to calendars for various CMU programs and locations, including registration dates, class start dates, add/drop deadlines, exam dates, and more."
  },
  {
    "question": "What day of the week and time is the University Archives open for drop-ins?",
    "context": [
      "to 2 p.m., Saturday, Sunday 10 a.m. to 4 p.m.",
      "Family Weekend. October 3 - 4, 2025. All Day (until October 4). Family Weekend brings together Carnegie Mellon undergraduate and graduate students and their families and friends for a weekend of events that showcase the vibrancy of the campus experience. Family Weekend features academic welcomes, information sessions, campus tours, student performances and other events. Add to my calendar. Contact Info: family@andrew.cmu.edu Related Content: Family Weekend Website. Independence Day; University Closed & No Classes. July 4, 2025. All Day. The Academic Calendar includes registration dates, class start dates, add/drop deadlines, exam dates, and more. Doctoral course-sections follow a separate academic calendar. Calendars for Heinz College, Tepper School of Business graduate courses, CMU-Africa, CMU-Australia, and CMU-Qatar can be found on The HUB Academic Calendar web page. Add to my calendar. Contact Info: Web: The HUB Academic Calendar Email: cmuregistrar@andrew.cmu.edu. University Archives: Drop-in Hours. April 17, 2025. 10 a.m. - 4 p.m. University Archives, Hunt Library 2nd Floor Repeats weekly (to Apr 24). On Thursdays between 10 a.m. and 4 p.m., the University Archives is open to researchers and the CMU community. Drop in, check out the item of the week, explore our collections, or learn how to navigate our discovery tools. All levels of curiosity are welcomed! No appointment is needed on Thursdays. While appointments are unnecessary, we still recommend you contact us ahead of time about what you would like to look at, as not all collections are stored on-site. Add to my calendar. Contact Info: https://library.cmu.edu/distinctive-collections/university-archives. Uncommon Perfection: Illustrations by Derek Norman. April 21, 2025.",
      "to 5 p.m. Special Hours\n\nThe Detre Library & Archives will close early at 12pm on March 7 and at 2pm on March 13, July 24, September 25, and December 11. The Detre Library & Archives will be closed on June 19 (Juneteenth), July 4 (Fourth of July), November 27 (Thanksgiving), December 25 (Christmas), and January 1 (New Year\u2019s Day). Appointments are recommended for researcher visits to ensure the availability of materials.",
      "GUARDIAN STORAGE SPRING 2025 FREE SHRED-IT EVENT. Sat., May 10, 11 a.m.-2 p.m. 1599 Washington Pike 1599 Washington Pike, Bridgeville Bridgeville. As a thank you to our customers and community, Guardian Storage is hosting a series of FREE Shred-It events throughout our Pittsburgh locations. These events provide a safe way to dispose of unwanted files, papers and documents free of charge and no purchase or commitment of any kind. The only request is a voluntary donation of cash or unopened school supplies at the event to help support The Education Partnership. Please limit to the equivalent of five file boxes' worth of paper waste and remove file clips before arrival. Not Specified.",
      "The Winter Break period is not included. Meal plan charges are adjusted weekly. Dine Express and Campus Express are assessed based upon actual use. There is no adjustment of the PAT bus fee or Student Activity fee. Financial Aid Adjustment Federal and institutional financial aid is adjusted on the same basis as tuition. A student earns 100% of his or her federal or institutional financial aid when 60% of the semester is completed. Student grants and non-federal outside scholarships are adjusted based upon the withdrawal policy of the agency awarding the funds. Undergraduate Course Meeting Policy Policy Statement No undergraduate classes, exams, academic, or artistic activities (including: extra help session, rehearsals, ROTC drill, make-up exams, etc.) are scheduled on weekdays between 4:50 p.m. and 6:50 p.m. Extra class time beyond those regularly scheduled must take place either before 4:50 p.m. or after 6:50 p.m. Undergraduate Course Meeting Procedure This policy is not intended to reduce the rigor or vigor of the academic or artistic programs, but to ensure that students have a period in which they are free to carry on co- curricular activities and athletics. Scheduling classes, exams, or other academic and artistic activities makes it very difficult for the students to meet these commitments. Since we are all concerned about the quality of life at the university, this time must be held for the students. In planning the academic course schedule, the University Registrar's Office will review all courses to ensure that no academic or artistic courses be scheduled in this period. In addition, any requests to schedule additional or makeup course meetings, review and/or study sessions, teaching assistant office hours, or other course-related meetings, must take place either before 4:50 p.m. or after 6:50 p.m. This includes meetings in all university spaces, not just within University Registrar's Office-controlled classrooms. 113"
    ],
    "answer": "Thursdays between 10 a.m. and 4 p.m.",
    "reference_answer": "The University Archives is open for drop-ins on Thursdays from 10 a.m. to 4 p.m."
  },
  {
    "question": "What is the name of the Carnegie Mellon University employee resource group that advocates for and supports neurodiverse people?",
    "context": [
      "Online. Need a break from all the screen time? Join us for a rejuvenating 30-minute workshop focused on connecting your breath, body and mind. Discover the power of simple yet effective techniques like breathwork, gentle tapping to increase circulation in the body, and heart-centered meditation. No experience needed \u2013 just an open mind and a desire to relax. Registration is required. Add to my calendar. Related Content: Registration. (M. Track and Field) Carnegie Mellon Invitational. March 28, 2025. All Day. (M. Track and Field) Carnegie Mellon Invitational Add to my calendar. CMU Tartans logo Contact Info: Full Athletics Schedule. Neurodiverse Employee Resource Group (NERG) Monthly Meeting. April 22, 2025. Noon - 1 p.m. Online. This group advocates for and supports neurodiverse people in the CMU community and beyond. \u201cNeurodiversity\u201d is a word used to explain the unique ways people\u2019s brains work. While everyone\u2019s brain develops similarly, no two brains function just alike. Being neurodivergent means having a brain that works differently from the average or \u201cneurotypical\u201d person. Learn more about the NERG here. Join the Zoom meeting Add to my calendar. Carnegie Mellon University NERG logo. Join Meeting Contact Info: neurodiverse-erg@andrew.cmu.edu. LGBTQIA+ Support and Social Group. April 8, 2025. 5:30 - 6:30 p.m. Counseling & Psychological Services, CaPS Morewood Garden Group Room Repeats weekly (to May 6). Come join us at this safer space for LGBTQIA+ folks to socialize and support one another! To join this group, please email the facilitator Jayme Jenkins, PhD, at jaymej@andrew.cmu.edu or call 412-268-2922 and schedule your pre-group consultation. Add to my calendar. Mini-4 pass/no pass & withdrawal deadline. April 14, 2025. All Day. The Academic Calendar includes registration dates, class start dates, add/drop deadlines, exam dates, and more. Doctoral course-sections follow a separate academic calendar. Calendars for Heinz College, Tepper School of Business",
      "At the basis of this precept is equal employment opportunity. It is critical that Carnegie Mellon's faculty, staff and student body continue to cultivate and enhance its diversity. Through administration of this and related policies, the university intends to assure that all people are included in the diversity that makes Carnegie Mellon stronger in sustaining world-class distinction. Regulatory Compliance The university does not discriminate and is required not to discriminate in employment by Executive Order 11246, the Rehabilitation Act of 1973, the Americans with Disabilities Act of 1990, the Vietnam Era Veterans Readjustment Assistance Act of 1974, Title VI of the Civil Rights Act of 1964, Title IX of the Education Amendments of 1972, and other federal, state and local laws. Consistent with the university's Policy Against Retaliation, employees and applicants are protected from harassment, threats, coercion, intimidation, interference, discrimination, or retaliation for filing a complaint or assisting in an investigation under the above statutes and executive order. The U.S. Department of Labor, including the Office of Federal Contract Compliance Programs (OFCCP) is responsible for the external administration and enforcement of the applicable federal laws, rules and regulations cited in this policy. Accountability This policy was developed by Equal Opportunity Services and incorporates suggestions by the president, general counsel, vice president for business and planning, assistant vice president for human resources and director for equal opportunity services.",
      "Rep. Dan Miller-Disability and Mental Health Summit: https://www.pahouse.com/Miller/DisabilitySummit\n\nThe Disability and Mental Health Summit, held annually, is designed to bring disability resources and experts out of their offices and into an easy-to-access environment, where people can meet face-to-face to better solve problems. Self-Advocacy Voices\n\nSelf-Advocacy Voices: https://selfadvocacyvoices.org/\n\nThe Self-Advocacy Voices mentorship incubator program empowers people with disabilities to give voice to their interests, passions, knowledge, and experiences through public speaking within a supportive environment of peers and mentors. Pittsburgh Mercy Intellectual & Developmental Disabilities Services\n\nPittsburgh Mercy Intellectual & Developmental Disabilities Services: https://www.pittsburghmercy.org/intellectual-disabilities/pittsburgh-mercy-intellectual-developmental-disabilities-services/\n\nUPMC\u2019s services are designed to promote community inclusion and improve quality of life, whether it\u2019s providing vocational training, preparing for employment or volunteer work, arranging housing and services that match the amount of supervision needed, or providing community opportunities and in-home support for those living with their families. The Arc of PA\n\nThe Arc of PA: https://thearcpa.org/\n\nThe Arc of Pennsylvania promotes the human rights of people with intellectual and Developmental Disabilities and actively supports their full inclusion and participation in the community throughout their lifetimes. Community Notification Enrollment\n\nCommunity Notification Enrollment: https://public.coderedweb.com/CNE/en-US/BF5CCF5B2AB3",
      "work closely with university administration to address issues and develop best solutions for the majority. Great things can happen when we focus our efforts! Staff Council committees are open to any interested CMU staff member and include Communication, Food Drive, Kennywood & Entertainment Discounts, DEI+B, Take Our Daughters and Sons to Work, Sustainability and Wellness. Meeting schedule & Zoom link: https://www.cmu.edu/staff-council/when-we-meet-committees/index.html#meetings Add to my calendar. Contact Info: staff-council@andrew.cmu.edu. Neurodiverse Employee Resource Group (NERG) Monthly Meeting. May 27, 2025.",
      "Discover Upcoming Events: https://www.cmu.edu/dei-office/events/2024/anti-hate.html\n\n\"Since our founding, Carnegie Mellon University has been committed to promoting academic excellence and economic mobility through education. This work prioritizes both expanding access and removing barriers to opportunity in support of an inclusive learning environment."
    ],
    "answer": "Neurodiverse Employee Resource Group (NERG)",
    "reference_answer": "Neurodiverse Employee Resource Group (NERG)"
  },
  {
    "question": "What time does the event, Laughs & Legacy: An Evening with CMU Alumna Paula Newman, take place?",
    "context": [
      "Kick off the evening with an exclusive alumni meet-and-greet at 5:30 PM, where you\u2019ll have the chance to chat with Paula and reconnect with old friends. Then, settle in for a hilarious comedy performance from 7:00 PM to 9:00 PM, as Paula brings her unique wit and CMU-inspired humor to the stage. This is a night you won\u2019t want to miss\u2014come laugh, reminisce, and celebrate the creativity and talent that defines the CMU community. Grab your tickets now and let\u2019s make it a night to remember! Questions? Contact alumni-house@andrew.cmu.edu. The Denver Network has over 1,250 alumni, parents and friends in the region. Event registrations close March 18th at 11:59 PM MDT. Free. PIT - April Cranberry Township Neighborhood Luncheon. April 18, 2025, 12:00pm - 1:30pm EDT. Juniper Grill - Cranberry, 2030 MacKenzie Way, Suite 800, Cranberry Township, Pennsylvania 16066. Join us for a monthly luncheon in Cranberry Township and network with other local alumni. This event is scheduled every third Friday of the month, so save the dates in your calendar. Registration is free, food and drink on your own. Questions?",
      "ET Thursday, February 27: 9 a.m.-5 p.m.",
      "Session 2: July 23-27 at the University of Pittsburgh. Session 3: July 30- August 3 at CCAC/Northside Campus. Session 4: August 6-10 at Chatham University. Each daily session runs from 8:30 a.m.",
      "Noon - 1 p.m.",
      "Free. CHI - Social Lunch at Beatrix River North. March 20, 2025, 12:00pm - 1:30pm CDT. Beatrix River North, 519 N Clark St, Chicago, Illinois 60654. Join your fellow Tartans for a networking lunch at Beatrix River North! Escape the winter chill and warm up with great company over a casual meal. Whether you're looking for a break from work or just want to connect with fellow alumni, this is the perfect opportunity! Attendees pay for their own food and beverage order. Space is limited to 10 seats, so be sure to register soon! Registration closes on Tuesday, March 18. We look forward to seeing you there! This event is sold out. Please complete this form to be added to the waitlist. You will be contacted via email if we have any cancellations. link:https://docs.google.com/forms/d/e/1FAIpQLSetelb7mJlQ2LehEkAxUDtcXWwiVeG1z-3hnXpU9l3mUQrwJg/viewform?... Questions? Contact alumni-house@andrew.cmu.edu. There are more than 2,300 alumni, parents and friends in the Chicago metropolitan area, including Cook, DuPage, Lake, and Will counties. Event is currently sold out. Free."
    ],
    "answer": "5:30 PM",
    "reference_answer": "March 19, 2025"
  },
  {
    "question": "What day of the week and time is the University Archives open for drop-ins?",
    "context": [
      "to 2 p.m., Saturday, Sunday 10 a.m. to 4 p.m.",
      "Family Weekend. October 3 - 4, 2025. All Day (until October 4). Family Weekend brings together Carnegie Mellon undergraduate and graduate students and their families and friends for a weekend of events that showcase the vibrancy of the campus experience. Family Weekend features academic welcomes, information sessions, campus tours, student performances and other events. Add to my calendar. Contact Info: family@andrew.cmu.edu Related Content: Family Weekend Website. Independence Day; University Closed & No Classes. July 4, 2025. All Day. The Academic Calendar includes registration dates, class start dates, add/drop deadlines, exam dates, and more. Doctoral course-sections follow a separate academic calendar. Calendars for Heinz College, Tepper School of Business graduate courses, CMU-Africa, CMU-Australia, and CMU-Qatar can be found on The HUB Academic Calendar web page. Add to my calendar. Contact Info: Web: The HUB Academic Calendar Email: cmuregistrar@andrew.cmu.edu. University Archives: Drop-in Hours. April 17, 2025. 10 a.m. - 4 p.m. University Archives, Hunt Library 2nd Floor Repeats weekly (to Apr 24). On Thursdays between 10 a.m. and 4 p.m., the University Archives is open to researchers and the CMU community. Drop in, check out the item of the week, explore our collections, or learn how to navigate our discovery tools. All levels of curiosity are welcomed! No appointment is needed on Thursdays. While appointments are unnecessary, we still recommend you contact us ahead of time about what you would like to look at, as not all collections are stored on-site. Add to my calendar. Contact Info: https://library.cmu.edu/distinctive-collections/university-archives. Uncommon Perfection: Illustrations by Derek Norman. April 21, 2025.",
      "to 5 p.m. Special Hours\n\nThe Detre Library & Archives will close early at 12pm on March 7 and at 2pm on March 13, July 24, September 25, and December 11. The Detre Library & Archives will be closed on June 19 (Juneteenth), July 4 (Fourth of July), November 27 (Thanksgiving), December 25 (Christmas), and January 1 (New Year\u2019s Day). Appointments are recommended for researcher visits to ensure the availability of materials.",
      "GUARDIAN STORAGE SPRING 2025 FREE SHRED-IT EVENT. Sat., May 10, 11 a.m.-2 p.m. 1599 Washington Pike 1599 Washington Pike, Bridgeville Bridgeville. As a thank you to our customers and community, Guardian Storage is hosting a series of FREE Shred-It events throughout our Pittsburgh locations. These events provide a safe way to dispose of unwanted files, papers and documents free of charge and no purchase or commitment of any kind. The only request is a voluntary donation of cash or unopened school supplies at the event to help support The Education Partnership. Please limit to the equivalent of five file boxes' worth of paper waste and remove file clips before arrival. Not Specified.",
      "The Winter Break period is not included. Meal plan charges are adjusted weekly. Dine Express and Campus Express are assessed based upon actual use. There is no adjustment of the PAT bus fee or Student Activity fee. Financial Aid Adjustment Federal and institutional financial aid is adjusted on the same basis as tuition. A student earns 100% of his or her federal or institutional financial aid when 60% of the semester is completed. Student grants and non-federal outside scholarships are adjusted based upon the withdrawal policy of the agency awarding the funds. Undergraduate Course Meeting Policy Policy Statement No undergraduate classes, exams, academic, or artistic activities (including: extra help session, rehearsals, ROTC drill, make-up exams, etc.) are scheduled on weekdays between 4:50 p.m. and 6:50 p.m. Extra class time beyond those regularly scheduled must take place either before 4:50 p.m. or after 6:50 p.m. Undergraduate Course Meeting Procedure This policy is not intended to reduce the rigor or vigor of the academic or artistic programs, but to ensure that students have a period in which they are free to carry on co- curricular activities and athletics. Scheduling classes, exams, or other academic and artistic activities makes it very difficult for the students to meet these commitments. Since we are all concerned about the quality of life at the university, this time must be held for the students. In planning the academic course schedule, the University Registrar's Office will review all courses to ensure that no academic or artistic courses be scheduled in this period. In addition, any requests to schedule additional or makeup course meetings, review and/or study sessions, teaching assistant office hours, or other course-related meetings, must take place either before 4:50 p.m. or after 6:50 p.m. This includes meetings in all university spaces, not just within University Registrar's Office-controlled classrooms. 113"
    ],
    "answer": "Thursdays between 10 a.m. and 4 p.m.",
    "reference_answer": "The University Archives is open for drop-ins on Thursdays from 10 a.m. to 4 p.m."
  },
  {
    "question": "Who is co-hosting and sponsoring the CMBAA - Juneteenth Party?",
    "context": [
      "Richard A. Pagliari\n\nPartySavvy\n\nKathleen and Demetrios Patrinos\n\nJudy Horgan and Steve Pavsner*\n\nMr. Robert A.",
      "THURSDAY, JULY 18\n\nSTANWIX ST. STAGE\n\nPerformance: 12:00\n\n1:00pm + Nick Guckert\n\nPerformance: 1:30\n\n2:30pm + Jay Wiley\n\nPerformance: 3:00 - 4:30pm + The Chris Casalinuovo Band\n\nPerformance: 5:00\n\n6:00pm + Casey Catone\n\nPerformance: 6:30 - 8:30pm + Mean Blue Planets\n\nPerformance: 9:00\n\n10:00pm + The Polkamaniacs\n\nSMITHFIELD ST. STAGE Performance: 12:00 - 1:00 pm + Melina Bowser feat. Dave Schmiech\n\nPerformance: 1:30 - 2:30 pm + Pickle Mafia\n\nPerformance: 3:00 - 4:00 pm + Pioneer Records - The Pit Crew\n\nPerformance: 4:30 - 5:30 pm + Caleb Kopta\n\nPerformance: 6:00 - 7:00 pm + Megan Paullet\n\nPerformance: 7:30 - 8:30 pm + Michael Christopher Band\n\nPerformance: 9:00 - 10:00 pm + The Conspiracy Theory\n\nFRIDAY, JULY 19\n\nSTANWIX ST. STAGE Performance: 12:00 - 1:00 pm + Kelley Jeanne\n\nPerformance: 1:30 - 2:30 pm + Elias Khouri\n\nPerformance: 3:00 - 4:00 pm + Echoes on Water\n\nPerformance: 4:30 - 5:30 pm + The Altered Egos\n\nPerformance: 6:00 - 7:00 pm + MASON. & Mr. Business\n\nPerformance: 7:30 - 8:30 pm + Full Fat\n\nPerformance: 9:00 - 10:00 pm + Franchise Band\n\nSMITHFIELD ST. STAGE Performance: 12:00 - 1:00 pm + Project Banjo\n\nPerformance: 1:30 - 2:30 pm + Max Rosen\n\nPerformance: 3:00 - 4:00 pm + Big Blitz\n\nPerformance: 4:30 - 5:30 pm + This-That & The Other Thing\n\nPerformance: 6:00 - 7:00 pm + Zinnia's Garden\n\nPerformance: 7:30 - 8:30 pm + Miss Freddye's Blues Band\n\nPerformance: 9:00\n\n10:00 pm + Pennsoulvanians\n\nSATURDAY, JULY 20\n\nSTANWIX ST. STAGE Performance: 12:00 - 1:00 pm + Anne Eliza\n\nPerformance: 1:30 - 2:30 pm + The Redlines\n\nPerformance: 3:00 - 4:00 pm + Paging Doctor Moon\n\nPerformance: 4:30\n\n5:30 pm + Chillhouse\n\nPerformance: 6:00 - 7:00 pm + Justin Fabus\n\nPerformance: 7:30 - 8:30 pm + The Appalachian Soul Man Aristotle Jones\n\nPerformance: 9:00 - 10:00 pm + Pickup Line\n\nSMITHFIELD ST. STAGE Performance: 12:00-1:00 pm + Jessica Bella Band\n\nPerformance: 1:30-2:30 pm + William Matheny\n\nPerformance: 3:00-4:00 pm + Pioneer Records - James the Seventh\n\nPerformance: 4:30",
      "Simmons VICE CHAIR Michael DeVanney VICE CHAIR Amy R. Sebastian VICE CHAIR Jon D. Walton PRESIDENT & CEO Melia Peters Tourangeau SECRETARY Debra L. Caplan TREASURER David Cable Executive Committee Michele R.",
      "PR@pghtacofest.com.",
      "JACK SIMS FROM MACOMB, MI: In the Jan."
    ],
    "answer": "Pioneer Records",
    "reference_answer": "Carnegie Mellon Trustee Larry Jennings"
  },
  {
    "question": "What organization provides the volunteers for the weekly pet therapy program at Carnegie Mellon University?",
    "context": [
      "As our community\u2019s needs have changed, we have grown from a small group of volunteers to more than 50 people dedicated to the care of all who come through our doors. Join us for our 40th birthday party, and your participation will help us continue our mission of inclusive, quality healthcare for years to come. 412-345-7456. Fundraisers. GET TICKETS. https://www.alliespgh.org/resources/40th-anniversary-sponsorship-and-registration. 21+ Night: Paws and Claws. Fri., April 11, 6-10 p.m. Carnegie Science Center 1 Allegheny Avenue, Pittsburgh North Side. From fur to scales to feathers, we can all agree that our pets are part of the family. Celebrate them with us at the Science Center on National Pet Day! Learn about some fun animal science, explore the exhibits after hours, and help local pets by bringing a toy or food donation. Snuggle up with some therapy dogs from Animal Friends, and learn about the mental health benefits of pets. Meet some purrfect adoptable cats from Oakland TNR (Trap, Neuter, Release) Meet the animal ambassadors who live at the Science Center and hear from our Animals & Habitats team. 4122373400.",
      "VI. Resources The university provides the following resources to individuals seeking assistance relating to the abuse of alcohol or drugs. 149\n\nCounseling & Psychological Services \u2014 Counseling and Psychological Services (CaPS) is available as a resource to students for initial assessment of drug and alcohol use, and referrals to off campus outpatient and inpatient treatment programs. University Health Services \u2014 University Health Services (UHS) also provides students with initial assessment of drug and alcohol use and referrals to CaPS or off\n\ncampus treatment programs, in addition to substance abuse prevention education, through its Office of Health Promotion. Individual sessions are offered alongside online programs to assist students in assessing their own usage patterns and reducing the risks associated with substance abuse. UHS also facilitates the Collegiate Recovery Community at the university to support and connect students and their allies who are choosing sobriety. Information about appropriate community support groups is available through CaPS and UHS. Some of the support programs available in the Pittsburgh area include: Alcoholics Anonymous, Narcotics Anonymous, Al\n\nAnon and the Adult Children of Alcoholics Network of Greater Pittsburgh. Employee Assistance Program \u2014 Carnegie Mellon has established an Employee Assistance Program (EAP), sponsored and paid for by the university, to facilitate employees' efforts to resolve problems that can affect job performance and general well\n\nbeing. EAP services include counseling and support relating to substance abuse. Broadcasting All students who participate in commercial, off\n\ncampus television or radio broadcasts, webcasts or podcasts and use the Carnegie Mellon name should consult with the Media Relations Department. These students should contact Media Relations at 412\n\n268\n\n2900 prior to their participation. Code of Business Ethics and Conduct Policy Authority Carnegie Mellon University has various well",
      "Carnegie Mellon reserves the right to remove any animal that is not appropriately cared for. To ensure that appropriate care is available at all times, students are\n\n183\n\nencouraged to establish a plan to care for the animal in the event the student is unable to do so (e.g. due to illness or emergency).",
      "work closely with university administration to address issues and develop best solutions for the majority. Great things can happen when we focus our efforts! Staff Council committees are open to any interested CMU staff member and include Communication, Food Drive, Kennywood & Entertainment Discounts, DEI+B, Take Our Daughters and Sons to Work, Sustainability and Wellness. Meeting schedule & Zoom link: https://www.cmu.edu/staff-council/when-we-meet-committees/index.html#meetings Add to my calendar. Contact Info: staff-council@andrew.cmu.edu. Neurodiverse Employee Resource Group (NERG) Monthly Meeting. May 27, 2025.",
      "Peer Health Advocates Drop-In Hours. April 22, 2025. 5 - 7 p.m. Highmark Center for Health, Wellness and Athletics Lobby Repeats weekly (to Apr 23). Explore featured health topics with activities and reflection prompts, and connect with students certified to provide health and wellness support. Space is available for private conversations. Add to my calendar. Contact Info: Email Related Content: Peer Health Advocates (PHA) Website. Master\u2019s Student Support Group. April 2, 2025. 4 - 5 p.m. CaPS Office, Highmark Center for Health, Wellness and Athletics Repeats weekly (to May 7). The Master\u2019s Student Support Group provides an opportunity for students to come together and discuss the unique experiences and challenges of being a Master\u2019s student. To join this group, please email co-facilitator Adrijana Vukelic, MSCP, at avukelic@andrew.cmu.edu or call 412-268-2922 to schedule your pre-group consultation. Add to my calendar. Paws to Relax: Weekly Pet Therapy Program. April 16, 2025. 7 - 8 p.m. Well-being Lab (Room 104), Wellness & Meaning-Making Suite, First Floor, Highmark Center for Health, Wellness and Athletics Repeats weekly (to May 1). Volunteers through Animal Friend\u2019s Therapet program join us weekly on Wednesdays from 7-8 p.m. to offer some friendly dog companions for the hour. Take a break and join us! Add to my calendar. Contact Info: Name: Harsh Agarwal Email: hagarwa2@andrew.cmu.edu. Snackified and Cozy Study Jams! May 9, 2025. 4 - 5 p.m. Well-Being Lab, Highmark Center for Health, Wellness and Athletics Repeats weekly (to May 9). Need a cozy and relaxing space to work? Bring your hardest work to this study jam, and we\u2019ll bring the snacks! Open to all students! Add to my calendar. Contact Info: hereforyou@andrew.cmu.edu. Playtest Night. April 8, 2025. 6 - 8 p.m. Hunt Library, Floor 1, Studio A (106B) Repeats weekly (to Apr 22). Join us for Playtest Night, an ongoing event series where Entertainment Technology Center and IDeATe students make their project"
    ],
    "answer": "Animal Friends",
    "reference_answer": "Animal Friend\u2019s Therapet program"
  },
  {
    "question": "Who organizes the Ph.D. Student Support Group at Carnegie Mellon University?",
    "context": [
      "Ph.D. Student Support Group. March 31, 2025. 6:30 - 7:30 p.m. Repeats weekly (to May 9). The PhD Support Group offers space to confidentially discuss the stressors and challenges of navigating relationships with advisors and peers, academic milestones, academic hazing, low motivation, struggles with self-confidence, and efforts to lead a more balanced life. The group is able to accommodate no more than one student per program/lab. Feel free to email Kym Jordan Simmons, PhD (kyms@andrew.cmu.edu) to schedule a 30-minute pre-group meeting. Add to my calendar. Uncommon Perfection: Illustrations by Derek Norman. April 1, 2025.",
      "7. All requests for the use of Carnegie Mellon facilities by non-university organizations shall be made originally with the Office of Conference and Event Services at 412-268- 1125 or via email. Permission to use facilities may not be assumed until a room reservation form has been signed by the Office of Conference and Event Services or the dean of students. 221",
      "Committee. However, a complaint may be resolved informally outside of the community standards process at the discretion of the dean of students or designee and the individuals involved in the matter. \u2022 Resolution Review Board \u2013 The team of designated and trained staff that reviews and approves initial allegations and determines appropriate venues for resolution through the community standards process. The Resolution Review Board also reviews and approves proposed outcomes stemming from Administrative Resolution Meetings. \u2022 Respondent \u2013 The person(s), group, or student organization alleged to have violated community standards. \u2022 Student \u2013 Any person registered for, enrolled in, or auditing any course(s) at Carnegie Mellon University at the time of the alleged violation. For community standards purposes, an individual is also considered to be a student if they have accepted their offer of admission and are not yet enrolled. Examples include, but are not limited to, students who are enrolled but not taking classes due to an academic break, medical leave, suspension, or other personal leave; students who were enrolled at the time of the incident; persons who demonstrate an intent to enroll by registering for courses; and students participating in study abroad programs. \u2022 Support Person \u2013 A person of the student's choosing who accompanies the student to any meeting related to the community standards process, including a University Disciplinary Committee hearing. The role of the support person is limited to supporting the student in meetings or a hearing. Support persons may not actively participate in meetings, the hearing process or communicate on the student's behalf. \u2022 Witness \u2013 Individuals positioned to provide direct information related to the alleged violations being reviewed by the University Disciplinary Committee, such as direct observation of the incident in question and/or direct interaction with The Community Standards Process Staff members in the Division",
      "work closely with university administration to address issues and develop best solutions for the majority. Great things can happen when we focus our efforts! Staff Council committees are open to any interested CMU staff member and include Communication, Food Drive, Kennywood & Entertainment Discounts, DEI+B, Take Our Daughters and Sons to Work, Sustainability and Wellness. Meeting schedule & Zoom link: https://www.cmu.edu/staff-council/when-we-meet-committees/index.html#meetings Add to my calendar. Contact Info: staff-council@andrew.cmu.edu. Neurodiverse Employee Resource Group (NERG) Monthly Meeting. May 27, 2025.",
      "We believe that education can be a transformative and enriching force for every person, irrespective of their background, identity or life circumstances. The concept of belonging is foundational to our mission and is intricately interwoven into the very essence of our university, helping to shape our values, policies and practices. Let's continue on this journey together. The Office of the Vice Provost for Diversity, Equity and Inclusion and Chief Diversity Officer412-268-4744Send us a message\n\nCenter for Student Diversity and Inclusion412-268-2150Send us a message\n\nIn an era of global complexity and division, meaningful dialogue has never been more essential.Deeper Conversationsis a university-wide initiative dedicated to fostering civil discourse, critical inquiry and mutual understanding on today\u2019s most pressing issues. From geopolitical conflicts to democracy and elections, our programming spans expert panels, book discussions and interactive forums designed to encourage thoughtful engagement in a space where diverse perspectives can be shared, challenged and explored with curiosity and respect. Learn More About Deeper Conversations Programming\n\nThis multi-event series, part of CMU\u2019s Deeper Conversations initiative, provides interactive programs to foster knowledge, empathy and awareness among staff, faculty and students. Discover Upcoming Events\n\n\"Since our founding, Carnegie Mellon University has been committed to promoting academic excellence and economic mobility through education. This work prioritizes both expanding access and removing barriers to opportunity in support of an inclusive learning environment."
    ],
    "answer": "Kym Jordan Simmons",
    "reference_answer": "Kym Jordan Simmons, PhD"
  },
  {
    "question": "Who organizes the LGBTQIA+ Support and Social Group at Carnegie Mellon University?",
    "context": [
      "Discover Upcoming Events: https://www.cmu.edu/dei-office/events/2024/anti-hate.html\n\n\"Since our founding, Carnegie Mellon University has been committed to promoting academic excellence and economic mobility through education. This work prioritizes both expanding access and removing barriers to opportunity in support of an inclusive learning environment.",
      "Open Stage. Gertrude Stein Political Club of Greater Pittsburgh. Second Thursday of every month, 7 p.m. United Cerebral Palsy of Pittsburgh 4638 Centre Avenue, Pittsburgh Oakland. Meetings of group devoted to LGBT issues in electoral politics. 412-521-2504. Politics. Live Band Karaoke by Lead Singer Wanted. Second Thursday of every month, 8 p.m.-12 a.m. The Bridge Music Bar 6018 Broad Street, Pittsburgh East Liberty. Be a RockStar!",
      "7. All requests for the use of Carnegie Mellon facilities by non-university organizations shall be made originally with the Office of Conference and Event Services at 412-268- 1125 or via email. Permission to use facilities may not be assumed until a room reservation form has been signed by the Office of Conference and Event Services or the dean of students. 221",
      "an investigation and hearing process that protects the safety of all involved while promoting accountability and a fair process. Cases Involving Student Organizations Carnegie Mellon University is committed to managing all cases that involve alleged violations of university policy by student organizations with appropriate care and sensitivity. In these cases, the university may need to invoke additional procedural provisions to determine responsibility for alleged policy violation(s) by a student organization. Recognized student organizations include groups that are given recognition by a college, department or governing body on campus. Recognized student organizations have certain privileges and use of campus resources (e.g. funding (university or student",
      "Ph.D. Student Support Group. April 21, 2025. 6:30 - 7:30 p.m. Repeats weekly (to May 9). The PhD Support Group offers space to confidentially discuss the stressors and challenges of navigating relationships with advisors and peers, academic milestones, academic hazing, low motivation, struggles with self-confidence, and efforts to lead a more balanced life. The group is able to accommodate no more than one student per program/lab. Feel free to email Kym Jordan Simmons, PhD (kyms@andrew.cmu.edu) to schedule a 30-minute pre-group meeting. Add to my calendar. Black Women\u2019s Support Group (Graduate Students). April 4, 2025. 4 - 5:15 p.m. Virtual via Zoom Repeats weekly (to May 9). A supportive, virtual space for students who identify as Black women, facilitated by Black female therapists. This weekly, unstructured group provides an opportunity to discuss stress and coping, misogynoir, oppression and privilege, intersectional identities, self-esteem, relationships, colorism, family, internalized racism and other topics of interest. Everyone\u2019s agreement to maintaining the confidentiality of other members is essential! Contact Kym Jordan Simmons, PhD (kyms@andrew.cmu.edu) to schedule a 30-minute pre-group meeting. Add to my calendar. Ph.D. Student Support Group. April 28, 2025. 6:30 - 7:30 p.m. Repeats weekly (to May 9). The PhD Support Group offers space to confidentially discuss the stressors and challenges of navigating relationships with advisors and peers, academic milestones, academic hazing, low motivation, struggles with self-confidence, and efforts to lead a more balanced life. The group is able to accommodate no more than one student per program/lab. Feel free to email Kym Jordan Simmons, PhD (kyms@andrew.cmu.edu) to schedule a 30-minute pre-group meeting. Add to my calendar. Fix-it Fair: Mending Workshop. March 20, 2025. 3 - 6 p.m. Sustainability Studio, First Floor, Hunt Library. Do you have shirts missing buttons or pants that need hemmed? Don\u2019t throw them"
    ],
    "answer": "Kym Jordan Simmons",
    "reference_answer": "Jayme Jenkins"
  },
  {
    "question": "What is the significance of March 20 or 21 for Bah\u00e1\u2019\u00eds and Iranians?",
    "context": [
      "Master\u2019s Student Support Group. May 7, 2025. 4 - 5 p.m. CaPS Office, Highmark Center for Health, Wellness and Athletics Repeats weekly (to May 7). The Master\u2019s Student Support Group provides an opportunity for students to come together and discuss the unique experiences and challenges of being a Master\u2019s student. To join this group, please email co-facilitator Adrijana Vukelic, MSCP, at avukelic@andrew.cmu.edu or call 412-268-2922 to schedule your pre-group consultation. Add to my calendar. Naw R\u00faz. March 19 - 20, 2025. All Day (until March 20). Rooted in Zoroastrianism, March 20 or 21 is the New Year celebration for Bah\u00e1\u2019\u00eds and Iranians. For some, it marks the end of 19 days of fasting. Naw R\u00faz celebrations include a feast with traditional and symbolic foods and giving gifts. Add to my calendar. University Archives: Drop-in Hours. April 24, 2025. 10 a.m. - 4 p.m. University Archives, Hunt Library 2nd Floor Repeats weekly (to Apr 24). On Thursdays between 10 a.m. and 4 p.m., the University Archives is open to researchers and the CMU community. Drop in, check out the item of the week, explore our collections, or learn how to navigate our discovery tools. All levels of curiosity are welcomed! No appointment is needed on Thursdays. While appointments are unnecessary, we still recommend you contact us ahead of time about what you would like to look at, as not all collections are stored on-site. Add to my calendar. Contact Info: https://library.cmu.edu/distinctive-collections/university-archives. Ramadan. Feb. 28 - March 29, 2025. All Day (until March 29). Ramadan is one of the most important Muslim seasons, commemorating the revelation of the Qur\u2019an to the Prophet Mohamed. Many Muslims fast from both food and drink between sunrise and sunset, honor halal food guidelines when they break the fast with the iftar meal, and spend more time reading the Qu\u2019ran and praying, either alone or at a mosque. Add to my calendar. Contact Info: To request an addition, update or",
      "International Transgender Day of Visibility. March 31, 2025. All Day. This day celebrates the successful advocacy, leadership, and lives of transgender and gender-expansive people. It also lifts up the ongoing need for societal prevention of violence and discrimination. Add to my calendar. Uncommon Perfection: Illustrations by Derek Norman. April 7, 2025.",
      "More of the same, just intensified. We've got to be careful as leaders, because people get their tenor from us, and so we've got to be ourselves.",
      "Holy Week or Passion Week. April 13 - 19, 2025. All Day (until April 19). Beginning with Palm Sunday on April 13, Eastern Orthodox Christians and some Western Christians commemorate the last week before Pascha or Easter Day with Passion Week or Holy Week. There are special worship services and observances such as prayer, fasting, and confession on multiple days, depending on the specific denomination. Add to my calendar.",
      "This is so important. I can't give enough credit to them for what they're doing.\"\n\nKhan's mother was born in Honduras and his father in India, and while they met in the United States, Khan understands the struggles those who immigrate to this country face. \"Any opportunity I have to help a young person with their future, I'm always going to do whatever I can do because I always appreciated it when people did that for me,\" said Khan. \"If you go back 30 years and the people I was around then, a majority of the people probably would never have expected that I'd be sitting where I'm sitting right now. Any time I can help those kids, I'm going to do whatever I can. \"I just want to give them hope. What I noticed today with some of those kids, they're searching for hope. They haven't found hope because of where they are from, how they got here and some of the stuff that they've faced in their lives. They're searching for hope. \"If I can give at least one of those kids just a little bit of hope, I'm going to do everything I can.\"\n\nTuesday, October 1"
    ],
    "answer": "New Year celebration",
    "reference_answer": "March 20 or 21 marks the New Year celebration for Bah\u00e1\u2019\u00eds and Iranians."
  },
  {
    "question": "Who is the speaker at the event?",
    "context": [
      "MAY 09 2025, 7:00 PM FRI. 15212, Pittsburgh, PA, US. Stage AE. Prices from $37. Trevor Wallace.",
      "Talks run approximately 20 minutes. Gallery conversations are also held at 2:30 p.m.",
      "with 100 or more persons in attendance. Hosts should consider the items below as guidance in planning campus events, recognizing that not all of the items below will apply to all events: 1. A public declaration of the event, its purpose, the identification of sponsors and co- sponsors, and contact information for those seeking further information. 2. A plan for advertising the event, including advance notice to relevant members of the community who may wish to co-sponsor, protest, or host other events in response to the planned activity. 3. Where appropriate, a clear and detailed contract with outside speakers, artists, or suppliers of services to ensure continuity of purpose and the ability of the host to reasonably control the event, consistent with the host's intent. 169",
      "Richard A. Pagliari\n\nPartySavvy\n\nKathleen and Demetrios Patrinos\n\nJudy Horgan and Steve Pavsner*\n\nMr. Robert A.",
      "Speakers Series: Chris Wallace. Mar 26, 2025 , 8:00 pm - 10:00 pm. Heinz Hall 600 Penn Ave Pittsburgh, PA 15222. Award-winning television anchor and commentator, Wallace\u2019s career on ABC,?NBC,?Fox News, and?CNN spans five decades. He anchored Fox News Sunday for 18 years, and has interviewed everyone from Vladimir Putin to George Clooney to Bill Gates. He is currently host of The Chris Wallace Show. Community, Workshops & Classes. EVENT WEBSITE: https://www.pittsburghsymphony.org/production/94258/speakers-series-chris-wallace. An Evening with Rob Zellers. Mar 26, 2025 , 7:00 pm - 9:00 pm. O'Reilly Theater 621 Penn Ave Pittsburgh, PA 15222. Join us for an intimate reading and conversation with esteemed playwright Rob Zellers (The Chief, Billy Strayhorn: Something to Live For, Harry\u2019s Friendly Service) as he explores how inspiration and loss intertwine in his newest play that maps the parallel paths of his evolution as an artist and his daughter Alexa\u2019s battle with illness. Community. EVENT WEBSITE: https://trustarts.org/production/98127/an-evening-with-rob-zellers. An Evening with Gregory Alan Isakov. Mar 26, 2025 , 7:00 pm - 11:00 pm. Stage AE 400 N Shore Dr Pittsburgh, PA 15212. $1 from the sale of each ticket purchased will be donated to Greater Pittsburgh Community Food Bank, who are leveraging the power of community to achieve lasting solutions to hunger and its root causes. Every $1 donated results in providing 3 meals to the those in need. Entertainment, Music. EVENT WEBSITE: https://promowestlive.com/pittsburgh/stage-ae/2025/03/an-evening-with-gregory-alan-isakov. Traffic Club of Pittsburgh 2025. Mar 27, 2025. David L. Lawrence Convention Center 1000 Fort Duquesne Blvd Pittsburgh, PA 15222. The Traffic Club of Pittsburgh organizes a wide array of recreational, educational and social events throughout the year to keep the transportation community updated and reward individuals that excel in their fields. Convention. EVENT WEBSITE:"
    ],
    "answer": "Trevor Wallace",
    "reference_answer": "Rayid Ghani"
  },
  {
    "question": "What is the significance of National Arab American Heritage Month?",
    "context": [
      "Heartfulness Weekly Meditation. April 27, 2025. 8:30 - 11 a.m. Well-being Lab (Room 104), Wellness & Meaning-Making Suite, First Floor, Highmark Center for Health, Wellness and Athletics Repeats weekly (to May 5). Reduce stress, calm your mind and improve the quality of your life through the Heartfulness Meditation. Add to my calendar. Contact Info: Name: Harsh Agarwal Email: hagarwa2@andrew.cmu.edu. National Arab American Heritage Month. April 1 - 30, 2025. All Day (until April 30). During National Arab American Heritage Month, the U.S. celebrates the cultural and leadership contributions of Arab Americans. Add to my calendar. Contact Info: To request an addition, update or correction to CMU\u2019s Inclusive Holiday Observations and Interfaith Calendar, please contact Jennifer McCurry. Make-Up Final Examinations. May 6, 2025. All Day. The Academic Calendar includes registration dates, class start dates, add/drop deadlines, exam dates, and more. Doctoral course-sections follow a separate academic calendar. Calendars for Heinz College, Tepper School of Business graduate courses, CMU-Africa, CMU-Australia, and CMU-Qatar can be found on The HUB Academic Calendar web page. Add to my calendar. Contact Info: Web: The HUB Academic Calendar Email: cmuregistrar@andrew.cmu.edu. Summer All, Two & Mini-6 Faculty Course Evaluations close. August 1, 2025. All Day. The Academic Calendar includes registration dates, class start dates, add/drop deadlines, exam dates, and more. Doctoral course-sections follow a separate academic calendar. Calendars for Heinz College, Tepper School of Business graduate courses, CMU-Africa, CMU-Australia, and CMU-Qatar can be found on The HUB Academic Calendar web page. Add to my calendar. Contact Info: Web: The HUB Academic Calendar Email: cmuregistrar@andrew.cmu.edu. Peer Health Advocates Drop-In Hours. April 1, 2025. 5 - 7 p.m. Highmark Center for Health, Wellness and Athletics Lobby Repeats weekly (to Apr 23). Explore featured health topics with",
      "Museum: American_Jewish_Museum",
      "Pride Month. June 1 - 30, 2025. All Day (until June 30). This month-long celebration demonstrates how LGBTQ Americans have strengthened our country, by using their talent and creativity to help create awareness and goodwill. The first Pride March in New York City was held on June 28, 1970, on the one-year anniversary of the Stonewall Uprising. Add to my calendar.",
      "URL: https://www.steelers.com/news/harvin-making-his-mark\n\nCONTENT:\n\nHarvin making his mark\n\nSteelers.com\n\nIn celebration of Black History Month, we take the time to recognize and reflect on the thoughts and contributions of members of the Steelers organization. Today, punter Pressley Harvin shares why Black History Month is important to him and his story of being one of only six Black punters in the history of the NFL. For punter Pressley Harvin, Black History Month is about learning about those who came before him, understanding the history of the men and women who made strides to make life better for him and others just like him. \"Going back, looking at the history of Black History Month and the things that happened and the things that transpired to have where we are today, sometimes you have to take a step back and look at that history to really learn from it,\" said Harvin. \"I really honor and recognize the month by always trying to find something that's fresh and new education wise. I always wanted to learn more about the Black heritage, Black culture. \"Just being a Black athlete, especially a Black punter, a Black specialist in the NFL, there hasn't been too many of us so just trying to make the road easier for the people behind me is my biggest thing.\"",
      "Olives \u2013 Tomatoes \u2013 Cucumbers \u2013 Za\u2019atar *Manaeesh (Flatbread) \u2013 Buttered Rose Petal Jam & Asiago, Parmesan Cheese *Manaeesh (Flatbread) \u2013 Assorted Gourmet Breads \u2013 Assorted Gourmet Pastries \u2013 Assorted Jams \u2013 Assorted Fresh fruits \u2013 Arabic Coffee or Syrian Mint Tea"
    ],
    "answer": "celebrates the cultural and leadership contributions of Arab Americans",
    "reference_answer": "National Arab American Heritage Month is a time when the U.S. celebrates the cultural and leadership contributions of Arab Americans."
  },
  {
    "question": "Who organizes the Virtual Gratitude Gathering?",
    "context": [
      "And they hit on everything in between. And every minute of it, from basketball camps, to classes, to wrapping Christmas gifts, brings joy to Wilson-Batch. \"There is so much I enjoy, so much that brings me joy on a daily basis,\" said Wilson-Batch. \"One thing that stands out happened recently. We ask the parents of the kids in our program to engage because all our programs are free, and we ask our parents to engage in order to keep programs free. We ask them to show up four times during the academic year for their child. We were hosting a dinner for our third and fourth grade kids, and we surprised one of the moms, honoring her for giving back to us and being an outstanding parent.",
      "\u00a7 376(a). PATRON \u2013 anyone participating in the privilege of engaging in an amusement. (Ord.",
      "Family, Tours. EVENT WEBSITE: https://www.gatewayclipper.com/highland-heroes/",
      "\"It's nice to be thought of like this. It makes us feel like we are part of the community to be asked to come out to an event like this. We are having some fun banter back and forth and it's awesome. \"There is a smile on everybody's face.",
      "Pittsburgh Steelers defensive tackle Cameron Heyward (97) with the help of his teammates, distributes turkeys and fixings for Thanksgiving meals to members of the community at the Greater Pittsburgh Community Food Bank on Monday, Nov. 18, 2024 in Duquesne, PA. (Karl Roser / Pittsburgh Steelers)\n\nPittsburgh Steelers defensive tackle Larry Ogunjobi (99) distributes Thanksgiving meals at the YWCA on Tuesday, Nov. 19, 2024 in Pittsburgh, PA. (Alysa Rubin / Pittsburgh Steelers)\n\nPittsburgh Steelers distribute Thanksgiving food with the Pittsburgh Pirates and Pittsburgh Penguins on Tuesday, Nov. 26, 2024 in Pittsburgh, PA. (Alysa Rubin / Pittsburgh Steelers)\n\nPittsburgh Steelers tight end Pat Freiermuth (88) held a Thanksgiving dinner for 50 youth at Carnegie Boys and Girls Club Clubhouse, Tuesday, Nov. 26, 2024 in Pittsburgh, PA. (Karl Roser / Pittsburgh Steelers)\n\nPittsburgh Steelers quarterback Justin Fields (2) held a Thanksgiving dinner for youth at @412YouthZone, Tuesday, Nov. 26, 2024 in Pittsburgh, PA. (Alex Mowrey)"
    ],
    "answer": "Wilson-Batch",
    "reference_answer": "Harsh Agarwal"
  },
  {
    "question": "What is the purpose of the Black Women\u2019s Support Group (Graduate Students)?",
    "context": [
      "Black Women\u2019s Support Group (Graduate Students). April 18, 2025. 4 - 5:15 p.m. Virtual via Zoom Repeats weekly (to May 9). A supportive, virtual space for students who identify as Black women, facilitated by Black female therapists. This weekly, unstructured group provides an opportunity to discuss stress and coping, misogynoir, oppression and privilege, intersectional identities, self-esteem, relationships, colorism, family, internalized racism and other topics of interest. Everyone\u2019s agreement to maintaining the confidentiality of other members is essential! Contact Kym Jordan Simmons, PhD (kyms@andrew.cmu.edu) to schedule a 30-minute pre-group meeting. Add to my calendar. Uncommon Perfection: Illustrations by Derek Norman. April 11, 2025.",
      "The role of females has grown by leaps and bounds and Brown and Schweitzer, well they are prime examples. \"I think it's about progress. It's about opportunity,\" said Schweitzer. \"When I got into football, I didn't really think differently. I didn't think I was different than the rest. I knew I was a female in a male industry, but I didn't work any differently than what my male counterparts were. I don't think you realize it until someone else tells you because you're just here to do the work. That's the biggest thing about women in football. We're here to do the work.",
      "Aadam Soorma, head of marketing and guest experience at Trace Brewing, says the company\u2019s overarching goal is always community with a focus on inclusion. \u201cA lot of our regulars aren't the types to visit a bunch of breweries,\u201d he explains. \u201cWe're their neighborhood spot and third space. We're their coffee shop, meeting place, work-from-home space and gathering place.\u201d He feels that at Trace they curate a vibe in many ways. But the purposeful and intentional steps taken through programming \u2014 with events, their bar program and menu selections, plus hiring practices \u2014 is all geared toward touching diverse communities with the goal of everyone feeling comfortable in their space. Trace first evolved during COVID when the owners were simply brainstorming about where they envisioned things going once it was safe to gather and host events again. \u201cBut the density of Bloomfield and walkability/bikeability/public transit access was something we thought about,\u201d Soorma says, \u201cand the way that our space could sort of gel with the neighborhood as a part of folks' day to day.\u201d He adds, \u201cAlso, our General Manager (Katie Rado) has underrepresented communities in breweries literally at the top of her mind so there was no doubt our events would showcase, celebrate and pay Black, Queer artists and lead the way for other breweries to start thinking about their events strategies.\u201d",
      "We believe that education can be a transformative and enriching force for every person, irrespective of their background, identity or life circumstances. The concept of belonging is foundational to our mission and is intricately interwoven into the very essence of our university, helping to shape our values, policies and practices. Let's continue on this journey together. The Office of the Vice Provost for Diversity, Equity and Inclusion and Chief Diversity Officer412-268-4744Send us a message\n\nCenter for Student Diversity and Inclusion412-268-2150Send us a message\n\nIn an era of global complexity and division, meaningful dialogue has never been more essential.Deeper Conversationsis a university-wide initiative dedicated to fostering civil discourse, critical inquiry and mutual understanding on today\u2019s most pressing issues. From geopolitical conflicts to democracy and elections, our programming spans expert panels, book discussions and interactive forums designed to encourage thoughtful engagement in a space where diverse perspectives can be shared, challenged and explored with curiosity and respect. Learn More About Deeper Conversations Programming\n\nThis multi-event series, part of CMU\u2019s Deeper Conversations initiative, provides interactive programs to foster knowledge, empathy and awareness among staff, faculty and students. Discover Upcoming Events\n\n\"Since our founding, Carnegie Mellon University has been committed to promoting academic excellence and economic mobility through education. This work prioritizes both expanding access and removing barriers to opportunity in support of an inclusive learning environment.",
      "https://www.youtube.com/embed/OZWRN-YzS3E: https://www.youtube.com/embed/OZWRN-YzS3E\n\nLegislation declaring racism a Public Health crisis in the City Pittsburgh and a commitment to provide concrete solutions. Your browser does not support inline frames. Please visit https://www.youtube.com/embed/3d6gMivVKVk\n\nhttps://www.youtube.com/embed/3d6gMivVKVk: https://www.youtube.com/embed/3d6gMivVKVk\n\nA Commission charged with making recommendations to increase racial equity. Your browser does not support inline frames. Please visit https://www.youtube.com/embed/9oSr9W9alUk\n\nhttps://www.youtube.com/embed/9oSr9W9alUk: https://www.youtube.com/embed/9oSr9W9alUk\n\nThe has committed to the Ten principles of racial Equity to increase equity, diversity and inclusion. Your browser does not support inline frames. Please visit https://www.youtube.com/embed/I3hQpFYwIo4\n\nhttps://www.youtube.com/embed/I3hQpFYwIo4: https://www.youtube.com/embed/I3hQpFYwIo4\n\n5 Investment Principles designed to increase funding to black people, black organizations and black businesses in Black Communities. Your browser does not support inline frames. Please visit https://www.youtube.com/embed/QtzTSnf5WcM\n\nhttps://www.youtube.com/embed/QtzTSnf5WcM: https://www.youtube.com/embed/QtzTSnf5WcM\n\nThe Pittsburgh Avenues of Hope A Holistic Model for Rebuilding Pittsburgh's Black & Disinvested Main Streets. The Pittsburgh Avenues of Hope: https://www.ura.org/pages/avenues-of-hope\n\nYour browser does not support inline frames. Please visit https://www.youtube.com/embed/4H1Ll3oFcRw\n\nhttps://www.youtube.com/embed/4H1Ll3oFcRw: https://www.youtube.com/embed/4H1Ll3oFcRw\n\nCity of Pittsburgh 414 Grant St. Pittsburgh, PA 15219 (Accessibility entrance on Ross St.) View on Map 412-255-2621\n\n## Mayor-Ed-Gainey-submits-legislation-to-Council-creating-Groundbreaking-Longtime-Owner-Occupant-Tax-Exemption-Program-LOOP.txt\n\nPublished on March 07, 2025"
    ],
    "answer": "to discuss stress and coping, misogynoir, oppression and privilege, intersectional identities, self-esteem, relationships, colorism, family, internalized racism and other topics of interest",
    "reference_answer": "The Black Women\u2019s Support Group (Graduate Students) is a weekly, virtual space for students who identify as Black women, facilitated by Black female therapists, to discuss various topics of interest including stress and coping, misogynoir, oppression and privilege, intersectional identities, self-esteem, relationships, colorism, family, and internalized racism."
  },
  {
    "question": "When is the opening reception for the Derek Norman exhibition?",
    "context": [
      "- 5 p.m. Hunt Institute for Botanical Documentation, Hunt Library 5th Floor Repeats M-F (to May 9). In celebration of the recent acquisition of over 200 artworks by Derek Norman, this exhibition highlights work created over the last three decades and reflects his lifelong interest in the beauty of nature. Hours: Monday-Friday, 9 a.m.-5 p.m. Join us Thursday, March 13, from 5-7 p.m. for the opening reception.",
      "on Friday, January 28. PITTSBURGH, PA (January.",
      "A Museum Experience Associate will orient you to our campus and help you purchase day-of tickets, if available. Tickets\n\n================================================================================",
      "Summer All, Two & Mini-6 Last Day of Classes. July 31, 2025. All Day. The Academic Calendar includes registration dates, class start dates, add/drop deadlines, exam dates, and more. Doctoral course-sections follow a separate academic calendar. Calendars for Heinz College, Tepper School of Business graduate courses, CMU-Africa, CMU-Australia, and CMU-Qatar can be found on The HUB Academic Calendar web page. Add to my calendar. Contact Info: Web: The HUB Academic Calendar Email: cmuregistrar@andrew.cmu.edu. Uncommon Perfection: Illustrations by Derek Norman. April 9, 2025.",
      "Delmont Apple 'n Arts Festival. Delmont Apple 'n Arts Festival. Saturday, October 4th, 2025: 10 a.m."
    ],
    "answer": "Thursday, March 13, from 5-7 p.m.",
    "reference_answer": "The opening reception for the Derek Norman exhibition is on March 13, from 5-7 p.m."
  },
  {
    "question": "When is Yom HaShoah observed?",
    "context": [
      "Holy Week or Passion Week. April 13 - 19, 2025. All Day (until April 19). Beginning with Palm Sunday on April 13, Eastern Orthodox Christians and some Western Christians commemorate the last week before Pascha or Easter Day with Passion Week or Holy Week. There are special worship services and observances such as prayer, fasting, and confession on multiple days, depending on the specific denomination. Add to my calendar.",
      "10 - 11 a.m.",
      "27 and Oct.",
      "The week-long enforcement initiative will run nightly from Thursday, June 29 until Thursday, July\u00a06, 2023 to respond to fireworks-related calls and complaints.",
      "MAR 20 2025, 7:30 PM THU."
    ],
    "answer": "MAR 20 2025, 7:30 PM THU",
    "reference_answer": "Yom HaShoah is observed on April 23, 2025."
  },
  {
    "question": "Who organizes the Monthly Crafternoon event at Carnegie Mellon University?",
    "context": [
      "Spring Carnival. Homecoming on a crisp fall day.Those traditions are part of your Carnegie Mellon University experience \u2014 and this space is your connection to those memories, whether you graduated 50 years ago or just last spring.The Carnegie Mellon University Alumni Association is the link between your experiences at CMU and everything and everyone that CMU is today, including your fellow alumni and current faculty, staff and students. On this site, you can explore all of the activities, events and resources available for you to deepen your experience as an alum.Please reach out if you need additional information or assistance \u2014 the CMU Alumni Association is here to help you stay connected to the university\u2019s past, present and future. And check back frequently \u2014 exciting events and news are always on the way.Welcome home, Tartans. Email theAlumni Associationor call us at412-268-8089to learn more about connecting with CMU and the global Tartan network. Alumni Association: mailto:%20alumni-house@andrew.cmu.edu\n\n412-268-8089: tel:412-268-8089\n\nREAD MORE NEWS: news/index.html\n\nMar16BOS - CMU Boston Pi Day: https://www.givecampus.com/schools/CarnegieMellonUniversity/events/bos-cmu-boston-pi-day\n\nMar17PIT - Pizza Party at Alumni House: https://www.givecampus.com/schools/CarnegieMellonUniversity/events/pit-pizza-party-at-alumni-house\n\nMar18PIT - Trivia Night at Over the Bar Bicycle Cafe: https://www.givecampus.com/schools/CarnegieMellonUniversity/events/pit-trivia-night-at-over-the-bar-bicycle-cafe\n\nMore events\n\nMore events: events/index.html\n\nUpdate Your Information\n\nUpdate Your Information: ../update-information.html\n\nGive Now\n\nGive Now: https://givenow.cmu.edu/campaigns/42524/donations/new?a=8338674\n\nUniversity Advancement5000 Forbes AvePittsburgh, PA 15213Contact Us\n\nContact Us: mailto:advancement@andrew.cmu.edu\n\nCMU on Facebook: https://www.facebook.com/carnegiemellonalumni/\n\nCMU on LinkedIn: https://www.linkedin.com/company/cmuaa/",
      "Other Stuff. GET TICKETS $25-30. https://carnegiesciencecenter.org/events/21-plus-nights/",
      "7. All requests for the use of Carnegie Mellon facilities by non-university organizations shall be made originally with the Office of Conference and Event Services at 412-268- 1125 or via email. Permission to use facilities may not be assumed until a room reservation form has been signed by the Office of Conference and Event Services or the dean of students. 221",
      "Classical. GET TICKETS $10 / $5. https://www.cmu.edu/cfa/music/concerts-events/#event=43900776. Knit Pit Yarn Club. First Wednesday of every month, 6:30-9 p.m. Eleventh Hour Brewing Co 3711 Charlotte Street, Pittsburgh Lawrenceville. Welcome to Knit PIT Yarn Club, a meetup for knitters of all levels! Tap into your creativity and have fun while crafting with others. Join us to learn new skills, share patterns, and make friends. Whether you're knitting your first scarf or your 25th sweater, you'll find inspiration, laughter, and good vibes. Come enjoy the crafty chaos \u2014 knitting is about the journey, not just the finished piece! We meet at Eleventh Hour Brewing on the first Wednesday of each month. We also offer workshops, lessons, and kits. (412)699-4074. Visual Art. Attendance is Free. The Bo'Hog Brothers. First Wednesday of every month, 7 p.m. Keystone Bar 210 First St., Ellwood City Sewickley. 724-758-4217.",
      "in the sights of Pittsburgh fall foliage on a riverboat tour. Fort Ligonier Days - Ligonier, PA. Oct. 11-13, 2024. Fort Ligonier Days is a three-day festival that commemorates the Battle of Fort Ligonier, a key engagement of the French & Indian War. The festival features historic battle reenactments, live music, authentic crafts, delicious food and more. Houston Pumpkin Festival- Houston, PA. October 11-13, 2024. Features family fun for all ages, including; over 175 food and craft vendors, music and entertainment, children's games and activities, a parade, and many pumpkin related contests. Free admission. Annual Country Fall Festival - Zelienople, PA. Oct. 12-13, 2024. Enjoy two days of musical entertainment, three towers of paranormal ghost walks, pumpkin and costume contests, chainsaw carving, petting zoo, free horse-drawn wagon rides, and historic encampments and demonstrations during the Zelienople Country Fall Festival. Get a Taste of all things Pumpkin Spice in Pittsburgh! Pittsburgh Coffee Week. Oct. 13-19, 2024. A weeklong celebration of everyone's favorite hot bean water with coffee-themed community events, drink specials at participating locations and collaborations with local businesses, all to elevate Pittsburgh's local coffee scene. Pittsburgh Monster Pumpkins Festival. Oct. 19-20, 2024. Join in on the action during the Pittsburgh Monster Pumpkins Festival, featuring a \"Costume Caper\" 5K run/walk, pumpkin ragatta, pumpkin pie eating contest, giant pumpkin sculptures and, of course, record breaking giant pumpkins. This year's event is in a new location in the Strip District, at 3 Crossings Campus along 28th & 29th Street. Past Fall Festivals. Highmark Blues & Heritage Festival - Highmark Stadium. Nov. 3-4, 2023. Highmark Blues & Heritage Festival (HBHF) at Highmark Stadium features two days celebrating hope, roots and the connections that music makes across races, neighborhoods and beliefs. Presented by the August Wilson African American Cultural"
    ],
    "answer": "Knit PIT Yarn Club",
    "reference_answer": "Harsh Agarwal"
  },
  {
    "question": "In the performance, Mary-Kate Olsen is in Love, In which country does the story take place, where Mary-Kate and Grace go on a quest?",
    "context": [
      "CMU Drama Presents: Mary-Kate Olsen Is in Love. April 24, 2025. 8 p.m. John Wells Video Studio, Purnell Center for the Arts. Pop culture, conformity and self-actualization Grace was supposed to have a certain kind of life. She did everything right, but now finds herself in an unfulfilling marriage to Tyler; her unemployed, video-game-addicted, stoner husband. Her now monotonous days consist of going to work, coming home and watching commercials. The only thing she has left is her manifestations of Mary-Kate and Ashley Olsen, who try to teach her how to be the perfect woman through consumerism, sexual objectification and medication, in hopes that Grace\u2019s pursuit of perfection will satisfy her and quell the emptiness of her life. However, Grace\u2019s relationship with her metaphysical celebrity companions takes a bizarre turn when Mary-Kate falls in love with her, and the two go on a quest to New Zealand. Tyler, now alone, is compelled to enter his Call of Duty: Modern Warfare game to face his failures and find his purpose in his wife\u2019s absence. Mary Kate Olsen Is in Love is a dark comedy that follows Grace on her journey to figure out what she actually wants out of her life in a world determined to tell her what will make her \u201chappy.\u201d By Mallery Avidon Directed by Anya Hilpert Performances April 23-25 Tickets are free and can be reserved online beginning at noon the day before each performance. Reserve Tickets Content & Sensory Advisories Add to my calendar. Contact Info: https://drama.cmu.edu/performances/",
      "The scene is set in a church by a Fenland river in early medieval times. A group of monks, acolytes, and lay brethren process in with their Abbot, intoning the plain-chant \u201cTe lucis ante terminum.\u201d The lay brothers go to their instruments and the Abbot announces the performance of a mystery showing how a sign of God\u2019s grace was given. The monks who are to play the Madwoman, the Traveller, and the Ferryman are ceremonially costumed. The Madwoman and the Traveller leave the acting area. The Ferryman, whose duty it is to ferry pilgrims across the Curlew River, steps forward. Today is the day when they come to visit a grave on the other bank which is revered as a shrine. There was a burial there a year ago, and the folk believe it can heal the sick. The Traveller approaches. He has been long on the road and he begs for a place on the ferry, which the Ferryman grants. The Madwoman\u2019s cries are heard in the distance as she sings about curlews, lambs, and crows. When she appears, her confused singing includes the mention of her child, and the pilgrims listen to her in amazement. She tells how her son was seized by a stranger, and how she has lost her mind in despair. She begs to get into the boat, but the Ferryman refuses, alarmed by her strange story. Eventually the Traveller, the Abbot, and the pilgrims persuade the Ferryman to allow her on board, and a sail is hoisted. As the ferry crosses to the other bank, the Ferryman tells how a year before a Heathen man came and left behind a boy who had been ill-treated and was very weak. The boy was able to say he head been stolen from his mother before dying with a prayer on his lips. He was buried nearby. The ferry has reached the bank and the sail is lowered. All go ashore to visit the boy\u2019s tomb except the Madwoman. The Ferryman impatiently tels the Madwoman to be on her way, until her questions reveal that she is his mother and this was the boy she lost. She leads the lamentation, in which all join, her prayers mingling with",
      "MADAMA BUTTERFLY In this groundbreaking new production created by an all Japanese and Japanese American creative team, Madama Butterfly\u2019s story is transported to a fantastical realm where reality and dreams intersect.",
      "Mary invites Timothy over to warn him of Hawkins\u2019s fickle nature. She tells Timothy she is pregnant from a one-night stand. In Timothy\u2019s apartment, Hawkins rejoices that he\u2019s been cleared of allegations of homosexuality. Timothy is shocked by how Hawkins wants to celebrate. Scene 11\n\nRoof of the Old Post Office. Timothy, in agony over his fraught relationship, tells Hawkins he\u2019s decided to enlist in the Army. Scene 12\n\nHawkins\u2019s Office. Mary tells Hawkins she is quitting, as she can no longer work in an atmosphere of panic and persecution. Scene 13\n\nTimothy in France/Hawkins in Chevy Chase. Three years pass. Timothy writes letters to Hawkins and Mary from France, where he is stationed. Hawkins is now married to a woman named Lucy, with a house in the suburbs, but would clearly like to rekindle his relationship with Timothy upon his return. Scene 14\n\nBrick House. In a house in D.C. that Hawkins has rented for his afternoon flings with Timothy, Hawkins expresses that he cannot be everything Timothy wants. Hawkins resolves to end the affair himself. Scene 15\n\nMary\u2019s Kitchen/Brick House/Room M304. Mary is packing when Hawkins stops by, distraught. Hawkins confesses that in order to push Timothy away, he has given Timothy\u2019s name to those investigating alleged homosexuals. He asks Mary to tell Timothy about this betrayal in hopes it will make Timothy hate him. Scene 16\n\nPark in Dupont Circle. His dreams dashed, Timothy decides to leave Washington, D.C., and Hawkins Fuller for good.",
      "Scene 1: A dark, forbidding grove, with a large myrtle tree. Rinaldo, aware that the myrtle tree holds the secret to Armida\u2019s powers, enters the grove to destroy it. Zelmira and a group of nymphs appear, attempting to persuade him to return to Armida. As Rinaldo raises his weapon to strike the myrtle, a disheveled Armida emerges from the tree and confronts him. Unable to kill Rinaldo despite her fury, she watches as he strikes the tree, causing the magic wood to fall lifeless. As Rinaldo tries to escape, he declares to still love her. Armida, consumed by fury, turns into a monster of rage, destroying all in her path. Courtesy of Pinchgut Opera\n\nDETAILS & RESOURCES\n\nWe want you to have the best experience possible at our performances!"
    ],
    "answer": "New Zealand",
    "reference_answer": "New Zealand"
  },
  {
    "question": "Who does Grace's manifestations of Mary-Kate and Ashley Olsen represent in her life?",
    "context": [
      "CMU Drama Presents: Mary-Kate Olsen Is in Love. April 24, 2025. 8 p.m. John Wells Video Studio, Purnell Center for the Arts. Pop culture, conformity and self-actualization Grace was supposed to have a certain kind of life. She did everything right, but now finds herself in an unfulfilling marriage to Tyler; her unemployed, video-game-addicted, stoner husband. Her now monotonous days consist of going to work, coming home and watching commercials. The only thing she has left is her manifestations of Mary-Kate and Ashley Olsen, who try to teach her how to be the perfect woman through consumerism, sexual objectification and medication, in hopes that Grace\u2019s pursuit of perfection will satisfy her and quell the emptiness of her life. However, Grace\u2019s relationship with her metaphysical celebrity companions takes a bizarre turn when Mary-Kate falls in love with her, and the two go on a quest to New Zealand. Tyler, now alone, is compelled to enter his Call of Duty: Modern Warfare game to face his failures and find his purpose in his wife\u2019s absence. Mary Kate Olsen Is in Love is a dark comedy that follows Grace on her journey to figure out what she actually wants out of her life in a world determined to tell her what will make her \u201chappy.\u201d By Mallery Avidon Directed by Anya Hilpert Performances April 23-25 Tickets are free and can be reserved online beginning at noon the day before each performance. Reserve Tickets Content & Sensory Advisories Add to my calendar. Contact Info: https://drama.cmu.edu/performances/",
      "There is, as Tylor argued long ago, a \u201cmental gulf that divides the lowest savage from the highest ape\u201d (Anthropology). In line with the foregoing distinction, human behaviour is to be defined as behaviour consisting of, or dependent upon, symboling rather than upon anything else that Homo sapiens does; coughing, yawning, stretching, and the like are not human. Next to nothing is yet known about the neuroanatomy of symboling. Man is characterized by a very large brain, considered both absolutely and relatively, and it is reasonable\u2014and even obligatory\u2014to believe that the central nervous system, especially the forebrain, is the locus of the ability to symbol. But how it does this and with what specific mechanisms remain to be discovered. One is thus led to the conclusion that at some point in the evolution of primates a threshold was reached in some line, or lines, when the ability to symbol was realized and made explicit in overt behaviour. There is no intermediate stage, logical or neurological, between symboling and nonsymboling; an individual or a species is capable of symboling, or he or it is not. The life of Helen Keller makes this clear: when, through the aid of her teacher, Anne Sullivan, Keller was enabled to escape from the isolation to which her blindness and deafness had consigned her and to effect contact with the world of human meanings and values, the transformation was instantaneous. But even if almost nothing is known about the neuroanatomy of symboling, a great deal is known about the evolution of mind (or \u201cminding,\u201d if mind is considered as a process rather than a thing), in which one finds symboling as the characteristic of a particular stage of development. The evolution of minding can be traced in the following sequence of stages. First is the simple reflexive stage, in which behaviour is determined by the intrinsic properties of both the organism and the thing reacted to\u2014for example, the contraction of the pupil of the eye under increased",
      "After her husband\u2019s death in 1919, Adelaide divided her time between their New York home (now The Frick Collection), their summer home Eagle Rock, and their Pittsburgh home, Clayton. Upon her death, October 4, 1931, her daughter Helen inherited the Pittsburgh home and the summer home and its contents. ================================================================================",
      "Holy Cats by Andy Warhol\u2019s Mother\n\nHaving artistic talent herself, Julia Warhola recognized her youngest son Andy\u2019s abilities from a young age and encouraged him to pursue his passion, including sending him to Saturday art classes at Carnegie Museum of Art. When Warhol moved to New York City in 1949, it wasn\u2019t long before Julia joined him, and he began enlisting her to add her unique handwriting to hundreds of his drawings, advertisements, and book illustrations. Julia also loved to draw, with cats and angels as her favorite subjects. In 1956, the pair made a book about their cats, 25 Cats Name Sam and One Blue Pussy , featuring illustrations combining Andy\u2019s blotted line drawings and calligraphy by Julia. When she left out the \u201cd\u201d in the book\u2019s title, her son loved it and opted to keep it anyway. Four years later, Julia wrote and illustrated Holy Cats by Andy Warhol\u2019s Mother . A print of Alice Patrick\u2019s Women Do Get Weary, but They Don\u2019t Give Up hangs in the Braddock municipal building. Photo: Bryan Conley\n\nThe Art Lending Collection\n\nIt was 1991 when artist Alice Patrick\u2019s mural Women Do Get Weary, but They Don\u2019t Give Up first loomed large on the National Council of Negro Women\u2019s Los Angeles building. Some 20 years later, a smaller yet still powerful framed print of the work hung in the Braddock municipal building. Thanks to the Art Lending Collection, Women Do Get Weary is one of more than 160 artworks available to anyone with an Allegheny County library card to borrow, display, and enjoy for up to three weeks at a time\u2014changing the dynamic of who gets to interpret and experience art. Now funded by the Heinz Endowments, the collection was the brainchild of Braddock-based artists Dana Bishop-Root, Leslie Stem, and Ruthie Stringer.",
      "She got introduced, and her son saw her and was so proud. He screamed, 'Mommy, you're the best, you're the best, mom.' He kept saying, 'that's my mom.' That moment for me, and of course my emotional self, I'm sitting there boo-hooing because he was so proud of his mom. In those moments, when kids are able to be fulfilled, when they're able to have that look on their face of just being a kid, those are the things that I live for. \"It's seeing kids accomplish things they didn't think they could accomplish, things they have never done, and they take it on. Those moments make me excited to keep moving forward. \"We're not just a one-off program."
    ],
    "answer": "the perfect woman",
    "reference_answer": "Grace's manifestations of Mary-Kate and Ashley Olsen represent the ideal of perfection that Grace aspires to in her life."
  },
  {
    "question": "What is the contact email for the Academic Calendar?",
    "context": [
      "Fall 2025 Registration Week. April 7 - 11, 2025. All Day (until April 11). The Academic Calendar includes registration dates, class start dates, add/drop deadlines, exam dates, and more. Doctoral course-sections follow a separate academic calendar. Calendars for Heinz College, Tepper School of Business graduate courses, CMU-Africa, CMU-Australia, and CMU-Qatar can be found on The HUB Academic Calendar web page. Add to my calendar. Contact Info: Web: The HUB Academic Calendar Email: cmuregistrar@andrew.cmu.edu. Last Day of Classes. April 25, 2025. All Day. The Academic Calendar includes registration dates, class start dates, add/drop deadlines, exam dates, and more. Doctoral course-sections follow a separate academic calendar. Calendars for Heinz College, Tepper School of Business graduate courses, CMU-Africa, CMU-Australia, and CMU-Qatar can be found on The HUB Academic Calendar web page. Add to my calendar. Contact Info: Web: The HUB Academic Calendar Email: cmuregistrar@andrew.cmu.edu. Ph.D. Student Support Group. May 5, 2025. 6:30 - 7:30 p.m. Repeats weekly (to May 9). The PhD Support Group offers space to confidentially discuss the stressors and challenges of navigating relationships with advisors and peers, academic milestones, academic hazing, low motivation, struggles with self-confidence, and efforts to lead a more balanced life. The group is able to accommodate no more than one student per program/lab. Feel free to email Kym Jordan Simmons, PhD (kyms@andrew.cmu.edu) to schedule a 30-minute pre-group meeting. Add to my calendar. Summer All add, audit, & tuition adjustment drop deadline. May 23, 2025. All Day. The Academic Calendar includes registration dates, class start dates, add/drop deadlines, exam dates, and more. Doctoral course-sections follow a separate academic calendar. Calendars for Heinz College, Tepper School of Business graduate courses, CMU-Africa, CMU-Australia, and CMU-Qatar can be found on The HUB Academic Calendar web page. Add to my",
      "Hotmail, Yahoo or Gmail etc.).",
      "PR@pghtacofest.com.",
      "227\n\n(412) 268-2323 (for emergencies on-campus) campuspd@andrew.cmu.edu V. How the University Responds to Reports A.",
      "Check out additional university resources and important contacts on the Student Affairs -Student Support & Resourceshomepage."
    ],
    "answer": "cmuregistrar@andrew.cmu.edu",
    "reference_answer": "cmuregistrar@andrew.cmu.edu"
  },
  {
    "question": "Who is the speaker at the event, AI-SDM Webinar taking place May 9th, 2025 at Carnegie Mellon University?",
    "context": [
      "and Thu., March 27, 9 a.m.-4 p.m. August Wilson African American Cultural Center 980 Liberty Ave, Pittsburgh Downtown. Innovation Summit 2025 brings professionals together for 2 days of actionable insights focused on AI, data, and cloud technology topics. Date and Time: Starts: Wed, Mar 26, 25 ( 9:00 AM) Ends: Thu, Mar 27, 25 ( 4:00 PM).",
      "AI-SDM Webinar: Giacomo de Nicola. May 9, 2025. 3 - 4:30 p.m. Online. The AI Institute for Societal Decision Making (AI-SDM) invites you to engage in an intellectual discourse through our biweekly seminar series. AI-SDM invites you to engage in an intellectual discourse through our biweekly seminar series. This interactive forum serves as a cornerstone for collaboration and knowledge exchange, convening the Institute\u2019s investigators, postdocs, and graduate students alongside preeminent guest speakers from academia, industry, and government entities. Each session presents an opportunity for remote and in-person attendees to delve into the Institute\u2019s cutting-edge research at the nexus of artificial intelligence and societal decision-making. Sessions are further enriched by stimulating Q&A sessions and, of course, delectable refreshments for our dedicated physical audience. We invite you to engage, learn, and contribute to the advancement of AI for the betterment of society. Speaker: Giacomo de Nicola, Postdoctoral Research Fellow, Harvard T.H. Chan School of Public Health, Harvard University Learn more Register for the Zoom session Add to my calendar. Contact Info: Parker Werns pwerns@andrew.cmu.edu Related Content: Registration AI-SDM Seminar Series website. Uncommon Perfection: Illustrations by Derek Norman. March 31, 2025.",
      "Jeremy Piven Live. Mar 21, 2025 , 7:30 pm - 10:30 pm.",
      "Women in Science Highlight Mentorship, Outreach as Integral to Career Success: /news/stories/archives/2025/march/women-in-science-highlight-mentorship-outreach-as-integral-to-career-success\n\nFor Women's History Month, Carnegie Mellon is featuring the work of women across the science, technology, engineering and mathematics fields.(opens in new window)(opens in new window)\n\n(opens in new window)(opens in new window): https://www.cmu.edu/leadership/president/bio/index.html\n\nCarnegie Mellon University: https://www.twitter.com/CarnegieMellon\n\n@USNavy: https://twitter.com/USNavy\n\nhttps://t.co/CJc0vUX31B: https://t.co/CJc0vUX31B\n\nhttps://t.co/Ch5gHl2CDI: https://t.co/Ch5gHl2CDI\n\nFeb 6, 2025: https://twitter.com/CarnegieMellon/status/1887614580123386265\n\nShare\n\nPowered by Curator.io: https://curator.io\n\nRales Fellows Revolutionize Artificial IntelligenceTwo Rales Fellows focus on artificial intelligence and machine learning in their studies: master\u2019s degree candidate Nicole Villavicencio-Gardu\u00f1o and doctoral candidate Maxwell Jones.March 7, 2025: /news/stories/archives/2025/march/rales-fellows-revolutionize-artificial-intelligence\n\nTwo Rales Fellows focus on artificial intelligence and machine learning in their studies: master\u2019s degree candidate Nicole Villavicencio-Gardu\u00f1o and doctoral candidate Maxwell Jones. Researchers Use Computer Science To Save BeesCMU and UC Riverside researchers have created a system to help beekeepers monitor and analyze the health of their beehives and take corrective actions to prevent colony collapse.March 5, 2025: /news/stories/archives/2025/march/researchers-use-computer-science-to-save-bees\n\nCMU and UC Riverside researchers have created a system to help beekeepers monitor and analyze the health of their beehives and take corrective actions to prevent colony collapse.",
      "Rep. Dan Miller-Disability and Mental Health Summit: https://www.pahouse.com/Miller/DisabilitySummit\n\nThe Disability and Mental Health Summit, held annually, is designed to bring disability resources and experts out of their offices and into an easy-to-access environment, where people can meet face-to-face to better solve problems. Self-Advocacy Voices\n\nSelf-Advocacy Voices: https://selfadvocacyvoices.org/\n\nThe Self-Advocacy Voices mentorship incubator program empowers people with disabilities to give voice to their interests, passions, knowledge, and experiences through public speaking within a supportive environment of peers and mentors. Pittsburgh Mercy Intellectual & Developmental Disabilities Services\n\nPittsburgh Mercy Intellectual & Developmental Disabilities Services: https://www.pittsburghmercy.org/intellectual-disabilities/pittsburgh-mercy-intellectual-developmental-disabilities-services/\n\nUPMC\u2019s services are designed to promote community inclusion and improve quality of life, whether it\u2019s providing vocational training, preparing for employment or volunteer work, arranging housing and services that match the amount of supervision needed, or providing community opportunities and in-home support for those living with their families. The Arc of PA\n\nThe Arc of PA: https://thearcpa.org/\n\nThe Arc of Pennsylvania promotes the human rights of people with intellectual and Developmental Disabilities and actively supports their full inclusion and participation in the community throughout their lifetimes. Community Notification Enrollment\n\nCommunity Notification Enrollment: https://public.coderedweb.com/CNE/en-US/BF5CCF5B2AB3"
    ],
    "answer": "Giacomo de Nicola",
    "reference_answer": "Giacomo de Nicola"
  },
  {
    "question": "Which team is Carnegie Mellon Men's Tennis team playing against on April 19, 2025?",
    "context": [
      "Summer One & Mini-5 Final Exams. June 20, 2025. All Day. The Academic Calendar includes registration dates, class start dates, add/drop deadlines, exam dates, and more. Doctoral course-sections follow a separate academic calendar. Calendars for Heinz College, Tepper School of Business graduate courses, CMU-Africa, CMU-Australia, and CMU-Qatar can be found on The HUB Academic Calendar web page. Add to my calendar. Contact Info: Web: The HUB Academic Calendar Email: cmuregistrar@andrew.cmu.edu. (Men\u2019s Tennis) St. Francis (Pa.) vs. Carnegie Mellon. March 21, 2025. All Day. (Men\u2019s Tennis) St. Francis (Pa.) vs. Carnegie Mellon Add to my calendar. CMU Tartans logo Contact Info: Full Athletics Schedule. Monthly Chair Massage. March 28, 2025. 11 a.m. - 1 p.m. Near the Concierge Desk, First Floor, Highmark Center for Health, Wellness and Athletics. Join us for a free five-minute chair massage on the last Friday of every month at the Highmark Center. This event is free and open to all. No registration required. Add to my calendar. Contact Info: Name: Harsh Agarwal Email: hagarwa2@andrew.cmu.edu. AI-SDM Seminar: Rayid Ghani. April 11, 2025. 11:30 a.m. - 1 p.m.",
      "THE INFORMATION PLAYERS PROVIDE IN CONNECTION WITH THIS TOURNAMENT IS BEING PROVIDED TO TOURNAMENT ORGANIZER AND NOT TO PSYONIX LLC. 2024 Pittsburgh E-Arena Tournament\n\nThis multi-day event will kick off with online gameplay on the first day, followed by in-person matches on the second, giving young gamers the opportunity to compete for the prestigious title of \"Best in the City\". This year's Pittsburgh E-Arena tournament will feature Rocket League, with 16 teams competing in Doubles mode (2v2). Teams will compete online in preliminary rounds to determine the final teams for the in-person event. Each match will last 5 minutes, excluding any overtime periods, with teams aiming to be the first to score 3 goals in a best-of-3 series. The tournament will follow a double-elimination format, featuring both upper and lower brackets. Winners will advance in the upper bracket, while runners-up will move to the lower bracket, where a loss results in elimination from the tournament. Trophies will be awarded to the First, Second, and Third place team members. All participants will receive a commemorative t-shirt, complimentary food, and access to various activities sponsored by Tech 25. Finalists will have access to Legion Gaming PCs provided by Tech 25 for gameplay, but controller players are welcome to Bring Your Own Device (BYOD). Upcoming Tournament Dates\n\nRegistration for this year\u2019s E-Arena event opens on November 1, 2024 !",
      "is nationally recognized [ 61 ] for its passionate members and perseverance through consecutive unsuccessful seasons from 2016 to 2022. [ 62 ] The suburban Robert Morris University's Colonials have competed in NCAA Division I basketball since the 1970s, qualifying for the NCAA tournament in each of the last four decades (8). In the 2013 National Invitation Tournament the Colonials notched an upset win over the defending national champions Kentucky Wildcats. Pitt women's basketball has also made recent appearances in the NCAA tournament . [ 63 ] A rivalry game between Pitt and Duquesne, termed the City Game , is played annually between the two schools' men's and women's basketball teams, as well as their baseball teams. Other collegiate sports [ edit ] Along with college football and men's and women's basketball, the area universities compete in many additional sports. The University of Pittsburgh also fields NCAA Division I teams in baseball (its oldest sport. first played in 1869 [ 64 ] ), cross country, gymnastics, track and field, soccer, softball , swimming and diving, tennis, volleyball , and wrestling . [ 65 ] The Duquesne Dukes, in addition to many of the sports above, also participates in Division I lacrosse, golf, and rowing. [ 66 ] Robert Morris University fields Division I teams in men's and women's hockey, among other sports. [ 67 ] Major events [ edit ] Event Number Venue Years PGA Championship 5 Oakmont Country Club Pittsburgh Field Club Laurel Valley Golf Club 1922 , 1951 , 1978 1937 1965 Senior PGA Championship 1 Laurel Valley Golf Club 2005 PGA Tour Champions 5 Laurel Valley Golf Club Fox Chapel Golf Club 1989 2012 , 2013 , 2014 US Open 9 Oakmont Country Club 1927 , 1935 , 1953 , 1962 , 1973 , 1983 , 1994 , 2007 , 2016 Ryder Cup 1 Laurel Valley Golf Club 1975 MLB All Star Game 5 Forbes Field Three Rivers Stadium PNC Park 1944 , 1959 1974 , 1994 2006 NHL All Star Game 1 Pittsburgh Civic Arena 1990 NHL Entry Draft 2 Pittsburgh Civic Arena PPG Paints",
      "Plus, special dates for the holidays! November 29, December 22\u201323, and December 26\u201330 at 12:30 p.m. Where: Carnegie Museum of Natural History Tickets: Free with Museum Admission Join our expert Natural History Interpreters for guided tours. See highlights of favorite exhibitions, learn fun facts, and have your burning questions answered. Tours meet at the entrance to Dinosaurs in Their Time. Buy your tickets in advance! 4126223131. Exhibits. GET TICKETS $25.00. https://cli.re/91515-museum-highlight-tours. Donation-Based Yoga. Saturdays, Sundays, 7-7:45 a.m. Frick Park Red Clay Tennis Courts 800 S. Braddock Ave., Pittsburgh Point Breeze. Join the Frick Park Clay Tennis Court Club and The Om Lounge for donation based (socially distanced) yoga every Saturday and Sunday morning at 7 AM, weather-permitting. Donations are accepted via credit/debit card, but are not required for participation. No pre-registration is required at this time. Participants must wear a mask while not on their mat. Please bring your own mat, towel, water, and any other props. Class is all levels and open to the public. Donations support the Frick Park Clay Court Tennis Club. Exercise.",
      "(W. Track and Field) Carnegie Mellon Invitational. March 28, 2025. All Day. (W. Track and Field) Carnegie Mellon Invitational Add to my calendar. CMU Tartans logo Contact Info: Full Athletics Schedule. Ostara. March 20, 2025. All Day. On March 20, Wiccans and Neo-pagans celebrate Ostara, which occurs on the Spring Equinox. It is named after the Anglo-Saxon goddess, Eostre. Ostara rituals and gatherings focus on fertility, rebirth, and renewal. Add to my calendar. Libraries Workshop: Analyzing Scholarly Literature Using Bibliometrics. April 7, 2025."
    ],
    "answer": "St. Francis",
    "reference_answer": "Case Western Reserve"
  },
  {
    "question": "When does the AI-SDM seminar series take place?",
    "context": [
      "Session 2: July 23-27 at the University of Pittsburgh. Session 3: July 30- August 3 at CCAC/Northside Campus. Session 4: August 6-10 at Chatham University. Each daily session runs from 8:30 a.m.",
      "AI-SDM Webinar: Giacomo de Nicola. May 9, 2025. 3 - 4:30 p.m. Online. The AI Institute for Societal Decision Making (AI-SDM) invites you to engage in an intellectual discourse through our biweekly seminar series. AI-SDM invites you to engage in an intellectual discourse through our biweekly seminar series. This interactive forum serves as a cornerstone for collaboration and knowledge exchange, convening the Institute\u2019s investigators, postdocs, and graduate students alongside preeminent guest speakers from academia, industry, and government entities. Each session presents an opportunity for remote and in-person attendees to delve into the Institute\u2019s cutting-edge research at the nexus of artificial intelligence and societal decision-making. Sessions are further enriched by stimulating Q&A sessions and, of course, delectable refreshments for our dedicated physical audience. We invite you to engage, learn, and contribute to the advancement of AI for the betterment of society. Speaker: Giacomo de Nicola, Postdoctoral Research Fellow, Harvard T.H. Chan School of Public Health, Harvard University Learn more Register for the Zoom session Add to my calendar. Contact Info: Parker Werns pwerns@andrew.cmu.edu Related Content: Registration AI-SDM Seminar Series website. Uncommon Perfection: Illustrations by Derek Norman. March 31, 2025.",
      "Delmont Apple 'n Arts Festival. Delmont Apple 'n Arts Festival. Saturday, October 4th, 2025: 10 a.m.",
      "and Thu., March 27, 9 a.m.-4 p.m. August Wilson African American Cultural Center 980 Liberty Ave, Pittsburgh Downtown. Innovation Summit 2025 brings professionals together for 2 days of actionable insights focused on AI, data, and cloud technology topics. Date and Time: Starts: Wed, Mar 26, 25 ( 9:00 AM) Ends: Thu, Mar 27, 25 ( 4:00 PM).",
      "AI \u2014 a tool with endless sustainability applications that also consumes eye-watering amounts of energy to power its data centers. CMU Energy Week is free and open to the public. View the Energy Week schedule and details Register to attend Energy Week 2025 Add to my calendar. Related Content: Energy Week Website Registration Form. Uncommon Perfection: Illustrations by Derek Norman. April 25, 2025."
    ],
    "answer": "biweekly",
    "reference_answer": "The AI-SDM seminar series takes place biweekly."
  },
  {
    "question": "Who is the director of the play \"The Inseparables\" at CMU Drama?",
    "context": [
      "CMU Drama Presents: The Inseparables. March 27, 2025. 8 p.m. Helen Wayne Rauh Studio Theater, Purnell Center for the Arts. Puppets. Pool noodles. Putting on a play! The North American Unified Theatre Collaborators of the West really want to put on a show. Like, really bad. Under the leadership of their founder and director, this group of actors has decided to stage a new adaptation of \u201cThe Three Musketeers.\u201d Only, they aren\u2019t nearly as prepared as they should be. With puppets and pool noodles, this theatre group prepares for their glorious comeback\u2026that may not happen. Written by School of Drama professor TJ Young, and directed by Head of School Robert Ramirez, this one is sure to leave you with something to laugh about! By TJ Young Directed by Robert Ramirez Performances March 20-29 Purchase Tickets Content & Sensory Advisories Add to my calendar. Contact Info: https://drama.cmu.edu/performances/",
      "of Music. Ms. Berry is currently pursuing a Doctor of Musical Arts at Eastman where she serves not only as a studio accompanying graduate assistant but also as a music theory teaching assistant. Her instructors include David Allen Wehr, Dr.",
      "Portman William H. Rackoff Gregory E. Scott Ryan Vaccaro Directors Eric Boughner Ellen Still Brooks Jeffrey Craft Ann C. Donahue Julie Gulick Matt Helfrich Thomas B.",
      "After receiving his Bachelor of Arts from California State University-Northridge under the tutelage of David Sannerud, he went on to obtain his Graduate Diploma from The Juilliard School, studying under Darrell Babidge. His most recent engagements include the Fifth Jew (Strauss\u2019Salome) in his mainstage debut as a 2024 Apprentice Artist at Des Moines Metro Opera, the Sacristan (Puccini\u2019sTosca) and the Colonel (Redler\u2019sThe Falling and the Rising) as a 2023 Young Artist with Opera Memphis, the Herald (Wagner\u2019sLohengrin) with Utah Festival Opera, and the Commendatore (Mozart\u2019sDon Giovanni) in SAT\u2019s collaborative production with Teatro Grattacielo. Mr.",
      "and Wed., April 23, 8 p.m. Purnell Center for the Arts 4908 Forbes Ave, Pittsburgh Oakland. Epic and majestic, this Tony Award-winning musical captures the triumph and tragedy of the hopeful passengers on the ill-fated Ship of Dreams. Story & Book by Peter Stone Music & Lyrics by Maury Yeston Orchestrations by Ian Weinberger Directed by Telly Leung Music Directed by Michael McKelvey. Theater."
    ],
    "answer": "Robert Ramirez",
    "reference_answer": "Robert Ramirez"
  },
  {
    "question": "How many alumni, parents, and friends does CMU have in the San Francisco Bay Area?",
    "context": [
      "Contact alumni-house@andrew.cmu.edu. One of CMU's largest regional networks, the San Francisco Bay Area boasts a collection of over 10,500 alumni, parents and friends. Event registrations close April 4th at 09:00 AM PDT.",
      "Paying for a CMU Education\n\nPaying for a CMU Education: https://www.cmu.edu/admission/costs-aid#aid-fundamentals\n\nOur financial aid resources are committed to meeting 100% of demonstrated financial need for domestic students. Average starting salary for 2024 graduates\n\nOur 2023 undergraduates averaged $18,200 in Federal Loan debt, much less than the $32,062 average for ranked private colleges. (US News & World Report)\n\n91% of our 2024 graduates were employed or continuing education within six months of graduation. Explore graduate outcomes for our students.(opens in new window): https://www.cmu.edu/career/outcomes/post-grad-dashboard.html\n\nThe furiously curious kind. The deeply driven kind. The kind who wants to make life better for all humankind. Explore The Student Blog(opens in new window)\n\nExplore The Student Blog(opens in new window): /admission/student-community-blog\n\n412.268.2082: tel:412.268.2082\n\nEmail Us(opens in new window): mailto:admission@andrew.cmu.edu\n\nConnect with Us: /admission/contact-us\n\nMeet Our Staff: /admission/meet-our-staff\n\nDownloads: /admission/downloads\n\nCampus Map: /admission/campus-map\n\nPre-College Programs: https://www.cmu.edu/pre-college/\n\nChat with us: https://www.livechatinc.com/chat-with/8321781/\n\nLiveChat: https://www.livechatinc.com/?welcome",
      "Contact alumni-house@andrew.cmu.edu. The Denver Network has over 1,250 alumni, parents and friends in the region. Boulder, Denver, Jefferson and Larimer counties feature prominently in this network. Event registrations close March 26th at 09:59 PM MDT. $109.00 per person. DC - Washington Wizards vs. Orlando Magic and Post-Game Concert with Shaquille O'Neal. March 21, 2025, 7:00pm - 10:00pm EDT. Capital One Arena, 601 F St NW, Washington, District of Columbia 20004. Join the CMU DC Alumni Network for a night out at the Washington Wizards vs. (currently 4th ranked) Orlando Magic NBA game. This game is part of their Friday Concert Series and tickets include a post-game performance by the one and only Shaquille O'Neal (DJ Diesel) if you choose to stay! Everyone who registers through this link will be seated together in section 406, so this is a great way to connect with your fellow CMU DC Tartans. Friends and family are invited to join in the on the fun. Stay tuned for details on a potential pre-game meet up if we get enough registrants. Questions? Contact alumni-house@andrew.cmu.edu. With just under 6,500 alumni, students, parents and friends in the Washington, D.C., Network, many of those Tartans are located in and around Fairfax, Montgomery and Arlington counties, as well as the District of Columbia. Event registrations close March 20th at 11:59 PM EDT. $28.00 per person. HLAA - Coffee with Glenn and Jonathan at Think Coffee. March 22, 2025, 10:00am - 12:00pm EDT. Think Coffee, 246 5th Ave, New York, New York 10001. Hey Tartans, Join us for Coffee with Glenn and Jonathan on Saturday March 22 at Think Coffee on the corner of 28th and 5th. Nothing fancy, just two Tartans drinking coffee, and building community. Wear your CMU gear and join us to meet fellow NYC and HLAA Alums. Hope to see you at Think Coffee. Questions? Contact alumni-house@andrew.cmu.edu. Our mission is to connect and reconnect Hispanic alumni, students, parents and friends to the university and each",
      "Hope to see you at Think Coffee. Questions? Contact alumni-house@andrew.cmu.edu. Our mission is to connect and reconnect Hispanic alumni, students, parents and friends to the university and each other through experiences and communications for the purpose of generating multifaceted support for Carnegie Mellon University. Event registrations close March 21st at 11:59 PM EDT. Free. PIT - Pizza Party at Alumni House. March 17, 2025, 6:00pm - 8:00pm EDT. Alumni House, 5017 Forbes Ave, Pittsburgh, Pennsylvania 15213. Join us at Alumni House for a St. Patrick\u2019s Day Pizza Party! Celebrate St. Patrick\u2019s Day with us in person at Alumni House for an evening of fun, community, and, of course, delicious pizza! We\u2019ll be recognizing the outstanding achievements of our student scholarship recipients and the Highland Ambassadors. Come dressed in green and enjoy lively conversations while connecting with alumni and students. It\u2019s a great opportunity to learn about their academic journeys and contributions both in and out of the classroom. After the party, you're welcome to stay for a brief planning meeting to discuss upcoming activities for the month ahead. Don't miss this chance to celebrate St. Patrick\u2019s Day with great food and even better company! Questions? Contact alumni-house@andrew.cmu.edu. With more than 33,000 alumni, parents, faculty, staff, students and friends in the region, the Pittsburgh network is the largest regional network of the Carnegie Mellon University Alumni Association. Event registrations close March 17th at 04:00 PM EDT.",
      "With just under 5,000 alumni throughout Middlesex, Norfolk, Suffolk, Essex and Worcester counties, the Boston Network is one of the largest networks in the Carnegie Mellon University Alumni Association. Event registrations close March 11th at 11:59 PM EDT."
    ],
    "answer": "10,500",
    "reference_answer": "The San Francisco Bay Area has over 10,500 alumni, parents, and friends."
  },
  {
    "question": "When is the Three Minute Thesis Championship taking place?",
    "context": [
      "Summer One & Mini-5 Final Exams. June 20, 2025. All Day. The Academic Calendar includes registration dates, class start dates, add/drop deadlines, exam dates, and more. Doctoral course-sections follow a separate academic calendar. Calendars for Heinz College, Tepper School of Business graduate courses, CMU-Africa, CMU-Australia, and CMU-Qatar can be found on The HUB Academic Calendar web page. Add to my calendar. Contact Info: Web: The HUB Academic Calendar Email: cmuregistrar@andrew.cmu.edu. (Men\u2019s Tennis) St. Francis (Pa.) vs. Carnegie Mellon. March 21, 2025. All Day. (Men\u2019s Tennis) St. Francis (Pa.) vs. Carnegie Mellon Add to my calendar. CMU Tartans logo Contact Info: Full Athletics Schedule. Monthly Chair Massage. March 28, 2025. 11 a.m. - 1 p.m. Near the Concierge Desk, First Floor, Highmark Center for Health, Wellness and Athletics. Join us for a free five-minute chair massage on the last Friday of every month at the Highmark Center. This event is free and open to all. No registration required. Add to my calendar. Contact Info: Name: Harsh Agarwal Email: hagarwa2@andrew.cmu.edu. AI-SDM Seminar: Rayid Ghani. April 11, 2025. 11:30 a.m. - 1 p.m.",
      "From 12:00 p.m.",
      "Event: First Full Squad Workout\n\nDate: Feb 22 (Sat)\n\nOpponent: Orioles (BAL)\n\nType: vs vs. Event:\n\nOutcome: W,\n\nDate: Feb 23 (Sun)\n\nOpponent: Twins (MIN)\n\nType: vs vs.",
      "3-Nov.",
      "on Friday, January 28. PITTSBURGH, PA (January."
    ],
    "answer": "January 28",
    "reference_answer": "The Three Minute Thesis Championship is taking place on March 12, 2025 at 3:30 PM ET."
  },
  {
    "question": "In which college is the Statistics & Data Science major located?",
    "context": [
      "The university offers a broad range of undergraduate, graduate, and professional degree programs. Research facilities affiliated with the main campus include the Learning Research and Development Center and the Pymatuning Laboratory of Ecology. The Johnstown campus is a four-year college with a liberal arts and sciences and engineering curriculum. The branches in Bradford and Greensburg are both four-year liberal arts colleges. The Titusville branch is a junior college. Total enrollment for the system is approximately 31,400.",
      "Scientific data.",
      "Business Analytics Summer Summit: programs/master-business-analytics/community/summer-summit.html\n\nCareer Resources: programs/master-business-analytics/careers/index.html\n\nSalary and Employment Highlights: programs/master-business-analytics/careers/compensation-highlights.html\n\nTuition and Financial Aid: programs/master-business-analytics/tuition/index.html\n\nCorporate Partnerships: programs/master-business-analytics/corporate-partners/index.html\n\nRequest Information: programs/master-business-analytics/request-information.html\n\nMaster of Science in Management: programs/master-science-management/index.html\n\nCurriculum: programs/master-science-management/curriculum/index.html\n\nCourses: programs/master-science-management/curriculum/courses.html\n\nAdmissions: programs/master-science-management/admissions/index.html\n\nAdmission Events: programs/master-science-management/admissions/events/index.html\n\nApply: programs/master-science-management/admissions/apply/index.html\n\nApplication Deadlines: programs/master-science-management/admissions/apply/deadlines.html\n\nInternational Applicants: programs/master-science-management/admissions/apply/international-applicants.html\n\nTuition and Financial Aid: programs/master-science-management/tuition/index.html\n\nMaster of Science in Product Management: programs/master-product-management/index.html\n\nMaster of Integrated Innovation for Products & Services: https://www.cmu.edu/iii/degrees/miips/index.html\n\nMaster of Science in Computational Finance: https://www.cmu.edu/mscf\n\nPh.D.: programs/phd/index.html\n\nProgram: programs/phd/program/index.html\n\nAccounting: programs/phd/program/accounting/index.html\n\nBusiness Technologies: programs/phd/program/business-technologies/index.html\n\nEconomics: programs/phd/program/economics/index.html\n\nFinancial Economics: programs/phd/program/financial-economics/index.html\n\nMarketing: programs/phd/program/marketing/index.html\n\nOperations Management: programs/phd/program/operations-management/index.html",
      "Jump to Header: #global-header\n\nJump to Main Content: #main\n\nJump to Footer: #global-footer\n\nAbout: /about/\n\nSchool of Information Systems & Management: /about/information-systems-management\n\nSchool of Public Policy & Management: /about/public-policy-management\n\nCollege of Fine Arts Joint Degree Programs: /about/fine-arts\n\nDiversity & Inclusion: /about/diversity-inclusion-climate-equity\n\nHeinz College Policy Impact: /about/heinz-college-policy-impact\n\nHeinz College in Washington D.C.: /about/policy-in-dc\n\nArtificial Intelligence Leadership: /about/artificial-intelligence-leadership\n\nTrillion Dollar Questions: /about/trillion-dollar-questions\n\nPublic Interest Technology: /about/public-interest-technology/\n\nHistory: /about/history\n\nRankings: /about/rankings\n\nContact Us: /contact/\n\nPrograms: /programs/index\n\nAdmissions: /admissions/index\n\nFaculty & Research: /faculty-research/index\n\nFaculty Experts: /faculty-research/profiles/index\n\nOur Faculty In The News: /faculty-research/our-faculty-in-the-news\n\nResearch Centers: /faculty-research/research-centers\n\nLife at Heinz College: /life-at-heinz/index\n\nEmployers & Corporate Partners: /employers-partners/index\n\nAlumni: /alumni/index\n\nCurrent Students: /current-students/index\n\nGIVE: https://www.heinz.cmu.edu/give/\n\nAPPLY: https://apply.heinz.cmu.edu/apply/\n\nEmpowered Public Sector Leaders Leverage Evidence-Based Policy\n\nFeatured: ?cat=Featured\n\nIn the Public Interest: ?cat=In the Public Interest\n\nEMPOWERING STUDENTS: ?cat=EMPOWERING STUDENTS\n\nSOCIETAL IMPACT OF AI: ?cat=SOCIETAL IMPACT OF AI\n\nRecent News: ?cat=Recent News\n\nRead More: ../../media/2025/February/data-for-a-difference-how-alumna-sarah-ali-helps-states-expand-high-speed-internet-access.php\n\nRead More: ../../media/2025/January/heinz-alumna-sara-cortez-advises-state-lawmakers-on-education-policy.php\n\nRead More: ../../media/2025/January/study-of-16-years-of-u-s-canada-free-trade-agreement-finds-that-workers-were-not-hurt-by-freer-trade.php",
      "Undergraduate and graduate degree programs are offered in a range of fields."
    ],
    "answer": "Heinz College",
    "reference_answer": "Mellon College of Science"
  },
  {
    "question": "Who is the Vice President for Diversity and Inclusion at Carnegie Mellon University?",
    "context": [
      "These efforts are ongoing and remain critical to our university's mission to advance learning, research, and creativity and make a positive impact on society more broadly.\"\n\nDr. Farnam JahanianPresidentHenry L. Hillman President's Chair\n\n\u201cCMU\u2019s Framework 'Bridging to Inclusive Excellence' charts a clear, strategic course for how our community can both foster individual and collective excellence and nurture a culture where all members feel welcomed, valued and empowered to succeed.\u201d\n\nDr. Wanda Heading-GrantVice Provost for Diversity, Equity and Inclusion and Chief Diversity Officer\n\nInclusive ExcellenceCarnegie Mellon University5000 Forbes AvenuePittsburgh, PA 15213",
      "1 64,251\n\n12\n\n64,251\n\n1\n\n20G\n\n12\n\n66,179\n\n311 Call Center Representative\n\n7\n\nU01-N\n\n12\n\n279,114\n\n5\n\nU01-N\n\n12\n\n205,348\n\nDigital Engagement Strategist\n\n1 54,260\n\n12\n\n54,260\n\n\u2014 55,345\n\n\u2014\n\n\u2014\n\nDigital Engagement Coordinator\n\n\u2014\n\n18G\n\n\u2014\n\n\u2014\n\n1\n\n18G\n\n12\n\n60,837\n\nTotal Office of Neighborhood Services\n\n18\n\n982,694\n\n16\n\n953,081\n\nBusiness Diversity Manager\n\n1 81,515\n\n12\n\n81,515\n\n1\n\n26G\n\n12\n\n84,783\n\nBusiness Diversity Coordinator\n\n1 74,975\n\n12\n\n74,975\n\n1\n\n24G\n\n12\n\n77,981\n\nStrategic Partnerships Manager\n\n1\n\n69,133\n\n12\n\n69,133\n\n1\n\n22G\n\n12\n\n71,905\n\nContract Compliance Analyst\n\n1 47,822\n\n12\n\n47,822\n\n1\n\n16G\n\n12\n\n55,888\n\nTotal Office of Business Diversity\n\n4\n\n273,445\n\n4\n\n290,557\n\nPosition Summary\n\n2023\n\nRate/\n\nHours/\n\n2023\n\n2024\n\nRate/\n\nHours/\n\n2024\n\nTitle\n\nFTE\n\nGrade Months\n\nBudget\n\nFTE\n\nGrade Months\n\nBudget\n\nCity of Pittsburgh Operating Budget\n\nOffice of the Mayor\n\nFiscal Year 2024\n\n102000\n\n71\n\nOffice of Immigrant and Refugee Affairs\n\nManager\n\n1 77,948\n\n12\n\n77,948\n\n1\n\n25G\n\n12\n\n81,074\n\nPolicy Coordinator\n\n1 56,102\n\n12\n\n56,102\n\n1\n\n17G\n\n12\n\n58,352\n\nTotal Office of Immigrant and Refugee\n\nAffairs\n\n2\n\n134,050\n\n2\n\n139,426\n\nWorkforce Development & Youth Manager\n\n1 77,948\n\n12\n\n77,948\n\n1\n\n25G\n\n12\n\n81,074\n\nSpecial Initiatives Coordinator\n\n1 71,922\n\n12\n\n71,922\n\n\u2014 74,080\n\n\u2014\n\n\u2014\n\nYouth Coordinator\n\n\u2014\n\n20G\n\n\u2014\n\n\u2014\n\n1\n\n20G\n\n12\n\n66,179\n\nTotal Office of Workforce Development,\n\nYouth, and Education\n\n2\n\n149,870\n\n2\n\n147,253\n\nFinancial Empowerment Manager\n\n\u2014\n\n24G\n\n\u2014\n\n\u2014\n\n1\n\n24G\n\n4\n\n25,994\n\nTotal Office of Financial Empowerment\n\n\u2014\n\n\u2014\n\n1\n\n25,994\n\nTotal Full-Time Permanent Positions\n\n45\n\n$ 3,062,065\n\n44\n\n$ 3,155,260\n\nTemporary, Part-Time, and Seasonal Allowances\n\nIntern\n\n\u2014 10.00-15.00\n\n\u2014 $\n\n28,000\n\n\u2014 10.00-20.00\n\n\u2014 $\n\n28,000\n\nPittsburgh Public Schools Interns\n\n\u2014 10.00-15.00\n\n\u2014\n\n86,400\n\n\u2014 10.00-15.00\n\n\u2014\n\n50,000\n\n311 Call Center Representatives, part-time\n\n\u2014\n\nU01-N\n\n\u2014\n\n\u2014\n\n\u2014\n\nU01-N\n\n\u2014\n\n88,852\n\n\u2014\n\n$ 114,400\n\n\u2014\n\n$ 166,852\n\nTotal Full-Time Permanent Positions\n\n45\n\n$ 3,062,065\n\n44\n\n$ 3,155,260",
      "Women in Science Highlight Mentorship, Outreach as Integral to Career Success: /news/stories/archives/2025/march/women-in-science-highlight-mentorship-outreach-as-integral-to-career-success\n\nFor Women's History Month, Carnegie Mellon is featuring the work of women across the science, technology, engineering and mathematics fields.(opens in new window)(opens in new window)\n\n(opens in new window)(opens in new window): https://www.cmu.edu/leadership/president/bio/index.html\n\nCarnegie Mellon University: https://www.twitter.com/CarnegieMellon\n\n@USNavy: https://twitter.com/USNavy\n\nhttps://t.co/CJc0vUX31B: https://t.co/CJc0vUX31B\n\nhttps://t.co/Ch5gHl2CDI: https://t.co/Ch5gHl2CDI\n\nFeb 6, 2025: https://twitter.com/CarnegieMellon/status/1887614580123386265\n\nShare\n\nPowered by Curator.io: https://curator.io\n\nRales Fellows Revolutionize Artificial IntelligenceTwo Rales Fellows focus on artificial intelligence and machine learning in their studies: master\u2019s degree candidate Nicole Villavicencio-Gardu\u00f1o and doctoral candidate Maxwell Jones.March 7, 2025: /news/stories/archives/2025/march/rales-fellows-revolutionize-artificial-intelligence\n\nTwo Rales Fellows focus on artificial intelligence and machine learning in their studies: master\u2019s degree candidate Nicole Villavicencio-Gardu\u00f1o and doctoral candidate Maxwell Jones. Researchers Use Computer Science To Save BeesCMU and UC Riverside researchers have created a system to help beekeepers monitor and analyze the health of their beehives and take corrective actions to prevent colony collapse.March 5, 2025: /news/stories/archives/2025/march/researchers-use-computer-science-to-save-bees\n\nCMU and UC Riverside researchers have created a system to help beekeepers monitor and analyze the health of their beehives and take corrective actions to prevent colony collapse.",
      "the application of our non-discrimination policy as it applies to educational programming, and works with the university's Faculty Review Committee to resolve complaints regarding the application of Carnegie Mellon's policies as they apply to faculty. University Ombudsperson, 412-268-1018 The ombudsperson hears complaints, clarifies issues and suggests possible solutions to work-related problems. Farnam Jahanian, president, 412-268-2200\t\t\t\tInvolved in all queries concerning the application of our\t\t\t\t\tnon-discrimination policy as it applies to educational\t\t\t\t\tprogramming, and works with the university's Faculty\t\t\t\t\tReview Committee to resolve complaints regarding the\t\t\t\t\tapplication of Carnegie Mellon's policies as they apply to\t\t\t\t\tfaculty. University\t\tThe ombudsperson hears complaints, clarifies issues and suggests possible solutions to work-related problems. Ombudsperson,\t\t\t\t\t412-268-1018 167",
      "^ Daniels, Melissa. \"CMU fires contemporary art gallery's director\" . TribLIVE.com . Archived from the original on March 4, 2016 . Retrieved May 3, 2018 . External links [ edit ] Miller Gallery at Carnegie Mellon University Archived 2018-03-16 at the Wayback Machine Carnegie Mellon University show v t e Carnegie Mellon University Academics College of Engineering Information Networking Institute College of Fine Arts Architecture Art Design Drama Music Entertainment Technology Center Dietrich College of Humanities and Social Sciences Social and Decision Sciences H. John Heinz III College of Information Systems and Public Policy Mellon College of Science School of Computer Science Masters in Software Engineering Tepper School of Business Margaret Morrison Carnegie College (defunct) Branch campuses Australia Qatar Rwanda Silicon Valley Student life Traditions Greek Life Scotch'n'Soda Theatre Miller ICA The Tartan WRCT Research Pittsburgh Supercomputing Center Software Engineering Institute CERT Coordination Center Carnegie Mellon CyLab Robotics Institute National Robotics Engineering Center Human Computer Interaction Institute Hunt Institute for Botanical Documentation Carnegie Mellon University Computational Biology Department Language Technologies Institute Pittsburgh Life Sciences Greenhouse Carnegie School Ames Research Center Carnegie Mellon University Usable Privacy and Security Laboratory Pittsburgh Science of Learning Center Integrated Innovation Institute Carnegie Mellon University Press Location, Buildings and Structures Squirrel Hill Bellefield Boiler Plant Kraus Campo Main Building, U.S. Bureau of Mines Mellon Institute of Industrial Research Newell Simon Hall Pittsburgh Technology Center Walking to the Sky People Andrew Carnegie Mellon family Alumni and faculty Projects and legacies Alice Andrew Project BLISS CMMI Mach 3M computer Center for PostNatural History Conflict Kitchen Robot Hall of Fame Swartz Center for Entrepreneurship Waffle Shop: A Reality"
    ],
    "answer": "Wanda Heading-Grant",
    "reference_answer": "Dr. Wanda Heading-Grant"
  },
  {
    "question": "In which city is Carnegie Mellon University located?",
    "context": [
      "Carnegie Mellon University homepage: https://www.cmu.edu\n\nNews: /news/\n\nStories: /news/stories\n\nCollege of Engineering: /news/stories/college-of-engineering\n\nCollege of Fine Arts: /news/stories/college-of-fine-arts\n\nDietrich College of Humanities & Social Sciences: /news/stories/dietrich-college-of-humanities-social-sciences\n\nHeinz College of Information Systems and Public Policy: /news/stories/heinz-college-of-information-systems-and-public-policy\n\nMellon College of Science: /news/stories/mellon-college-of-science\n\nSchool of Computer Science: /news/stories/school-of-computer-science\n\nTepper School of Business: /news/stories/tepper-school-of-business\n\nArchives: /news/stories/archives\n\n2025: /news/stories/archives/2025\n\nJanuary: /news/stories/archives/2025/january\n\nFebruary: /news/stories/archives/2025/february\n\nMarch: /news/stories/archives/2025/march\n\n2024: /news/stories/archives/2024\n\nJanuary: /news/stories/archives/2024/january\n\nFebruary: /news/stories/archives/2024/february\n\nMarch: /news/stories/archives/2024/march\n\nApril: /news/stories/archives/2024/april\n\nMay: /news/stories/archives/2024/may\n\nJune: /news/stories/archives/2024/june\n\nJuly: /news/stories/archives/2024/july\n\nAugust: /news/stories/archives/2024/august\n\nSeptember: /news/stories/archives/2024/september\n\nOctober: /news/stories/archives/2024/october\n\nNovember: /news/stories/archives/2024/november\n\nDecember: /news/stories/archives/2024/december\n\n2023: /news/stories/archives/2023\n\nJanuary: /news/stories/archives/2023/january\n\nFebruary: /news/stories/archives/2023/february\n\nMarch: /news/stories/archives/2023/march\n\nApril: /news/stories/archives/2023/april\n\nMay: /news/stories/archives/2023/may\n\nJune: /news/stories/archives/2023/june\n\nJuly: /news/stories/archives/2023/july\n\nAugust: /news/stories/archives/2023/august\n\nSeptember: /news/stories/archives/2023/september\n\nOctober: /news/stories/archives/2023/october\n\nNovember: /news/stories/archives/2023/november\n\nDecember: /news/stories/archives/2023/december",
      "The Pittsburgh Symphony Orchestra performs at Heinz Hall, a restored movie theatre. Phipps Conservatory and Botanical Gardens (1893), which covers 15 acres (6 hectares), is noted for its extensive greenhouses. The city\u2019s zoo, in the northeastern Highland Park neighbourhood, includes an aquarium. Two new sports venues opened in 2001 on the north bank of the Allegheny opposite the Golden Triangle: PNC Park is home of the Pirates, the city\u2019s professional baseball team, and Acrisure Stadium houses the Steelers, its professional football team. The Penguins, Pittsburgh\u2019s professional ice hockey team, plays at PPG Paints Arena. Popular summertime attractions include riverboat excursions on Pittsburgh\u2019s waterways and Kennywood, an amusement park southeast of the city in West Mifflin. Carnegie Mellon University, private, coeducational institution of higher learning in Pittsburgh, Pennsylvania, U.S. The university includes the Carnegie Institute of Technology, the College of Humanities and Social Sciences, the College of Fine Arts, the Mellon College of Science, the School of Computer Science, the H. John Heinz III School of Public Policy and Management, and the Graduate School of Industrial Administration.",
      "by law and those necessary to protect the rights of other members of the University community and to ensure the normal functioning of the University. Rights On Carnegie Mellon's campus, anyone may distribute printed material, offer petitions for signature, make speeches, and hold protests or demonstrations outside university buildings. All such activities must be peaceful, avoiding acts or credible threats of violence",
      "Total enrollment is about 7,700. In 1900 the industrialist Andrew Carnegie gave a gift of $1 million to the city of Pittsburgh for the creation of a technical school. Originally called Carnegie Technical Schools, it was renamed Carnegie Institute of Technology in 1912. The institute merged with the Mellon Institute (established in 1913 in Pittsburgh by financier Andrew W. Mellon) in 1967. The university has built a reputation as a vital arts centre, operating three art galleries, two concert halls, and two theatres. The faculty has included Nobel Prize-winning economists Herbert Alexander Simon and Merton Miller. University of Pittsburgh, coeducational state system of higher learning in Pennsylvania, U.S., comprising a main campus in Pittsburgh and branches in Bradford, Greensburg, Johnstown, and Titusville. The Pittsburgh campus is a comprehensive research institution of higher learning and includes 16 schools that offer more than 360 degree programs. Among these schools are those of Medicine, Dental Medicine, Law, Engineering, and Social Work.",
      "alumni, parents, students and friends in the New York Metro area, the network is one of the largest regional networks for the Carnegie Mellon University Alumni Association. Event registrations close April 2nd at 11:59 PM EDT."
    ],
    "answer": "Pittsburgh",
    "reference_answer": "Pittsburgh"
  },
  {
    "question": "In which college is the Biomedical Engineering major located at Carnegie M Mellon University?",
    "context": [
      "Carnegie Mellon University homepage: https://www.cmu.edu\n\nNews: /news/\n\nStories: /news/stories\n\nCollege of Engineering: /news/stories/college-of-engineering\n\nCollege of Fine Arts: /news/stories/college-of-fine-arts\n\nDietrich College of Humanities & Social Sciences: /news/stories/dietrich-college-of-humanities-social-sciences\n\nHeinz College of Information Systems and Public Policy: /news/stories/heinz-college-of-information-systems-and-public-policy\n\nMellon College of Science: /news/stories/mellon-college-of-science\n\nSchool of Computer Science: /news/stories/school-of-computer-science\n\nTepper School of Business: /news/stories/tepper-school-of-business\n\nArchives: /news/stories/archives\n\n2025: /news/stories/archives/2025\n\nJanuary: /news/stories/archives/2025/january\n\nFebruary: /news/stories/archives/2025/february\n\nMarch: /news/stories/archives/2025/march\n\n2024: /news/stories/archives/2024\n\nJanuary: /news/stories/archives/2024/january\n\nFebruary: /news/stories/archives/2024/february\n\nMarch: /news/stories/archives/2024/march\n\nApril: /news/stories/archives/2024/april\n\nMay: /news/stories/archives/2024/may\n\nJune: /news/stories/archives/2024/june\n\nJuly: /news/stories/archives/2024/july\n\nAugust: /news/stories/archives/2024/august\n\nSeptember: /news/stories/archives/2024/september\n\nOctober: /news/stories/archives/2024/october\n\nNovember: /news/stories/archives/2024/november\n\nDecember: /news/stories/archives/2024/december\n\n2023: /news/stories/archives/2023\n\nJanuary: /news/stories/archives/2023/january\n\nFebruary: /news/stories/archives/2023/february\n\nMarch: /news/stories/archives/2023/march\n\nApril: /news/stories/archives/2023/april\n\nMay: /news/stories/archives/2023/may\n\nJune: /news/stories/archives/2023/june\n\nJuly: /news/stories/archives/2023/july\n\nAugust: /news/stories/archives/2023/august\n\nSeptember: /news/stories/archives/2023/september\n\nOctober: /news/stories/archives/2023/october\n\nNovember: /news/stories/archives/2023/november\n\nDecember: /news/stories/archives/2023/december",
      "The university began in 1787, in a three-room log schoolhouse, as Pittsburgh Academy. In 1819 it became the Western University of Pittsburgh. The School of Medicine, originally chartered in 1886 as the Western Pennsylvania Medical College, joined the university in 1892. The school\u2019s name was changed to the University of Pittsburgh in 1908. The central feature of the main campus is its Cathedral of Learning, a 42-story Gothic skyscraper. Notable alumni include dancer Gene Kelly, filmmaker Werner Herzog, and philanthropist Andrew Mellon. Jonas Salk conducted his polio-vaccine research while on the medical school faculty.",
      "The most complex problems. The most diverse experts. Advanced Collaboration\u00ae is how the College of Engineering solves the world\u2019s greatest problems. Advanced Collaboration\u00ae is how the College of Engineering solves the world\u2019s greatest problems.: about-us/advanced-collaboration.html\n\nThe College of Engineering is now offeringonline graduate certificates. online graduate certificates: education/graduate-studies/online-certificates.html\n\nThe graduate certificate inAI Engineering Fundamentals - Mechanical Engineeringprepares mechanical engineers to solve problems with artificial intelligence and design next-generation solutions for today\u2019s industries. Physicians, biomedical engineers, and other medical professionals can learn the fundamentals of 3D bioprinting tissues and organs from CMU researchers who are pioneering these innovative medical techniques with the graduate certificate in3D Bioprinting & Biofabrication. In theAI Engineering for Digital Twins & Analyticsgraduate certificate, engineers in senior engineering, design, and managerial roles can learn how to build a strong business case for using digital twins and gain the skills to lead the implementation of this cutting-edge technology in their organization. Featured ProgramCarnegie Mellon University AfricaPrepare to be a technology manager and innovator through a multidisciplinary curriculum with a special emphasis on emerging ICT innovations and applications in Africa.: http://www.cmu.edu/africa\n\nFeatured Program\n\nPrepare to be a technology manager and innovator through a multidisciplinary curriculum with a special emphasis on emerging ICT innovations and applications in Africa. Featured ProgramBiomedical EngineeringCollaborate across engineering disciplines and with cutting-edge medical facilities in Pittsburgh for a strong foundation in both biomedicine and traditional engineering.: https://www.bme.cmu.edu/\n\nFeatured Program",
      "the Heinz College, the Mellon College of Science and the Tepper School of Business.) \u2022 After the last day of classes: Permanent grades assigned by the instructor will be recorded. Student Parental Accommodation Protocols Providing holistic student support is a top priority at Carnegie Mellon. The protocols on this policy are designed to support the parental needs of students and their families. Students seeking any of the Parental Accommodations described below must register with the Office of the Dean of Student Affairs by contacting the office for an appointment by calling 412-268-2075. 88",
      "Contact alumni-house@andrew.cmu.edu. With more than 33,000 alumni, parents, faculty, staff, students and friends in the region, the Pittsburgh network is the largest regional network of the Carnegie Mellon University Alumni Association. Event registrations close April 16th at 11:59 PM EDT."
    ],
    "answer": "College of Engineering",
    "reference_answer": "The Biomedical Engineering major is located in the College of Engineering at Carnegie Mellon University."
  },
  {
    "question": "Who is the Program Director for Research Information Management Services at Carnegie Mellon University?",
    "context": [
      "^ Daniels, Melissa. \"CMU fires contemporary art gallery's director\" . TribLIVE.com . Archived from the original on March 4, 2016 . Retrieved May 3, 2018 . External links [ edit ] Miller Gallery at Carnegie Mellon University Archived 2018-03-16 at the Wayback Machine Carnegie Mellon University show v t e Carnegie Mellon University Academics College of Engineering Information Networking Institute College of Fine Arts Architecture Art Design Drama Music Entertainment Technology Center Dietrich College of Humanities and Social Sciences Social and Decision Sciences H. John Heinz III College of Information Systems and Public Policy Mellon College of Science School of Computer Science Masters in Software Engineering Tepper School of Business Margaret Morrison Carnegie College (defunct) Branch campuses Australia Qatar Rwanda Silicon Valley Student life Traditions Greek Life Scotch'n'Soda Theatre Miller ICA The Tartan WRCT Research Pittsburgh Supercomputing Center Software Engineering Institute CERT Coordination Center Carnegie Mellon CyLab Robotics Institute National Robotics Engineering Center Human Computer Interaction Institute Hunt Institute for Botanical Documentation Carnegie Mellon University Computational Biology Department Language Technologies Institute Pittsburgh Life Sciences Greenhouse Carnegie School Ames Research Center Carnegie Mellon University Usable Privacy and Security Laboratory Pittsburgh Science of Learning Center Integrated Innovation Institute Carnegie Mellon University Press Location, Buildings and Structures Squirrel Hill Bellefield Boiler Plant Kraus Campo Main Building, U.S. Bureau of Mines Mellon Institute of Industrial Research Newell Simon Hall Pittsburgh Technology Center Walking to the Sky People Andrew Carnegie Mellon family Alumni and faculty Projects and legacies Alice Andrew Project BLISS CMMI Mach 3M computer Center for PostNatural History Conflict Kitchen Robot Hall of Fame Swartz Center for Entrepreneurship Waffle Shop: A Reality",
      "work closely with university administration to address issues and develop best solutions for the majority. Great things can happen when we focus our efforts! Staff Council committees are open to any interested CMU staff member and include Communication, Food Drive, Kennywood & Entertainment Discounts, DEI+B, Take Our Daughters and Sons to Work, Sustainability and Wellness. Meeting schedule & Zoom link: https://www.cmu.edu/staff-council/when-we-meet-committees/index.html#meetings Add to my calendar. Contact Info: staff-council@andrew.cmu.edu. Neurodiverse Employee Resource Group (NERG) Monthly Meeting. May 27, 2025.",
      "belong to the university, the university community as a whole, or some individual or group within that community. Access to Carnegie Mellon\u2019s computing resources is contingent upon being a member of the university community and adhering to university and Computing Services policies, guidelines and procedures, including this policy. Misuse may result in the loss of access and/or university disciplinary action. For some users and certain systems, access may be authorized by specific departments, research centers or other organizations affiliated with Carnegie Mellon. In such cases, any department- or group-specific policies and guidelines must be adhered to when using resources provided by the department or group. This is in addition to university policies and Computing Services guidelines and procedures. Any user who suspects a violation of the university\u2019s computer use policies, or who has knowledge of potential vulnerabilities or security loopholes in a system or network at",
      "Pittsburgh. Departmental/Bureau Overview\n\nThe Department of Innovation & Performance is divided into the following six service teams:\n\nIT Operations Reliability - supports core IT infrastructure, including systems administration, network engineering\n\nand telecommunications configuration, as well as providing IT help services to fulfill requests and resolve IT-\n\nrelated incidents. Security and Risk - responsible for cybersecurity risk assessments and the application of best practices to\n\nmitigate and remediate identified threats. Business Technology - supports enterprise applications, geospatial information systems, data engineering,\n\ndigital services and organizational performance analytics. Within Business Technology, the Innovation team is\n\nresponsible for IT project management, business relationship management, technology training support and civic\n\ninnovation such as the award-winning PGH Lab program and the Pittsburgh Digital Equity Coalition. Operations Performance Excellence (OPE) - supports City executives and staff as an internal consultancy to\n\nhelp them meet high priority operational goals. Through performance coaching and process improvement training,\n\nOPE supports all departments to advance their innovative efforts toward improved delivery of services to the\n\ncommunity. Communications \u2013 includes the City Cable Bureau, the official city government cable television team, along with\n\nCommunications Services which is responsible for the City\u2019s website, graphic design and the print shop. Administration - responsible for the policies, finances, human resources and administration of the department. 2023 Accomplishments\n\nAchieved 95% success rate in providing key computing devices and information systems access for new\n\nCity employees on their first day of work. Reduced average time to resolve IT service requests by 73% YoY from 2022 to 2023. Published a software inventory for the city depicting the modernization efforts and timelines of all",
      "Women in Science Highlight Mentorship, Outreach as Integral to Career Success: /news/stories/archives/2025/march/women-in-science-highlight-mentorship-outreach-as-integral-to-career-success\n\nFor Women's History Month, Carnegie Mellon is featuring the work of women across the science, technology, engineering and mathematics fields.(opens in new window)(opens in new window)\n\n(opens in new window)(opens in new window): https://www.cmu.edu/leadership/president/bio/index.html\n\nCarnegie Mellon University: https://www.twitter.com/CarnegieMellon\n\n@USNavy: https://twitter.com/USNavy\n\nhttps://t.co/CJc0vUX31B: https://t.co/CJc0vUX31B\n\nhttps://t.co/Ch5gHl2CDI: https://t.co/Ch5gHl2CDI\n\nFeb 6, 2025: https://twitter.com/CarnegieMellon/status/1887614580123386265\n\nShare\n\nPowered by Curator.io: https://curator.io\n\nRales Fellows Revolutionize Artificial IntelligenceTwo Rales Fellows focus on artificial intelligence and machine learning in their studies: master\u2019s degree candidate Nicole Villavicencio-Gardu\u00f1o and doctoral candidate Maxwell Jones.March 7, 2025: /news/stories/archives/2025/march/rales-fellows-revolutionize-artificial-intelligence\n\nTwo Rales Fellows focus on artificial intelligence and machine learning in their studies: master\u2019s degree candidate Nicole Villavicencio-Gardu\u00f1o and doctoral candidate Maxwell Jones. Researchers Use Computer Science To Save BeesCMU and UC Riverside researchers have created a system to help beekeepers monitor and analyze the health of their beehives and take corrective actions to prevent colony collapse.March 5, 2025: /news/stories/archives/2025/march/researchers-use-computer-science-to-save-bees\n\nCMU and UC Riverside researchers have created a system to help beekeepers monitor and analyze the health of their beehives and take corrective actions to prevent colony collapse."
    ],
    "answer": "H. John Heinz III",
    "reference_answer": "Jason Glenn"
  },
  {
    "question": "Which professor at Carnegie Mellon introduced the first Girl Scout badge for negotiation?",
    "context": [
      "Qatar. Africa. Washington, D.C. To name a few. See global locations & programs \u00bb\n\nU.S. News & World Report, 2023\n\nU.S. News & World Report, 2023\n\nThe Hollywood Reporter, 2023\n\nU.S. News & World Report, 2023\n\nU.S. News & World Report, 2023\n\nTimes Higher Education, 2023\n\nTimes Higher Education, 2023\n\nThe Smiley :-) was created by Carnegie Mellon research professor Scott Fahlman on September 19, 1982. This was the beginning of emoticons in email, and the precursor to emojis. ;-)\u00a0 \u00a0:-(\u00a0 \u00a0:-o\n\nCarnegie Mellon alumnus Andy Warhol was an iconic figure in the pop art movement that explored the relationship of art to modern celebrity culture and advertising. His work included hand drawing, painting, printmaking, photography, silk screening, sculpture, film and music. A pioneer in computer-generated art, he is considered one of the most influential artists of the 20th century. It's never too early for women to learn the art of negotiation, and that's why a Carnegie Mellon professor has partnered with the Girl Scouts. The first Girl Scout badge for negotiation, named \"Win-Win: How to Get What You Want,\" started with Carnegie\u00a0Mellon professor Linda Babcock. To earn the badge, girls learn why and how negotiation can be useful\u00a0\u2014 and it goes beyond selling cookies. Babcock has also co-authored two books on the subject:Women Don't AskandAsk for it: How Women Can Use the Power of Negotiation to Get What They Really Want. In 1979, Carnegie Mellon established the nation's first Robotics Institute. Since then, professor and alumnus William \"Red\" Whittaker has been a robotics pioneer, founding the discipline of Field Robotics, developing unmanned vehicles to clean\u00a0up the Three Mile Island nuclear accident site, and leading the Tartan Racing Team to victory in the $2 million Urban Challenge robotic autonomous vehicles race. Technologies like these can help make driving safer by preventing accidents.",
      "At the History Center, scouts can earn badges during special programs while having fun and learning about the history of our region. Scouting at the Fort Pitt Museum\n\nAt the Fort Pitt Museum, scouts can schedule either a tour of the museum or an adventure program where scouts work on fun activities to help complete badge requirements! Scouting at Meadowcroft\n\nAt Meadowcroft, scouts can schedule programs about archaeology, American Indian cultural traditions, and the plants and geology of the Rockshelter. You can also spend the night camping with your troop! ================================================================================\n\nURL: https://www.heinzhistorycenter.org/learn/videos-and-podcasts\n\nTITLE: Videos & Podcasts - Heinz History Center\n\nCONTENT:\n\nVideos & Podcasts\n\nKDKA Radio Time Capsule\n\nWhether a person, place, or event, Heinz History Center President and CEO Andy Masich delivers historical insight that will leave you asking for more. Allegheny Arsenal Explosion\n\nAllegheny City\n\nAllegheny Observatory\n\nArnold Palmer\n\nBiddle Brothers\n\nBigelow Blvd. Bill Mazeroski\n\nBlack and Gold\n\nBloomfield\n\nBurton Morris\n\nCrawford Grille\n\nDonora Baseball Players\n\nFerris Wheel\n\nFort Pitt Blockhouse\n\nFort Pitt Foundry\n\nFrank Bolden\n\nFrick Assassination Attempt\n\nGeorge Washington\u2019s Teeth\n\nGhost Bomber\n\nGrant Street\n\nH.J. Heinz\n\nIwo Jima\n\nJeep\n\nJimmy Stewart\n\nJohn Brashear\n\nJonas Salk\n\nLawrenceville\n\nLuna Park\n\nMario Lemieux\n\nMarket Square\n\nMel Blount\n\nMister Rogers\n\nNight of the Living Dead\n\nPittsburgh Courier\n\nPittsburgh Pirates Name\n\nPittsburghese\n\nPoint State Park\n\nPolish Hill\n\nPontiac\u2019s Rebellion\n\nRachel Carson\n\nRobert Fulton\n\nSamuel Rosenberg\n\nSister Bridges\n\nSouthside\n\nStephen Foster\n\nStrip District\n\nStrong Vincent\n\nThe Beatles\n\nThe Cookie Table\n\nTuskegee Airmen\n\nUnconquered\n\nUnderground Railroad\n\nWestinghouse Electric Car\n\nWillie Stargell\n\nWorld\u2019s Fair\n\nThe Cornerstone Podcast",
      "Social Regulations Events that are in any way identified with Carnegie Mellon and are conducted by students or student organizations for purely social purposes are covered by the following regulations: \u2022 Any such event, whether on or off campus, must comply with city, state and federal laws. Carnegie Mellon accepts no responsibility for the direct supervision of the social activities engaged in by its students and student organizations. \u2022 Student organizations must submit this form to the Director of Student Leadership, Involvement and Civic Engagement for review and approval prior to any events being held during final examinations, during final examinations, on the night before any recess, or during any recess of more than three days duration. \u2022 It is expected that students will organize and conduct social activities in a responsible manner. \u2022 The university reserves the right to review the planning for social events requiring the use of university facilities and to establish special requirements as needed to ensure the well-being of all students. Last revised Spring 1998. Statement of Assurance Policy The Statement of Assurance must be placed in all graduate and undergraduate admissions publications and all other publications where such a statement is necessary or appropriate. Also, the Carnegie Mellon Writer's Style Guide gives detailed guidance on how to use the statement of assurance in campus-related publications. Carnegie Mellon University does not discriminate in admission, employment, or administration of its programs or activities on the basis of race, color, national origin, sex, handicap or disability, age, sexual orientation, gender identity, religion, creed, ancestry, belief, veteran status, or genetic information. Furthermore, Carnegie Mellon University does not discriminate and is required not to discriminate in violation of federal, state, or local laws or executive orders. Inquiries concerning the application of and compliance with this statement",
      "It\u2019s a place where science is cool, optimism runs high, and scores of young scientists want nothing more than to change their world. Nearly 1,000 students in grades six through 12 compete from western Pennsylvania and northern Maryland. Hundreds of regional professionals weigh in as judges for the event that, all told, awards hundreds of prizes and scholarships. It\u2019s a win-win for aspiring changemakers and our region. Founder\u2019s Day Program\n\nThe Founder\u2019s Day celebrations of the early Carnegie Institute were no small affairs. The 14th annual event should have occurred on April 29, 1910, but was postponed to May 2 to oblige the schedule of the celebration\u2019s keynote speaker, President William Howard Taft.",
      "Cassaro Professor, Emeritus Head, Theodore M. Finney Music Library, University of Pittsburgh Natalie Della Rosa Community Volunteer Margot B. Dermody Artist William Donovan Community Volunteer Kate Freed Nonprofit Management Consultant Bartley P. Griffith, Jr. President, Shady Side Academy Leon E. Haynes, III Founding Director, Hosanna House Barbara Noble Howard Executive Director, Impact Young Lives Foundation Susan Hunter Chairman, Hunter Associates Kirk J. Johnson Managing Director, Merrill Wealth Management Jonathan D. Kessler Executive Vice President and Managing Director, Head of Private Banking, PNC Asset Management Group Carol MacPhail Associate Professor, School of Business, Robert Morris University Whitney S. Morgan Community Volunteer Michael Ruck Tax Office Managing Partner, BDO Pittsburgh Office Robert J. Schuetz President of RS Solutions, LLC Brian Sloan Chief Financial Officer, Sloan Lubrication, Inc. Maureen M. Staley Co-owner, The Picket Fence Dr. Scott Symington Clinical Psychologist Isabel Trafton Community Volunteer Bonnie VanKirk Community Volunteer Britton P. Wean Stewardship Officer, Shady Side Academy David Werner Ophthalmologist (retired) Brian Wongchaowart Senior Software Engineer, Google Trustees Emeriti David A. Brownlee Partner, K&L Gates LLP Charles \"Chip\" Burke Chairman, The Grable Foundation David Burstin Partner, Burstin, Burstin & Frantz Danforth P. Fales Community Volunteer Thomas J. Gillespie, Jr. President and CEO, The Lockhart Company Carolyn B. Reed Community Volunteer Nancy D."
    ],
    "answer": "Linda Babcock",
    "reference_answer": "Professor Linda Babcock introduced the first Girl Scout badge for negotiation."
  },
  {
    "question": "In which year was the first Intersect@CMU conference held?",
    "context": [
      "Ways to Partner: partner/index.html\n\nPartner Highlights: highlights/index.html\n\nFaculty/Staff Resources: faculty-resources/index.html\n\nSince its founding by industrialist Andrew Carnegie, CMU has been where ideas become innovations, academia partners with industry, and problems find real-world solutions. You\u2019d expect nothing less from the birthplace of AI, the university that reinvented business education, the leading pioneer in advanced manufacturing and the first degree-granting program in drama. Here, the world\u2019s best researchers, students and faculty engage in boundary breaking cross-disciplinary collaboration, both internally and externally, that bring new products to market, move industries forward, prepare workers for the challenges of tomorrow and create new fields of discovery.",
      "Varies. LA - Dodgers & Pirates at Dodger Stadium. April 26, 2025, 6:00pm - 9:00pm PDT. Dodger Stadium, 1000 Vin Scully Avenue, Los Angeles, California 90012. Come out and see the Pirates take on the World Champion Dodgers, and as a bonus it's Dave Roberts Bobblehead Night! This will be a great event with the best players from last year plus so many exciting new Dodger stars. This is the third consecutive year for this event - it's always super fun! Questions? Contact alumni-house@andrew.cmu.edu. With over 4,250 alumni, students, parents and friends from Los Angeles, Orange, Ventura and San Bernadino counties, the Los Angeles Network is one of CMU\u2019s largest regional networks. Event registrations close April 10th at 08:59 PM PDT. $62.00 per person. NEO - Summer Social: Guardians Game. June 8, 2025, 1:40pm - 4:40pm EDT. Progressive Field, 2401 Ontario St, Cleveland, Ohio 44115. Join the Northeast Ohio Network to support the Guardians as they take on the Houston Astros. Everyone who registers through this link will be seated together in section 171 (shaded area), so this is a great way to connect with your fellow NEO Tartans. Friends and family are invited to join in the on the fun. Questions? Contact alumni-house@andrew.cmu.edu. The Northeast Ohio Network has over 1,200 alumni, students, parents and friends in the region. Event registrations close June 7th at 11:59 PM EDT. $30.00 per person. DEN - Mile High Madness: CMU Alumni Night with the Nuggets. March 28, 2025, 7:00pm - 9:30pm MDT. Ball Arena, 1000 Chopper Cir, Denver, Colorado 80204. Join the CMU Alumni Network for an unforgettable night of basketball and camaraderie! On Friday, March 28th, cheer on the reigning NBA Champion Denver Nuggets as they take on the Utah Jazz at Ball Arena. Connect with fellow Tartans, celebrate the Nuggets' championship energy, and experience the thrill of world-class basketball. Don\u2019t miss this opportunity to showcase your Tartan pride and make memories in the Mile High City! *Special",
      "must be cleared with the University Registrar. These requests must be in writing either as a memo or through email to CMURegistrar@andrew.cmu.edu. All requests must include the course relationship, intent for the requested meeting, and the reason why the meeting cannot be held either before 4:50 p.m. or after 6:50 p.m.",
      "Summer All, Two & Mini-6 Last Day of Classes. July 31, 2025. All Day. The Academic Calendar includes registration dates, class start dates, add/drop deadlines, exam dates, and more. Doctoral course-sections follow a separate academic calendar. Calendars for Heinz College, Tepper School of Business graduate courses, CMU-Africa, CMU-Australia, and CMU-Qatar can be found on The HUB Academic Calendar web page. Add to my calendar. Contact Info: Web: The HUB Academic Calendar Email: cmuregistrar@andrew.cmu.edu. Uncommon Perfection: Illustrations by Derek Norman. April 9, 2025.",
      "Our Community: community/index.html\n\nOur Data: tartans/index.html\n\nOur Framework: framework/index.html\n\nWe believe that education can be a transformative and enriching force for every person, irrespective of their background, identity or life circumstances. The concept of belonging is foundational to our mission and is intricately interwoven into the very essence of our university, helping to shape our values, policies and practices. Let's continue on this journey together. The Office of the Vice Provost for Diversity, Equity and Inclusion and Chief Diversity Officer412-268-4744Send us a message\n\nThe Office of the Vice Provost for Diversity, Equity and Inclusion and Chief Diversity Officer: https://www.cmu.edu/dei-office/index.html\n\nSend us a message: mailto:vp-dei@andrew.cmu.edu\n\nCenter for Student Diversity and Inclusion412-268-2150Send us a message\n\nCenter for Student Diversity and Inclusion: https://www.cmu.edu/student-diversity/index.html\n\nIn an era of global complexity and division, meaningful dialogue has never been more essential.Deeper Conversationsis a university-wide initiative dedicated to fostering civil discourse, critical inquiry and mutual understanding on today\u2019s most pressing issues. From geopolitical conflicts to democracy and elections, our programming spans expert panels, book discussions and interactive forums designed to encourage thoughtful engagement in a space where diverse perspectives can be shared, challenged and explored with curiosity and respect. Deeper Conversations: https://www.cmu.edu/leadership/deeper-conversations/\n\nLearn More About Deeper Conversations Programming\n\nThis multi-event series, part of CMU\u2019s Deeper Conversations initiative, provides interactive programs to foster knowledge, empathy and awareness among staff, faculty and students. Discover Upcoming Events\n\nDiscover Upcoming Events: https://www.cmu.edu/dei-office/events/2024/anti-hate.html"
    ],
    "answer": "2024",
    "reference_answer": "The first Intersect@CMU conference was held in 2018."
  },
  {
    "question": "Which organization is responsible for connecting businesses with CMU faculty and students?",
    "context": [
      "A connection to the CMU community has been the key advantage for many startups, tech firms, manufacturers, financial institutions and more. Ready to join them?TheCenter for Business Engagement teamis your first stop. We will guide and connect you to the right people at CMU to achieve your goals. Center for Business Engagement team: contact-us/staff-directory.html\n\nThere are no cookie-cutter solutions here. We offer a variety of ways to partner with collaborative and entrepreneurially minded CMU faculty and students that can be customized for your exact situation and need. Let\u2019s get to work\n\nWhen CMU faculty members connect with a corporate partner, both can achieve greater success. We will explore your needs and work with you to find the right partner to achieve your goals. Explore opportunities\n\nCenter for Business Engagement4665 Forbes Ave.Pittsburgh, PA 15213Contact Us\n\nCMU on LinkedIn: https://www.linkedin.com/company/cmu-center-for-business-engagement/\n\nDiscover Real-World Solutions: partner/working-with-businesses.html\n\nWork with our Colleges: partner/colleges.html",
      "services/index.html\n\nUniversity Police: https://www.cmu.edu/police/\n\nUniversity Policies: https://www.cmu.edu/policies/\n\nVice Provost for Education: https://www.cmu.edu/education\n\noffice/",
      "an investigation and hearing process that protects the safety of all involved while promoting accountability and a fair process. Cases Involving Student Organizations Carnegie Mellon University is committed to managing all cases that involve alleged violations of university policy by student organizations with appropriate care and sensitivity. In these cases, the university may need to invoke additional procedural provisions to determine responsibility for alleged policy violation(s) by a student organization. Recognized student organizations include groups that are given recognition by a college, department or governing body on campus. Recognized student organizations have certain privileges and use of campus resources (e.g. funding (university or student",
      "visiting faculty, 2) faculty who will teach courses taught predominantly in a foreign language, 3) faculty who do not teach undergraduate students, and 4) faculty who work one-on-one with students. (Note: CMU requires TAs to take the ITA for any job that requires student interaction.)",
      "work closely with university administration to address issues and develop best solutions for the majority. Great things can happen when we focus our efforts! Staff Council committees are open to any interested CMU staff member and include Communication, Food Drive, Kennywood & Entertainment Discounts, DEI+B, Take Our Daughters and Sons to Work, Sustainability and Wellness. Meeting schedule & Zoom link: https://www.cmu.edu/staff-council/when-we-meet-committees/index.html#meetings Add to my calendar. Contact Info: staff-council@andrew.cmu.edu. Neurodiverse Employee Resource Group (NERG) Monthly Meeting. May 27, 2025."
    ],
    "answer": "Center for Business Engagement",
    "reference_answer": "The Center for Business Engagement"
  },
  {
    "question": "What must a party provide when they wish to introduce Expert Witness testimony?",
    "context": [
      "A party who wishes to introduce Expert Witness testimony must provide written notice of the intent to introduce Expert Witness testimony no later than thirty (30) calendar days after receiving the Notice of Investigation issued under Section VI.B or no later than ten (10) calendar days after receiving notification that the other party intends to introduce Expert Witness Testimony, whichever date is later. 4. After receiving Notice of Intent to Introduce Expert Witness Testimony, the Investigator shall provide written notice of such to all other Complainant(s) or Respondent(s) in the investigation. 5. A party seeking to introduce Expert Witness Testimony must submit the name of the proposed Expert Witness and a copy of the Expert Witness\u2019s Curriculum Vitae to the Investigator no later than ten (10) calendar days after submitting the notice of intent to introduce Expert Witness testimony under Section 2 above. The Investigator will promptly share the name and Curriculum Vitae of the proposed Expert Witness with all other Complainant(s) or Respondent(s) in the investigation. 255",
      "Definitions 1. Expert Witness \u2014 An Expert Witness is a person who is a specialist in a subject, often technical, who may present expert opinion without having been a witness to or having first hand personal knowledge relating to an allegation of Prohibited Conduct under this Policy. 2. Hearing Officer \u2014 For purposes of this Appendix only, the term Hearing Officer means (i) the Hearing Officer appointed under Section VI.C, (ii) the University Disciplinary Committee for cases involving Student Respondents under Section VI.E, (iii) the Assistant Vice President of Human Resources, People and Organizational Effectiveness or designee for cases involving Staff Respondents under Section VI.E, or (iv) the Hearing Officer appointed for cases involving Faculty Respondents under Section VI.E. Notice of Intent to Introduce Expert Witness Testimony 3.",
      "The taxpayer\u2019s name, address, and daytime telephone number. 2. The taxpayer\u2019s account and/or social security number. 3. A copy of the assessment notice the taxpayer received from the Finance Department. 4. A detailed explanation consisting of the reason or reasons the taxpayer disagrees with the assessment and any documentation necessary to support the taxpayer\u2019s claims. 5.",
      "to obtain informed consent, and (3) the risks and potential benefits of the investigations. The IRB is responsible for determining when additional expertise is required for adequate review and for obtaining that additional expertise. The IRB is further responsible for maintaining records of its review activities and decisions and for ensuring that records of informed consent are developed and kept by investigators where appropriate. It is the responsibility of investigators who plan to use human subjects in research to obtain written consent from the IRB prior to conducting an investigation involving human subjects. It is the investigator's further responsibility to take whatever steps are",
      "2. A violation of community standards must be determined. The student must agree that what occurred during the incident was a violation of the university's community standards. 3. A proposed outcome or set of outcomes must be determined. The student and adjudicator must jointly agree about what outcome or set of outcomes will be proposed"
    ],
    "answer": "written notice",
    "reference_answer": "A party must provide written notice of the intent to introduce Expert Witness testimony no later than thirty (30) calendar days after receiving the Notice of Investigation or no later than ten (10) calendar days after receiving notification that the other party intends to introduce Expert Witness Testimony, whichever date is later. Context: for cases involving Staff Respondents under Section VI.E, or (iv) the Hearing Officer appointed for cases involving Faculty Respondents under Section VI.E. Notice of Intent to Introduce Expert Witness Testimony 3. A party who wishes to introduce Expert Witness testimony must provide written notice of the intent to introduce Expert Witness testimony no later than thirty (30) calendar days after receiving the Notice of Investigation issued under Section VI.B or no later than ten (10) calendar days after receiving notification that the other party intends to introduce Expert Witness Testimony, whichever date is later. 4. After receiving Notice of Intent to Introduce Expert Witness Testimony, the Investigator shall provide written notice of such to all other Complainant(s) or Respondent(s) in the investigation. 5. A party seeking to introduce Expert Witness Testimony must submit the name of the proposed Expert Witness and a copy of the Expert Witness\u2019s Curriculum Vitae to the Investigator no later than ten (10)"
  },
  {
    "question": "What are self-scheduled examinations?",
    "context": [
      "There should be no expectation that the following points will cover every conceivable situation. The student should anticipate the demands of the exam schedule, plan accordingly and early, and be prepared. The faculty should recognize that the student is encumbered with many tightly orchestrated and intensive obligations during this period over which he or she has no control: expectations should be reasonably consistent with the number of course units and, of course, should be made known to the student well in advance of the final examination period, preferably as part of the course syllabus. In order to help students plan their time and study optimally for examinations, this document lays out in some detail the policies regarding final and in-term examinations. Instructors are requested to provide notification of the major in-term examinations in the course syllabus. The final examination date is posted early in the semester. It is the responsibility of the student to give his or her instructor sufficient notice and to work with the instructor to re-schedule examinations if this is needed. Definitions \u2022 Final examination period. The university's official final examination period begins on the Monday immediately following the last day of classes and continues through the last day of scheduled final examinations, with the exception of reading day(s). \u2022 Scheduled final examinations. Scheduled final examinations are those scheduled by the University Registrar's Office. \u2022 Self-scheduled examinations. An instructor may choose not to fix a schedule for the final examination, but instead allow each student to choose the examination time; such exams are called self-scheduled examinations. \u2022 Final examinations. Final examinations can either be comprehensive, covering all course materials, or non-comprehensive, covering only a part of the course. \u2022 In-term examinations. Major examinations during the semester are referred to here as in-term examinations. 43",
      "By appt.",
      "Exceptions will be reviewed on a periodic basis for appropriateness. 174\n\nDefinitions \u2022 Health Information is defined as any information, whether oral or recorded in any form or medium, that is created or received by a health care provider, health plan, public health authority, employer, life insurer, school or university, or healthcare clearinghouse; and that is related to the past, present or future physical or mental health condition of an individual, the provision of health care of an individual, or the past, present or future payment for the provision of healthcare to an individual. \u2022 Individually Identifiable Health Information is defined as any heath information, as defined above, that identifies an individual or where there is reasonable basis to believe that the information can be used to identify an individual. \u2022 Protected Health Information (\"PHI\") is defined as Individually Identifiable Health Information transmitted by electronic media, maintained in electronic media or transmitted or maintained in any other form or medium. Protected Health Information does not include education records covered by, or treatment records excluded from, the Family Educational Rights and Privacy Act (20 U.S.C. 1232g) or employment records held by the University in its role as an employer. \u2022 Workforce member means employees, volunteers, trainees, and other persons whose conduct, in the performance of work for the Health Care Component, is under the direct control of the Health Care Component, whether or not they are paid by the Health Care Component. Housing Policies Adherence to the Housing Services policies is vital to a safe, fair, and enjoyable residential experience.",
      "radiation effects on a developing embryo/fetus. At these sessions, attendees are given the opportunity to have questions answered. The radiation safety officer may, at his or her discretion, administer an oral and/or written exam in order to confirm attendees' understanding of the subject matter. The radiation safety officer obtains from each attendee a signed acknowledgment of understanding of the Prenatal Radiation Exposure Policy. No employee or student may enter a radiologically restricted area before attending such a training session and signing such an acknowledgment of understanding. 77",
      "Inspection What are education records? Education records are records maintained by the university that are directly related to students. These include biographic and demographic data, application materials, course schedules, grades and work-study records. The term does not include: \u2022 information contained in the private files of instructors and administrators, used only as a personal memory aid and not accessible or revealed to any other person except a temporary substitute for the maker of the record; \u2022 Campus Police records; \u2022 employment records other than work-study records; \u2022 medical and psychological records used solely for treatment purposes; \u2022 records that only contain information about individuals after they have left the university; \u2022 any other records that do not meet the above definition of education records. 91\n\nHow do I inspect my education records? \u2022 Complete an Education Inspection and Review Request Form [pdf] and return it to The HUB in order to notify the University Registrar's Office. \u2022 The custodian of the education record you wish to inspect will contact you to arrange a mutually convenient time for inspection, not more than 45 days after your request. The custodian or designee will be present during your inspection. \u2022 You will not be permitted to review financial information, including your parents' financial information; or confidential letters of recommendation, if you have waived your right to inspect such letters. \u2022 You can get copies of your education records from the office where they are kept for 25 cents per page, prepaid. 2."
    ],
    "answer": "An instructor may choose not to fix a schedule for the final examination, but instead allow each student to choose the examination time; such exams are called self-scheduled examinations",
    "reference_answer": "Self-scheduled examinations are exams where an instructor allows each student to choose the examination time instead of fixing a schedule."
  },
  {
    "question": "What is the contact number for the Washington Coalition of Sexual Assault Programs?",
    "context": [
      "Pennsylvania Coalition Against Rape (PCAR): http://www.pcar.org/\n\nTexas Association Against Sexual AssaultAustin, TX512-474-7190\n\nTexas Association Against Sexual Assault: http://taasa.org/\n\nVirginia Sexual and Domestic Violence Action AllianceCharlottesville, VA434-979-9002 Richmond, VA, 804-377-0335\n\nVirginia Sexual and Domestic Violence Action Alliance: http://www.vsdvalliance.org/\n\nWashington Coalition of Sexual Assault ProgramsOlympia, WA360.754.7583\n\nWashington Coalition of Sexual Assault Programs: http://www.wcsap.org/\n\nProvidence Intervention Center for Assault and Abuse: https://www.providence.org/locations/wa/intervention-center-for-assault-and-abuse-everett\n\nOffice for Institutional Equity and Title IX4615 Forbes Ave, Suite 400, Pittsburgh, PA 15213(412) 268-7125Contact Us\n\nCMU on Facebook: https://www.facebook.com/CMUIEX/\n\nCMU on Instagram: https://www.instagram.com/titleixcmu/\n\nSexual Misconduct Awareness Survey: resources-and-information/cmu-sexual-misconduct-awareness-survey.html\n\nSex-Based Discrimination and Sexual Misconduct: resources-and-information/sex-based-discrimination-and-sexual-misconduct.html\n\nResource Guide: resources-and-information/resource-guide.html\n\nCross-Cultural Dating Norms: Tips and Insights for CMU Students: resources-and-information/cross-cultural-dating-norms.html\n\nFAQ's + Downloads: resources-and-information/faqs-and-downloads.html\n\nYes Yes Yes \u2013 A Theatrical Event on Consent & Relationships: education-and-training/yes-yes-yes-theatre-event.html\n\nEducation and Prevention Resources: education-and-training/education-resources.html\n\nRisk Reduction: education-and-training/risk-reduction.html\n\nFiling a Formal Complaint: how-to-report-+-options-for-resolution/filing-a-formal-complaint.html\n\nAlternative Resolution Options: how-to-report-+-options-for-resolution/alternative-resolution-options.html",
      "888-217-9599.",
      "https://pittsburghpa.gov/press-releases/press-releases/5203#: https://gcc02.safelinks.protection.outlook.com/?url=https%3A%2F%2Fpittsburghpa.gov%2Fpress-releases%2Fpress-releases%2F5203%23&data=04%7C01%7Ccara.cruz%40pittsburghpa.gov%7C142efe7689a14681b08208d9ace7e171%7Cf5f47917c90443689120d327cf175591%7C1%7C0%7C637730934184463962%7CUnknown%7CTWFpbGZsb3d8eyJWIjoiMC4wLjAwMDAiLCJQIjoiV2luMzIiLCJBTiI6Ik1haWwiLCJXVCI6Mn0%3D%7C3000&sdata=Av9g0X3ULS33GaxNJPP86UP5s%2Bvmx8hRjIcjLl0pomI%3D&reserved=0",
      "\u2014\n\n27E\n\n\u2014\n\n\u2014\n\nROOTS Program Manager\n\n\u2014\n\n26E\n\n\u2014\n\n\u2014\n\n1\n\n27E\n\n12\n\n81,074\n\nCommunity Engagement Coordinator\n\n1\n\n24E\n\n12\n\n69,811\n\n\u2014\n\n24E\n\n\u2014\n\n\u2014\n\nCommunity Partnership Specialist\n\n\u2014\n\n24E\n\n\u2014\n\n\u2014\n\n1\n\n24E\n\n12\n\n71,905\n\nSocial Work Manager\n\n1\n\n24E\n\n12\n\n69,811\n\n1\n\n27E\n\n12\n\n81,074\n\nCommunity Social Worker\n\n7\n\n22E\n\n12\n\n449,759\n\n5\n\n22E\n\n12\n\n330,895\n\nSocial Worker Team Lead\n\n\u2014\n\n24E\n\n\u2014\n\n\u2014\n\n2\n\n24E\n\n12\n\n143,810\n\nTrauma Specialist\n\n1\n\n22E\n\n12\n\n64,251\n\n1\n\n22E\n\n12\n\n66,179\n\nSenior Project Manager, Diversion & Evaluation\n\n1\n\n26E\n\n12\n\n75,710\n\n1\n\n26E\n\n12\n\n77,981\n\nDivision Outreach Coordinator\n\n1\n\n21E\n\n12\n\n61,590\n\n\u2014\n\n21E\n\n\u2014\n\n\u2014\n\nProgram Manager LEAD\n\n\u2014\n\n26E\n\n\u2014\n\n\u2014\n\n1\n\n27E\n\n12\n\n81,074\n\nVictim Assistance and Trauma Coordinator\n\n1\n\n23E\n\n12\n\n67,025\n\n1\n\n23E\n\n12\n\n69,035\n\nVictim Assistance Coordinator\n\n1\n\n22E\n\n12\n\n64,251\n\n1\n\n22E\n\n12\n\n66,179\n\nContinuum of Support Program Coordinator\n\n1\n\n32E\n\n12\n\n64,362\n\n1\n\n32E\n\n12\n\n99,440\n\nAdministrative Specialist\n\n\u2014\n\n10E\n\n\u2014\n\n\u2014\n\n1\n\n10E\n\n12\n\n41,509\n\nBachelor Social Worker\n\n\u2014\n\n20E\n\n\u2014\n\n\u2014\n\n2\n\n20E\n\n12\n\n121,674\n\nCriminal Justice Liaison\n\n\u2014\n\n23E\n\n\u2014\n\n\u2014\n\n1\n\n23E\n\n12\n\n69,035\n\nTeam Lead\n\n\u2014\n\n24E\n\n\u2014\n\n\u2014\n\n3\n\n24E\n\n12\n\n215,716\n\nSenior Outreach Specialist\n\n\u2014\n\n17E\n\n\u2014\n\n\u2014\n\n3\n\n17E\n\n12\n\n160,139\n\nCommunity Health Worker\n\n\u2014\n\n17E\n\n\u2014\n\n\u2014\n\n3\n\n17E\n\n12\n\n160,139\n\nOutreach Site Manager\n\n\u2014\n\n19E\n\n\u2014\n\n\u2014\n\n3\n\n19E\n\n12\n\n175,056\n\nOutreach Site Support Coordinator\n\n\u2014\n\n14E\n\n\u2014\n\n\u2014\n\n3\n\n14E\n\n12\n\n143,749\n\nCommunity Services and Violence Prevention\n\nStop the Violence Coordinator\n\n1\n\n24E\n\n12\n\n69,811\n\n1\n\n24E\n\n12\n\n71,905\n\nSafer Together PGH Project Coordinator\n\n5\n\n22E\n\n12\n\n321,256\n\n5\n\n22E\n\n12\n\n330,894\n\nPublic Safety Ambassador\n\n2\n\n18E\n\n12\n\n108,520\n\n\u2014\n\n18E\n\n\u2014\n\n\u2014\n\nAdministrative Specialist - Community\n\nO\n\n1\n\n10E\n\n12\n\n40,300\n\n\u2014\n\n10E\n\n\u2014\n\n\u2014\n\nAdministrative Assistant\n\n\u2014\n\n17F\n\n\u2014\n\n\u2014\n\n1\n\n17F\n\n12\n\n55,888\n\nAdministrative Assistant - Disruptive Properties\n\n\u2014\n\n17F\n\n\u2014\n\n\u2014\n\n1\n\n21E\n\n12\n\n63,437\n\nCommunity Outreach Supervisor\n\n\u2014\n\n26E\n\n\u2014\n\n\u2014\n\n1\n\n26E\n\n12\n\n77,981\n\nSenior Safer Together PGH Project Coordinator\n\n1\n\n24E\n\n12\n\n69,811\n\n1\n\n24E\n\n12",
      "Resources may be required to report non-identifying information to CMUPD for crime reporting purposes. 2. Campus Resources o Counseling and Psychological Services (CaPS) (Student only) 412-268-2922 o University Health Services (Student only) 412-268-2157 o Employee Assistance Program (Employees only) 3. Community Resources o Women's Shelter and Center of Greater Pittsburgh"
    ],
    "answer": "360.754.7583",
    "reference_answer": "The contact number for the Washington Coalition of Sexual Assault Programs is 360-754-7583."
  },
  {
    "question": "What should students do if they need assistance with hoverboard shipping or storage?",
    "context": [
      "maintain a substance free (no alcohol, tobacco or other drugs) lifestyle and environment for themselves and guests. Housing Disability Accommodation Policy Carnegie Mellon University does not discriminate in the provision of housing to students with disabilities. Carnegie Mellon will provide reasonable accommodations to students with disabilities who need special housing accommodations to ensure that students with disabilities receive comparable, convenient and accessible housing at the same cost as to other students. Carnegie Mellon will make reasonable modifications to its housing policies, procedures and practices when such modifications are necessary to avoid discrimination, unless such modifications would fundamentally alter the nature of the housing services provided by the University. Please visit the special accommodations page for full details about the housing accommodations policy, including applicable deadlines and forms required when requesting special accommodations. Hoverboards Hoverboards are not permitted in all university operated housing (including residence halls, apartments, and Greek Houses). If you currently possess a hoverboard, we recognize that you may need assistance making shipping arrangements (due to postal regulations) or storing it until a later date. Should you find yourself in this situation, please contact your Housing Services Facility Coordinator (FC) as soon as possible. Illegal Possession of Keys Students are responsible for access gained through the use of their assigned access device. Access devices include keys, student ID card, or Mobile ID app. Swapping or sharing or copying these items is not permitted as your name data is associated with your assigned access device. Students found using or having in their possession any access device for any university doors or facilities that they are unauthorized to use or possess will be subject to disciplinary action. Improper Use of University Facilities Improper use of facilities",
      "Box, provide the physical location address. 6. Phone Number- Enter the subcontractor/company phone number and/or cell phone number. 7.",
      "PITTSBURGH, PA, (June 10, 2021) \u2013 June is National Safety Month and the Pittsburgh Bureau of Fire is pleased to announce an exciting new partnership with Duquesne Light Company (DLC) to provide our Hazardous Materials Response Team (HazMat) with an innovative training tool to learn safe containment of chemical and fuel spills from highway tank trailers. The Pittsburgh Bureau of Fire replicates hazardous materials spills for HazMat technicians with a highway trailer training prop at its facility on Washington Boulevard. Now, a critical assist from Duquesne Light's hydraulic service truck and mechanics, will help provide a \u201creal-life\u201d experience for first responders who encounter a tanker rollover emergency. \u201cWe are now able to position this prop to simulate a rollover of a tank or fuel trailer in transit. If a transportation emergency occurs, we can arrive and it\u2019s in a variety of different configurations or positions. This one-of-a-kind training prop gives our team the opportunity to practice on a real-life, hands-on tool,\u201d said Pittsburgh Bureau of Fire Assistant Chief Brian Kokkila. \u201cDuquesne Light is uniquely positioned with the equipment and expertise in hydraulic systems. We were able to ask for their help to power the hydraulic system and they really stepped up and helped us solve some challenges.\u201d",
      "Exhibits. Assemble Girls Maker Night Virtual Afterschool Program. Mondays, 4-5:30 p.m. Virtual Assemble is a STEAM (Science, Technology, Engineering, Art, & Math) centered digital hangout and material kit. Join Assemble teachers after school from 4:00pm-5:30pm in this weekly after school program. Each week students explore the dynamic world of STEAM through hands-on activities and dreaming up creative inventions together. Virtual Assemble after school sessions also include special visits from local artists, makers, and technologists who share their passion and talents with the group. 412-661-6111. Kidstuff.",
      "Fundraisers. 0.00. GUARDIAN STORAGE SPRING 2025 FREE SHRED-IT EVENT. Sat., May 17, 11 a.m.-2 p.m. Guardian Storage 4711 William Penn Highway, Monroeville Monroeville. As a thank you to our customers and community, Guardian Storage is hosting a series of FREE Shred-It events throughout our Pittsburgh locations. These events provide a safe way to dispose of unwanted files, papers and documents free of charge and no purchase or commitment of any kind. The only request is a voluntary donation of cash or unopened school supplies at the event to help support The Education Partnership. Please limit to the equivalent of five file boxes' worth of paper waste and remove file clips before arrival. 412-275-4429. Community."
    ],
    "answer": "contact their Housing Services Facility Coordinator",
    "reference_answer": "Students should contact their Housing Services Facility Coordinator (FC) as soon as possible."
  },
  {
    "question": "What is the maximum number of days a student can be absent for a sport or organization annually?",
    "context": [
      "access to external sites or removes network access for internal sites, the purpose of the action is to maintain the security and reliability of the computer systems and networks rather than to punish an individual or a site, or to restrict the free expression of ideas. Conduct of Classes (Undergraduate Students) Students are expected to attend all scheduled classes unless the instructor explicitly informs the class that other ways of doing the work are acceptable. The action to be taken in regard to tardiness, absence from class or making up late work is the responsibility of the individual instructor; the instructor should consult with the department head and the student's dean if major action, such as dropping the student from the course, is being considered. All classes will be held at their scheduled hour on days immediately before and after all holidays and recesses. Both faculty and students are expected to be present. Members of athletic teams and other student organizations are permitted to be absent from classes to participate in authorized contests and presentations, either at home or out of town, provided the following conditions are met: \u2022 All work missed must be made up to the satisfaction of the instructor(s) concerned; \u2022 No trip shall involve an absence of more than two days, excluding days when classes are not scheduled; \u2022 The total number of days of absence shall not exceed six per sport or per organization annually; \u2022 Instructor(s) may request confirmation from the relevant coach, department or student affairs staff member. Technology affords many students access to portable devices including cell phones, PDAs, and laptops. It is expected that students will respect the wishes of faculty with regard to the use of electronic devices within the academic environment. Students who, because of religious beliefs, cannot attend class may arrange as individuals to be absent, provided the work missed is made up in a manner satisfactory to the instructor(s)",
      "25 and runs through Friday, Feb.",
      "ALLOCATION OF EARNED INCOME. (a)     Members of professional athletic teams, other than professional football teams calculate a \u201ctotal games played within the City of Pittsburgh\u201d versus \u201ctotal games played (including exhibition, preseason, regular season and post-season games)\u201d fraction. Multiply that fraction against the player\u2019s total compensation. In determining \u201cgames played\u201d include exhibition games that are officially sanctioned by the team\u2019s league office in both the numerator and denominator of this fraction. Earned Income x (Total games played in PGH/Total games played) x .03 (b)     Members of professional football teams calculate a \u201ctotal duty days within the City of Pittsburgh\u201d versus \u201ctotal duty days\u201d fraction. Multiply that fraction against the player\u2019s total compensation. In determining \u201cduty days\u201d, include preseason and regular season practice sessions; pre-season and regular season games; and post-season games and practice sessions that are officially sanctioned by the team\u2019s league office in both the numerator and denominator of this fraction. Earned Income x (Total duty days in PGH/Total duty days) x .03\n\n6\n\n(c)    Non-Player Personnel are apportioned on the basis of working days per year. These include team employees, such as coaches, trainers and any other persons required to travel with the team and perform services on behalf of the team; game officials. Divide the total number of working days within the city of Pittsburgh by the total number of working days in the year to arrive at the working days apportionment fraction. Earned Income x (Total work days in PGH/Total work days) x .03 (d) Entertainers are apportioned based on earned income attributable for the performance in the city\u2019s Publicly Funded Facility Earned Income for performance x .03\n\n(e) In general the taxpayer\u2019s apportionable income for the City of Pittsburgh would correspond to the apportionable income reported to PA as earned in the City of Pittsburgh. \u00a7 203.",
      "three years after the student separates from the university if a student has not fulfilled all obligations or has not resolved a pending Academic Integrity violation. Records of academic disciplinary actions proceedings resulting in the permanent separation of a student from the university (e.g., expulsion) will be maintained and reported indefinitely. Case-specific questions regarding timeframes for academic disciplinary actions records retention and reporting can be directed to the Office of Community Standards & Integrity. 132",
      "department, the student may change their status between In Residence and In Absentia multiple times with approval. A student In Residence or In Absentia must meet the specific criteria noted later in this policy. Students In Absentia will not be verified by the university as an enrolled \"student\" for immigration or loan purposes. All But Dissertation students in J1 or F1 immigration status must continue to follow the Department of Homeland Security (DHS) regulations [2]. All But Dissertation Students In Residence All But Dissertation students In Residence receiving any financial support (such as tuition, stipend, fees or health insurance, whether full or partial), tied to activities that are integral to their doctoral program that is  paid by or administered by the university must be enrolled for at least thirty-six units to maintain full time student status and all subsequent student privileges. Exceptions to the thirty-six unit enrollment requirement may be granted by the Provost [3]. All But Dissertation students In Residence who are not receiving any financial support (such as tuition, stipend, fees or health insurance, whether full or partial), from the university tied to activities that are integral to their doctoral program should consult their college policy to determine the number of units for which they must be registered in order to maintain full-time student status and all subsequent privileges. All But Dissertation students In Residence who are pursuing their doctoral degree on a part time basis and are not receiving any financial support (such as tuition, stipend, fees or health insurance, whether full or partial), from the university tied to activities that are integral to their doctoral program should consult their college policy to determine the number of units they must be registered for in order to maintain part time student status and all subsequent privileges. Note that doctoral students must be a full time graduate student for at least one"
    ],
    "answer": "six",
    "reference_answer": "The total number of days of absence shall not exceed six per sport or per organization annually."
  },
  {
    "question": "Under what conditions will amnesty from university disciplinary action be granted to students seeking medical assistance?",
    "context": [
      "Amnesty from university disciplinary action and University Police action will be granted to the student(s) for whom medical assistance is summoned and for those seeking assistance from emergency services personnel[18] when all of the following conditions apply: 1. An individual contacted emergency services personnel based on a reasonable belief that another individual was in need of immediate medical attention, which had not otherwise been sought, to prevent death or serious bodily injury; 2.",
      "who shall make a recommendation to the Dean. The Dean shall render a decision on the appeal within thirty (30) days or as soon thereafter as practical. Graduate students who wish to appeal the written decision of the Dean must submit a formal written appeal, with appropriate documentation, to the Provost within fourteen (14) calendar days after receipt of the Dean's decision. A copy of the appeal must also be submitted to the Assistant Vice Provost for Graduate Education and to the Dean. The Provost may delegate review of the matter to another individual or committee, including but not limited to the Vice Provost for Education who shall make a recommendation to the Provost. The Provost shall render a decision on the appeal within thirty (30) days or as soon thereafter as practical. Decisions by the Provost are final and not appealable. Generally, sanctions resulting from an Academic Action (e.g. probation, suspension, or dismissal /drop) take effect immediately, regardless of whether an appeal is filed. In exceptional circumstances, however, the appropriate Dean or the Provost may elect to hold sanctions in abeyance pending the resolution of an appeal. Summary of Levels of Appeal for Academic Actions: \u2022 Seek informal resolution within department, unit, or program \u2022 Formal written appeal to the Dean \u2022 Decision rendered by the Dean \u2022 Formal written appeal to the Provost \u2022 Provost issues final non-appealable decision Appeal from Academic Disciplinary Actions Academic Disciplinary Actions are sanctions and outcomes imposed when any student violates the University Policy on Academic integrity including cheating, plagiarism an unauthorized assistance. The Office of Community Standards and Integrity manages the Academic Disciplinary Process and provides resources to all students, faculty and staff. The process for appealing an academic integrity violation can be found under the Academic Disciplinary Actions Index. Community Standards Violations As members of the",
      "Any and all conditions of a mandate will be specified in a written letter from the associate vice president of student affairs to the student. Such conditions may include: \u2022 A behavioral contract; \u2022 A no contact agreement/order; \u2022 Transferring rooms within university housing; \u2022 Removal from university housing; \u2022 Completion of a pending community standards proceeding and/or investigation by the Office for Institutional Equity and Title IX; \u2022 Engagement in an appropriate care or treatment plan; \u2022 Temporary withdrawal from the university; \u2022 Signed releases of information or communication with support sources such as parents or treatment providers; and/or \u2022 Other conditions deemed reasonable and appropriate under the circumstances. A mandate will only be issued when, in the professional judgment of an associate vice president of student affairs (or their designee), after considering all reasonably available information, it is determined that the student: \u2022 Poses a credible substantial risk of harm to individuals within the University or to the University community as a whole; or \u2022 Substantially impedes the lawful activities, the educational process, or the proper activities or functions of members of the University community. The decision to issue a mandate will be predicated on an individualized assessment of the student\u2019s behaviors. The primary considerations in making this assessment will be the severity of the safety risk presented by the student, the impact of the student\u2019s behaviors on the university community and the broader community, the student\u2019s willingness or unwillingness to voluntarily engage in a level of care that is clinically indicated; and whether reasonable modifications of the university\u2019s polices, practices or procedures significantly mitigate the risk. Should a mandate be deemed appropriate, the university will identify the student affairs staff member(s) who will support and assist the student in meeting specific requirements and associated",
      "B. Time Frame for Reporting an Incident to the University The university strongly encourages individuals to report possible Prohibited Conduct promptly. Although the university does not limit the time frame for reporting Prohibited Conduct, it may be more difficult for the university to gather relevant and reliable evidence or to take corrective action regarding conduct that is reported to have occurred relatively long ago. If the Respondent is no longer a Student, Staff member, Faculty member, or participant in any university program or activity at the time of the report, or if the conduct does not fall within the scope of the Policy, the university\u2019s ability to take action against the Respondent under the Policy may be limited. The university will, however, also help a Complainant identify other options outside the university, such as local law enforcement, and provide support and resources. C. Information on Amnesty to Students When Reporting Prohibited Conduct to the University The university will not pursue university Prohibited Conduct charges against any Student in an investigation under this Policy for potential violations of university policy for personal consumption of alcohol or other drugs identified during an investigation, as long as any such violations did not and do not place the health or safety of any other person at risk. The university may, however, initiate an assessment, educational discussion, or pursue other developmental interventions (non-disciplinary options) to address the alcohol or other drug use.",
      "Academic Disciplinary Actions\n\n115\n\nAcademic Disciplinary Actions Statute of Limitations ................................................................................................................... 116 Important Definitions ................................................................................................................... 116 Course-Level Review, Decision, and Action ................................................................................. 117 Appeals of Course-Level Action .................................................................................................... 120 Second-Level Review, Decision, and Action ................................................................................. 121 Multiple Violation Reports ............................................................................................................. 121 Requests for Additional Outcomes ............................................................................................... 122 Academic Review Board ............................................................................................................... 123 Composition of the Academic Review Board ............................................................................... 123 Conduct of the Academic Review Board ...................................................................................... 124 Appeals of Academic Review Board Decisions ............................................................................ 128 Outcomes ...................................................................................................................................... 129 Withholding a Degree ................................................................................................................... 131 Academic Disciplinary Actions Records Retention and Reporting .............................................. 131\n\n116"
    ],
    "answer": "when all of the following conditions apply: 1. An individual contacted emergency services personnel based on a reasonable belief that another individual was in need of immediate medical attention, which had not otherwise been sought, to prevent death or serious bodily injury",
    "reference_answer": "Amnesty will be granted when an individual contacts emergency services based on a reasonable belief that another individual needs immediate medical attention, provides their own name to emergency services, and remains with the individual in need until emergency services arrive and their presence is no longer needed."
  },
  {
    "question": "Who must approve an event deploying games of chance on campus?",
    "context": [
      "The presence of the function on campus will not interfere with the normal activities of the university. 4. Where there is a question in the mind of the authorizing officer about the appropriateness of the request, it will be referred immediately to the dean of students and the appropriate campus administrators. 5. When a university group requests facilities for a meeting at which substantial off- campus attendance would be expected and notice of the meeting would be disseminated beyond the campus, the request must be reviewed with the dean of students and the appropriate campus administrators. 6. If an event is to be approved that will substantially reduce the facilities available for student use during periods when students are in residence, the request will be discussed with the Student Government before final approval is given.",
      "Lotteries and Raffles Lotteries, raffles or other devices of a like nature are governed by the laws of the Commonwealth of Pennsylvania and are therefore authorized on campus only when required permits are obtained by the appropriate governing authority. Approval to host an event deploying games of chance must receive approval from the director of student leadership, involvement and civic engagement to ensure compliance with the law. Deadly Weapons Policy Objectives This Policy is part of a broad initiative aimed at maintaining the university as a safe place for students, faculty, staff and visitors. The prohibition of deadly weapons on campus is a proactive step toward reducing the risk of injury or death due to the intentional, accidental, inexpert or improper use of firearms. Statement Deadly weapons are not permitted on any property owned or controlled by the university. For the purposes of this policy, a deadly weapon is any device designed to produce death or serious bodily injury. Deadly weapons include, but are not limited to: \u2022 Firearms, whether loaded or unloaded \u2022 Pellet, flare, tranquilizer, stun, spear and dart guns \u2022 Knives with blades larger than that of a folding pocket knife. \u2022 Switchblades \u2022 Daggers \u2022 Striking instruments, including clubs, truncheons, blackjacks, metal knuckles and sap gloves \u2022 Martial arts weapons, including nunchakus, tonfas, staffs and throwing stars \u2022 Bow and arrow combinations \u2022 Explosive devices, including hand grenades, bombs, black powder, smokeless powder, percussion caps, friction primers and pyrotechnic fuses. 157",
      "OFEM is tasked with receiving and vetting applications for small and large-scale events and film productions within the City of Pittsburgh as well as consulting with both film and event permit applicants to ensure that industry standards, safety regulations, and city policies are followed and met. Via the Special Events Committee, OFEM also works with all City departments to ensure proper planning, coordination, and execution of all events and film projects. Additionally, it will ensure that events and film productions do not negatively impact the City\u2019s operations and remain positive assets to the City and its residents. Beginning in the spring of 2024, the Office of Film & Event Management (OFEM) launched a new permit management system, Eproval! With the launch of this new system came a new two-phase application approach to special event permitting. The new process allowed event organizers to secure their preferred venue first, and then focus on the details of the event. Previously, applicants had to wait until many details of their event were in place before they could apply. Now, applicants could secure their venue and dates, then move forward with hiring all of their vendors and performers with the comfort of knowing they had a secure venue and dates. Please see the release below for more information on EProval, and please visit the Special Event & Block Party Permitting page for information on the new application process. Please check out the 'Getting Started: Event Permits' document under the 'Important Documents' tab on the left for information on the entire permitting process! In addition to being able to secure their event venue prior to completing all event-specific details, Eproval provides several new exciting features that will make the event permitting process more streamlined for applicants. Among them:",
      "A strategy for hosting of additional events, discussions, or town meetings before or after a principal event to help provide a context in which the principal event may be best experienced. The Office of Student Activities and the Office of the Dean of Student Affairs may assist in, or directly coordinate, some aspects of campus events, such as fostering discussions preceding or following an event, or accommodating an opposing view at an alternative event. It is assumed that the spirit of community, both among people and groups with opposing views, as well as between event sponsors and the Student Activities and Student Affairs staffs, will foster communication and cooperation in the planning of campus events. Whenever possible, Student Affairs will work in concert with University Police to notify occupants of buildings in advance of any potential disruption caused by such events. Security Personnel Statement At times, members of the campus community or their invited guests may have a legitimate basis for being accompanied by independent security personnel. It is incumbent upon the host of such an individual to ensure that the University Police approve in advance the presence and scope of involvement of any such security personnel. Hazing Students have a right to be treated with respect and dignity by and among their peers. Hazing is inconsistent with Carnegie Mellon University\u2019s values and is strictly prohibited. On October 19, 2018, the Commonwealth of Pennsylvania enacted the Timothy J. Piazza\n\n170",
      "Committee of the Board of Trustees before it is accepted by the university. The PAC meets on an ad hoc basis as public art proposals require review, or to address other public art planning issues. Recommendations of the PAC shall be upon a vote of the majority of members convened. The Design Review Committee must be consulted on proposals for outdoor sites that require integration into the campus master plan. In order to ensure that the PAC has the opportunity to receive input from all campus constituencies, prior to recommending acceptance of a piece of public art the PAC shall hold at least one public meeting which all interested members may attend for purposes of hearing about and offering comment on the proposed piece. Representatives of the primary user(s) of the space where the public art is to be sited must also be consulted. 213"
    ],
    "answer": "director of student leadership, involvement and civic engagement",
    "reference_answer": "The director of student leadership, involvement and civic engagement must approve an event deploying games of chance on campus."
  },
  {
    "question": "Who must approve all banners?",
    "context": [
      "of one (1) active poster per event, per bulletin board location; \u2022 New posters are not posted over other active posters; \u2022 The posted items are removed from bulletin board locations no more than seven (7) days after they are no longer active posters. Banners Student organizations are permitted to hang banners on Doherty Hall through the following procedure:",
      "(5) The power to prescribe forms necessary for the administration of the Code and these Regulations; and\n\n(6) The power to issue citations for violations of these Regulation and institute penalties, including but not limited to those prescribed in Article 6 of these Regulations. (c) The Treasurer is authorized to issue a ruling upon written request of any operator. \u00a7 502.",
      "Please have the meeting date available. Year\n\nMinutes PDF\n\n2024\n\nLink to Minutes PDF\n\n2023\n\nLink to Minutes PDF\n\n2022\n\nLink to Minutes PDF\n\n2021\n\nLink to Minutes PDF\n\n2020\n\nLink to Minutes PDF\n\nTo receive Commissions and Board agendas via email, please email\u00a0planningcommission@pittsburghpa.gov\n\nPlanning Commission Process Guide: https://www.pittsburghpa.gov/files/assets/city/v/1/dcp/documents/6573_planning_commission_20190719.pdf\n\nThe PACD Commission meets on the fourth Wednesday of each month, with a December recess. Meetings start at 2:00 PM. The City of Pittsburgh\u2019s Public Art & Civic Design Commission empowers the development of art and culture in public spaces and promotes the design of public spaces and civic structures that have a positive impact on the City\u2019s Public Realm. For that purpose, the Commission is authorized to review and approve the aesthetics of the designed environment on or over City-owned property. The Commission conducts reviews through two Committees:\n\nTo receive Commissions and Board agendas via email, please email\u00a0pacd@pittsburghpa.gov\n\nPublic Art Committee\n\nCivic Design Committee\n\nOver-The-Counter (OTC) review is conducted by staff for low-impact projects that meet certain eligibility criteria. Reviews are limited to proposed projects that will have a relatively minimal impact on the public realm. Projects may be eligible for Over-The-Counter approval based on the following criteria:\n\nReplacements: Projects which replace the form or content of existing elements or fixtures in order to repair, improve, or update existing implementations. Replacements may be either of the following:",
      "reject, or modify the recommendation, or may remand the matter to a new University Disciplinary Committee for review. 18. After reviewing the recommendations, the associate vice president of student affairs for community life or designee will render a decision in writing. The decision letter will typically be delivered to the respondent(s) by the process advisor.",
      "of the Code. Upon suspending or revoking any amusement permit the Treasurer shall request that the permittee surrender to him or her immediately all permits and duplicates thereof issued to him or her. The permittee shall surrender promptly all permits to the Treasurer as requested. Whenever the Treasurer suspends an amusement permit, he or she shall notify the permittee immediately and afford him or her a hearing if desired. After the hearing and for good cause, the Treasurer may either rescind or continue the order of suspension and revoke the permit. 9"
    ],
    "answer": "The City of Pittsburgh\u2019s Public Art & Civic Design Commission",
    "reference_answer": "All banners must be approved by the Office of Student Activities."
  },
  {
    "question": "Which colleges at Carnegie Mellon record W grades for graduate students?",
    "context": [
      "Students who entered Carnegie Mellon (as graduate students) prior to Fall 1995 follow their previous graduate grading standard. Graduate students who take a leave of absence and return to Carnegie Mellon will do so under the 4.33-point grading scale. These students will have their past semester QPAs recalculated at the time of their return. No A+ may be given in an H&SS or CIT course. No D or D+ may be given in a Tepper course. Pass/Fail policies for graduate students vary and students should be advised to check with their individual colleges/departments/programs for details. Only Tepper and MCS record W grades. Department and college policy determine minimum passing grades in graduate courses. Any course that a graduate student completes will be graded using this scale.",
      "Carnegie Mellon University homepage: https://www.cmu.edu\n\nNews: /news/\n\nStories: /news/stories\n\nCollege of Engineering: /news/stories/college-of-engineering\n\nCollege of Fine Arts: /news/stories/college-of-fine-arts\n\nDietrich College of Humanities & Social Sciences: /news/stories/dietrich-college-of-humanities-social-sciences\n\nHeinz College of Information Systems and Public Policy: /news/stories/heinz-college-of-information-systems-and-public-policy\n\nMellon College of Science: /news/stories/mellon-college-of-science\n\nSchool of Computer Science: /news/stories/school-of-computer-science\n\nTepper School of Business: /news/stories/tepper-school-of-business\n\nArchives: /news/stories/archives\n\n2025: /news/stories/archives/2025\n\nJanuary: /news/stories/archives/2025/january\n\nFebruary: /news/stories/archives/2025/february\n\nMarch: /news/stories/archives/2025/march\n\n2024: /news/stories/archives/2024\n\nJanuary: /news/stories/archives/2024/january\n\nFebruary: /news/stories/archives/2024/february\n\nMarch: /news/stories/archives/2024/march\n\nApril: /news/stories/archives/2024/april\n\nMay: /news/stories/archives/2024/may\n\nJune: /news/stories/archives/2024/june\n\nJuly: /news/stories/archives/2024/july\n\nAugust: /news/stories/archives/2024/august\n\nSeptember: /news/stories/archives/2024/september\n\nOctober: /news/stories/archives/2024/october\n\nNovember: /news/stories/archives/2024/november\n\nDecember: /news/stories/archives/2024/december\n\n2023: /news/stories/archives/2023\n\nJanuary: /news/stories/archives/2023/january\n\nFebruary: /news/stories/archives/2023/february\n\nMarch: /news/stories/archives/2023/march\n\nApril: /news/stories/archives/2023/april\n\nMay: /news/stories/archives/2023/may\n\nJune: /news/stories/archives/2023/june\n\nJuly: /news/stories/archives/2023/july\n\nAugust: /news/stories/archives/2023/august\n\nSeptember: /news/stories/archives/2023/september\n\nOctober: /news/stories/archives/2023/october\n\nNovember: /news/stories/archives/2023/november\n\nDecember: /news/stories/archives/2023/december",
      "the Heinz College, the Mellon College of Science and the Tepper School of Business.) \u2022 After the last day of classes: Permanent grades assigned by the instructor will be recorded. Student Parental Accommodation Protocols Providing holistic student support is a top priority at Carnegie Mellon. The protocols on this policy are designed to support the parental needs of students and their families. Students seeking any of the Parental Accommodations described below must register with the Office of the Dean of Student Affairs by contacting the office for an appointment by calling 412-268-2075. 88",
      "110\n\nofficial, final transcripts to the Office of Undergraduate Admission once they are admitted and prior to their beginning coursework at Carnegie Mellon. As part of the admission process, Admission will verify the official final transcripts, and then send them to the appropriate academic unit responsible for college/department acceptance decisions. Each unit will be responsible for student's review of transfer credit and the establishment of transfer course credit for each individual student. Current Students Current Carnegie Mellon students taking courses at other accredited institutions (colleges and universities), during either summer semesters or as part of exchange programs or other departmentally approved programs, or while on leave from Carnegie Mellon, must arrange for the submission of official final transcripts to the University Registrar's Office. Upon receipt, the University Registrar's Office will verify these official transcripts and send a copy of the transcript to the appropriate academic unit responsible for that student's college/department transfer credit decisions. The official transcript will reside in the student's university academic folder in the University Registrar's Office. Each unit will be responsible for its students' transfer credit review and the establishment of transfer course credit for each individual student. Should a unit receive the official transcript, it must be sent immediately to the University Registrar's Office. Incoming Graduate Students External applicants applying for admission to Carnegie Mellon will arrange for submission of:\n\nofficial transcripts to their graduate admission committee as part of the admission process,",
      "Contact alumni-house@andrew.cmu.edu. With over 13,000 alumni, parents, students and friends in the New York Metro area, the network is one of the largest regional networks for the Carnegie Mellon University Alumni Association. Event registrations close March 31st at 11:59 PM EDT."
    ],
    "answer": "Tepper and MCS",
    "reference_answer": "Only Tepper and MCS record W grades."
  },
  {
    "question": "What will be recorded on a student's academic record for work below D?",
    "context": [
      "factorable\t\t\tPassing\t\t\t\t\t\t\t\t\t\t\t\t\t\t\t\t\t\tN\t\t\tNon\n\nfactorable\t\t\tNot Passing\t\t\t\t\t\t\t\t\t\t\t\t\t\t\t\t\t\tO\t\t\tNon\n\nfactorable\t\t\tAudit\t\t\t\t\t\t\t\t\t\t\t\t\t\t\t\t\t\tW\t\t\tNon\n\nfactorable\t\t\tWithdrawal\t\t\t\t\t\t\t\t\t\t\t\t\t\t\t\t\t\tI\t\t\tNon\n\nfactorable\t\t\tIncomplete\n\n57\n\nAD Non-factorable Credit granted for work completed at another institution or by examination credit. Any +/- grades received by undergraduate students when taking graduate-level courses will automatically convert to the corresponding letter grade as listed in the scale above. Grade\n\nQuality Points\n\nA+\n\n4.33\n\nA\n\n4.0\n\nA\n\n3.67\n\nB+\n\n3.33\n\nB\n\n3.0\n\nB\n\n2.67\n\nC+\n\n2.33\n\nC\n\n2.0\n\nC\n\n1.67\n\nD+\n\n1.33\n\nD 1.0 R 0.0 Failure S Non-factorable Satisfactory P Non-factorable Passing N Non-factorable Not Passing O Non-factorable Audit W Non-factorable Withdrawal I Non-factorable Incomplete AD Non-factorable Credit granted for work completed at another institution or by examination credit. This grading standard is for all students classified as seeking a graduate degree and special students taking graduate courses. AD\tNon-factorable\t\tCredit granted for work completed at another\t\t\t\tinstitution or by examination credit. Grade\t\t\tQuality Points\t\t\t\t\t\t\t\t\t\t\t\t\t\t\t\t\t\t\t\t\tA+\t\t\t4.33\t\t\t\t\t\t\t\t\t\t\t\t\t\t\t\t\t\t\t\t\tA\t\t\t4.0\t\t\t\t\t\t\t\t\t\t\t\t\t\t\t\t\t\t\t\t\tA-\t\t\t3.67\t\t\t\t\t\t\t\t\t\t\t\t\t\t\t\t\t\t\t\t\tB+\t\t\t3.33\t\t\t\t\t\t\t\t\t\t\t\t\t\t\t\t\t\t\t\t\tB\t\t\t3.0\t\t\t\t\t\t\t\t\t\t\t\t\t\t\t\t\t\t\t\t\tB-\t\t\t2.67\t\t\t\t\t\t\t\t\t\t\t\t\t\t\t\t\t\t\t\t\tC+\t\t\t2.33\t\t\t\t\t\t\t\t\t\t\t\t\t\t\t\t\t\t\t\t\tC\t\t\t2.0\t\t\t\t\t\t\t\t\t\t\t\t\t\t\t\t\t\t\t\t\tC-\t\t\t1.67\t\t\t\t\t\t\t\t\t\t\t\t\t\t\t\t\t\t\t\t\tD+\t\t\t1.33\t\t\t\t\t\t\t\t\t\t\t\t\t\t\t\t\t\t\t\t\tD\t\t\t1.0\t\t\t\t\t\t\t\t\t\t\t\t\t\t\t\t\t\t\t\t\tR\t\t\t0.0\t\t\tFailure\t\t\t\t\t\t\t\t\t\t\t\t\t\t\t\t\t\tS\t\t\tNon-factorable\t\t\tSatisfactory\t\t\t\t\t\t\t\t\t\t\t\t\t\t\t\t\t\tP\t\t\tNon-factorable\t\t\tPassing\t\t\t\t\t\t\t\t\t\t\t\t\t\t\t\t\t\tN\t\t\tNon-factorable\t\t\tNot Passing\t\t\t\t\t\t\t\t\t\t\t\t\t\t\t\t\t\tO\t\t\tNon-factorable\t\t\tAudit\t\t\t\t\t\t\t\t\t\t\t\t\t\t\t\t\t\tW\t\t\tNon-factorable\t\t\tWithdrawal\t\t\t\t\t\t\t\t\t\t\t\t\t\t\t\t\t\tI\t\t\tNon-factorable\t\t\tIncomplete\t\t\t\t\t\t\t\t\t\t\t\t\t\t\t\t\tAD\t\t\tNon-factorable\t\t\t\tCredit granted for work completed at another\t\t\t\t\t\t\t\tinstitution or by examination credit. 58",
      "campus, non\n\nprofit organization as an outcome. The particular assignment of duties must be pre\n\napproved by the process advisor. Students must provide appropriate documentation verifying their completed community service. Educational/Developmental Assignment: The university may require a student to complete a project, assignment, or activity to promote the student\u2019s education and development. These assignments are determined by the Academic Review Board and\n\n131",
      "Inspection What are education records? Education records are records maintained by the university that are directly related to students. These include biographic and demographic data, application materials, course schedules, grades and work-study records. The term does not include: \u2022 information contained in the private files of instructors and administrators, used only as a personal memory aid and not accessible or revealed to any other person except a temporary substitute for the maker of the record; \u2022 Campus Police records; \u2022 employment records other than work-study records; \u2022 medical and psychological records used solely for treatment purposes; \u2022 records that only contain information about individuals after they have left the university; \u2022 any other records that do not meet the above definition of education records. 91\n\nHow do I inspect my education records? \u2022 Complete an Education Inspection and Review Request Form [pdf] and return it to The HUB in order to notify the University Registrar's Office. \u2022 The custodian of the education record you wish to inspect will contact you to arrange a mutually convenient time for inspection, not more than 45 days after your request. The custodian or designee will be present during your inspection. \u2022 You will not be permitted to review financial information, including your parents' financial information; or confidential letters of recommendation, if you have waived your right to inspect such letters. \u2022 You can get copies of your education records from the office where they are kept for 25 cents per page, prepaid. 2.",
      "Restricted Research Policy ............................................................................................................... 81 Retention of Student Work Policy ................................................................................................... 85 Statute of Limitations \u2013 Master\u2019s Studies ....................................................................................... 85 Statute of Limitations \u2013 Undergraduate Students ........................................................................ 86 Student Leaves Policy ....................................................................................................................... 86 Student Parental Accommodation Protocols ................................................................................ 87 Student Privacy Rights Policy ........................................................................................................... 90 Student Return Policy ....................................................................................................................... 94 Students\u2019 Rights Policy ..................................................................................................................... 95 Student Suspension/Required Withdrawal Policy ......................................................................... 96 Summary of Graduate Student Appeal and Grievance Procedures ............................................ 98 Taxation of Graduate Student Awards Policy .............................................................................. 104 Temporary Emergency Closing of the University Policy ............................................................. 107 Transfer Credit Evaluation and Assignment Policy ..................................................................... 108 Tuition and Fees Adjustment Policy .............................................................................................. 111 Undergraduate Course Meeting",
      "Submission of work completed or edited in whole or in part by another person. 3. Supplying or communicating unauthorized information or materials, including graded work and answer keys from previous course offerings, in any way to another student. 4. Use of unauthorized information or materials, including graded work and answer keys from previous course offerings. 5. Use of unauthorized devices."
    ],
    "answer": "Grade Quality Points",
    "reference_answer": "Work below D will receive no credit and will be recorded as N on the student's academic record."
  },
  {
    "question": "Who manages the Academic Disciplinary Process at the university?",
    "context": [
      "for resolution of the matter, taking into account where appropriate the concerns of the reporting party. The aforementioned proposed outcome or set of outcomes will be reviewed by the Resolution Review Board. If approved, the student will receive notification in writing confirming the determined action, which then becomes final. If agreement on the appropriate action cannot be reached, the matter may be referred to the University Disciplinary Committee for review. Should a student be non-responsive to notification of an alleged violation of the university's community standards, after a reasonable period of time and having made reasonable attempts to contact the Respondent, the university adjudicator may make a determination regarding responsibility and assign restorative outcomes and/or a period of disciplinary probation based on the information available. Consistent with Administrative Resolution procedures, this determination will be forwarded to the Resolution Review Board for approval. Violations that may result in disciplinary suspension and where the student is non- responsive will be referred to the University Disciplinary Committee for resolution. University Disciplinary Committee The University Disciplinary Committee has jurisdiction in the following cases: 1. Any cases of alleged violations of university standards and policies that the Resolution Review Board deems sufficiently serious in nature or inappropriate for administrative resolution. 2. Any cases of alleged violations of university standards and policies in which one student(s) is filing allegation against another student(s) that cannot be appropriately resolved through the administrative resolution process. 3. Appeals referred by the dean of students or designee to review summary actions imposed by a university adjudicator or university staff member. 4. Cases in which administrative resolution has not been successful. When circumstances warrant, at the discretion of the Dean of Students or",
      "by their respective procedures separate from community standards action (e.g. University Libraries, Transportation Services, Environmental Health and Safety, Office for Institutional Equity and Title IX, etc.).",
      "the administrative officers of the university to maintain a campus climate which enhances the freedom of the faculty to teach, to engage in research and to take part in other scholarly and artistic activities, and the freedom of the students to learn and grow both inside and outside of the classroom. Faculty The faculty has the primary responsibility for carrying out the educational and scholarly programs of the university. All members of the faculty have the duty to conduct their courses in a manner consistent with the highest standards of their profession. Through the presentation of material in the",
      "Academic Disciplinary Actions\n\n115\n\nAcademic Disciplinary Actions Statute of Limitations ................................................................................................................... 116 Important Definitions ................................................................................................................... 116 Course-Level Review, Decision, and Action ................................................................................. 117 Appeals of Course-Level Action .................................................................................................... 120 Second-Level Review, Decision, and Action ................................................................................. 121 Multiple Violation Reports ............................................................................................................. 121 Requests for Additional Outcomes ............................................................................................... 122 Academic Review Board ............................................................................................................... 123 Composition of the Academic Review Board ............................................................................... 123 Conduct of the Academic Review Board ...................................................................................... 124 Appeals of Academic Review Board Decisions ............................................................................ 128 Outcomes ...................................................................................................................................... 129 Withholding a Degree ................................................................................................................... 131 Academic Disciplinary Actions Records Retention and Reporting .............................................. 131\n\n116",
      "The Academic Advisor may be designated by the department to disseminate relevant correspondence related to academic disciplinary action within the department according to departmental procedure. \u2022 Academic Disciplinary Action: Academic disciplinary actions are outcomes imposed for violations of the University Policy on Academic Integrity including cheating, plagiarism, and unauthorized assistance. \u2022 Academic Integrity Liaison: Each department designates an individual who is trained by the Office of Community Standards and Integrity to provide guidance to course instructors in cases of alleged violations of the University Policy on Academic Integrity. Absent a departmental designation, the associate dean of the college in which the course is housed is the default liaison for consultation purposes. \u2022 Course Failure: A grade of \u201cR\u201d as outlined in the University Policy on Grading. \u2022 Course Instructor: Any person responsible for the instruction or grading of a course at the university as documented in the Schedule of Classes. \u2022 Department Head: The university faculty or staff member who leads an academic department. In academic disciplinary cases in which the home department is an academic program, the program director is considered to be the department head. \u2022 Email: The official Carnegie Mellon University email address designated in the university directory. 117"
    ],
    "answer": "University Disciplinary Committee",
    "reference_answer": "The Office of Community Standards and Integrity manages the Academic Disciplinary Process."
  },
  {
    "question": "Who may direct that a degree not be certified by the university registrar?",
    "context": [
      "Any further clarification of this policy can be addressed to the Associate Vice President and Director of Enrollment Services. Withdrawal of a Degree Policy The university reserves the right to withdraw a degree even though it has been granted should there be discovery that the work upon which it was based or the academic records in support of it had been falsified. In such a case the degree will be withdrawn promptly upon discovery of the falsification. 114\n\nAcademic Disciplinary Actions\n\n115",
      "v. Regents of the Univ.",
      "2. In each case of a student cross-registration, the approval of the dean or a designated individual from the home college or university must be obtained prior to registration. 3. In addition, the student's advisor or dean is responsible for assuring the student's eligibility for the course in which he/she intends to enroll. 4. Full credit and grades for cross-registered courses will be transferred to the appropriate institution; the academic regulations of the host university will prevail. 5. The academic honesty code and other rules of conduct of the institution providing instruction apply with respect to its courses and behavior on its campus. That institution also determines whether its rules have or have not been violated. The student's own institution will impose such penalties as it considers proper when violations are reported to it. 35",
      "the consent of the instructor who assigned the grade. The following circumstances are the unusual exceptions that may warrant a grade appeal: (a) the final grade assigned for a course is based on manifest error (e.g. a clear error such as arithmetic error in computing a grade or failure to grade one of the answers on an exam), or (b) the faculty or staff member who assigned the grade did so in violation of a University policy. A graduate student who believes a final grade was assigned pursuant to (a) or (b) above should first present the case informally to the faculty or staff member responsible for the course in which the student believes an inappropriate grade has been awarded. Grade appeals should be initiated as soon as possible but no later than one year after the final course grade was issued. If the student is not satisfied with the resolution at this first step, the student shall submit a formal, written appeal, with appropriate documentation",
      "reviewed by the University Disciplinary Committee, such as direct observation of the incident in question and/or direct interaction with The Community Standards Process Staff members in the Division of Student Affairs adjudicate alleged violations of community standards by students through the community standards process. The following forums exist for formal resolution of alleged violations: \u2022 Administrative Resolution Meeting with a university adjudicator \u2022 University Disciplinary Committee (UDC)"
    ],
    "answer": "The university reserves the right to withdraw a degree even though it has been granted should there be discovery that the work upon which it was based or the academic records in support of it had been falsified",
    "reference_answer": "The dean of students or designee may direct that a degree not be certified by the university registrar."
  },
  {
    "question": "What is the address of Carnegie Mellon University?",
    "context": [
      "does not discriminate and is required not to discriminate in violation of federal, state, or local laws or executive orders. Inquiries concerning the application of and compliance with this statement should be directed to the Office for Institutional Equity and Title IX, Carnegie Mellon University, 4615 Forbes Avenue, Suite 330, Pittsburgh, PA 15213, telephone 412-268-7125. Obtain general information about Carnegie Mellon University by calling 412-268-2000. 259",
      "Museum: Carnegie_Museum_of_Art",
      "alumni, parents, students and friends in the New York Metro area, the network is one of the largest regional networks for the Carnegie Mellon University Alumni Association. Event registrations close April 2nd at 11:59 PM EDT.",
      "Look no further for information on hotel accommodations , restaurants and events to make your stay hassle-free and successful. Every campus has dorms and classrooms and activities. For a truly unique learning experience, visit Pittsburgh's rich arts , cultural , historical and outdoor attractions. dorms: https://www.visitpittsburgh.com/blog/move-in-day-pittsburgh-college-guide/\n\narts: https://www.visitpittsburgh.com/things-to-do/arts-culture/visual-arts/\n\ncultural: https://www.visitpittsburgh.com/things-to-do/arts-culture/music-performing-arts/\n\nPittsburgh is home to many n\" world-class educational institutions , including Carnegie Mellon University, the University of Pittsburgh, Duquesne University, La Roche, Point Park University, Robert Morris University and Chatham University among others. world-class educational institutions: https://www.visitpittsburgh.com/about-pittsburgh/relocation/education/colleges-universities/\n\nColleges & Universities\n\nCollege Sports Learn More: https://www.visitpittsburgh.com/things-to-do/pittsburgh-sports-teams/college-sports/\n\nCollege Sports\n\nNeighborhoods\n\n## hotels\n\nPittsburgh offers many options when it comes to hotels, resorts and accommodations. Pittsburgh offers a wide selection of world-class accommodations representing all of the major brands that are sure to leave your attendees with an exceptional lasting impression. Many of the properties, including several new hotels, are within walking distance of the David L. Lawrence Convention Center . Please enable JavaScript to show the Partner Listings listings. Submit RFP\n\nLet us know when you are ready to book.",
      "Carnegie Mellon University homepage: https://www.cmu.edu\n\nNews: /news/\n\nStories: /news/stories\n\nCollege of Engineering: /news/stories/college-of-engineering\n\nCollege of Fine Arts: /news/stories/college-of-fine-arts\n\nDietrich College of Humanities & Social Sciences: /news/stories/dietrich-college-of-humanities-social-sciences\n\nHeinz College of Information Systems and Public Policy: /news/stories/heinz-college-of-information-systems-and-public-policy\n\nMellon College of Science: /news/stories/mellon-college-of-science\n\nSchool of Computer Science: /news/stories/school-of-computer-science\n\nTepper School of Business: /news/stories/tepper-school-of-business\n\nArchives: /news/stories/archives\n\n2025: /news/stories/archives/2025\n\nJanuary: /news/stories/archives/2025/january\n\nFebruary: /news/stories/archives/2025/february\n\nMarch: /news/stories/archives/2025/march\n\n2024: /news/stories/archives/2024\n\nJanuary: /news/stories/archives/2024/january\n\nFebruary: /news/stories/archives/2024/february\n\nMarch: /news/stories/archives/2024/march\n\nApril: /news/stories/archives/2024/april\n\nMay: /news/stories/archives/2024/may\n\nJune: /news/stories/archives/2024/june\n\nJuly: /news/stories/archives/2024/july\n\nAugust: /news/stories/archives/2024/august\n\nSeptember: /news/stories/archives/2024/september\n\nOctober: /news/stories/archives/2024/october\n\nNovember: /news/stories/archives/2024/november\n\nDecember: /news/stories/archives/2024/december\n\n2023: /news/stories/archives/2023\n\nJanuary: /news/stories/archives/2023/january\n\nFebruary: /news/stories/archives/2023/february\n\nMarch: /news/stories/archives/2023/march\n\nApril: /news/stories/archives/2023/april\n\nMay: /news/stories/archives/2023/may\n\nJune: /news/stories/archives/2023/june\n\nJuly: /news/stories/archives/2023/july\n\nAugust: /news/stories/archives/2023/august\n\nSeptember: /news/stories/archives/2023/september\n\nOctober: /news/stories/archives/2023/october\n\nNovember: /news/stories/archives/2023/november\n\nDecember: /news/stories/archives/2023/december"
    ],
    "answer": "https://www.cmu.edu",
    "reference_answer": "The address of Carnegie Mellon University is 5000 Forbes Avenue, Pittsburgh, PA 15213-3890."
  },
  {
    "question": "Where must gifts designated to a specific organization be made to ensure compliance with tax laws?",
    "context": [
      "9\n\nthat portion of its Payroll Expense attributable to business activity for which a tax may be imposed pursuant to Section 511 of the Internal Revenue Code. 26 U.S.C. \u00a7 511. That section imposes a federal tax on unrelated business taxable income of a charity that is exempt from federal tax under Section 501(c) of the Internal Revenue Code. 26 U.S.C. \u00a7 501(c). If the charity has purchased or is operating branches, affiliates, subsidiaries or other business entities that do not independently meet the standards of the \u201cInstitutions of Purely Public Charity Act\u201d, the tax shall be paid on the payroll attributable to such for-profit branches, affiliates or subsidiaries, whether or not the employees are leased or placed under the auspices of the charity\u2019s umbrella or parent organization. Local Tax Enabling Act, 53 P.S.",
      "Cryptocurrency: ../give/make-your-gift/cryptocurrency.html\n\nGift Planning: ../give/gift-planning/index.html\n\nInspiring Donor Stories: ../give/gift-planning/donor-stories.html\n\nCreate Income with Giving: ../give/gift-planning/create-income.html\n\nGive Through Assets: ../give/gift-planning/give-through-assets.html\n\nDesign a Legacy: ../give/gift-planning/design-legacy.html\n\nImpact Stories: ../give/giving-impact/index.html\n\nDonor Recognition: ../give/donor-recognition/index.html\n\nParents Leadership Circle: ../give/donor-recognition/parents-leadership-circle.html\n\nOrder of the May: ../give/donor-recognition/order-of-the-may.html\n\nAndrew Carnegie Society: ../give/donor-recognition/andrew-carnegie-society/index.html\n\nThe ACS Board: ../give/donor-recognition/andrew-carnegie-society/acs-board-members.html\n\nACS Legacy Scholarships: ../give/donor-recognition/andrew-carnegie-society/acs-legacy-scholarships.html\n\nACS Scholars Program: ../give/donor-recognition/andrew-carnegie-society/acs-scholars.html\n\nThe Warner Circle: ../give/donor-recognition/warner-circle.html\n\nThe Dunfermline Circle: ../give/donor-recognition/dunfermline-circle.html\n\nThe Highlands Circle: ../give/donor-recognition/highlands-circle/index.html\n\nHeinz College Dean's Circle: https://www.heinz.cmu.edu/give-to-heinz/deans-circle/index.aspx\n\nW. L. Mellon Society: http://alumnihub.tepper.cmu.edu/s/1410/alumni/tepper/index.aspx?sid=1410&gid=25&pgid=4637\n\nThank a Donor: ../give/donor-recognition/thankadonor.html\n\nStudent Giving: ../give/students.html\n\nContact Us: ../give/contact-us/index.html\n\nFAQ: ../give/contact-us/faq.html\n\nBusiness Engagement: https://www.cmu.edu/business-engagement/index.html\n\nFoundation Relations: ../partner/foundations/index.html\n\nFor Faculty & Staff: ../partner/foundations/faculty-staff/index.html\n\nHighlighted Foundation Partnerships: ../partner/foundations/highlighted-partnerships/index.html\n\nContact Us: ../partner/foundations/foundations-staff.html\n\nLeadership: ../about-us/leadership.html",
      "The Grants Office is housed within this group.",
      "Where the taxpayer resides and works; and\n\n3. Where the taxpayer is employed that is nearest in miles to the taxpayer\u2019s home.",
      "Information on Statement of Financial Interests (SOFI), Gift Disclosures, and Campaign Finance\n\nEducation The Ethics Hearing Board regulates conduct under state and city ethics laws.: https://www.pittsburghpa.gov/City-Government/Boards-Authorities-Commissions/List-of-Boards-Authorities-Commissions/Ethics-Hearing-Board/Education\n\nThe Ethics Hearing Board regulates conduct under state and city ethics laws. City of Pittsburgh 414 Grant St. Pittsburgh, PA 15219 (Accessibility entrance on Ross St.) View on Map 412-255-2621\n\n## Rodent-Baiting-Program.txt\n\nIn This Section"
    ],
    "answer": "../give/gift-planning/give-through-assets.html",
    "reference_answer": "Gifts designated to a specific organization must be made through the University\u2019s annual giving website or by deposit to the Office of Student Leadership, Involvement and Civic Engagement."
  },
  {
    "question": "What must a student submit to elect a course as pass/fail?",
    "context": [
      "department or the student's home department/college. Policies for graduate students vary and students should be advised to check with their individual colleges/departments/programs for details. A student must submit a Grade Option Request Form to Enrollment Services indicating the course they are electing as pass/fail before the end of the university's withdraw period. This decision is irreversible thereafter. No information regarding the student's decision will be passed on to the instructor. Instructors will submit letter grades, which will automatically be converted to pass/fail. 55",
      "4. Upon receipt of the violation report, the Office of Community Standards and Integrity will notify the following individuals of the course-level decision and action: \u2022 Head of the student\u2019s home department \u2022 Associate dean of the student\u2019s home college \u2022 Academic advisor for the student \u2022 Head of department in which the course is registered (if different from the student's department)\n\n120\n\nAssociate dean of the college in which the course is registered (if different from the student's college) 5. Students will receive official notification that the report has been received from the Office of Community Standards and Integrity. The notification will include an invitation to meet with a process advisor in the Office of Community Standards to discuss the case, review the appeal process, and prepare for second\n\nlevel review (if needed). 6. In addition to the above notifications, the Office of Community Standards and Integrity will be responsible for coordinating all second\n\nlevel review, decision, and action and documenting the violation in the student\u2019s university conduct record consistent with the university policy on Student Conduct Records Retention and Reporting. Appeals of Course\n\nLevel Action When a student has received official notification of course\n\nlevel action from the Office of Community Standards and Integrity, a student has seven calendar days to request an appeal of course\n\nlevel action. All requests for appeal must be submitted in writing via email to the Office of Community Standards and Integrity. The written appeal request must indicate whether the student is appealing the finding of responsibility, the outcome, or both, as well as the basis for the appeal itself. The basis of an appeal will be limited to one or more of the following:\n\nA gross error in procedural process that materially affected the outcome;\n\nInconsistency between the available evidence and the finding(s) of responsibility in the course\n\nlevel review;\n\nStated course",
      "Final Examinations 1. All scheduled final examinations are held at the end of the semester during the university's official final examination period. Comprehensive final examinations are not required for each course, but are given at the option of the department or instructor. The reading day and weekend preceding the examination days shall never be used for examination purposes of any kind, unless a student opts to take a self- scheduled examination during this time. Non-comprehensive final examinations or final projects (but not both) are allowed during this final examination period only in courses that do not give a final comprehensive examination. 2. Instructors are expected to return all work assigned no later than the last regular day of classes in courses for which there is a final examination. In cases when this is not possible, an answer key, solution sets or equivalent feedback should be provided unless the final examination will not cover material in work that has not been returned. 44",
      "17\n\nfairness and exemplary behavior represent the expectations for ethical behavior for all members of the Carnegie Mellon community. Policy Statement In any manner of presentation, it is the responsibility of each student to produce her/his own original academic work. Collaboration or assistance on academic work to be graded is not permitted unless explicitly authorized by the course instructor(s). Students may utilize the assistance provided by the Student Academic Success Center and the Academic Resource Center (CMU-Q) unless specifically prohibited by the course instructor(s). Any other sources of collaboration or assistance must be specifically authorized by the course instructor(s). In all academic work to be graded, the citation of all sources is required. When collaboration or assistance is permitted by the course instructor(s) or when a student utilizes the services provided by the Student Academic Success Center and the Academic Resource Center (CMU-Q), the acknowledgement of any collaboration or assistance is likewise required. This citation and acknowledgement must be incorporated into the work submitted and not separately or at a later point in time. Failure to do so is dishonest and is subject to disciplinary action. Instructors have a duty to communicate their expectations including those specific to collaboration, assistance, citation and acknowledgement within each course. Students likewise have a duty to ensure that they understand and abide by the standards that apply in any course or academic activity. In the absence of such understanding, it is the student\u2019s responsibility to seek additional information and clarification. Policy Violations Cheating occurs when a student avails her/himself of an unfair or disallowed advantage which includes but is not limited to: 1. Theft of or unauthorized access to an exam, answer key or other graded work from previous course offerings. 2. Use of an alternate, stand-in or proxy during an examination. 3.",
      "for Instructors Policy ........................................ 41 Examinations for Undergraduate Courses Policy ......................................................................... 42 Fair Use Policy ................................................................................................................................... 45 Final Examinations for Graduate Courses ..................................................................................... 50 Financial Aid Policy ........................................................................................................................... 50 Financial Obligations ........................................................................................................................ 52 Grading Policies ................................................................................................................................ 52 Handling Alleged Misconduct In Research Policy .......................................................................... 58 Human Subjects in Research Policy ................................................................................................ 62 Intellectual Property Policy .............................................................................................................."
    ],
    "answer": "Grade Option Request Form",
    "reference_answer": "A student must submit a Grade Option Request Form to Enrollment Services."
  },
  {
    "question": "Where are emotional support animals approved by the Office of Disability Resources not permitted on campus?",
    "context": [
      "3. Emotional support animals are only permitted in the approved student\u2019s private living space. Animals are not permitted in any public or common spaces within the residence facility, except as necessary to bring the animal into and out of the building as needed. Housing Services or the Office of Student Life may establish reasonable restrictions on how an emotional support animal is transported into and out of the building. 4. Emotional support animals approved by the Office of Disability Resources for university residence facilities are not permitted inside other campus buildings. See The Word. 5. Emotional support animals are not permitted in the private living spaces of other residents of the facility. 6. The student is responsible for any damages caused by the service animal or emotional support animal in the student\u2019s private living space or elsewhere. 7. The student is responsible for the behavior of the service animal or emotional support animals, even when the student is not present in the living space. 8. The student is responsible for providing appropriate care for the service animal or emotional support animal at all times, including the clean-up and disposal of any waste. Animal waste or bags containing animal waste cannot be placed in garbage chutes or common area trash cans. 9.",
      "Disability Options Network: https://www.doninc.org/\n\nDisability Options Network is an advocacy organization that focuses on advocacy around disability rights issues, as well as skills training, peer support, transitioning, and information and referral services. Disability Pride Pennsylvania\n\nDisability Pride Pennsylvania: https://www.disabilitypridepa.org/\n\nMore than just a means of self advocacy and a push for acceptance, Disability Pride is above all a celebration of inclusion and disabled people who are proud to be themselves! Disabilities Resources in the Community, UPMC\n\nDisabilities Resources in the Community, UPMC: https://www.upmc.com/patients-visitors/patient-info/disabilities-resource-center/community-resources\n\nUPMC\u2019s Disabilities Resource Center provides links to resources designed to help people with disabilities live independently and be active within the community. Disability Information and Access Line (DIAL)\n\nDisability Information and Access Line (DIAL): https://dial.acl.gov/home\n\nThe Disability Information and Access Line (DIAL) helps people with disabilities get connected to information about local community resources that support independent living. Down Syndrome Center at Children's Hospital of Pittsburgh\n\nDown Syndrome Center at Children's Hospital of Pittsburgh: https://www.chp.edu/our-services/down-syndrome\n\nThe Down Syndrome Center provides families with the tools they need to become educated and strong advocates for children and adolescents with Down syndrome. Friendship Circle\n\nFriendship Circle: https://www.fcpgh.org/\n\nFriendship Circle creates fun and innovative programs that enable youth and young adults of all abilities to be firmly connected in the community through friendships and relationships, access to wellness supports, and employment opportunities. In doing so, they develop active, empowered members and young leaders who strengthen both Friendship Circle and greater communities. HealthBridges",
      "182\n\n1. Any emotional support animal or service animal must be healthy and free of communicable disease. If appropriate for the animal, documentation of all veterinarian recommended vaccination must be provided to the Office of Disability Resources. New proof of vaccination must be provided before the previous proof of vaccination expires. 2. Dogs must be properly registered with the City of Pittsburgh. Registration documentation must be submitted annually to the Office of Disability Resources.",
      "For our visitors who are unable to ascend the steps, the video program shown at the Rockshelter is also available upon request in the accessible Visitor Center. In addition, an interactive kiosk in the Visitor Center allows visitors to virtually explore the archaeological excavation in great detail using GigaPan image technology. Wheelchairs: A limited number of manual wheelchairs are available to visitors on a first come, first served basis located in the Visitor Center. Support staff: Meadowcroft will grant free admission to any therapeutic staff support, counselor, doctor, therapist, or nurse that accompanies a visitor. Dogs are the only animals recognized as service animals by federal and state law. Service animals are individually trained to do work or perform tasks for people with disabilities and must be under control at all times by the owner. Service animals must be harnessed, leashed, or tethered, unless these devices interfere with the service animal\u2019s work or the individual\u2019s disability prevents using these devices. In that case, the individual must maintain control of the animal through voice, signal, or other effective controls. The owner of a service animal may be asked to remove the animal from the premises if they do not take effective action to control the animal. The Heinz History Center, Fort Pitt Museum, and the Meadowcroft Rockshelter and Historic Village abide by the Americans with Disabilities Act (ADA)\u202fdefinition of service animals. However, animals such as \u201ccomfort animals,\u201d \u201ctherapy animals,\u201d \u201ccompanion animals\u201d or \u201cemotional support animals\u201d are not service animals as defined by the ADA,\u202fbecause they are not trained to perform a specific task for an individual with a disability. Therefore, these animals are not permitted entry into our family of museums. ================================================================================\n\nURL: https://www.heinzhistorycenter.org/visit/fort-pitt\n\nTITLE: Fort Pitt Museum - Heinz History Center",
      "Peer Health Advocates Drop-In Hours. March 25, 2025. 5 - 7 p.m. Highmark Center for Health, Wellness and Athletics Lobby Repeats weekly (to Apr 23). Explore featured health topics with activities and reflection prompts, and connect with students certified to provide health and wellness support. Space is available for private conversations. Add to my calendar. Contact Info: Email Related Content: Peer Health Advocates (PHA) Website. Paws to Relax: Weekly Pet Therapy Program. April 9, 2025. 7 - 8 p.m. Well-being Lab (Room 104), Wellness & Meaning-Making Suite, First Floor, Highmark Center for Health, Wellness and Athletics Repeats weekly (to May 1). Volunteers through Animal Friend\u2019s Therapet program join us weekly on Wednesdays from 7-8 p.m. to offer some friendly dog companions for the hour. Take a break and join us! Add to my calendar. Contact Info: Name: Harsh Agarwal Email: hagarwa2@andrew.cmu.edu. Paws to Relax: Weekly Pet Therapy Program. March 26, 2025. 7 - 8 p.m. Well-being Lab (Room 104), Wellness & Meaning-Making Suite, First Floor, Highmark Center for Health, Wellness and Athletics Repeats weekly (to May 1). Volunteers through Animal Friend\u2019s Therapet program join us weekly on Wednesdays from 7-8 p.m. to offer some friendly dog companions for the hour. Take a break and join us! Add to my calendar. Contact Info: Name: Harsh Agarwal Email: hagarwa2@andrew.cmu.edu. CMU Drama Presents: The Dumb Waiter. March 28, 2025. 4 p.m. John Wells Video Studio, Purnell Center for the Arts. Wit, suspense and dark humor Two hitmen await their next assignment. Thrust into a claustrophobic basement, Ben and Gus must face a series of bizarre, increasingly urgent messages sent from a service lift. This gripping play is filled with sharp dialogue, masterfully combining suspense and dark humor. The Dumb Waiter is a story that teases the boundaries of power, trust and the absurdity of existence. By Harold Pinter Directed by Alon Moradi Performances March 26-28 Tickets are free and"
    ],
    "answer": "university residence facilities",
    "reference_answer": "Emotional support animals approved by the Office of Disability Resources are not permitted inside other campus buildings."
  },
  {
    "question": "What should users do if they believe someone has made unauthorized use of their account at Carnegie Mellon?",
    "context": [
      "reprimands, loss of computing privileges, course failures for students, disciplinary probation, suspension or dismissal from the university and/or criminal prosecution. Offenses that are minor or appear to be accidental in nature are often handled in a very informal manner such as through electronic mail. More serious offenses involve formal procedures pursued through the Division of Student Affairs for students, Human Resources and/or the hiring university department or administrative unit for staff, or the Faculty Review Committee for faculty. Restrictions of Privileges During Investigations During the course of an investigation of alleged inappropriate or unauthorized use, it may be necessary to temporarily suspend a user\u2019s network or computing privileges, but only after determining there is at least a prima facie case against the individual, as well as a risk to the university or its computing resources if privileges are not revoked. In these cases, it is important to recognize that the restriction of network or computing privileges is intended to protect the system rather than to punish the individual. For example, if a computer account has been used to launch an attack on another system, that account will be rendered inactive until the investigation is complete. This is a necessary action taken to prevent further misuse and does not presume that the account holder initiated the misuse. Unsubstantiated reports of abuse will not result in the suspension of accounts or network access unless sufficient evidence is provided to show that inappropriate activity occurred. For example, if someone reports that their computer was \u201cattacked\u201d by a Carnegie Mellon system, the burden will be upon the complainant to provide sufficient data logs or other evidence to show that the incident did, indeed at least appear to be an attack. Adverse Impact on Shared Systems The university reserves the right to discontinue communication with external systems that are known to harbor",
      "This responsibility begins with selecting a secure password, and involves maintaining the confidentiality of that password and changing the password regularly in order to assure the continued security of your account. For guidance in selecting a secure password, see Guidelines for Password Management. If you believe that someone has made unauthorized use of your account, you should change your password immediately and report the incident to the Information Security Office. Respect for Others\u2019 Property and Privacy Rights Users are responsible to respect copyright agreements and intellectual property ownership.",
      "Complaints If you believe the university has not complied with FERPA, you can file a complaint with the: Family Policy Compliance Office Department of Education 400 Maryland Avenue, S.W. Washington, DC 20202-4605 Note: Your Carnegie Mellon GUID (global user identification) number is also designated as directory information under FERPA, but does not contain personally identifiable information and therefore cannot be used by itself to determine your identity or to access your records. Student Return Policy Students on leave wishing to return to Carnegie Mellon to resume their degree studies may do so under several conditions. In order to be considered for return from leave, a student must first obtain an Application for Return form from The HUB or their academic department. This application requires information from the student regarding the intended\n\n95",
      "22\n\nCarnegie Mellon, should immediately notify the Information Security Office at iso- ir@andrew.cmu.edu. Maintain the Security and Confidentiality of your Account Users assume personal responsibility for the use made of their computer accounts.",
      "225\n\no Office for Institutional Equity and Title IX/Title IX Coordinator 4615 Forbes Avenue, Suite 330 Pittsburgh, PA 15213 \u2022 To report by phone or email: o Please call 412-268-7125 or email institutionalequity@cmu.edu \u2022 To report online, including anonymously: o Please go to cmu.ethicspoint.com or call 844-587-0793 \u2022 To report possible criminal conduct: o University Police Department 300 South Craig Street Pittsburgh, PA 15213 412-268-2323 campuspd@andrew.cmu.edu The university maintains a Resource Guide for individuals who file reports of Prohibited Conduct that provides information for community members about filing reports of Prohibited Conduct through the university\u2019s policies, support resources, community resources, and how to support a friend or family member who has been impacted by such conduct. Individuals who report Prohibited Conduct in Pennsylvania will also be informed of their rights as a victim of a crime under Pennsylvania law. A. How to Make a Report Any individual, including Complainants, Students, Faculty, Staff, or third parties are encouraged to submit reports of suspected Prohibited Conduct directly to the Office for Institutional Equity and Title IX in-person, via email, phone call, or online. Reports can also be made to the university officials listed in Section VIII who are designated with the authority to institute corrective measures. The university encourages all members of the Carnegie Mellon community to report to the Title IX Coordinator any information they learn about Prohibited Conduct. Sharing information of concern enables the university to offer support to impacted parties and protects the community from continuance of the alleged misconduct. Third parties should note that a report about possible Prohibited Conduct, including Federal Rule Sexual Misconduct, does not alone trigger a formal resolution process. Instead, as further explained\n\n226"
    ],
    "answer": "change your password immediately and report the incident to the Information Security Office",
    "reference_answer": "Users should change their password immediately and report the incident to the Information Security Office."
  },
  {
    "question": "During what hours is disruptive activity restricted on Saturday and Sunday?",
    "context": [
      "to 2 p.m., Saturday, Sunday 10 a.m. to 4 p.m.",
      "## Disruptive-Properties\n\nIn This Section\n\nThe Mayor\u2019s Office of Equal Protection enforces and ensures compliance with Chapter 670 of the City Code, the Disruptive Properties ordinance. Disruptive commercial properties threaten the health, safety, and welfare of the residents of the City of Pittsburgh and burden its public safety services. When owners repeatedly violate the law by permitting illegal activities onsite or failing to properly maintain their commercial properties, the City may take action against them. Such action is reserved for repeated, unabated offenses. A commercial property may be designated as Disruptive pursuant to Chapter 670 only after a single felony violation or at least three citations for disruptive activity. Neighbors disturbed by properties in disrepair are advised to contact the City\u2019s 3-1-1 Response Center to initiate a complaint. Designation as a Disruptive Property has serious consequences. The Public Safety Director is authorized to charge the property owner for all costs of law enforcement or public services called to a Disruptive Property. When a property violation remains unabated for an unreasonably long period of time, misdemeanor charges may also result. Abatement Plan Form: https://forms.office.com/g/vfMnkdMGa0\n\nLegislation (PDF,\u00a04MB): /files/assets/city/v/1/mayor/documents/disruptive-properties.pdf\n\nDisruptive Properties Department of Public Safety 414 Grant Street Pittsburgh, PA 15219 DisruptiveProperties@pittsburghpa.gov\n\nDisruptiveProperties@pittsburghpa.gov: mailto:DisruptiveProperties@pittsburghpa.gov\n\nCity of Pittsburgh 414 Grant St. Pittsburgh, PA 15219 (Accessibility entrance on Ross St.) View on Map 412-255-2621\n\n## Special-Event-Operations\n\nIn This Section",
      "Parking and deliveries will be prohibited on either side of E. Carson Street between 7 p.m.",
      "The week-long enforcement initiative will run nightly from Thursday, June 29 until Thursday, July\u00a06, 2023 to respond to fireworks-related calls and complaints.",
      "the building's Facility Coordinator. In addition to disciplinary action, student(s) found with common area furniture will be charged the standard hourly labor rate to return each piece to its proper location. Quiet Hours Quiet hours for all residential areas are 8 pm - 8 am on Sunday through Thursday nights, and Midnight - 9 am on Friday and Saturday nights. During finals week or reading days, 24-hour quiet hours will be in effect. For long vacation weekends, weekend hours will be"
    ],
    "answer": "10 a.m. to 4 p.m.",
    "reference_answer": "Disruptive activity is restricted on Saturday and Sunday before 7:00 a.m. and after 10:00 p.m."
  },
  {
    "question": "What is the name of the college at Carnegie Mellon University that offers programs in Biological Sciences, Chemistry, Mathematical Sciences, and Physics?",
    "context": [
      "Carnegie Mellon University homepage: https://www.cmu.edu\n\nNews: /news/\n\nStories: /news/stories\n\nCollege of Engineering: /news/stories/college-of-engineering\n\nCollege of Fine Arts: /news/stories/college-of-fine-arts\n\nDietrich College of Humanities & Social Sciences: /news/stories/dietrich-college-of-humanities-social-sciences\n\nHeinz College of Information Systems and Public Policy: /news/stories/heinz-college-of-information-systems-and-public-policy\n\nMellon College of Science: /news/stories/mellon-college-of-science\n\nSchool of Computer Science: /news/stories/school-of-computer-science\n\nTepper School of Business: /news/stories/tepper-school-of-business\n\nArchives: /news/stories/archives\n\n2025: /news/stories/archives/2025\n\nJanuary: /news/stories/archives/2025/january\n\nFebruary: /news/stories/archives/2025/february\n\nMarch: /news/stories/archives/2025/march\n\n2024: /news/stories/archives/2024\n\nJanuary: /news/stories/archives/2024/january\n\nFebruary: /news/stories/archives/2024/february\n\nMarch: /news/stories/archives/2024/march\n\nApril: /news/stories/archives/2024/april\n\nMay: /news/stories/archives/2024/may\n\nJune: /news/stories/archives/2024/june\n\nJuly: /news/stories/archives/2024/july\n\nAugust: /news/stories/archives/2024/august\n\nSeptember: /news/stories/archives/2024/september\n\nOctober: /news/stories/archives/2024/october\n\nNovember: /news/stories/archives/2024/november\n\nDecember: /news/stories/archives/2024/december\n\n2023: /news/stories/archives/2023\n\nJanuary: /news/stories/archives/2023/january\n\nFebruary: /news/stories/archives/2023/february\n\nMarch: /news/stories/archives/2023/march\n\nApril: /news/stories/archives/2023/april\n\nMay: /news/stories/archives/2023/may\n\nJune: /news/stories/archives/2023/june\n\nJuly: /news/stories/archives/2023/july\n\nAugust: /news/stories/archives/2023/august\n\nSeptember: /news/stories/archives/2023/september\n\nOctober: /news/stories/archives/2023/october\n\nNovember: /news/stories/archives/2023/november\n\nDecember: /news/stories/archives/2023/december",
      "the Heinz College, the Mellon College of Science and the Tepper School of Business.) \u2022 After the last day of classes: Permanent grades assigned by the instructor will be recorded. Student Parental Accommodation Protocols Providing holistic student support is a top priority at Carnegie Mellon. The protocols on this policy are designed to support the parental needs of students and their families. Students seeking any of the Parental Accommodations described below must register with the Office of the Dean of Student Affairs by contacting the office for an appointment by calling 412-268-2075. 88",
      "URL: https://carnegiemuseums.org/carnegie-science-center\n\nTITLE: Carnegie Science Center - Carnegie Museums of Pittsburgh\n\nCONTENT:\n\nCarnegie Science Center\n\nIf you want to go to the edge of the universe, make a splash, or a boom for your next event, think Carnegie Science Center. Our scenic North Shore location offers incredible city and Point views, convenient parking, awesome exhibits, and cool ideas for truly individual events.",
      "Total enrollment is about 7,700. In 1900 the industrialist Andrew Carnegie gave a gift of $1 million to the city of Pittsburgh for the creation of a technical school. Originally called Carnegie Technical Schools, it was renamed Carnegie Institute of Technology in 1912. The institute merged with the Mellon Institute (established in 1913 in Pittsburgh by financier Andrew W. Mellon) in 1967. The university has built a reputation as a vital arts centre, operating three art galleries, two concert halls, and two theatres. The faculty has included Nobel Prize-winning economists Herbert Alexander Simon and Merton Miller. University of Pittsburgh, coeducational state system of higher learning in Pennsylvania, U.S., comprising a main campus in Pittsburgh and branches in Bradford, Greensburg, Johnstown, and Titusville. The Pittsburgh campus is a comprehensive research institution of higher learning and includes 16 schools that offer more than 360 degree programs. Among these schools are those of Medicine, Dental Medicine, Law, Engineering, and Social Work.",
      "CARNEGIE MELLON UNIVERSITY ETHICS REPORTING HOTLINE TOLL FREE: 844-587-0793 Via the Internet: cmu.ethicspoint.com Reports of suspected violations submitted to this hotline may be made confidentially, and even anonymously, although the more information that is given, the easier it is to investigate the reports. Policy for Use of Carnegie Mellon University Trademarks Policy for the Use of Carnegie Mellon University Trademarks Carnegie Mellon University owns and controls its name(s), logos, insignias, seals, crests, designs, symbols and any other marks associated with the university (hereafter \u201cCarnegie Mellon trademarks\u201d or \u201ctrademarks\u201d). The purpose of this policy is to provide information and guidelines to the university community regarding the use of Carnegie Mellon's\n\n199"
    ],
    "answer": "Mellon College of Science",
    "reference_answer": "The name of the college is the Mellon College of Science."
  },
  {
    "question": "Who should a staff member report to if they believe their electronic data has been inappropriately accessed by another staff member?",
    "context": [
      "imply consent, and electronic access given to specific parties by the staff member will likewise imply consent for those parties to access permitted data. Emergencies may include, for example, but are not limited to, the death, incapacity or disappearance of the staff member, or the search for and examination of files used for apparently malicious activity in an account which endangers the integrity of shared computers, the network, or other aspects of the university\u2019s computing infrastructure. Only specifically designated individuals are permitted to determine what passes for an \u201cemergency.\u201d  Such individuals may be specifically designated, or may be designated by job position/description. All assignments for individuals or positions will be done by Provost or by a designate of the Provost. Whenever possible and legally permissible, notification must be given to the staff member whose data are subject to subpoena, search warrant, or order of court prior to compliance therewith. Information obtained from an examination warranted by an emergency will not be released to the public, or to the university community or to public officials, except as such releases are essential to resolution of the emergency, or constitute evidence of a crime concealment of which would obstruct justice, and in the latter case release may only be to appropriate law enforcement officials. Any such findings may be reported to the staff member\u2019s supervisor, department head, or to Human Resources for appropriate investigation and action. Any intrusion by an employee of the university into a staff member\u2019s electronic data must be reported to the staff member as soon as possible, and within five days of the event via electronic mail unless prohibited by order of court, or due to a continuance of an ongoing investigation by the University. Violation of any aspect of this policy is a sanctionable offense. When possible, staff members will be informed about the issuance of court orders, or other",
      "This responsibility begins with selecting a secure password, and involves maintaining the confidentiality of that password and changing the password regularly in order to assure the continued security of your account. For guidance in selecting a secure password, see Guidelines for Password Management. If you believe that someone has made unauthorized use of your account, you should change your password immediately and report the incident to the Information Security Office. Respect for Others\u2019 Property and Privacy Rights Users are responsible to respect copyright agreements and intellectual property ownership.",
      "Investigations will be conducted as confidentially as possible and related information will only be shared with others on a need-to-know basis. Those involved in such investigations are required to be truthful, accurate, and cooperative throughout the investigation process. Those who report misconduct are known as complainants. Those against whom a complaint is lodged are known as respondents. Complaints should be as detailed as possible and include a description of the complained of conduct, the names of all individuals involved as well as any witnesses, and the dates on which the complained of conduct occurred. If discrimination, harassment, or retaliation is substantiated, appropriate disciplinary action, up to and including suspension, expulsion, and/or termination of employment, will be taken. CMP may also report conduct to law enforcement, as appropriate. Initial Assessment\n\nThe Coordinator will conduct an initial assessment of any reported conduct. As part of the assessment, the Coordinator will, among other things: consider the expressed resolution preferences by the reporting party; assess the circumstances surrounding the alleged misconduct; address any immediate physical and emotional safety concerns; notify the reporting party of their right to contact law enforcement if warranted by the circumstances; provide the reporting party with information about the procedural options available under this policy; assess for pattern evidence by the respondent; and explain CMP\u2019s policy prohibiting retaliation. Following the initial assessment, the Coordinator will determine whether this policy is implicated and whether an informal or formal resolution is appropriate and articulate those conclusions to the complainant. CMP strives to assess, investigate, and resolve all reports of potential misconduct under this policy within sixty (60) days. Resolution and Investigation Procedures\n\nInformal Resolution",
      "of the university. These are individuals whose \u201cactual knowledge\u201d may be imputed to the university. ADVISOR: An individual who provides support and advice for the Complainant or Respondent. The Complainant and Respondent may have an Advisor of their choice, who may be, but is not required to be, an attorney. If either party does not have an Advisor present at the live hearing conducted under Section VI.C, the university will provide, without fee or charge to that party, a substitute Advisor of the university\u2019s choice who may be, but is not required to be, an attorney. In this event, the role of the Advisor provided by the university will be limited to the conducting of cross examination on behalf of the party that did not have an Advisor. COMPLAINANT: In most circumstances, Complainant means a person who is reported to have experienced Prohibited Conduct. The term Complainant also includes such individuals who file a Formal Complaint and who participates in a process undertaken by the university to address the report of Prohibited Conduct (including Federal Rule Sexual Misconduct). In some cases, a Complainant may be different than the person who initially reports information to the university. EMPLOYEE: person who is employed by the university to perform one or more of the following roles: regular instructional faculty, supplemental instructional faculty, research track faculty, visiting faculty, librarians, archivists, curators, graduate student instructors, graduate student staff assistants, graduate student research assistants, postdoctoral research fellows, and all regular and temporary staff. FACULTY/FACULTY MEMBER means all individuals who hold appointments on the tenure- track, research-track, teaching-track, librarian/archivist-track and special faculty track of the university, as well as individuals holding Emeritus Faculty status. FEDERAL RULE SEXUAL MISCONDUCT is a subset of Prohibited Conduct which meets the definition of Sexual Harassment in the Title",
      "policy is found, shall inform the Faculty Review Committee of the policy violation; and (iii) where appropriate, in the absence of the affected faculty member, to bring a grievance before the Faculty Review Committee. Violation of any aspect of this policy is a sanctionable offense. For purposes of this section, the term \u201cfaculty\u201d shall mean any person who is a member of the Faculty Organization as defined in Article III of the Constitution of the Faculty Organization. Access to Staff Data Electronic data on a staff member\u2019s account, whether stored on a computer in the staff member\u2019s office or elsewhere under the proprietary control of that staff member, may not be examined, i.e., the contents of the data read by a person, without the staff member\u2019s consent, except in cases of emergency, in response to a valid subpoena, search warrant, order of a court, or by specific request by the staff members\u2019 supervisor for the purpose of accessing work-related electronic data. Posting of data by a staff member on servers available to the public or to members of the university shall be understood to"
    ],
    "answer": "Information Security Office",
    "reference_answer": "The incident should be reported to Human Resources."
  },
  {
    "question": "Which NFL analyst did Dale and Matt interview on SNR Drive on February 25?",
    "context": [
      "Related Content\n\nWATCH: SNR Drive (March 6)\n\nDale Lolley and Matt Williamson talk about cap space, free agency ranking, Draft prospect rankings and more on SNR Drive on Thursday, March 6, 2025\n\nWATCH: SNR Drive (March 5)\n\nDale Lolley and Matt Williamson continue to discuss the Steelers' checklist ahead of Free Agency next week. In addition, Bob Labriola calls in, and our hosts break down the value proposition in letting players explore free agency, more from across the league and what the Steelers salary cap situation is like. WATCH: SNR Drive (March 3)\n\nRob King joins Matt Williamson to discuss how the Steelers could be preparing for Free Agency, as well as previewing tomorrow's mock draft, and sharing further thoughts on the 2025 rookie class after watching the NFL Combine, all on Monday, March 3rd's episode of SNR Drive. WATCH: SNR Drive (Best of Combine Week)\n\nA recap of the best conversations and moments from SNR Drive across each day of our 2025 Combine coverage\n\nWATCH: SNR Drive (Feb. 27)\n\nDale Lolley, Matt Williamson, and Max Starks talk about happened on day three of the 2025 NFL Scouting Combine\n\nWATCH: SNR Drive (Feb. 26)\n\nDale Lolley, Matt Williamson, and Max Starks talk about the Steelers defensive line and wide receivers, news from around the NFL and more on SNR Drive on Wednesday, February 26\n\nWATCH: SNR Drive (Feb. 25)\n\nFrom the 2025 NFL Scouting Combine: Dale Lolley and Matt Williamson sit down with NFL analyst Greg Cosell to discuss the 2025 draft class, and later on in the episode Dale and Matt react to GM Omar Khan's Press Conference and discuss what the Steelers should do at 21st overall in the draft. WATCH: SNR Drive (Feb. 21)\n\nDale Lolley and Matt Williamson evaluate each NFL team's 2022-2024 wins relative to their projected salary cap space for 2025, conduct a mock draft, and share their bold moves in free agency for the AFC and the NFC on Friday, February 21st's episode of SNR Drive. WATCH: SNR Drive (Feb. 20)",
      "JACK SIMS FROM MACOMB, MI: In the Jan.",
      "Both stations are owned by iHeartMedia . Games are also available on 51 radio stations in Pennsylvania , Western Maryland , Ohio , and Northern West Virginia . [ 218 ] The announcer is Tunch Ilkin . Craig Wolfley is the sideline reporter. Myron Cope , the longtime color analyst and inventor of the \" Terrible Towel \", retired after the 2004 season , and died in 2008. Longtime lead announcer Bill Hillgrove retired after the 2023 season . Pre-season games not shown on one of the national broadcasters are seen on CBS O&O KDKA-TV , channel 2; independent sister station WPKD-TV , channel 19; and AT&T SportsNet Pittsburgh . KDKA-TV's Bob Pompeani and former Steelers quarterback Charlie Batch do the announcing for the pre-season games, as well as the two hosting the pre-game program Steelers Kickoff during the regular season prior to the national airing of The NFL Today . Pompeani and former Steelers lineman Chris Hoke also host the Xfinity Xtra Point following the game on days when CBS does not have that week's NFL doubleheader. When CBS has a week's doubleheader, the show airs on WPKD-TV. Coach Mike Tomlin's weekly press conference is shown live on AT&T SportsNet Pittsburgh. Both Batch and Hoke replaced former Steelers lineman Edmund Nelson , who retired from broadcasting in 2015. [ 219 ] Thursday Night Football broadcasts are shown locally on Fox affiliate WPGH-TV , channel 53 (along with home games with NFC opponents and some flexed interconference games), while ESPN Monday Night Football broadcasts are shown locally on WTAE-TV , channel 4. (WTAE-TV is owned by the Hearst Corporation , which owns a 20% stake in ESPN.) By virtue of being members of the AFC, most of the Steelers' games air on CBS and KDKA. NBC Sunday Night Football games are carried by WPXI , channel 11, in the market. The Steelers hold a national contract with Grupo Imagen for radio rights to their games in Mexico; Imagen broadcasts the Steelers on their stations in 17 Mexican cities. Figures with",
      "\"Tape? Check. Senior Bowl? Check. Forty? Check.\"\n\nMitchell, 6-foot, 195 pounds, made plenty of similar such statements last season and at the Senior Bowl. \"A mixture of Marshon Lattimore and Darius Slay is what one evaluator told me,\" NFL Network analyst Charles Davis reported. Lattimore went 11th overall to the Saints in 2017. Slay was a second-round pick of the Lions (36th overall) in 2013. Jeremiah listed Mitchell as the 15th-best prospect available prior to the Combine. That might no longer apply. \"You start asking yourself, if you're a team that needs a corner and you're picking up there in the top 10, what's to keep you from taking him all the way up there?\" Jeremiah wondered aloud. \"He's literally done everything you can do. The athleticism is elite, the ball skills are elite, the competitiveness. \"He's an impressive dude.\"\n\nMitchell ran a second 40 at 4.38. The NFL Network simulcast his first 40 with Jets cornerback Sauce Gardner's 4.41 from 2022 for perspective. As the numbers would suggest, Mitchell comfortably prevailed in that graphics-generated matchup. NFL Network analyst Peter Schrager mentioned Mitchell had been asked about playing in the Mid-American Conference and replied he considered himself the best player in MAC history. \"So, no shortage of confidence there,\" Schrager noted.",
      "\"I like Arthur a lot, and we work well together. We have to resolve the quarterback situation, and once we get that resolved, we'll do our best to help surround that person with the right pieces to make Arthur's job a lot easier.\"\n\nThe NFL is considering changing the rules of overtime in the regular season. From 2017 to 2024, teams that won the opening coin toss of overtime won the game 56.8 percent of the time. That was up from 55.4 percent from 2001 through 2016. Dale Lolley is co-host of \"SNR Drive\" on Steelers Nation Radio. Subscribe to the podcast here: Apple Podcast | iHeart Podcast Pittonline@iheartmedia.com"
    ],
    "answer": "Greg Cosell",
    "reference_answer": "Greg Cosell"
  },
  {
    "question": "Who inspired Charlie and LaTasha Batch to give back and share lessons during Black History Month?",
    "context": [
      "URL: https://www.steelers.com/news/boykin-wants-to-carry-on-the-tradition\n\nCONTENT:\n\nBoykin wants to carry on the tradition\n\nSteelers.com\n\nIn celebration of Black History Month, we take the time to recognize and reflect on the thoughts and contributions of members of the Steelers organization. Today, receiver Miles Boykin shares why Black History Month is important to him and how hearing from those who came before him has inspired and touched him. There are lessons we all learn in life that come from so many sources, but for receiver Miles Boykin, when it comes to Black History Month, there is no greater source than his grandmother, Cornelia Brigmon. \"Black culture is such a part of American culture,\" said Boykin. \"I think we need to relay that to everybody and recognize its importance in the United States today. \"For me, listening to my grandma is one of the best ways to do it. My grandma would always tell me stories. She is turning close to 80-years old now, so she has some crazy stories. She was born during segregation. I can't even remember the whole specifics, but it was her mom or her grandmother who was born a slave and then they were eventually able to leave out of it. Just some of the stories that she tells me really makes me grateful for what I have today and grateful for those who came before me.\"",
      "Wilson-Batch proudly serves on multiple boards and is an active member with numerous organizations. She is on the Advisory Council for Robert Morris Sports Management, Advisory Council for the University of Pittsburgh Brain Institute, a Trustee at Carlow, a member of Leadership Pittsburgh, Family Advisor for the Football Players Health Study at Harvard University, Executive Committee for Off The Field Players Wives Association, and Ladies Council Liaison for the NFLPA. Oh, and just because it's worth sharing, in her free time, she makes the best mac and cheese you have ever tasted. While she is passionate about all of the above and pours her heart and soul into everything she does, there is nothing that touches her the way her role as Executive Director of the Best of the Batch Foundation does, a role she has embraced since 2002. The Best of the Batch Foundation was founded in 1999, fulfilling a promise Charlie Batch made after his younger sister, Danyl Settles, was shot and killed in 1996, in the crossfire between rival gangs in their Homestead neighborhood. Through the Best of the Batch Foundation, they have established themselves as true difference makers, people the community and region can depend on, to be there for the youth in particular to help give them a better future. The foundation has been serving the area now for 25 years and has been built into a force to serve others by the two. The Foundation was originally housed in a 5,300 square foot building in the Homestead area. Earlier this year, they opened a new 'Clubhouse,' a building that was originally planned for 21,000 square feet, but through additional development is now a state-of-the-art educational facility that is 33,000 square feet. The foundation's mission is to provide children in grades K-12 in Western Pennsylvania free programs focused on education, health and wellness, outreach services and more, with the majority of the activities taking place in the 'Clubhouse,' a welcoming, safe place",
      "Black in Bloom: Spring Community Day. Mar 15, 2025 , 12:00 pm - 3:00 pm. August Wilson African American Cultural Center 980 Liberty Ave Pittsburgh, PA 15222. Join us for \u201cBlack in Bloom\u201d Spring Community Day! Co-presented by UPMC/UPMC Health Plan and Citizens\u2019, this event highlights Black health, joy, and growth, while promoting wellness, empowerment, and connection. Bring your friends and family to explore our Spring Vendor Market, enjoy live DJ sets, experience performances from local artists, and discover a wealth of resources and activities for all ages. Step into Spring with us, celebrating the strength and resilience that surrounds us!. All ages are welcome\u2014don\u2019t miss this vibrant celebration of community and the spirit of Spring!. Community. EVENT WEBSITE: https://awaacc.org/event/black-in-bloom-spring-community-day/\n\nGuided Tour with Urban Academy \u2013 August Wilson: The Writer\u2019s Landscape. Mar 15, 2025 , 1:00 pm - 2:00 pm. August Wilson African American Cultural Center 980 Liberty Ave Pittsburgh, PA 15222. Experience the Enduring Legacy of August Wilson with Special Guided Tours Lead by Urban Academy K-5 Students. Step into the world of August Wilson through the eyes of the next generation of writers. We are thrilled to partner with Urban Academy\u2019s K-5 students to offer unique, guided tours of our immersive exhibition, August Wilson: The Writer\u2019s Landscape. Experience the life and legacy of the legendary playwright, while hearing firsthand stories and insights from these young, creative minds. Discover the power of storytelling and how Wilson\u2019s work continues to inspire and shape the future of theater. The exhibition has timed entry to ensure each guest has adequate time to experience the full impact of the exhibit.",
      "During Austin's senior year at Memphis, he was part of a group honored at the museum at the annual Black Men Crowned Awards, which honors Black males in the Memphis area for their leadership and accomplishments in different fields. Just knowing the history of the museum, being honored there moved Austin. \"That was very impactful for me,\" said Austin. \"Back then I didn't really see myself as somebody in the community that little kids, specifically young Black kids, could look up to. Being there and having kids talk to me, tell me they watched me at Memphis, and other things, it was very impactful. It made me reflect and know you're an example for people. I need to continue to put myself out there because by nature I'm kind of an introvert. But God blessed me with intelligence, and I know there are things I can do, and that encouraged me to continue to do them.\"\n\nAustin hopes that Dr. King's message, that his legacy, that his battle for all to be treated as one is something that never gets lost on today's youth. He knows how important it is for kids to continue to learn about it, whether it's in the classroom or through an educational and emotional trip to the museum. \"We're supposed to be one and united under God,\" said Austin. \"You don't want to stifle someone's legacy or a memory of them after they sacrificed so much, put their life on the line every day, to not teach the youth and not educate people on what he did. That would be a disservice or dishonor to what he stood for.",
      "She\u2019ll also share insights into the technical and creative process behind bringing these historic landmarks to life each year. Recorded Thursday, February 25\n\nZoom In: Types of Love\n\nLove comes in many forms. Explore what makes your heart beat as we celebrate the visual language of love. This virtual experience explores relationships between family, friends, spouses, lovers, and even pets and their humans through artworks from Carnegie Museum of Art\u2019s collection. Enjoy a close-up look at artworks and learn some of the stories they tell. We can\u2019t think of a better way to celebrate Valentine\u2019s Day, so grab a loved one, a furry friend, or just a decadent box of chocolates and zoom in on the details! Recorded Sunday, February 14\n\nBenjamin West, Venus Lamenting the Death of Adonis, 1768\n\nStanding Up for Change: African American Women and the Civil Rights Movement\n\nIn our latest virtual pairing, on two different days, we partner with the National Women\u2019s History Museum and Carnegie Science Center to celebrate stories of African American women and their incredible contributions to the Civil Rights and women\u2019s suffrage movements. On February 10, join Emma Rothberg, National Women\u2019s History Museum Predoctoral Fellow in Gender Studies, for a virtual walk-through of the museum\u2019s popular online exhibition Standing Up for Change: African American Women and the Civil Rights Movement. Through photographs and archival material, learn more about the grassroots leaders who challenged America to embrace justice and equality for all. Recorded Wednesday, February 10\n\nWarhol\u2019s Magic Purse: The Philanthropy of a Pop Art Icon"
    ],
    "answer": "Danyl Settles",
    "reference_answer": "The legacy and sacrifices of individuals who came before them inspired Charlie and LaTasha Batch to give back and share lessons during Black History Month."
  },
  {
    "question": "When did Gerald Alexander start working as a undergraduate assistant at Arkansas State?",
    "context": [
      "from Alcorn State University in 2012, and then earned his master's degree in education leadership from the University of Northern Colorado in 2017. Williams has also coached at Millsaps College, Clinton High School (Mississippi) and Sumner Hill Jr. High School (Mississippi). Club Links",
      "of members appointed\tTerm\t\t\t\tSchool of Computer Science\t1\t3 years\t\t\t\t\t\t\t\t\t\t\tDean\t\t\tNo. of members appointed\t\t\tTerm\t\t\t\t\t\t\t\t\t\t\t\t\t\t\t\t\t\tDietrich College\t\t\t1\t\t\t3 years 215\n\nalumnus/a, a Pittsburgh-based museum director, or the head of a regional arts organization), appointed for a term of two years. The PAC membership also shall include at least one member of the Design Review Committee (who can be one of the individuals named above) and the Artistic Properties Committee (who shall be the university librarian serving as the university archivist or other librarian designated by him/her).",
      "If you do not allow these cookies, you will experience less targeted advertising. Cookie List\n\nURL: https://www.steelers.com/team/coaches-roster/gerald-alexander\n\nCONTENT:\n\nGerald Alexander\n\nDefensive Backs Coach\n\nCollege: Boise State\n\nExperience: 6 years\n\nBiography",
      "JACK SIMS FROM MACOMB, MI: In the Jan.",
      "Check out our most recentEmployment & Internshiplistings andAuditioninformation."
    ],
    "answer": "2012",
    "reference_answer": "Alexander started working as a graduate assistant at Arkansas State in 2013."
  },
  {
    "question": "Which pitcher did the Pittsburgh Pirates sign to a minor league contract and invited to spring training on February 12, 2024?",
    "context": [
      "Description: OFTres Gonzalezassigned to Pittsburgh Pirates. Date: 02/24/24\n\nDescription: SSMike Jarvisassigned to Pittsburgh Pirates. Date: 02/20/24\n\nDescription: CFCanaan Smith-Njigbachanged number to 0. Date: 02/19/24\n\nDescription: Pittsburgh Pirates placed RHPJT Brubakeron the 60-day injured list. Date: 02/19/24\n\nDescription: Pittsburgh Pirates activated CFCanaan Smith-Njigba. Date: 02/19/24\n\nDescription: Pittsburgh Pirates claimed CFCanaan Smith-Njigbaoff waivers from Seattle Mariners. Date: 02/17/24\n\nDescription: Pittsburgh Pirates signed free agent RHPChase Andersonto a minor league contract and invited him to spring training. Date: 02/17/24\n\nDescription: RHPChase Andersonroster status changed by Pittsburgh Pirates. Date: 02/16/24\n\nDescription: Pittsburgh Pirates signed free agent RHPYeison Martinezto a minor league contract. Date: 02/14/24\n\nDescription: Pittsburgh Pirates signed free agent CYasmani Grandal. Date: 02/14/24\n\nDescription: Pittsburgh Pirates placed CEndy Rodr\u00edguezon the 60-day injured list. Right elbow surgery. Date: 02/14/24\n\nDescription: Pittsburgh Pirates placed RHPJohan Oviedoon the 60-day injured list. Tommy John surgery. Date: 02/14/24\n\nDescription: Pittsburgh Pirates signed free agent LHPJosh Fleming. Date: 02/12/24\n\nDescription: RHPWily Peraltaroster status changed by Pittsburgh Pirates.",
      "^ Jenifer Langosch (January 2, 2010). \"Bucs sign pair of Indian hurlers\" . Pittsburgh.pirates.mlb.com. Archived from the original on June 5, 2011 .",
      "instead re-creating the action in Pittsburgh after it came in over the teleprinter , usually an inning or so behind. After working solo for a decade, he was joined in the booth by Bob Prince in 1947; Prince would become the lead play-by-play man after Rowswell died in February 1955. [ 127 ] Prince's broadcasting style made him immensely popular with fans, and his almost 30-year run with the club coincided with the Pirates' rise to a championship-caliber team. [ 128 ] [ 129 ] Nicknamed \"The Gunner,\" Prince was known for his \"Gunnerisms\"\u2014nicknames and quips\u2014and created the Green Weenie in 1966. He also called the Pirates' championships in 1960 and 1971 as part of the national broadcast for NBC . Prince and his broadcast partner Nellie King were fired in 1975, which drew the ire of the Pirates' fanbase. Milo Hamilton and Lanny Frattare took over as the new broadcast team in 1976. Hamilton was unhappy in Pittsburgh; he didn't get along with Frattare and felt that he was being criticized for not being Bob Prince. [ 130 ] Hamilton left to join the Chicago Cubs after the 1979 season, and Frattare was elevated to the lead play-by-play announcer. Frattare would continue to call Pirate games through the 2008 season, becoming the longest tenured play-by-play man in team history. In turn, he was replaced by Tim Neverett , who called Pirate games from 2009 through 2015. [ 131 ] Former analysts include Don Hoak , Nelson Briles , and Jim Rooker . Former Pirate pitcher Steve Blass , who won Game 7 of the 1971 World Series, worked as a color analyst for the team from 1983 to 2019. [ 132 ] Figures with broadcasting resum\u00e9s [ edit ] Nellie Briles Steve Blass Joe Garagiola Ralph Kiner Bob Walk John Wehner See also [ edit ] Baseball portal Pittsburgh portal Pennsylvania portal List of Pittsburgh Pirates seasons Green Weenie References [ edit ] ^ \"Pirates Uniforms and Logos\" . Pirates.com . MLB Advanced Media . Retrieved June 22, 2019 . 1948: The team replaced the traditional blue and",
      "Lithuanian-born player to play in MLB, as a member of the Philadelphia Athletics, however, he grew up in Boston. [ 100 ] On April 26, 2017, the Pirates promoted South African Gift Ngoepe from the AAA Indianapolis Indians ; making him the first African-born player in MLB history. [ 101 ] On August 23, 2017, the Pirates became the first team in MLB history to break up a no-hitter in extra innings with a walk-off home run . The home run was hit by Josh Harrison in the tenth inning, off of pitcher Rich Hill , to give the Pirates a 1\u20130 win over the Los Angeles Dodgers . [ 102 ] Minor league affiliations [ edit ] Main article: List of Pittsburgh Pirates minor league affiliates The Pittsburgh Pirates farm system consists of seven minor league affiliates. [ 103 ] Class Team League Location Ballpark Affiliated Triple-A Indianapolis Indians International League Indianapolis, Indiana Victory Field 2005 Double-A Altoona Curve Eastern League Altoona, Pennsylvania Peoples Natural Gas Field 1999 High-A Greensboro Grasshoppers South Atlantic League Greensboro, North Carolina First National Bank Field 2019 Single-A Bradenton Marauders Florida State League Bradenton, Florida LECOM Park 2010 Rookie FCL Pirates Florida Complex League Bradenton, Florida Pirate City Complex 1969 DSL Pirates Black Dominican Summer League Boca Chica , Santo Domingo Pirates Academy 2018 DSL Pirates Gold Civil rights advocacy [ edit ] Throughout the 1940s Pirates owner William Benswanger was a leading advocate of integration of the Major Leagues, once planning a tryout for African American players to sign up for the club. [ 104 ] The Pirates organization was the first in baseball to have both an African-American coach and manager, when Gene Baker broke the color line in 1961 and 1962 respectively. On September 21, 1963, the Pirates were the first MLB team to have an African-American manager in Gene Baker, as he filled in for Danny Murtaugh. [ 105 ] On September 1, 1971, manager Murtaugh assembled a starting",
      "The teams played six games in 2020 as MLB instituted an abbreviated schedule focusing on regional match-ups. Beginning in 2023, the teams will play a three-game series each season as a result of the new \"balanced\" schedule. The Pirates lead the series 21\u201318. [ 64 ] Roster [ edit ] Pittsburgh Pirates 2025 spring training roster v t e 40-man roster Non-roster invitees Coaches/Other Pitchers 67 Braxton Ashcraft 51 David Bednar 53 Mike Burrows 6 Bailey Falter 64 Caleb Ferguson 0 Andrew Heaney 35 Colin Holderman 37 Jared Jones 23 Mitch Keller -- Justin Lawrence 18 Tim Mayza 50 Carmen Mlodzinski 66 Kyle Nicolas 60 Dennis Santana 84 Chase Shugart 30 Paul Skenes 44 Peter Strzelecki 34 Joey Wentz Catchers 14 Joey Bart 32 Henry Davis 55 Jason Delay 5 Endy Rodr\u00edguez Infielders 71 Tsung-Che Cheng 25 Billy Cook 15 Oneil Cruz 26 Adam Frazier 39 Nick Gonzales 13 Ke'Bryan Hayes 2 Spencer Horwitz 7 Isiah Kiner-Falefa 31 Liover Peguero 19 Jared Triolo 48 Enmanuel Valdez 38 Nick Yorke Outfielders 3 Ji-hwan Bae 22 Andrew McCutchen 77 Joshua Palacios 28 Tommy Pham 10 Bryan Reynolds 65 Jack Suwinski Pitchers 89 Hunter Barco 43 Ryan Borucki 57 Bubba Chandler 41 Carson Fulmer 78 Thomas Harrington 61 Isaac Mattson 27 Tanner Rainey 49 Yohan Ram\u00edrez 68 Yerry Rodr\u00edguez 80 Ryder Ryan 54 Burch Smith 75 Anthony Solometo 63 Hunter Stratton 79 Sean Sullivan 70 Eddy Yean Catchers 91 Omar Alfonzo 73 Abrahan Gutierrez 92 Aaron McKeithan Infielders 83 Jack Brannigan 85 Konnor Griffin 45 Darick Hall 81 Termarr Johnson 74 Malcom N\u00fa\u00f1ez 72 Alika Williams Outfielders 76 Matt Gorski 59 Bryce Johnson 46 Nick Solak 29 DJ Stewart Manager 17 Derek Shelton Coaches 16 Tarrik Brock (first base) 82 Jordan Comadena (bullpen catcher) 86 Radley Haddad (game planning/strategy) 12 Don Kelly (bench) 90 Raul Hernandez (bullpen catcher) 96 Mendy L\u00f3pez (infield) 47 Oscar Marin (pitching) 88 Christian Marrero (assistant hitting) 95 Stephen Morales (coach / translator) 87 Miguel P\u00e9rez (bullpen) 58 Mike Rabelo (third base) 56"
    ],
    "answer": "Chase Anderson",
    "reference_answer": "Wily Peralta"
  },
  {
    "question": "Who is a sleeper pick for the third-down/complementary back role in the NFL Draft?",
    "context": [
      "5. Luther Burden III, Missouri, 6-0, 206 lbs. - Burden ran a 4.41 40-yard dash at the NFL Scouting Combine in Indianapolis. That isn't \"Golden fast\" but it's fast enough for Burden to excel as a run-after-the-catch wide receiver and as one who is capable of taking the top off of a defense. Sleeper: Savion Williams, TCU, 6-4, 222 lbs. - He won't sleep long and he won't hit snooze. Not with the \"Wildcat QB\" component Williams will bring to his eventual NFL team. Williams caught  60 passes for 611 yards and six touchdowns in 2024. He also carried 51 times for 322 yards and six more scores. His NFL comparison in the eyes of some is Cordarrelle Patterson. Are you not entertained? Related Content\n\nTriple Take: Ranking the top TEs in the draft\n\nTight end position deep, talented in 2025 NFL Draft\n\nTriple Take: Ranking the top 2025 RBs in the Draft\n\nAshton Jeanty headlines what appears to be a deep and talented class of running backs\n\nTriple Take: Ranking the top 2025 QBs in the Draft\n\nTop quarterback not disputed, but there are disagreements over No. 2\n\nClub Links\n\nNFL Clubs\n\nMore NFL Sites\n\n\u00a9 2025 Pittsburgh Steelers. All Rights Reserved\n\nYour Privacy Choices\n\nStrictly Necessary\n\nPerformance\n\nFunctional\n\nTargeting\n\nIn order to provide you with free high-quality content that you love to watch and offers that are more relevant to you, the National Football League collects and shares certain personal information. Because we respect your privacy, we also provide you choices with respect to your personal information.",
      "CONTENT:\n\nDefensive line takes center stage at NFL Scouting Combine\n\nINDIANAPOLIS - One of the conundrums faced by teams when it comes to drafting defensive tackles is if the player is really good at stopping the run, can he also give a team enough as a pass rusher to now allow himself to be taken out of a game? For example, as good as former Steelers nose tackle Casey Hampton was against the run, opponents could dictate how much he played in a game simply by going to three wide receiver sets and forcing the Steelers to match their wide receivers on the field with a nickel defense. Finding a nose tackle who also has pass rushing ability is key. The Steelers had that in Javon Hargrove, whom they selected in the third round of the 2016 NFL Draft. They feel they could have that in 2023 second-round draft pick Keeanu Benton, who has manned the team's nose tackle position the past two seasons. But adding another player to that equation who might allow Benton to perhaps become a defensive end and not be forced to play nose tackle could be something in which the Steelers are interested in accomplishing in the 2025 NFL Draft. Fortunately, this particular draft has a number of players who might offer that prospect. \"This is a really good draft for the defensive line,\" Steelers general manager Omar Khan said. And topping the list of players who might step in and make an immediate impact for the Steelers is Michigan defensive tackle Kenneth Grant. A 6-foot-3, 342-pound defensive lineman, Grant offers the flexibility to have the size and run-stuffing ability to be a true nose tackle, while also offering enough athleticism to rush the passer situationally. Grant had 6.5 sacks the past two seasons for the Wolverines. \"I'm a 3-down player for sure,\" Grant said here Wednesday at the NFL Scouting Combine. \"I can rush the passer with my strength and a little bit of finesse in there. Most guys think I'm just a run-stopper, but I'm super athletic and can rush the passer.\"",
      "That being said, there could be some surprises, as we'll see good players at the position taken in Rounds 3 and 4. The wildcard will be Colorado's Travis Hunter. I, however, view him as a cornerback prospect who will play wide receiver as a secondary position. Dale's Rankings\n\n1. Tetairoa McMillan, Arizona, 6-4 1/8, 219 lbs. - A big receiver with good ball skills, McMillan was extremely productive, posting over 80 catches and 1,300 yards in each of the past two seasons, winning as a size mismatch. Will that translate to the NFL against bigger, more physically gifted receivers? We'll see. He has good run-after-the-catch ability but isn't necessarily a blazer. There's definitely a tantalizing skillset here.",
      "Triple Take: Ranking the top WRs in the draft\n\nThe Triple Take crew dives into a talented group of pass catchers in the 2025 NFL Draft\n\n5 for Friday: Can Steelers improve more than rest of division? The Steelers ready to enter free agency in great cap shape\n\nBaking with Beanie\n\nBeanie Bishop is mixing things up with a fun off-the-field hobby\n\nClub Links\n\nNFL Clubs\n\nMore NFL Sites\n\n\u00a9 2025 Pittsburgh Steelers. All Rights Reserved\n\nYour Privacy Choices\n\nStrictly Necessary\n\nPerformance\n\nFunctional\n\nTargeting\n\nIn order to provide you with free high-quality content that you love to watch and offers that are more relevant to you, the National Football League collects and shares certain personal information. Because we respect your privacy, we also provide you choices with respect to your personal information.",
      "2. Omarion Hampton, North Carolina, * 5-11 3/4, 221 lbs. - Hampton is a big back with great bit play abilities as both a runner and receiver who runs away from defenders in the open field. This is a very physical downhill runner that delivers an awful lot of contact. His pass protection skills could use more work and Hampton isn't the shiftiest guy in this class, but he projects as a feature back at the next level. 3. TreVeyon Henderson, Ohio State, 5-10 1/8, 202 lbs. - Henderson was fantastic in the college playoffs this season and is a big play waiting to happen every time he touches the football. While he probably doesn't project to a high-carry workhorse role in the league, Henderson will give his new team an immediate jolt. Henderson has good size for a back with his dynamism while also excelling in pass protection. 4. Kaleb Johnson, Iowa, 6-1, 224 lbs. - Johnson is coming off a big season for the Hawkeyes. He is extremely well built but can run a little bit high at times. Johnson has very good vision and patience and is best suited for a predominantly zone scheme. He is somewhat of a linear athlete, but Johnson has very good long speed for a back his size. 5. Quinshon Judkins, Ohio State, 5-11 5/8, 221 lbs. - Judkins and Henderson made for an outstanding one two punch in the National Champions backfield this season with their complementary styles. Judkins is much more of a banger than Henderson with great aggression but isn't in Henderson's realm in terms of breakaway speed. Sleeper: Jordan James, Oregon, 5-9 1/2, 205 lbs. - Oregon is a major college football program so it isn't like their top running back is a true sleeper that would fall through the cracks. But James backed up Bucky Irving (who went on to have an exceptional rookie season) a year ago, making James just a one-year starter and therefore, doesn't have as many carries at the college level as many of these prospects. James has excellent vision and contact balance but is somewhat limited thus far"
    ],
    "answer": "Jordan James",
    "reference_answer": "Woody Marks."
  },
  {
    "question": "When is the deadline for clubs to exercise their right of first refusal to restricted free agents who signed offer sheets?",
    "context": [
      "Contract Advisor (\"unrepresented player\") is permitted to communicate directly with a new club's front office officials (excluding the head coach and other members of the club's coaching staff) regarding contract negotiations. The club is responsible for confirming the player's status as an unrepresented player. No prospective unrestricted free agent is permitted to execute a contract with a new club until 4:00 p.m., New York time, on March 12. March 12 - The 2025 League Year and free agency signing period begin at 4:00 p.m., New York time. Trading period for 2025 begins at 4:00 p.m., New York time, after expiration of all 2024 contracts. The first day of the 2025 League Year will end at 11:59:59 p.m., New York time, on March 12. Clubs will receive a personnel notice that will include all transactions submitted to the league office during the period between 4:00 p.m., New York time, and 11:59:59 p.m., New York time, on March 12. March 30-April 2 - Annual League Meeting, Palm Beach, Florida. April 7 - Clubs that hired a new head coach after the end of the 2024 regular season may begin offseason workout programs. April 16 - Deadline for clubs to time, test, visit, interview or conduct a physical examination with a draft-eligible player at its club facility. April 18 - Deadline for restricted free agents to sign offer sheets. April 21 - Clubs with returning head coaches may begin offseason workout programs. April 23 - Deadline for prior club to exercise right of first refusal to restricted free agents who signed offer sheets. Deadline for clubs to time, test, visit, interview (including video and phone calls) or conduct a physical examination with a draft-eligible player at any location. April 24-26 - NFL Draft, Green Bay, Wisconsin. May 1 Deadline for clubs to exercise Fifth-Year Option for players selected in the first round of the 2022 Draft. May 2-5 or May 9-12 - Clubs may elect to hold their one three-day post-Draft rookie minicamp from Friday through Sunday or",
      "September 09/25: Signed CB C.",
      "At 4:00 p.m. ET on Wednesday, March 12. Q. When is the two-day negotiating period for potential unrestricted free agents? A.",
      "a restricted free agent and an unrestricted free agent? A. In the 2025 league year, players with three accrued seasons who have received a qualifying offer become restricted free agents when their contracts expire at the conclusion of the 2024 league year on March 12. Unrestricted free agents have completed four or more accrued seasons. Upon expiration of his 2024 contract, an unrestricted free agent is free to sign with any club with no draft-choice compensation owed to his old club. Q. What constitutes an \"accrued season\"? A. Six or more regular season games on a club's active/inactive, reserve/injured or reserve/physically unable to perform lists. Q. How do the free agency rules apply to restricted free agents? A. If a player with three accrued seasons has received a \"qualifying offer\" (a salary tender predetermined by the Collective Bargaining Agreement between the league and its players) from his old club, he can negotiate with any club through April 19. If the restricted free agent signs an offer sheet with a new club, his old club can match the offer and retain him because the qualifying offer entitles it to a \"right of first refusal\" on any offer sheet the player signs. If the old club does not match the offer, it may receive draft-choice compensation depending on the amount of its qualifying offer. If an offer sheet is not executed on or before April 18, the player's negotiating rights revert exclusively to his old club. In addition, prior to the start of free agency a player who would otherwise be a restricted free agent may be designated by his old club as its franchise player or transition player. Q. What are the right of first refusal/qualifying offer amounts for players who have completed three accrued seasons? A. For right of first refusal only, a one-year salary of at least $3,263,000. For right of first refusal and compensation at the player's original draft round, a one-year salary of at least $3,406,000 or 110 percent of the 2024 Paragraph 5",
      "the right to decide whether or not to spend your hard-earned money on the product. Beyond that, I'm sorry but fans don't deserve to be involved/polled in the franchise's decisions. MARK RICE FROM LAS VEGAS, NV: If the Steelers are interested in re-signing Russell Wilson, or Justin Fields, what is taking this long to sign one of them? ANSWER: Taking so long? You're talking about contracts that will end up being multi-year, multi-million-dollar deals. Taking so long? Seriously? The Steelers have exclusive negotiating rights with all of its own players until the start of the legal tampering period, which is on March 10. Today is Feb."
    ],
    "answer": "April 23",
    "reference_answer": "April 23."
  },
  {
    "question": "Who were the first three Pittsburgh Steelers players inducted into the Pro Football Hall of Fame?",
    "context": [
      "following Steelers were named to NFL All-Decade Teams (and 75th and 100th Anniversary All-Time Teams, selected in 1994 and 2019, respectively). Only those who spent time with Pittsburgh during the respective decades are listed. Bold indicates those elected to the Pro Football Hall of Fame. NFL 1930s All-Decade Team No. Player Position Tenure 15 Johnny \"Blood\" McNally HB 1934, 1937\u201338 NFL 1940s All-Decade Team No. Player Position Tenure 35 Bill Dudley HB 1942, 1945\u201346 76 Bucko Kilroy T 1943 79 Vic Sears T 1943 70 Al Wistert T 1943 NFL 1950s All-Decade Team No. Player Position Tenure 22 Bobby Layne QB 1958\u201362 70 Ernie Stautner DT 1950\u201363 80 Jack Butler DB 1951\u201359 NFL 1960s All-Decade Team No. Player Position Tenure No players selected NFL 1970s All-Decade Team No. Player Position Tenure 12 Terry Bradshaw QB 1970\u201383 32 Franco Harris RB 1972\u201383 88 Lynn Swann WR 1974\u201382 52 Mike Webster C 1974\u201388 68 L. C. Greenwood DE 1969\u201381 75 Joe Greene DT 1969\u201381 58 Jack Lambert MLB 1974\u201384 59 Jack Ham OLB 1971\u201382 Chuck Noll Coach 1969\u201391 NFL 1980s All-Decade Team No. Player Position Tenure 52 Mike Webster C 1974\u201388 58 Jack Lambert MLB 1974\u201384 47 Mel Blount CB 1970\u201383 1 Gary Anderson K 1982\u201394 Chuck Noll Coach 1969\u201391 NFL 75th Anniversary All-Time Team No. Player Position Tenure 14 Johnny Unitas QB 1955 36 Marion Motley FB 1955 52 Mike Webster C 1974\u201388 75 Joe Greene DT 1969\u201381 58 Jack Lambert LB 1974\u201384 59 Jack Ham LB 1971\u201382 47 Mel Blount CB 1970\u201383 26 Rod Woodson CB 1987\u201396 NFL 1990s All-Decade Team No. Player Position Tenure 63 Dermontti Dawson C 1988\u20132000 91 Kevin Greene LB 1993\u201395 54 Hardy Nickerson LB 1987\u201392 99 Levon Kirkland LB 1992\u20132000 26 Rod Woodson CB 1987\u201396 37 Carnell Lake S 1989\u201398 1 Gary Anderson K 1982\u201394 NFL 2000s All-Decade Team No. Player Position Tenure 66 Alan Faneca G 1998\u20132007 55 Joey Porter LB 1999\u20132006 43 Troy Polamalu S 2003\u201314 NFL 100th Anniversary All-Time Team No. Player Position Tenure 14 Johnny Unitas QB 1955 36 Marion Motley RB 1955 52 Mike Webster C",
      "Pittsburgh Steelers wide receiver George Pickens (14) catches a pass during a regular season game between the Pittsburgh Steelers and the Baltimore Ravens, Sunday, Nov. 17, 2024 in Pittsburgh, PA. The Steelers defeated the Ravens 18-16. (Karl Roser / Pittsburgh Steelers)\n\nPittsburgh Steelers tight end Pat Freiermuth (88) scores a touchdown during a regular season game between the Pittsburgh Steelers and the Washington Commanders, Sunday, Nov. 10, 2024 in Landover, MD. The Steelers defeated the Commanders 28-27. (Jared Wickerham / Pittsburgh Steelers)\n\nPittsburgh Steelers tight end Pat Freiermuth (88) scores a touchdown during a regular season game between the Pittsburgh Steelers and the Philadelphia Eagles, Sunday, Dec. 15, 2024 in Philadelphia, PA. The Eagles beat the Steelers 27-13. (Taylor Ollason / Pittsburgh Steelers)\n\nPittsburgh Steelers tight end Pat Freiermuth (88) catches a pass during a regular season game between the Pittsburgh Steelers and the New York Jets, Sunday, Oct. 20, 2024 in Pittsburgh, PA. The Steelers defeated the Jets 37-15. (Karl Roser / Pittsburgh Steelers)\n\nPittsburgh Steelers safety Minkah Fitzpatrick (39) intercpets a pass during a regular season game between the Pittsburgh Steelers and the Baltimore Ravens, Saturday, Dec. 21, 2024 in Baltimore, MD. The Ravens beat the Steelers 34-17. (Jared Wickerham / Pittsburgh Steelers)\n\nPittsburgh Steelers quarterback Russell Wilson (3) leads the Steelers tight ends, wide receivers and centers out of the tunnel prior to a regular season game between the Pittsburgh Steelers and the Baltimore Ravens, Sunday, Nov. 17, 2024 in Pittsburgh, PA. The Steelers defeated the Ravens 18-16. (Karl Roser / Pittsburgh Steelers)",
      "Retrieved June 3, 2013 . ^ \"Bobby Layne \u2013 Pro Football Hall of Fame Official Site\" . www.profootballhof.com . Archived from the original on April 17, 2008 . Retrieved April 21, 2008 . ^ \"Marion Motley \u2013 Pro Football Hall of Fame Official Site\" . www.profootballhof.com . Archived from the original on May 5, 2008 . Retrieved April 21, 2008 . ^ \"Johnny Unitas \u2013 Pro Football Hall of Fame Official Site\" . www.profootballhof.com . Archived from the original on April 29, 2016 . Retrieved April 28, 2016 . ^ \"Len Dawson \u2013 Pro Football Hall of Fame Official Site\" . www.profootballhof.com . Archived from the original on July 16, 2013 . Retrieved June 3, 2013 . ^ \"Jim Finks \u2013 Pro Football Hall of Fame Official Site\" . www.profootballhof.com . Archived from the original on January 2, 2014 . Retrieved June 3, 2013 . ^ \"Pro Football Hall of Fame's Class of 2016 Announced \u2013 General \u2013 News \u2013 Pro Football Hall of Fame Official Site\" . www.profootballhof.com . Archived from the original on February 7, 2016 . Retrieved February 7, 2016 . ^ \"Bert Bell \u2013 Pro Football Hall of Fame Official Site\" . www.profootballhof.com . Archived from the original on April 22, 2009 .",
      "Pittsburgh Steelers Hall of Famers\n\nA look at the City of Champions' recent honors with Hall of Fame enshrinements and retired numbers. Ultimate Steelers Gameweek Guide Steelers Nation! In Pittsburgh for the big game? We've got the scoop on how to enjoy the ultimate sports city! Details: https://www.visitpittsburgh.com/blog/guide-to-football-in-pittsburgh/\n\nUltimate Steelers Gameweek Guide\n\nSteelers Nation! In Pittsburgh for the big game? We've got the scoop on how to enjoy the ultimate sports city! Steelers Nation, Here We\u00a0Go! Let's celebrate the Pittsburgh Steelers  \u2013 here and around the\u00a0world. Eating Your Way Through Pittsburgh Sports \u200bExperience Pittsburgh\u2019s food scene through our local sports scene Details: https://www.visitpittsburgh.com/blog/eating-your-way-through-pittsburgh-sports/\n\nEating Your Way Through Pittsburgh Sports\n\n\u200bExperience Pittsburgh\u2019s food scene through our local sports scene\n\nPittsburgh Penguins 1001 Fifth Ave., PPG Paints Arena Pittsburgh, Pennsylvania 15219\n\nOpen in Google Maps: http://maps.google.com/?q=1001%20Fifth%20Ave.%2C%20PPG%20Paints%20Arena%0APittsburgh%2C%20Pennsylvania%2015219%0A\n\n(412) 642-7367: tel:+1-412-642-7367\n\nWebsite: http://www.pittsburghpenguins.com\n\nPittsburgh Pirates at PNC Park 115 Federal St., PNC Park at the North Shore Pittsburgh, Pennsylvania 15212\n\nMuseums\n\nFrom history, art, science, sports and more, Pittsburgh museums offer much to be explored. ## holiday-photos-in-pittsburgh\n\nKick off the holiday season with a family photo in your favorite city! Pittsburgh is beautiful all year long and especially during the holidays. Celebrate the season and share your love for Pittsburgh with picture-perfect holiday photos at these iconic locations. Whether you just want family photos to go on the Christmas card, are looking to create content as a TikTok influencer or anything in between, here's where to go in Pittsburgh:",
      "Retrieved July 28, 2018 . ^ Jump up to: a b c d e Varley, Teresa (July 27, 2019). \"Four legends selected to Hall of Honor\" . Pittsburgh Steelers. Archived from the original on July 27, 2019 ."
    ],
    "answer": "Johnny \"Blood\" McNally HB 1934, 1937\u201338",
    "reference_answer": "John McNally, Art Rooney Sr. and Bobby Layne were the first three Pittsburgh Steelers players inducted into the Pro Football Hall of Fame."
  },
  {
    "question": "Who is the current running backs coach for the Pittsburgh Steelers?",
    "context": [
      "current coach is Mike Tomlin . [ 216 ] Current staff Pittsburgh Steelers staff v t e Front office Owner/president \u2013 Art Rooney II Vice president \u2013 Art Rooney Jr. Vice president of player personnel \u2013 Dan Rooney Jr. General manager \u2013 Omar Khan Assistant general manager \u2013 Andy Weidl Director of player scouting \u2013 Mark Sadowski Assistant director of player scouting \u2013 Max Gruder Director of college scouting \u2013 Dan Colbert Director of pro scouting \u2013 Sheldon White Director of football administration \u2013 Cole Marcoux Director of player development \u2013 Darrel Young Head coaches Head coach \u2013 Mike Tomlin Offensive coaches Offensive coordinator \u2013 Arthur Smith Quarterbacks \u2013 Tom Arth Running backs \u2013 Eddie Faulkner Wide receivers \u2013 Zach Azzanni Tight ends \u2013 Alfredo Roberts Offensive line \u2013 Pat Meyer Assistant offensive line \u2013 Isaac Williams Senior offensive assistant \u2013 Mike Sullivan Offensive assistant \u2013 Matt Baker Offensive assistant \u2013 Mateo Kambui Defensive coaches Defensive coordinator \u2013 Teryl Austin Defensive line \u2013 Karl Dunbar Outside linebackers \u2013 Denzel Martin Inside linebackers \u2013 Scott McCurley Defensive backs \u2013 Gerald Alexander Assistant secondary \u2013 Anthony Midget Defensive quality control \u2013 Jason Brooks Special teams coaches Special teams coordinator \u2013 Danny Smith Strength and conditioning Head strength and conditioning \u2013 Phil Matusz Assistant strength and conditioning \u2013 Justus Galac Senior conditioning coordinator \u2013 Garrett Giemont Sports science coordinator \u2013 Roderick Moore \u2192 Coaching staff \u2192 Front office \u2192 More NFL staffs Offensive coordinator history Source: [ 217 ] Years Name 2024\u2013present Arthur Smith 2023 Eddie Faulkner (interim) 2021\u20132023 Matt Canada 2018\u20132020 Randy Fichtner 2012\u20132017 Todd Haley 2007\u20132011 Bruce Arians 2004\u20132006 Ken Whisenhunt 2001\u20132003 Mike Mularkey 1999\u20132000 Kevin Gilbride 1998 Ray Sherman 1996\u20131997 Chan Gailey 1992\u20131995 Ron Erhardt 1990\u20131991 Joe Walton 1983\u20131989 Tom Moore Defensive coordinator history Source: [ 217 ] Years Name 2022\u2013present Teryl",
      "Arthur Smith, previous head coach for the Atlanta Falcons for three years (2021-23),  is in his \ufb01rst season as the Steelers' o\ufb00ensive coordinator in 2024. This marks his 16th year in the National Football League coaching ranks. Under Smith's guidance, the Falcons led the NFL in fewest penalties (2022), ranked third in successful play rate on rushing attempts, based on EPA, (2022), \ufb01nished third in rushing yards/game (2022), ninth in rushing yards/game (2023), 10th in third-down conversion rate (2022), 13th in third-down conversion rate (2023) and 13th in passing yards/attempt (2023). Atlanta eclipsed 400 total yards of o\ufb00ense on six occasions in 2023, tied for the fourth-most in single-season franchise history. The Falcons and Miami were the only teams in the NFL to \ufb01nish the season with a top-10 rushing attack and a top-\ufb01ve opponent pressure rate. Bijan Robinson \ufb01nished the season second among rookies with 1,463 yards from scrimmage. He recorded the most yards from scrimmage by a rookie in franchise history (1,463) and led all NFL rookies with 976 rushing yards, while adding 487 receiving yards and eight TDs (four rushing, four receiving). Robinson set the franchise record for most receptions by a rookie running back (58) and became the \ufb01fth rookie running back in League history to record at least 1,400 yards from scrimmage, 55 receptions and four receiving TDs. He also registered the most games with 100 yards from scrimmage by a rookie in franchise history (six). Kyle Pitts (667) and Jonnu Smith (582) are the \ufb01rst pair of tight ends to both have 500+ receiving yards in the same season since Zach Ertz (916) and Dallas Goedert (607) in 2019 with Philadelphia. Atlanta's rushing attack averaged 74.5 more rushing yards per game in 2022 than it did in 2021, resulting in the largest one-season improvement by any team since at least 2001. Additionally, Tyler Allgeier became the sixth rookie in the NFL, selected in the \ufb01fth round-or-later, to eclipse 1,000 rushing yards",
      "URL: https://www.steelers.com/team/coaches-roster/alfredo-roberts\n\nCONTENT:\n\nAlfredo Roberts\n\nTight Ends Coach\n\nCollege: University of Miami\n\nExperience: 20 years\n\nBiography",
      "URL: https://www.steelers.com/news/statement-from-rooney-on-wolfley\n\nCONTENT:\n\nStatement from Rooney on Wolfley\n\nStatement from Art Rooney II on the passing of Craig Wolfley\n\nWe are deeply saddened by the passing of Craig Wolfley, a beloved member of the Pittsburgh Steelers family. Craig was an outstanding player who brought both toughness and heart to the field during his 10 seasons with the Steelers. As an offensive lineman, his grit and dedication were essential to our success, contributing to the solid foundation of the Steelers' offensive line in the 1980s and 1990s. His work ethic and commitment to excellence were felt both in the locker room and on the field, and his leadership was always evident. Following his retirement from playing, Craig seamlessly transitioned into a broadcaster, providing insightful commentary and analysis as part of the Steelers Radio Network. His passionate voice and deep understanding of the game made him a trusted figure for Steelers fans, and his humor, warmth, and enthusiasm left a lasting impact on our community. On behalf of the entire Steelers organization, we offer our deepest condolences to Craig's family, friends, and all who had the privilege of knowing him. Related Content\n\n2025 NFL Free Agency Q & A\n\nEverything you need to know about NFL free agency, including the salary cap number for 2025\n\nSteelers Announce the Official Steelers Fan Cruise\n\nTake a six-day, five-night adventure aboard the Norwegian Escape Ship with Steelers Legends\n\nSteelers name McCurley inside linebackers coach\n\nThe Steelers named Scott McCurley inside linebackers coach\n\nSteelers name Alexander defensive backs coach\n\nThe Steelers have named Gerald Alexander defensive backs coach\n\nSteelers to play in NFL's first regular season game in Ireland in '25\n\nHistoric game to be played in Dublin's iconic Croke Park\n\nStatement from Rooney on McCaskey",
      "Pittsburgh Steelers wide receiver Scotty Miller (13) during practice at the UPMC Rooney Sports Complex preparing for a Week 18 matchup against the Cincinnati Bengals, Thursday, Jan. 2, 2025 in Pittsburgh, PA. (Alysa Rubin / Pittsburgh Steelers)\n\nPittsburgh Steelers quarterback Justin Fields (2) during practice at the UPMC Rooney Sports Complex preparing for a Week 18 matchup against the Cincinnati Bengals, Thursday, Jan. 2, 2025 in Pittsburgh, PA. (Alysa Rubin / Pittsburgh Steelers)\n\nPittsburgh Steelers running back/kick returner Cordarrelle Patterson (84) during practice at the UPMC Rooney Sports Complex preparing for a Week 18 matchup against the Cincinnati Bengals, Thursday, Jan. 2, 2025 in Pittsburgh, PA. (Alysa Rubin / Pittsburgh Steelers)\n\nPittsburgh Steelers tight end Pat Freiermuth (88) during practice at the UPMC Rooney Sports Complex preparing for a Week 18 matchup against the Cincinnati Bengals, Thursday, Jan. 2, 2025 in Pittsburgh, PA. (Alysa Rubin / Pittsburgh Steelers)\n\nPittsburgh Steelers wide receiver Mike Williams (18) during practice at the UPMC Rooney Sports Complex preparing for a Week 18 matchup against the Cincinnati Bengals, Thursday, Jan. 2, 2025 in Pittsburgh, PA. (Alysa Rubin / Pittsburgh Steelers)\n\nPittsburgh Steelers running back Aaron Shampklin (33) during practice at the UPMC Rooney Sports Complex preparing for a Week 18 matchup against the Cincinnati Bengals, Thursday, Jan. 2, 2025 in Pittsburgh, PA. (Alysa Rubin / Pittsburgh Steelers)\n\nPittsburgh Steelers running back Najee Harris (22) during practice at the UPMC Rooney Sports Complex preparing for a Week 18 matchup against the Cincinnati Bengals, Thursday, Jan. 2, 2025 in Pittsburgh, PA. (Alysa Rubin / Pittsburgh Steelers)"
    ],
    "answer": "Mike Tomlin",
    "reference_answer": "Eddie Faulkner"
  },
  {
    "question": "Which NFL team did MyCole Pruitt play for before joining the Steelers?",
    "context": [
      "URL: https://www.steelers.com/news/steelers-how-he-fits-mycole-pruitt\n\nCONTENT:\n\nHow he fits: MyCole Pruitt\n\nContributing Writer/Editor\n\nThe Steelers signed veteran tight end MyCole Pruitt to a one-year contract. Pruitt (6-2, 245) is a bit undersized, but he has played as a move tight end/fullback throughout his nine seasons in the NFL. Initially a fifth-round pick of the Vikings in 2015 out of Southern Illinois, Pruitt showed excellent athleticism at the NFL Scouting Combine, posting a 4.58-second 40-yard dash and 38-inch vertical jump. Pruitt has spent time with six different NFL teams, but has become a favorite of new Steelers offensive coordinator Arthur Smith. PHOTOS: Steelers sign MyCole Pruitt\n\nSee photos of Steelers newly-signed TE MyCole Pruitt\n\nAtlanta Falcons tight end MyCole Pruitt (85) works during the second half of an NFL football game against the Green Bay Packers, Sunday, Sep. 17, 2023, in Atlanta. The Atlanta Falcons won 25-24. (AP Photo/Danny Karnik)\n\nAtlanta Falcons tight end MyCole Pruitt (85) makes a catch in the end zone for a touchdown against the New York Jets during the second quarter of an NFL football game, Sunday, Dec. 3, 2023, in East Rutherford, N.J. (AP Photo/Adam Hunger)\n\nAtlanta Falcons tight end MyCole Pruitt (85) works during the second half of an NFL football game against the Tampa Bay Buccaneers, Sunday, Dec. 10, 2023, in Atlanta. The Tampa Bay Buccaneers won 29-25. (AP Photo/Danny Karnik)\n\nAtlanta Falcons tight end MyCole Pruitt (85) runs after a catch against the Detroit Lions during an NFL football game in Detroit, Sunday, Sept. 24, 2023. (AP Photo/Paul Sancya)\n\nAtlanta Falcons tight end MyCole Pruitt (85) runs the ball during the second half of an NFL football game against the Houston Texans, Sunday, Oct. 8, 2023, in Atlanta. The Atlanta Falcons won 21-19. (AP Photo/Danny Karnik)",
      "Notes ^ Although Marlin Briscoe is sometimes erroneously cited as the first African-American starting quarterback in 1968, this was not for an NFL team and not in an NFL game (the Denver Broncos, for which Briscoe played, were an American Football League team then), additionally the vast majority of Briscoe's career was not as quarterback. References ^ Varley, Teresa (May 19, 2020). \"The day it all began for the Steelers\" . Steelers.com . NFL Enterprises, LLC. Archived from the original on June 3, 2020 . Retrieved June 3, 2020 . ^ Varley, Teresa (December 7, 2019). \"Black and gold was everywhere\" . Steelers.com . NFL Enterprises, LLC. Archived from the original on November 10, 2020 . Retrieved November 4, 2020 . ^ \"Pittsburgh Steelers Team History\u2013NFL Football Operations\" . Operations.NFL.com . NFL Enterprises, LLC . Retrieved July 8, 2024 . ^ \"Pittsburgh Steelers Team Capsule\" (PDF) . 2022 Official National Football League Record and Fact Book (PDF) . NFL Enterprises, LLC. July 20, 2022 . Retrieved July 8, 2024 . ^ \"Steelers Front Office Roster\" . Steelers.com . Retrieved June 14, 2023 . ^ Jump up to: a b c d e f \"Pittsburgh Steelers Team History\" . ProFootballHOF.com . NFL Enterprises, LLC. Archived from the original on November 27, 2020 .",
      "KEITH MILLER FROM CANTON, NC: It's never too early for fans to start preparing for the draft. Please explain how compensatory picks are awarded for lost free agents? ANSWER: This is from a story in The New York Times:\n\n\"Under the rules for compensatory draft selections, a team losing more or better compensatory free agents (\"CFA\") than it acquires in the previous year is eligible to receive compensatory draft picks, according to the NFL policy. Compensatory free agents are determined by a formula based on salary, playing time, and postseason honors. The formula was developed by the NFL Management Council. Not every free agent lost or signed by a club is covered by this formula. Clubs that suffer a net loss of CFAs during the prior free agent signing period are eligible to receive a corresponding number of compensatory selections. In addition, the formula factors in the value of the free agents lost.\"\n\nAsk Bob a question\n\nDo you have a question for Bob Labriola? Fill out the form below, then check back to see if your question appears on the next edition of Asked & Answered. By clicking the submit question button, I agree to the Pittsburgh Steelers' T erms and Conditions and understand that personal information will be used as described in the Steelers' Privacy Policy . Related Content\n\nAsked and Answered: March 6\n\nAustin did some nice things from the slot in 2024 and is still on a rookie contract\n\nAsked and Answered: March 4\n\nDawson's Hall of Fame career spanned 1988-2000\n\nAsked and Answered: Feb. 26\n\nDraft capital must be spent in order to acquire top-quality D-linemen\n\nAsked and Answered: Feb. 25\n\nFautanu played 41 games in college, including 28 in 2022-23\n\nAsked and Answered: Feb. 20\n\nWilliams played 171 offensive snaps in 9 games with Pittsburgh\n\nAsked and Answered: Feb. 18\n\nBen has better credentials than Eli to be a 'first-ballot Hall of Famer'\n\nAsked and Answered: Feb. 13\n\nL.C.'s HOF candidacy wasn't impacted by Jared Allen's election",
      "4.47u \ud83d\udd25 James Pearce Jr.\u2019s draft stock \ud83d\udcc8 \ud83d\udcfa: #NFLCombine on @NFLNetwork \ud83d\udcf1: Stream on @NFLPlus pic.twitter.com/2gf4rKR7rO\n\nAll in the family: Steelers scout Mark Bruener is closely watching all of the players at the Combine, but there isn't anyone who likely has his attention more than a linebacker from the University of Washington. And that's because it's his son. Huskies' linebacker Carson Bruener is participating in the Combine, running a 4.59 in the 40-yard dash on both of his turns. The young Bruener said he had gotten plenty of advice from his father, who was drafted by the Steelers in the first round of the 1995 NFL Draft and played nine seasons for the team. \"He's given me a lot of great pointers,\" said Bruener. \"Biggest thing is he's not a helicopter dad. He lets me enjoy this whole journey and just be myself. He'll give me pointers and tips here and there. I don't know what my true scouting report on myself really is. I haven't asked him, nor has he told me. \"He told me, 'You control what you can control, and you've done everything at this point to be where you're at.' I'm here, and this was my goal to be here, and I feel blessed to be here.\"\n\nBruener said he hasn't read any of his dad's scouting reports on himself and when he was interviewed by the Steelers at the Shrine Bowl, dad took a back seat. \"I walked in and there was a second room of interviews,\" shared Bruener. \"There was a certain amount of teams in each one, 15-minute interviews. The Steelers were the first team I met with in that room. My dad was sitting right across the table and he kind of stood up.",
      "\"The timing was right for me. It was quite a blessing.\"\n\nThanks to his time at Bradford High School, Brown was able to earn a scholarship to the University of Kansas. And ultimately the Steelers drafted him in the fifth round of the 1971 NFL Draft, landing him at a place that was an ideal situation. \"When I got here, you could just tell the makeup of the club, the way people were treated, the community aspect of the team itself and the coaching,\" said Brown. \"It was the perfect place for me. I got a chance to play on what arguably was one of the best teams that was ever assembled with all the players. There were a lot of players who didn't necessarily get some of the hype, but also very good players throughout the roster. The Rooneys and Coach (Chuck) Noll had a philosophy that was focused on the best players available. You felt like you were getting a fair shot. That's the way it was the whole time."
    ],
    "answer": "Vikings",
    "reference_answer": "MyCole Pruitt played for the Atlanta Falcons before joining the Steelers."
  },
  {
    "question": "What is the best 40-yard dash time recorded by a defensive lineman at the pro day in 2025?",
    "context": [
      "A look back: NFL Research has been working overtime with the Combine, including providing the top performers in the 40-yard dash for defensive backs and tight ends since 2003. At the 2024 NFL Combine, CB Nate Wiggins ran a 4.28 40-yard dash which was tied for the 5th-fastest among defensive backs since 2003. Tight end Devin Culp ran a 4.47 40-yard dash at the 2024 Combine (4th-fastest by a TE since 2003). Fastest Official 40-Yard Dash - Defensive Backs - Since 2003:\n\n2022 Kalon Barnes Baylor 4.23 2023 DJ Turner II Michigan 4.26 2022 Tariq Woolen UTSA 4.26 2005 Stanford Routt Houston 4.27 2024 Nate Wiggins Clemson 4.28 2017 Jalen Myrick Minnesota 4.28\n\nFastest Official 40-Yard Dash - Tight Ends - Since 2003:\n\n2006 Vernon Davis Maryland 4.40 2010 Dorin Dickerson Pittsburgh 4.40 2017 Evan Engram Ole Miss 4.42 2024 Devin Culp Washington 4.47 2020 Albert Okwuegbunam Missouri 4.49 2012 James Hanna Oklahoma 4.49\n\nUp Next: Quarterbacks, receives and running backs take the field on Saturday in Indianapolis. Related Content\n\nPlenty to choose from\n\nAnticipated offensive line talent, versatility, depth closes Combine\n\nSkill position players make a big statement\n\nRBs, WRs, QBs have strong days at NFL Scouting Combine Saturday\n\nOff and running at the NFL Scouting Combine\n\nThe defensive line and linebackers are making an impression at the Combine\n\nHunter wants to break the mold as two-way player\n\nCornerback or wide receiver, Colorado star wants to be the best\n\nDefensive line takes center stage at NFL Scouting Combine\n\nTop prospects show ability to stop run, rush the passer\n\nKhan: Getting QB situation settled a priority\n\nSteelers would like to have Wilson or Fields signed before FA opens\n\nNFL Combine: How to watch, listen and follow\n\nThe NFL Scouting Combine is underway and we are bringing you full coverage\n\n2025 NFL Combine participants\n\nA look at all of the players invited to take part in the 2025 NFL Combine\n\nPlenty to go around",
      "Arthur Smith, previous head coach for the Atlanta Falcons for three years (2021-23),  is in his \ufb01rst season as the Steelers' o\ufb00ensive coordinator in 2024. This marks his 16th year in the National Football League coaching ranks. Under Smith's guidance, the Falcons led the NFL in fewest penalties (2022), ranked third in successful play rate on rushing attempts, based on EPA, (2022), \ufb01nished third in rushing yards/game (2022), ninth in rushing yards/game (2023), 10th in third-down conversion rate (2022), 13th in third-down conversion rate (2023) and 13th in passing yards/attempt (2023). Atlanta eclipsed 400 total yards of o\ufb00ense on six occasions in 2023, tied for the fourth-most in single-season franchise history. The Falcons and Miami were the only teams in the NFL to \ufb01nish the season with a top-10 rushing attack and a top-\ufb01ve opponent pressure rate. Bijan Robinson \ufb01nished the season second among rookies with 1,463 yards from scrimmage. He recorded the most yards from scrimmage by a rookie in franchise history (1,463) and led all NFL rookies with 976 rushing yards, while adding 487 receiving yards and eight TDs (four rushing, four receiving). Robinson set the franchise record for most receptions by a rookie running back (58) and became the \ufb01fth rookie running back in League history to record at least 1,400 yards from scrimmage, 55 receptions and four receiving TDs. He also registered the most games with 100 yards from scrimmage by a rookie in franchise history (six). Kyle Pitts (667) and Jonnu Smith (582) are the \ufb01rst pair of tight ends to both have 500+ receiving yards in the same season since Zach Ertz (916) and Dallas Goedert (607) in 2019 with Philadelphia. Atlanta's rushing attack averaged 74.5 more rushing yards per game in 2022 than it did in 2021, resulting in the largest one-season improvement by any team since at least 2001. Additionally, Tyler Allgeier became the sixth rookie in the NFL, selected in the \ufb01fth round-or-later, to eclipse 1,000 rushing yards",
      "New England Patriots, Dec 07, 2023 4 vs. Arizona Cardinals, Dec 03, 2023 1 more at 4. Solo Tackles 5 at Cleveland Browns, Nov 19, 2023 4 vs. New England Patriots, Dec 07, 2023 4 vs. Jacksonville Jaguars, Oct 29, 2023 3 vs. Green Bay Packers, Nov 12, 2023 1 more at 3. Passes Defensed 1 at Seattle Seahawks, Dec 31, 2023 1 vs. Cincinnati Bengals, Dec 23, 2023 8 more at 1. Tackles For Loss 1 vs. Green Bay Packers, Nov 12, 2023\n\nInterceptions 1 vs. Baltimore Ravens, Oct 08, 2023\n\nSINGLE-GAME HIGHS - POSTSEASON: DEFENSIVE\n\nTotal Tackles 2 at Buffalo Bills, Jan 15, 2024 Solo Tackles 2 at Buffalo Bills, Jan 15, 2024\n\nRelated Content\n\nRookie Recap: Ryan Watts\n\nRyan Watts rookie season ended before it started\n\nRookie Recap: Logan Lee\n\nLogan Lee is ready to take the next step after missing his rookie season\n\nRookie Recap: Mason McCormick\n\nMason McCormick stepped up to the plate his rookie season\n\nRookie Recap: Roman Wilson\n\nRoman Wilson didn't have the rookie season he set out for but still continued to improve\n\nRookie Recap: Zach Frazier\n\nZach Frazier stepped up big in his rookie season\n\nRookie Recap: Troy Fautanu\n\nThe 2024 season wasn't what No. 1 pick Troy Fautanu envisioned\n\nRookie Recap: Spencer Anderson\n\nAnderson made the 53-man roster right out of the gate\n\nRookie Recap: Cory Trice Jr. Trice's rookie season never got started due to injury\n\nRookie Recap: Nick Herbig\n\nHerbig's contributions grew as the season wore on\n\nRookie Recap: Darnell Washington\n\nNumbers don't always tell the story\n\nRookie Recap: Keeanu Benton\n\nKeeanu Benton earned a spot in the starting lineup his rookie season\n\nClub Links\n\nNFL Clubs\n\nMore NFL Sites\n\n\u00a9 2025 Pittsburgh Steelers. All Rights Reserved\n\nYour Privacy Choices\n\nStrictly Necessary\n\nPerformance\n\nFunctional\n\nTargeting\n\nIn order to provide you with free high-quality content that you love to watch and offers that are more relevant to you, the National Football League collects and shares certain personal information.",
      "The average offensive lineman 40 time was 5.13, the fastest by an offensive line group at a Combine. IT'S NOT ALL ABOUT THE MEASURABLES: Campbell is widely regarded as one of the prized offensive line prospects in the draft but there are some who question whether he'll wind up at guard because of his 325/8-inch arms. Campbell isn't among the concerned. \"It's no secret I don't have the stereotypical offensive lineman arms but I've never had them,\" he told Dales. \"There were concerns when I was coming into college, I handled it fine. And, obviously, there's concerns now and I'm gonna handle it fine whenever a team gives me the opportunity.\"\n\nCollege tackles with arms shorter than 33\" often end up at guard in the NFL. But to Campbell that's not necessarily a definitive indicator as to whether a player is better suited for guard or tackle. Dales also reported Campbell told her \"blocking is done with your feet.\"\n\nAIN'T THAT TOUGH ENOUGH: Jackson didn't run 40s and looked to be struggling to a degree in drills. At one point he received attention from the medical staff and had his right thigh wrapped. \"I don't know that he looks super healthy,\" Jeremiah said. \"You can see a strain on his face as well when he's trying to finish a drill. I admire the competitiveness but it's not necessary at this point. You got 55 starts at Ohio State, that's enough. I love you competing if you're healthy but if you're not 100 percent it's not worth that.\"\n\nAdded Davis, who worked on the field as well as upstairs at an anchor desk: \"I said to him, 'Are you OK young man?' He just looked at me and defiantly said, 'I'm doing great,' and just went back to the line. \"He doesn't look right, I think everyone's kind of seeing there may be something a little bit off but he's doing his best to fight his way through it.\"\n\nRelated Content\n\nSkill position players make a big statement\n\nRBs, WRs, QBs have strong days at NFL Scouting Combine Saturday\n\nSpeed on display at the Combine",
      "No record breaker: Friday, Texas wide receiver Isaiah Bond said he would break the combine record 40-yard dash of former teammate Xavier Worthy set in 2024. Worthy ran a 4.21-second 40-yard dash at Indianapolis last year. \"I'm going to break the record, for sure,\" Bond said Friday. \"I anticipate running 4.20 or possibly, if I'm feeling great, I might run 4.1.\"\n\nHis confidence didn't match the reality, as Bond was timed at 4.39 seconds in the 40. In fact, he wasn't even the fastest Texas receiver at the combine. Teammate Matthew Golden ran an official 4.29-second 40-yard dash T 5-11 \u215b and 191 pounds running in the same early group of wide receivers. Golden is considered a potential first-round prospect and Jeremiah compared him to former Steelers WR Santonio Holmes. \"He's one of my favorites to watch for a number of reasons,\" Jeremiah said. \"He's just really crisp. He just snaps everything off.\"\n\nGolden's time was the second-fastest for a wide receiver weighing at least 190 pounds since 2003. Tennessee's Donte Thornton Jr. nearly matched him at 6-4 \u00bd and 205 pounds, but was officially timed at 4.30 seconds. Overall, it was one of the fastest groups of wide receivers in combine history, as 10 players posted times of sub-4.40 seconds, the most since the NFL Network began tracking it in 2003. Faulkner runs the drill: Steelers running backs coach Eddie Faulkner is known for incorporating a lot of drill work with his position at practices. Saturday, he ran the running backs group through a drill named after former Steelers running back Duce Staley, getting an up-close look at this group. The drill is a footwork drill combined with a vision approach, as runners go forward, backward and side to side stepping over pads on the field. They then explode toward three big bags held by coaches who lean the pads one way or another to simulate a block."
    ],
    "answer": "4.28",
    "reference_answer": "The best 40-yard dash time recorded by a defensive lineman at the pro day was 4.47 seconds by James Pearce Jr."
  },
  {
    "question": "Which goaltender was recalled by the Penguins from the AHL?",
    "context": [
      "The Penguins have gone 21-14-3 in the last 38 games against the Maple Leafs. Pittsburgh is 5-2-0 in their last seven home games against Toronto dating back to Nov. 16, 2019. The Penguins have points in three of their last 5 home games (2-2-1). The Penguins have points in 13 of their last 20 games against the Avalanche (11-7-2) dating back to Apr. 6, 2014. Pittsburgh has points in five of their last eight games on the road against Colorado (4-3-1). The Penguins have points in three of their last four visits to Ball Arena (2-1-1). Recent News\n\nLineup Notes\n\nThe Penguins recalled goaltender Tristan Jarry from Wilkes-Barre/Scranton of the American Hockey League, and re-assigned rookie Joel Blomqvist. Jarry, a two-time NHL All Star, had been placed on waivers before clearing and heading down to work on his game. Full story here .",
      "URL: https://www.nhl.com/penguins/news/penguins-sign-defenseman-finn-harding-to-a-three-year-entry-level-contract\n\nTITLE: Penguins Sign Defenseman Finn Harding to a Three-Year Entry-Level Contract | Pittsburgh Penguins\n\nCONTENT:\n\nThe Pittsburgh Penguins have signed defenseman Finn Harding to a three-year entry-level contract, it was announced today by President of Hockey Operations and General Manager Kyle Dubas. Harding, 20, has spent the 2024-25 season as an alternate captain for the Brampton Steelheads of the Ontario Hockey League. Through 59 games, the 6-foot-2, 192-pound defenseman has posted seven goals, 48 assists and a career-high 55 points. Harding\u2019s 48 assists are a single-season franchise record among Steelheads defensemen, and his assist and point totals both rank fifth across the entire league among defensemen. Additionally, his plus-43 is currently ninth in the league across all players, and third among blueliners. The Toronto, Ontario native has played 190 games for the Steelheads over the course of three seasons from 2022-25. During that span, he has recorded 19 goals, 80 assists, 99 points and is plus-90. He has one goal and two assists for three points in 11 playoff games with the Steelheads. Harding was originally selected by Pittsburgh in the seventh round (223rd overall) of the 2024 NHL Draft. ================================================================================\n\nURL: https://www.nhl.com/penguins/news/penguins-simply-weren-t-good-enough-in-philadelphia\n\nTITLE: Penguins \"Simply Weren't Good Enough\" in Philadelphia | Pittsburgh Penguins\n\nCONTENT:\n\nThe Penguins dropped the first game of a home-and-home with the Flyers on Tuesday at Wells Fargo Center, 6-1. \u201cI don\u2019t think we played particularly good today,\u201d Erik Karlsson said.",
      "We still got a lot of hockey left, and we got a good group of guys in here, and we just got to stay in the moment and try and find it for each day. Today, obviously, we fell short on that.\u201d\n\nLineup Notes\n\nBryan Rust returned to action after missing the last two games due to illness, and the last game before the break \u2013 also in Philadelphia \u2013 with a lower-body injury. Matt Grzelcyk was good to go following a hit from Matt Rempe in the first period of Sunday\u2019s matchup with the Rangers that sent Penguins defenseman to the locker room for the remainder of the day. \u201cIt was kind of just like a scary kind of incident, probably more just caught me by surprise than anything,\u201d Grzelcyk said. \u201cI never touched the puck, I never had possession of the puck. So, in that spot, I don\u2019t think I\u2019m really expecting to get finished there. If anything, maybe rubbed out. I think his teammate had the puck the whole time through the neutral zone and dumped it in. I chased it from the other corner. I know he\u2019s a big man, but probably think you\u2019ve got to have a little bit more awareness in situations. He\u2019s coming from my blind side there, so I\u2019m not really expecting to take a big hit in that position.\u201d\n\n================================================================================\n\nURL: https://www.nhl.com/penguins/news/penguins-strong-effort-not-enough-against-avs\n\nTITLE: Penguins' Strong Effort Not Enough Against Avs | Pittsburgh Penguins\n\nCONTENT:\n\nBefore Pittsburgh hit the road for a three-game trip, Bryan Rust acknowledged how difficult this time of year is, especially with the team struggling to find results ahead of the upcoming trade deadline. \u201cFor us, we\u2019ve just got to keep taking it one day at a time,\u201d the longtime Penguins forward said. \u201cI think we\u2019ve got to just get through this week. We\u2019ve got to stay together as a team. And just take each day as it comes.\u201d",
      "today\u2019s game with four points in his last five games (2G-2A) and only two Penguins have more points than him during February. On February 9, the Penguins claimed defenseman Vladislav Kolyachonok (koh-lee-ah-CHOHN-ahk) off of waivers from the Utah Hockey Club. The 23-year-old defenseman is signed through the 2025-26 season and has posted five points (2G-3A) in 23 games this season. The native of Minsk, Belarus was originally a second-round pick (52nd overall) of the Florida Panthers in 2019 and has spent the past four seasons between the NHL and AHL. In 62 career NHL games, he\u2019s recorded 12 points (4G-8A) and one game-winning goal. Kolyachonok also has 150 games at the AHL level split between Tucson and Syracuse, where he\u2019s picked up 48 points (13G-35A) and is plus-12. Quick Hits",
      "URL: https://www.nhl.com/penguins/news/penguins-can-t-overcome-early-deficit-against-boston\n\nTITLE: Penguins Can\u2019t Overcome Early Deficit against Boston | Pittsburgh Penguins\n\nCONTENT:\n\nAlex Nedeljkovic was named the game\u2019s Second Star in Saturday\u2019s 3-2 loss to Boston at PPG Paints Arena, battling hard to keep his team within striking distance after they gave up an early two-goal lead. \u201cNed was huge. I don't think we came out with the game or the energy that we would have liked, and they jumped out to a lead,\u201d Bryan Rust said. \u201cI think after that lead, he was incredible. He made every save.\u201d\n\nMike Sullivan went back to Nedeljkovic after pulling him on Thursday against Philadelphia, a decision that was more momentum-based than performance-based, which elicited some raw emotion from the netminder . Nedeljkovic regrouped well after both that night and the early deficit, coming up with key saves throughout the game. \u201cI thought Ned responded really well,\u201d Matt Grzelcyk said. \u201cHe keeps us in it... That\u2019s the type of competitor he is. That\u2019s why we love playing in front of him."
    ],
    "answer": "Tristan Jarry",
    "reference_answer": "Tristan Jarry"
  },
  {
    "question": "Why is Black History Month important to Miles Boykin?",
    "context": [
      "URL: https://www.steelers.com/news/boykin-wants-to-carry-on-the-tradition\n\nCONTENT:\n\nBoykin wants to carry on the tradition\n\nSteelers.com\n\nIn celebration of Black History Month, we take the time to recognize and reflect on the thoughts and contributions of members of the Steelers organization. Today, receiver Miles Boykin shares why Black History Month is important to him and how hearing from those who came before him has inspired and touched him. There are lessons we all learn in life that come from so many sources, but for receiver Miles Boykin, when it comes to Black History Month, there is no greater source than his grandmother, Cornelia Brigmon. \"Black culture is such a part of American culture,\" said Boykin. \"I think we need to relay that to everybody and recognize its importance in the United States today. \"For me, listening to my grandma is one of the best ways to do it. My grandma would always tell me stories. She is turning close to 80-years old now, so she has some crazy stories. She was born during segregation. I can't even remember the whole specifics, but it was her mom or her grandmother who was born a slave and then they were eventually able to leave out of it. Just some of the stories that she tells me really makes me grateful for what I have today and grateful for those who came before me.\"",
      "Black in Bloom: Spring Community Day. Mar 15, 2025 , 12:00 pm - 3:00 pm. August Wilson African American Cultural Center 980 Liberty Ave Pittsburgh, PA 15222. Join us for \u201cBlack in Bloom\u201d Spring Community Day! Co-presented by UPMC/UPMC Health Plan and Citizens\u2019, this event highlights Black health, joy, and growth, while promoting wellness, empowerment, and connection. Bring your friends and family to explore our Spring Vendor Market, enjoy live DJ sets, experience performances from local artists, and discover a wealth of resources and activities for all ages. Step into Spring with us, celebrating the strength and resilience that surrounds us!. All ages are welcome\u2014don\u2019t miss this vibrant celebration of community and the spirit of Spring!. Community. EVENT WEBSITE: https://awaacc.org/event/black-in-bloom-spring-community-day/\n\nGuided Tour with Urban Academy \u2013 August Wilson: The Writer\u2019s Landscape. Mar 15, 2025 , 1:00 pm - 2:00 pm. August Wilson African American Cultural Center 980 Liberty Ave Pittsburgh, PA 15222. Experience the Enduring Legacy of August Wilson with Special Guided Tours Lead by Urban Academy K-5 Students. Step into the world of August Wilson through the eyes of the next generation of writers. We are thrilled to partner with Urban Academy\u2019s K-5 students to offer unique, guided tours of our immersive exhibition, August Wilson: The Writer\u2019s Landscape. Experience the life and legacy of the legendary playwright, while hearing firsthand stories and insights from these young, creative minds. Discover the power of storytelling and how Wilson\u2019s work continues to inspire and shape the future of theater. The exhibition has timed entry to ensure each guest has adequate time to experience the full impact of the exhibit.",
      "During Austin's senior year at Memphis, he was part of a group honored at the museum at the annual Black Men Crowned Awards, which honors Black males in the Memphis area for their leadership and accomplishments in different fields. Just knowing the history of the museum, being honored there moved Austin. \"That was very impactful for me,\" said Austin. \"Back then I didn't really see myself as somebody in the community that little kids, specifically young Black kids, could look up to. Being there and having kids talk to me, tell me they watched me at Memphis, and other things, it was very impactful. It made me reflect and know you're an example for people. I need to continue to put myself out there because by nature I'm kind of an introvert. But God blessed me with intelligence, and I know there are things I can do, and that encouraged me to continue to do them.\"\n\nAustin hopes that Dr. King's message, that his legacy, that his battle for all to be treated as one is something that never gets lost on today's youth. He knows how important it is for kids to continue to learn about it, whether it's in the classroom or through an educational and emotional trip to the museum. \"We're supposed to be one and united under God,\" said Austin. \"You don't want to stifle someone's legacy or a memory of them after they sacrificed so much, put their life on the line every day, to not teach the youth and not educate people on what he did. That would be a disservice or dishonor to what he stood for.",
      "The stories, many of which Boykin likes to just keep close to the vest, have been eye-opening for him and given him an even greater appreciation for those who came before him. \"You hear some of the things and it's almost unfathomable, but it seemed so normal to her,\" said Boykin. \"And now, she's just so grateful for everything. I truly think the older people are, the more appreciation they have for a lot of the things they had to go through. That's all we want for anybody. Hopefully when I'm 80-years old, I'll be able to say the same thing to my kids, and my grandkids, that they have been blessed in the world that they live and try to make it better for everybody. \"To me it means everything to hear stories from her because obviously oral history is so much better. The first-hand encounters are better than learning something from a book or watching it on television. Just the little things that my grandma would teach me about how things were when she was growing up. And even when my mom was growing up, how different things kind of were then as opposed to where we are today. \"It's huge to hear the stories because you don't want to forget where we came from.\"\n\nHearing the stories, understanding the struggles his grandmother went through, makes Boykin realize how far the country has come. But he is also aware of how much further we still need to go. \"I think we're always going to be working towards being perfect, because there's no such thing as perfect,\" said Boykin. \"Just seeing how far the needle has moved since then is definitely amazing.\"",
      "1 Citizen\n\nWhen Gus Miller turned 75, his daughter and business partner, Myrtle Mae Miller, decided to turn his birthday into a public event. She invited scores of his friends and loyal\u2026\n\nCelebrating the Lunar New Year in Pittsburgh\n\nLunar New Year, celebrated by people from East and Southeast Asia, marks the beginning of the new year. Based on the traditional Chinese lunisolar calendar, it begins with the first\u2026\n\nCollection Spotlight: The Gaddie-Truman Family Papers and Photographs\n\nNestled in Pittsburgh\u2019s East End Lincoln-Lemington neighborhood is the Belmar Gardens housing cooperative. At its conception, the community was celebrated as a solution for middle-income African American families who found\u2026\n\nHomestead\u2019s Asmongas: Sandlot Baseball Tradition in a Steel Town\n\nHomestead, Pa. has an extraordinarily rich sports history. Traditions of success in early professional football, women\u2019s swimming, basketball, and baseball frequently filled Pittsburgh\u2019s sports pages. Through the 1940s, though, town\u2026\n\nWhere Were Pittsburgh's Christmas Monorails? Christmas train rides have long been cherished childhood holiday traditions. But during a few select years in the 1960s, Pittsburgh children could also ride a Christmas monorail. Columbus, All Wrapped Up? October 12, the day Christopher Columbus landed his ships on the island of San Salvador in 1492, is upon us yet again. Here in Pittsburgh, the Columbus monument in Schenley\u2026\n\n================================================================================\n\nURL: https://www.heinzhistorycenter.org/event/american-girlhood-a-window-into-history\n\nTITLE: American Girlhood: A Window into History - Heinz History Center\n\nCONTENT:\n\nAmerican Girlhood: A Window into History\n\nEvent Information"
    ],
    "answer": "\"Black culture is such a part of American culture,\" said Boykin. \"I think we need to relay that to everybody and recognize its importance in the United States today.",
    "reference_answer": "Miles Boykin considers Black History Month important as it provides a time for reflection on the thoughts and contributions of members of the Steelers organization who have come before him."
  },
  {
    "question": "When did the first baseball game over the radio broadcast occur?",
    "context": [
      "Courtesy of the Smithsonian Institution\u2019s National Museum of American History\n\nKDKA transmitter, c. 1921\n\nIn the days when there were few regulations for radios, Frank Conrad, a Westinghouse engineer, built a makeshift studio in his garage and played records over the airwaves. His supervisor at Westinghouse, Harry P. Davis saw Conrad\u2019s hobby as a great way to sell more radios, and they applied for the first commercial radio license. On October 27, 1920, they received the call letters KDKA and set up a small studio in Westinghouse\u2019s East Pittsburgh Works. On November 2, KDKA broadcast the election results between Harding and Cox, credited as the first commercial radio broadcast. Courtesy of the Smithsonian Institution\u2019s National Museum of American History\n\nThis replica transmitter retains some parts from Frank Conrad\u2019s original, which is credited with the first commercial radio broadcast. ================================================================================\n\nURL: https://www.heinzhistorycenter.org/about/work-with-us\n\nTITLE: Work With Us - Heinz History Center\n\nCONTENT:\n\nWork With Us\n\nThe History Center, Fort Pitt Museum, and Meadowcroft Rockshelter and Historic Village offer a variety of full-time and part-time employment opportunities, as well as seasonal internships.",
      "Event: First Full Squad Workout\n\nDate: Feb 22 (Sat)\n\nOpponent: Orioles (BAL)\n\nType: vs vs. Event:\n\nOutcome: W,\n\nDate: Feb 23 (Sun)\n\nOpponent: Twins (MIN)\n\nType: vs vs.",
      "in 1912 with 36. On May 8, 1886, the Pittsburgh Alleghenys turned the first 3\u20134\u20132 triple play in Major League history. [ 83 ] In the fourth inning of a game, the Cincinnati Red Stockings put runners in first and second with no outs. John Reilly grounded out to first base, where Fred Carroll recorded the first out. He threw to second base, where Sam Barkley made the tag for the second out. The runner from second decided to try for home plate and he was cut down on a throw from Barkley and a tag by Doggie Miller . [ citation needed ] The Alleghenys won the game, 9\u20136. [ 84 ] First ever Major League Baseball game broadcast on the radio, a game between the Pirates and the host Philadelphia Phillies aired August 5, 1921, on KDKA (AM) Pittsburgh. The Pirates won the game, 8\u20135. In 1925 , the Pirates became the first MLB team to recover from a 3-games-to-1 deficit in winning a best-of-seven World Series; they then became the first MLB team to repeat that feat in 1979 . [ 85 ] [ 86 ] During the 1953 season, the Pirates became the first team to permanently adopt batting helmets on both offense and defense. These helmets resembled a primitive fiberglass \" miner's cap \". This was the mandate of general manager Branch Rickey , who also owned stock in the company producing the helmets. Under Rickey's orders, all Pirate players had to wear the helmets both at bat and in the field. The helmets became a permanent feature for all Pirate hitters, but within a few weeks the team began to abandon their use of helmets in the field, partly because of their awkward and heavy feel. Once the Pirates discarded the helmets on defense, the trend disappeared from the game. [ 87 ] In 2014, Major League Baseball allowed pitchers to choose to wear a padded hat that aims to combine the added safety of a helmet with the comfort of a baseball cap. [ 88 ] The cap would prove widely unpopular, with only Alex Torres of the New York Mets choosing to wear it. [ 89 ] First franchise to win a World Series on",
      "verbal texts and visual images are appealingly combined with an eye to the adult male sports fans who are the magazines\u2019 principal readers. One consequence of this focus on male readers is that magazines such as Sports Illustrated and The Sporting News provide minimal coverage of women\u2019s sports (and tend to emphasize the erotic appeal of female athletes when they do allot space to women\u2019s sports). Despite the convenience of sports journalism in the print media, the reader\u2019s experience is\u2014by definition\u2014mediated. It still lacks a vibrant sense of immediacy. The diffusion of radio technology throughout Europe and North America in the 1920s allowed fans, absent from the game for whatever reason (distance, scheduling, venue capacity, cost), to listen in to play-by-play descriptions of events. A new market developed around those who tuned in to sports and hearkened to the sponsors\u2019 and advertisers\u2019 messages. Once radio broadcasting had been established, the next technological innovation\u2014television\u2014added the crucial visual to the existing audio dimension of live sports spectatorship. Television provides an unprecedented opportunity for vicarious experience. Initially, in the 1950s, those who staged, organized, and performed at sports events feared that the availability of games on television might keep fans from attending, especially if they could receive these live television sports broadcasts \u201cfree-to-air\u201d\u2014that is, for only the cost of the reception equipment and electrical power. The doubts quickly disappeared when it was discovered that television also had the capacity to generate legions of new sports fans. The enthusiastic response to sports programming provided sports organizations with a powerful new revenue stream: the sale of broadcast rights. By the late 20th century, as the cultural economy became increasingly important and the need to attract consumers to converging broadcast, computer, and telecommunications technologies became ever more urgent,",
      "Retrieved March 2, 2016 . ^ \"Pittsburgh Pirates extend with KDKA-FM, return to KDKA - Radio Insight.com\" . February 26, 2021. ^ \"SportsNet Pittsburgh to remain television home of the Pirates\" . mlb.com . Retrieved December 13, 2023 . ^ Here Are The 2016 MLB Prime Time Television Ratings For Each Team - Maury Brown, Forbes SportsMoney, September 28, 2016 ^ \"Broadcasters\" . Team . PittsburghPirates.com. Archived from the original on February 14, 2007 . Retrieved December 29, 2008 . ^ \"Broadcasters\" . MLB.com . ^ \" Rowswell, Prince still casting long shadows . The Pittsburgh Press, April 7, 1986\" . ^ Kohnfelder, Earl (June 11, 1985). \"Prince lauded as broadcaster, human being\" . Pittsburgh Press . p. A1. ^ Golightly, John (June 11, 1985). \"Bob Prince dies, Bucs broadcaster\" . Pittsburgh Post-Gazette . p."
    ],
    "answer": "August 5, 1921",
    "reference_answer": "The first baseball game over the radio was broadcast on August 5, 1921."
  },
  {
    "question": "What injury did Cameron Johnston sustain in the 2022 season?",
    "context": [
      "Johnston played four seasons at Ohio State where he was named Big Ten Eddleman-Fields Punter of the Year and was a second-team All-America selection his senior year. He also attended St. Joseph's College in Newtown, Australia and took part in the Melbourne-based punter/kicker training ground Prokick Australia and was a former Australian Rules football player for Melbourne Football Club. Related: How He Fits: Cameron Johnston",
      "October 10/31: Signed LB Ade Ogundeji to the Practice Squad and waived OT Dylan Cook from the Active Roster. October 10/30: Signed RB Aaron Shampklin to the Practice Squad. October 10/29: Waived LB Ade Ogundeji from the Active Roster and terminated both RB La'Mical Perine and CB Thomas Graham from the Practice Squad. October 10/28: Placed WR Roman Wilson on the Reserve/Injured List, signed RB Jonathan Ward from the Practice Squad to the Active Roster, elevated WR Brandon Johnson from the Practice Squad to the Active/Inactive Roster and released RB Aaron Shampklin from the Active Roster. October 10/25: Signed WR Andy Isabella to the Practice Squad. October 10/22: Signed CB C. October 10/22: J. October 10/22: Henderson to the Active Roster off the Practice Squad, signed DT Breiden Fehoko to the Practice Squad and placed DT Montravius Adams Sr. October 10/22: on the Reserve/Injured List. October 10/19: Promoted LB Ade Ogundeji to the Active Roster off the Practice Squad and elevated WR Brandon Johnson and RB Jonathan Ward to the Active/Inactive Roster off the Practice Squad. October 10/18: Signed DB Zyon Gilbert on the Practice Squad; placed DB Anthony Averett to Practice Squad/Injured List. October 10/16: Signed LB Ade Ogundeji and LB Craig Young to the Practice Squad. October 10/14: Signed WR Lance McCutcheon to the practice squad, waived LB Ade Ogundeji from the active roster, and released WR Jaray Jenkins from the practice squad. October 10/12: Promoted LB Ade Ogundeji to the Active Roster off the Practice Squad, elevated LB Eku Leota and RB Jonathan Ward to the Active/Inactive Roster off the Practice Squad and placed DE DeMarvin Leal on the Reserve/Injured List. October 10/05: Activated OLB Jeremiah Moon from the Reserve/Injured List. October 10/02: Promoted RB Aaron Shampklin to the Active Roster off the Practice Squad, signed LB Jacoby Windmon to the Practice Squad and LB Jeremiah Moon will return to practice but remains on the Reserve/Injured List. October",
      "\"There's a lot of people who gave to me and sacrificed for me and gave me opportunities that I wouldn't have had if I was by myself. So just being able to give back, even if I can just change one kid's life, that means the world to me.\"\n\nCameron Heyward Cause: The Heyward House\n\nOne of the ugliest words Cameron Heyward will ever hear is cancer. It's a word that rocked his world, when he was a teenager, and his father, Craig \"Ironhead\" Heyward, died of brain cancer. His father died when he was just 16-years old, the summer before his senior year of high school. Craig 'Ironhead' Heyward, who played at the University of Pittsburgh and in the NFL, had to give up football in 1999 because of a tumor that impacted his vision in the right eye. They thought that was the end of things, but it wasn't. He suffered a stroke, becoming paralyzed on the right side. \"He was working to walk for my senior night,\" Heyward shared. \"Before that happened, the summer before my senior year, he ended up passing away while I was at a basketball camp. My mom had to be the one to tell me. I remember that day clearly, looking for my mom, not knowing what was happening. I could feel everybody was being very delicate with me. When I found my mom, she had to share that with me. I know that was hard for her to share.",
      "\"There are multiple things that went into it,\" Mike Sullivan said when asked about the transaction. \"But part of our job as coaches and a management group is making sure that we're putting young players in the best possible position to be successful. A priority, first and foremost, is the continued growth and development of Joel. There's always that underlying question that we try to answer, is what's the best course of action for him \u2013 is it at the NHL level or the American League level? So, that was some of it.\"\n\nAdditionally, defenseman P.O Joseph was placed on injured reserve after sustaining an upper-body injury on Saturday versus Boston. Forward Michael Bunting remains sidelined after undergoing surgery to remove his appendix last week. Alex Nedeljkovic starts in goal versus Colorado.",
      "Sprecher via AP)\n\nDale Lolley is co-host of \"SNR Drive\" on Steelers Nation Radio. Subscribe to the podcast here: Apple Podcast | iHeart Podcast\n\nHe had never appeared in fewer than 15 games in a season before injuries limited him to nine games in 2023, four of them starts. Converting back to a 3-4 defensive end for the Steelers should be right up his alley. While not a dynamic pass rusher \u2013 he has 15.5 career sacks \u2013 Lowry has been an above-average run defender for much of his career. With the Steelers, he'll add veteran depth to a defensive front that includes Cam Heyward, Larry Ogunjobi, Keeanu Benton, DeMarvin Leal and Isaiahh Loudermilk, helping offset the loss of Armani Watts in free agency. Related Content\n\nEarly negotiating period is now underway\n\nNFL teams can begin to free agency talks today, with rules in place\n\n2025 NFL Free Agency Q & A\n\nEverything you need to know about NFL free agency, including the salary cap number for 2025\n\nParham Jr. signed to one-year contract\n\nThe Steelers signed tight end Donald Parham to a one-year contract\n\nHow he fits: MyCole Pruitt\n\nVeteran tight end provides competition on Steelers roster\n\nHow he fits: Cordarrelle Patterson\n\nNFL's all-time kick returns touchdown leader offers versatility\n\nHow he fits: Kyle Allen\n\nVeteran backup provides depth in retooled quarterback room\n\nHow he fits: Quez Watkins\n\nSteelers sign veteran wide receiver with speed\n\nAdams signed to two-year contract\n\nThe Steelers signed defensive tackle Montravius Adams to a two-year contract\n\nJohnston signed to three-year contract\n\nThe Steelers signed punter Cameron Johnston to a three-year contract\n\nHow he fits: Cameron Johnston\n\nVeteran punter should bring level of consistency to Steelers' kicking game\n\nJefferson signed to one-year contract\n\nThe Steelers signed receiver Van Jefferson to a one-year contract\n\nClub Links\n\nNFL Clubs\n\nMore NFL Sites\n\n\u00a9 2025 Pittsburgh Steelers. All Rights Reserved\n\nYour Privacy Choices\n\nStrictly Necessary\n\nPerformance\n\nFunctional"
    ],
    "answer": "unanswerable",
    "reference_answer": "Cameron Johnston sustained a knee injury in the 2022 season."
  },
  {
    "question": "Which player started the whole season for his team as a rookie in Steelers in 2025?",
    "context": [
      "Pittsburgh Steelers defensive lineman Keeanu Benton (95) prior to a regular season game between the Pittsburgh Steelers and the Cincinnati Bengals, Saturday, Dec. 23, 2023 in Pittsburgh, PA. The Steelers defeated the Bengals 34-11. (Arron Anastasia / Pittsburgh Steelers)\n\nRelated Content\n\nRookie Recap: Ryan Watts\n\nRyan Watts rookie season ended before it started\n\nRookie Recap: Logan Lee\n\nLogan Lee is ready to take the next step after missing his rookie season\n\nRookie Recap: Mason McCormick\n\nMason McCormick stepped up to the plate his rookie season\n\nRookie Recap: Roman Wilson\n\nRoman Wilson didn't have the rookie season he set out for but still continued to improve\n\nRookie Recap: Zach Frazier\n\nZach Frazier stepped up big in his rookie season\n\nRookie Recap: Troy Fautanu\n\nThe 2024 season wasn't what No. 1 pick Troy Fautanu envisioned\n\nRookie Recap: Spencer Anderson\n\nAnderson made the 53-man roster right out of the gate\n\nRookie Recap: Cory Trice Jr. Trice's rookie season never got started due to injury\n\nRookie Recap: Nick Herbig\n\nHerbig's contributions grew as the season wore on\n\nRookie Recap: Darnell Washington\n\nNumbers don't always tell the story\n\nRookie Recap: Joey Porter Jr. Joey Porter Jr. started his NFL career off strong\n\nClub Links\n\nNFL Clubs\n\nMore NFL Sites\n\n\u00a9 2025 Pittsburgh Steelers. All Rights Reserved\n\nYour Privacy Choices\n\nStrictly Necessary\n\nPerformance\n\nFunctional\n\nTargeting\n\nIn order to provide you with free high-quality content that you love to watch and offers that are more relevant to you, the National Football League collects and shares certain personal information. Because we respect your privacy, we also provide you choices with respect to your personal information.",
      "\"He has a desire to be great here. We have a desire for him to be great and to be great here with respect to the contract. But you know, we won't discuss that publicly, and usually those things are addressed at a later date.\"\n\nKhan also said he has had talks with the agent of pending free agent running back Najee Harris about a possible return, while he expects fellow running back Jaylen Warren, who is slated to be a restricted free agent, to return in 2025. That said, one of the deeper positions in the 2025 NFL Draft is running back. \"It's a good running back class, for sure,\" Khan said. \"It's an exciting group. We haven't closed the door on Naj. We have had conversations with Doug Henderson, his representative. So all options are on the table.\"\n\nThe Steelers also have some potential losses coming in free agency, as well. Two of the team's opening day starters on their offensive line, left tackle Dan Moore and right guard James Daniels, are slated to become free agents March 12. But having selected five offensive linemen in the past two drafts, Khan feels they have potential options already on the roster to replace those players. Broderick Jones, a first-round pick in 2023, has started the past two seasons at right tackle, but will be given a shot at left tackle in 2025. \"I'd say it's a safe assumption that going into this you know that he'll be the left tackle,\" Khan said. Meanwhile, 2024 fourth-round draft pick Mason McCormick moved into the starting lineup early in the season when Daniels suffered a torn Achilles' tendon and held down that spot. \"It was awesome,\" Khan said of McCormick's rookie season. \"Mason came in, a small-school guy. This was not too big for him.",
      "Cookie List\n\nURL: https://www.steelers.com/news/2025-nfl-free-agency-q-a\n\nCONTENT:\n\n2025 NFL Free Agency Q & A\n\nSteelers.com\n\nFree agency is set to begin at 4 p.m. on Wednesday, March 12 and it can be a confusing and fast-paced time. Here is everything you need to know going in, including that the 2025 salary cap is set at $279,200,000 million per club. For all of the official details on the Steelers free agency moves, check Steelers.com on a regular basis. We will be bringing you all of the news via text, video, photo galleries and all of our social media platforms. In the meantime, here you go. All the answers from the NFL.",
      "Cookie List\n\nURL: https://www.steelers.com/news/5-for-friday-steelers-count-on-improvement-from-young-ol\n\nCONTENT:\n\n5 for Friday: Steelers count on improvement from young OL\n\nContributing Writer/Editor\n\nOne of the keys to the Steelers' 2025 season will be the improvement of the team's young offensive line. In the past two years, the Steelers have selected offensive linemen Broderick Jones, Spencer Anderson, Troy Fautanu, Zach Frazier and Mason McCormick in the draft. All are 24 or younger, with Jones and Frazier being the youngest at 23. With Dan Moore scheduled to become an unrestricted free agent when the new league year begins March 12, there is a good chance that at least four of the offensive linemen the Steelers have selected in the past two drafts will have a chance to start next season, with veteran guard Isaac Seumalo being the fifth starter. With so many young players in that group, it's not surprising that there were some struggles in 2024. In fact, the Steelers had four different players \u2013 Frazier, Fautanu, Anderson and McCormick \u2013 make their first career NFL starts during the first six weeks of the season. \"We absorbed a lot of attrition during the course of the journey,\" Steelers head coach Mike Tomlin said at the end of the season. \"We ended up playing a lot of young people. They responded in a real positive way, but maybe they fatigued, mentally and physically.\"",
      "Pittsburgh Steelers running back Najee Harris (22) during practice at the UPMC Rooney Sports Complex preparing for a Wild Card matchup against the Baltimore Ravens, Thursday, Jan. 9, 2025 in Pittsburgh, PA. (Karl Roser / Pittsburgh Steelers)\n\nPittsburgh Steelers quarterback Justin Fields (2) during practice at the UPMC Rooney Sports Complex preparing for a Wild Card matchup against the Baltimore Ravens, Thursday, Jan. 9, 2025 in Pittsburgh, PA. (Karl Roser / Pittsburgh Steelers)\n\nPittsburgh Steelers wide receiver Ben Skowronek (15) during practice at the UPMC Rooney Sports Complex preparing for a Wild Card matchup against the Baltimore Ravens, Thursday, Jan. 9, 2025 in Pittsburgh, PA. (Karl Roser / Pittsburgh Steelers)\n\nPittsburgh Steelers wide receiver Quez Watkins (16) during practice at the UPMC Rooney Sports Complex preparing for a Wild Card matchup against the Baltimore Ravens, Thursday, Jan. 9, 2025 in Pittsburgh, PA."
    ],
    "answer": "Mason McCormick",
    "reference_answer": "McCormick started the whole season for his team as a rookie."
  },
  {
    "question": "Who was being honored in the Pittsburgh arena?",
    "context": [
      "Mario Lemieux NHL Art Ross Trophy 1996-97 Jaromir Jagr NHL Art Ross Trophy 1997-98 Jaromir Jagr NHL Art Ross Trophy 1998-99 Jaromir Jagr NHL Art Ross Trophy 1999-2000 Jaromir Jagr NHL Art Ross Trophy 2000-01 Kendrell Bell NFL Defensive Rookie of the Year 2001 Jason Bay NL Rookie of the Year 2004 Ben Roethlisberger NHL Offensive Rookie of the Year 2004 Hines Ward NFL Super Bowl MVP 2005 Sidney Crosby NHL Art Ross Trophy 2006-07 Evgeni Malkin NHL Calder Memorial Trophy 2006-07 James Harrison NFL Defensive Player of the Year 2008 Santonio Holmes NFL Super Bowl MVP 2008 Evgeni Malkin NHL Art Ross Trophy 2008-09 Evgeni Malkin NHL Conn Smythe Trophy 2008-09 Sidney Crosby NHL Maurice \"Rocket\" Richard Trophy 2009-10 Troy Polamalu NFL Defensive Player of the Year 2010 Dan Bylsma NHL Jack Adams Trophy 2010-11 Evgeni Malkin NHL Art Ross Trophy 2011-12 Ray Shero NHL General Manager of the Year 2012-13 Clint Hurdle NL Manager of the Year 2013 Sidney Crosby NHL Art Ross Trophy 2013-14 Sidney Crosby NHL Conn Smythe Trophy 2015-16 Jim Rutherford NHL General Manager of the Year 2015-16 Sidney Crosby NHL Conn Smythe Trophy 2016-17 T.J. Watt NFL Defensive Player of the Year 2021 Paul Skenes NL Rookie of the Year 2024 Major sports events held in Pittsburgh [ edit ] Pittsburgh has hosted the following All-Star games and drafts : 1944 MLB All-Star Game 1948 NFL draft 1959 MLB All-Star Game 1974 MLB All-Star Game 1990 NHL All-Star Game 1994 MLB All-Star Game 1997 NHL draft 2006 MLB All-Star Game 2012 NHL draft Future [ edit ] 2026 NFL draft Other professional championships and awards [ edit ] Pittsburgh Passion (WFA) [ edit ] 1 NWFA title, 2 IWFL titles 2007 2014 2015 Steel City Yellow Jackets (ABA) [ edit ] 1 ABA title 2021-22 Pittsburgh Hornets (AHL) [ edit ] 3 Calder Cup titles 1951-52 1954-55 1966-67 Pittsburgh Triangles (WTT) [ edit ] 1 WTT title 1975 Awards [ edit ] MVPs [ edit ] The following Pittsburgh players won the regular season most valuable player award of the American",
      "Honoring fallen heroes: Punter Corliss Waitman welcomed a group from TAPS and Survivors Outreach Services to Acrisure Stadium today for a military banner hanging as part of the upcoming Steelers Salute to Service game this week. Waitman presented the families with banners that will honor their fallen heroes and will hang on Art Rooney Avenue for Sunday's game against the Cleveland Browns. The group enjoyed a luncheon and then spent time with Waitman, visiting and sharing stories. Tuesday, November 12\n\nShowing appreciation for veterans: Linebacker Patrick Queen spent Tuesday morning at Veterans Place, spending the morning serving breakfast and visiting with the veterans. Queen has a soft spot in his heart for those who have served, respecting them and the sacrifices they have made for our country. \"Just recently, with social media becoming more of a platform for things that take place, you get to see stuff and see how they're treated,\" said Queen. \"All the stuff they went through in the past, and then them coming back home and the stuff they go through.",
      "[ edit ] Ferdinand Foch visited the hall in 1921. [ 7 ] Garner Ted Armstrong of The World Tomorrow spoke at The Soldiers and Sailors Memorial Hall on March 25, 1978. [ 8 ] G. E. Lowman spoke at the hall on April 23, 1938, and again in 1962 [ 9 ] Nelson Mandela spoke at the hall on December 6, 1991. Barack Obama visited the hall in 2008. Donald Trump spoke at the hall on April 13, 2016. Gallery [ edit ] The bronze work America (1910) by Charles Keck sits above the entrance to the memorial The cast bronze Lookout (1923) by Frederick Hibbard on the memorial grounds. Cast bronze Parade Rest (1923) by Frederick Hibbard on the memorial grounds. World War II torpedo monument outside of the memorial Bell from the heavy cruiser USS Pittsburgh (CA-72) The 2,300-seat auditorium, which includes a stage backdropped by the Gettysburg Address , [ 10 ] holds events and concerts throughout the year. Barack Obama with Senator Bob Casey, Jr. in the auditorium in 2008. A life mask of Abraham Lincoln on display in the museum Interior hallway with military uniforms and equipment on display USS Pennsylvania bow ornament References [ edit ] Kidney, Walter C. (2002). Henry Hornbostel: An Architect's Master Touch . Pittsburgh: Pittsburgh History and Landmarks Foundation & Roberts Rinehart Publishers. ISBN 1-57098-398-4 . Toker, Franklin (1994) [1986]. Pittsburgh: An Urban Portrait . Pittsburgh: University of Pittsburgh Press . ISBN 0-8229-5434-6 . ^ \"Pittsburgh History and Landmarks Foundation: Local Historic Designations\" . May 1, 2002.",
      "Zimmerman learned that he won the honor when the Steelers hosted him and Soloway at Lincoln Financial Field to see the Steelers and Eagles meet. While Soloway was in on the surprise, Zimmerman had no idea what was in store. \"We talked about the fact that the Eagles and Steelers were playing. It's a rarity for both of our teams to play,\" said Soloway. \"I explained to Jim that I talked about our story and the Steelers wanted to send us to the game. That is how I framed it up. That people were so moved they wanted to do something special for us. \"He was really excited. I asked if he was ever in Philly and the only time was when James died, because he died in the Philly area. He doesn't have good memories of the area. But there are things he wanted to do and see, including getting a Philly cheesesteak. \"He couldn't wait to see another game. He was like gosh, I have never been to a Steelers game and now I am going to two.\"\n\nWhile they might have had their own favorite in the game, there was no doubt the black and gold ruled the day in their hearts. \"I brought some Terrible Towels for both of us,\" said Zimmerman. \"I told him, you have my son's heart, and he was a Steelers fan. And he let me know he is a Steelers fan at heart.\"\n\nRelated Content\n\nLuck of the Irish is with McCormack\n\nTom McCormack from Dublin, Ireland is the Steelers 2024 International Fan of the Year\n\nTowel Twirls Around the World\n\nSteelers fans are encouraged to take part in the Towel Twirls Around the World\n\nA special black and gold bond\n\nTaylor Sinnott is the 2024 Steelers Fan of the Year\n\nShowing their love for the Steelers\n\nSteelers fans turned in large numbers for the Siempre Steelers Watch Party in Monterrey\n\nLos Steelers anuncian las leyendas que estar\u00e1n en Monterrey\n\nLos Steelers anunciaron las leyendas que estar\u00e1n presentes en la Siempre Steelers Watch Party en Monterrey\n\nSmile for the camera\n\nSteelers fans from all over took part in the Steelers World Photo Day",
      "In celebration of Black History Month, we take the time to recognize and reflect on the thoughts and contributions of members of the Steelers organization. Today we look at the life, legacy and career of Lowell Perry. Inside the library at the Steelers office at the UPMC Rooney Sports Complex, prominently located behind the six Super Bowl trophies the team has won, is a wall that is home to photos of the best of the best who have ever worn the black and gold. A total of 94 pictures adorn the wall, all of them with meaning. The vast majority of the pictures are the same ones that hung on the wall in Art Rooney Sr.'s office at Three Rivers Stadium, with some added through the years. The photos are a who's who in Steelers' history, names that roll off the tongue of Steelers fans with ease. Joe Greene. Jack Lambert. Terry Bradshaw. Lynn Swann. I could list others, but you get the point. The players were special and had a special place in Art Rooney Sr.'s heart. One of those photos is of a player who Steelers fans not familiar with the early history of the team might not recognize, because his career wasn't a long one. However, his impact on Rooney, the Steelers, the NFL and the business world was. Below a photo of Lambert, and above one of Bradshaw, is a picture of Lowell Perry. Perry was selected by the Steelers in the eighth round of the 1953 NFL Draft. Perry's arrival with the Steelers was delayed for three seasons due to ROTC duties. In 1956 Perry was able to finally join the Steelers for a delayed rookie season. It was time to live out his dream of playing in the NFL, something he waited a long time for. Sadly, though, his career would be cut short before it barely even began. In the sixth game of his rookie campaign, one that was showing amazing signs of promise for a long and heralded career for the receiver and kick returner, it was abruptly cut short due to injury. While it ended his playing career, it was the start of a lifetime of breaking racial barriers. *"
    ],
    "answer": "Lowell Perry",
    "reference_answer": "Mike Lange was being honored in the Pittsburgh arena."
  },
  {
    "question": "Who is the most famous Steelers radio color commentator?",
    "context": [
      "Both stations are owned by iHeartMedia . Games are also available on 51 radio stations in Pennsylvania , Western Maryland , Ohio , and Northern West Virginia . [ 218 ] The announcer is Tunch Ilkin . Craig Wolfley is the sideline reporter. Myron Cope , the longtime color analyst and inventor of the \" Terrible Towel \", retired after the 2004 season , and died in 2008. Longtime lead announcer Bill Hillgrove retired after the 2023 season . Pre-season games not shown on one of the national broadcasters are seen on CBS O&O KDKA-TV , channel 2; independent sister station WPKD-TV , channel 19; and AT&T SportsNet Pittsburgh . KDKA-TV's Bob Pompeani and former Steelers quarterback Charlie Batch do the announcing for the pre-season games, as well as the two hosting the pre-game program Steelers Kickoff during the regular season prior to the national airing of The NFL Today . Pompeani and former Steelers lineman Chris Hoke also host the Xfinity Xtra Point following the game on days when CBS does not have that week's NFL doubleheader. When CBS has a week's doubleheader, the show airs on WPKD-TV. Coach Mike Tomlin's weekly press conference is shown live on AT&T SportsNet Pittsburgh. Both Batch and Hoke replaced former Steelers lineman Edmund Nelson , who retired from broadcasting in 2015. [ 219 ] Thursday Night Football broadcasts are shown locally on Fox affiliate WPGH-TV , channel 53 (along with home games with NFC opponents and some flexed interconference games), while ESPN Monday Night Football broadcasts are shown locally on WTAE-TV , channel 4. (WTAE-TV is owned by the Hearst Corporation , which owns a 20% stake in ESPN.) By virtue of being members of the AFC, most of the Steelers' games air on CBS and KDKA. NBC Sunday Night Football games are carried by WPXI , channel 11, in the market. The Steelers hold a national contract with Grupo Imagen for radio rights to their games in Mexico; Imagen broadcasts the Steelers on their stations in 17 Mexican cities. Figures with",
      "Retrieved November 17, 2015 . ^ \"Teams \u2013 Pro Football Hall of Fame Official Site\" . www.profootballhof.com . Archived from the original on March 17, 2007 . Retrieved April 21, 2008 . ^ \"Jerome Bettis \u2013 Pro Football Hall of Fame Official Site\" . www.profootballhof.com . Archived from the original on April 23, 2021 . Retrieved August 9, 2015 . ^ \"Mel Blount \u2013 Pro Football Hall of Fame Official Site\" . www.profootballhof.com . Archived from the original on May 6, 2008 . Retrieved April 21, 2008 . ^ \"Terry Bradshaw \u2013 Pro Football Hall of Fame Official Site\" . www.profootballhof.com . Archived from the original on April 17, 2008 . Retrieved April 21, 2008 . ^ \"Jack Butler \u2013 Pro Football Hall of Fame Official Site\" . www.profootballhof.com . Archived from the original on April 23, 2021 . Retrieved February 5, 2012 . ^ \"Dermontti Dawson \u2013 Pro Football Hall of Fame Official Site\" . www.profootballhof.com . Archived from the original on January 21, 2009 . Retrieved February 5, 2012 . ^ \"Bill Dudley \u2013 Pro Football Hall of Fame Official Site\" . www.profootballhof.com . Archived from the original on October 7, 2008 . Retrieved April 21, 2008 . ^ \"Alan Faneca \u2013 Pro Football Hall of Fame Official Site\" . www.profootballhof.com . Archived from the original on February 14, 2021 . Retrieved February 7, 2021 . ^ \"Joe Greene \u2013 Pro Football Hall of Fame Official Site\" . www.profootballhof.com . Archived from the original on April 23, 2008 . Retrieved April 21, 2008 . ^ \"Jack Ham \u2013 Pro Football Hall of Fame Official Site\" . www.profootballhof.com . Archived from the original on February 20, 2009 . Retrieved April 21, 2008 . ^ \"Franco Harris \u2013 Pro Football Hall of Fame Official Site\" . www.profootballhof.com . Archived from the original on April 15, 2008 . Retrieved April 21, 2008 . ^ \"John Henry Johnson \u2013 Pro Football Hall of Fame Official Site\" . www.profootballhof.com . Archived from the original on February 18, 2009 . Retrieved April 21, 2008 . ^ \"Walt Kiesling \u2013 Pro Football Hall of",
      "instead re-creating the action in Pittsburgh after it came in over the teleprinter , usually an inning or so behind. After working solo for a decade, he was joined in the booth by Bob Prince in 1947; Prince would become the lead play-by-play man after Rowswell died in February 1955. [ 127 ] Prince's broadcasting style made him immensely popular with fans, and his almost 30-year run with the club coincided with the Pirates' rise to a championship-caliber team. [ 128 ] [ 129 ] Nicknamed \"The Gunner,\" Prince was known for his \"Gunnerisms\"\u2014nicknames and quips\u2014and created the Green Weenie in 1966. He also called the Pirates' championships in 1960 and 1971 as part of the national broadcast for NBC . Prince and his broadcast partner Nellie King were fired in 1975, which drew the ire of the Pirates' fanbase. Milo Hamilton and Lanny Frattare took over as the new broadcast team in 1976. Hamilton was unhappy in Pittsburgh; he didn't get along with Frattare and felt that he was being criticized for not being Bob Prince. [ 130 ] Hamilton left to join the Chicago Cubs after the 1979 season, and Frattare was elevated to the lead play-by-play announcer. Frattare would continue to call Pirate games through the 2008 season, becoming the longest tenured play-by-play man in team history. In turn, he was replaced by Tim Neverett , who called Pirate games from 2009 through 2015. [ 131 ] Former analysts include Don Hoak , Nelson Briles , and Jim Rooker . Former Pirate pitcher Steve Blass , who won Game 7 of the 1971 World Series, worked as a color analyst for the team from 1983 to 2019. [ 132 ] Figures with broadcasting resum\u00e9s [ edit ] Nellie Briles Steve Blass Joe Garagiola Ralph Kiner Bob Walk John Wehner See also [ edit ] Baseball portal Pittsburgh portal Pennsylvania portal List of Pittsburgh Pirates seasons Green Weenie References [ edit ] ^ \"Pirates Uniforms and Logos\" . Pirates.com . MLB Advanced Media . Retrieved June 22, 2019 . 1948: The team replaced the traditional blue and",
      "LeBeau Defensive backs coach Defensive coordinator 1992\u201394 1995\u201396, 2004\u201314 2024 [ 213 ] 83 Louis Lipps WR 1984\u201391 2021 [ 210 ] 95 Greg Lloyd LB 1988\u201397 2020 [ 209 ] 56 Ray Mansfield C 1964\u201376 2023 [ 212 ] 25 Ray Mathews HB E 1951\u201359 2022 [ 211 ] 15 Johnny \"Blood\" McNally FB Coach 1934, 1937\u201339 1937\u201339 2017 [ 206 ] 83 Heath Miller TE 2005\u201315 2022 [ 211 ] 72 Gerry Mullins G 1971\u201379 2023 [ 212 ] 81 Elbie Nickel TE 1947\u201357 2019 [ 208 ] \u2014 Chuck Noll Coach 1969\u201391 2017 [ 206 ] \u2014 Bill Nunn Scout Assistant Director Player Personnel Senior Scout 1968\u20132014 2018 [ 207 ] 39 Willie Parker RB 2004\u201309 2024 [ 213 ] 43 Troy Polamalu S 2003\u201314 2020 [ 209 ] \u2014 Art Rooney, Jr. Personnel Director Vice President 1965\u201386 1987\u2013present 2018 [ 207 ] \u2014 Art Rooney, Sr. Founder President Chairman of the Board 1933\u201388 2017 [ 206 ] \u2014 Dan Rooney, Sr. President Chairman 1955\u20132017 2017 [ 206 ] 34 Andy Russell LB 1963, 1966\u201376 2017 [ 206 ] 31 Donnie Shell S 1974\u201387 2017 [ 206 ] 91 Aaron Smith DE 1999\u20132011 2023 [ 212 ] 82 John Stallworth WR 1974\u201387 2017 [ 206 ] 70 Ernie Stautner DT 1950\u201363 2017 [ 206 ] 88 Lynn Swann WR 1974\u201382 2017 [ 206 ] 23 Mike Wagner S 1971\u201380 2020 [ 209 ] 86 Hines Ward WR 1998\u20132011 2019 [ 208 ] 52 Mike Webster C 1974\u201388 2017 [ 206 ] 78 Dwight White DE 1971\u201380 2020 [ 209 ] 26 Rod Woodson CB 1987\u201396 2017 [ 206 ] Coaches Main article: List of Pittsburgh Steelers head coaches The Steelers have had 16 coaches through their history. [ 214 ] They have cycled through the fewest head coaches in the modern NFL history. [ 215 ] Their first coach was Forrest Douds , who coached them to a 3\u20136\u20132 record in 1933 . Chuck Noll had the longest term as head coach with the Steelers; he is one of only four coaches to coach a single NFL team for 23 years. [ 6 ] Hired prior to the 2007 season , the Steelers current coach is Mike Tomlin . [ 216 ] Current staff Pittsburgh Steelers staff v t e Front office Owner/president \u2013 Art Rooney II Vice president \u2013 Art Rooney Jr. Vice president of player personnel \u2013",
      "Retrieved December 4, 2021 . ^ \"Steelers' former radio announcer Myron Cope dies at 79\" . NFL.com . February 27, 2008 . Retrieved August 19, 2024 . ^ \"Steelers Digest\" . Steelers Digest . January 1, 1970 . Retrieved August 4, 2024 . ^ Mueller, Chris (March 2, 2022). \"The strangest fact or story from every Super Bowl\" . Yardbarker . Retrieved July 30, 2024 ."
    ],
    "answer": "Bob Prince",
    "reference_answer": "Myron Cope"
  },
  {
    "question": "What organization did Logan Lee support with his cleats and why?",
    "context": [
      "It's special. \"People messaged me because I also helped raise money for Cystic Fibrosis this offseason, and people will tell me their child has CF and what it meant to them. It's moments like that, messages like that, that makes it all worth it.\"\n\nWith the foundation still rather new, Kuntz loves the opportunity to bring attention to it through his cleats. \"That is going to be cool, especially because it's my own foundation and something I am proud of,\" said Kuntz. \"Every guy that is out there wearing their cleats has a special place in their heart for why they are wearing their cleats and it's all for a good reason.\"\n\nLogan Lee Cause: Athletes in Action\n\nLogan Lee has a long connection with Athletes in Action, which includes taking part in a service trip to Ecuador through Iowa's Athletes in Action when he was a student-athlete there. Lee, along with more than a dozen other athletes, distributed water filters to 86 families without access to clean water. \"In the villages, they had running water, but it was like muddy, muddy water,\" said Lee at the time. \"Many of the people just drank straight from it.\"",
      "Highsmith has also been involved with bringing attention to IJM, a global organization that protects people in poverty from violence. They partner with local authorities in 16 countries to combat trafficking and slavery, violence against women and children and police abuse of power. \"This is an important issue today that's not talked about enough,\" said Highsmith. \"I wore my cleats for them last year and I wanted to do it again just because I think it's important to continue to raise awareness. It's still going on and something that still needs to be talked about.\"\n\nMiles Killebrew Cause: Caf\u00e9 Momentum",
      "URL: https://www.steelers.com/news/rookie-recap-logan-lee\n\nCONTENT:\n\nRookie Recap: Logan Lee\n\nSteelers.com\n\nWhen Logan Lee suffered a calf injury during the preseason, he never anticipated it would be a quick end to a rookie season that really never got going. But Lee, the Steelers sixth round pick from Iowa, just knew he would have to be patient, because everything happens for a reason. Instead of being on the field all season, Lee spent the year on the Reserve/Injured List, learning a different side of how things are in the NFL. \"I have just been extremely blessed with the opportunity to be able to see the way the business works and see that there are a lot of moving parts,\" said Lee. \"I got to see a different point of view in the sense that I obviously wanted to play football. That was my ultimate goal this year. But the Lord had different plans, and ultimately it worked out the best it could have. \"I'm just grateful for the opportunities, my blessing so far, and I'm looking forward to getting to work this offseason. \"The biggest thing for me this season was being out so much, I had a lot of time to take more notes, see things from a different point of view. And me personally, I do learn better when I am doing it physically. But it was a good opportunity for me to learn while not being able to get any walkthrough or physical reps. I think I took a big step there. \"My plan is not always going to be the one that wins out. I think I'm a faithful man and I truly believe the Lord's plan will always be better than my own. Based off of my goals and my intentions, I always set a plan, but I often get reminded that ultimately, I am not in control. I would say that the biggest thing for me this year was it was really hard at the beginning of the year, but I ended up starting to settle down once I understood there is a bigger picture. Everything happens for a reason and I'm just looking forward to that opportunity.\"",
      "Pittsburgh Steelers safety Ayo Oyelola (17) will showcase his custom cleats supporting Lives not Knives during Week 14 (Taylor Ollason/ Pittsburgh Steelers)\n\nPittsburgh Steelers safety Ayo Oyelola (17) will showcase his custom cleats supporting Lives not Knives during Week 14 (Alysa Rubin/ Pittsburgh Steelers)\n\nPittsburgh Steelers running back/kick returner Cordarrelle Patterson (84) will showcase his custom cleats supporting Pregnancy and Infant Loss during Week 14 (Alysa Rubin / Pittsburgh Steelers)\n\nPittsburgh Steelers cornerback James Pierre (42) will showcase his custom cleats supporting Glimmer of Hope during Week 14 (Taylor Ollason/ Pittsburgh Steelers)\n\nPittsburgh Steelers cornerback James Pierre (42) will showcase his custom cleats supporting Glimmer of Hope during Week 14 (Alysa Rubin/ Pittsburgh Steelers)\n\nPittsburgh Steelers cornerback Joey Porter Jr. (24) will showcase his custom cleats supporting Jasmine Nyree Center during Week 14 (Alysa Rubin/ Pittsburgh Steelers)\n\nPittsburgh Steelers linebacker Patrick Queen (6) will showcase his custom cleats supporting Tragedy Assistance Program for Survivors during Week 14 (Alysa Rubin / Pittsburgh Steelers)\n\nPittsburgh Steelers linebacker Elandon Roberts (50) will showcase his custom cleats supporting Healthy Start during Week 14 (Alysa Rubin/ Pittsburgh Steelers)\n\nPittsburgh Steelers linebacker Elandon Roberts (50) will showcase his custom cleats supporting Healthy Start during Week 14 (Alysa Rubin / Pittsburgh Steelers)\n\nPittsburgh Steelers tight end Darnell Washington (80) will showcase his custom cleats supporting Military Appreciation during Week 14 (Alysa Rubin / Pittsburgh Steelers)\n\nPittsburgh Steelers linebacker T.J. Watt (90) will showcase his custom cleats supporting UPMC Children's Hospital of Pittsburgh during Week 14 (Alysa Rubin/ Pittsburgh Steelers)",
      "In one word, everything,\" said Garrant. \"I am going to cry.\"\n\nShe paused for a few minutes, too choked up to talk. After composing herself, she continued to talk about her son Reid, who passed away in 2018 of leukemia at just 22-years old. \"It's pretty big,\" said Garrant. \"I miss my son. It happened so quickly when the whole leukemia thing happened. It was 16 hours from the time he was diagnosed until he died. It was crazy. \"My son Reid played with Pat and his brother, Timmy. My son was a senior when Pat was a freshman. We are from the same hometown, the same school. It just means so much.\"\n\nFreiermuth said he wanted to bring attention to Garrant and the foundation, hoping to help others battling the same disease, so he is wearing cleats to support them once again. \"It means a lot,\" said Freiermuth. \"Just being able to wear those cleats and put recognition to that foundation. Reid's mom has worked so hard to get her son's name out there. Being able to help in that process on a national stage like that is awesome. \"It is cool. The more eyes on the cleats, the better. That is what really helps the cause.\"\n\nOne of the things that touches Garrant's heart the most is that Reid was a Steelers fan his entire life and would have been overjoyed that Freiermuth was drafted by them. \"Reid's favorite team from the time he was born, he had no choice because of his dad, was the Steelers,\" said Garrant. \"He came out in black and gold. Pat doing this not only for his teammates, friends, family, our community and Reid's organization, it means so much. \"When he was drafted by the Steelers, it was a divine intervention. It means so much to me."
    ],
    "answer": "Athletes in Action",
    "reference_answer": "Lee supported Athletes in Action with his cleats because he was impacted by them in many ways and wanted to help bring words to those in the organization who had helped him grow in his faith."
  },
  {
    "question": "Which team will the Pittsburgh Pirates face on June 18, 2025?",
    "context": [
      "The teams played six games in 2020 as MLB instituted an abbreviated schedule focusing on regional match-ups. Beginning in 2023, the teams will play a three-game series each season as a result of the new \"balanced\" schedule. The Pirates lead the series 21\u201318. [ 64 ] Roster [ edit ] Pittsburgh Pirates 2025 spring training roster v t e 40-man roster Non-roster invitees Coaches/Other Pitchers 67 Braxton Ashcraft 51 David Bednar 53 Mike Burrows 6 Bailey Falter 64 Caleb Ferguson 0 Andrew Heaney 35 Colin Holderman 37 Jared Jones 23 Mitch Keller -- Justin Lawrence 18 Tim Mayza 50 Carmen Mlodzinski 66 Kyle Nicolas 60 Dennis Santana 84 Chase Shugart 30 Paul Skenes 44 Peter Strzelecki 34 Joey Wentz Catchers 14 Joey Bart 32 Henry Davis 55 Jason Delay 5 Endy Rodr\u00edguez Infielders 71 Tsung-Che Cheng 25 Billy Cook 15 Oneil Cruz 26 Adam Frazier 39 Nick Gonzales 13 Ke'Bryan Hayes 2 Spencer Horwitz 7 Isiah Kiner-Falefa 31 Liover Peguero 19 Jared Triolo 48 Enmanuel Valdez 38 Nick Yorke Outfielders 3 Ji-hwan Bae 22 Andrew McCutchen 77 Joshua Palacios 28 Tommy Pham 10 Bryan Reynolds 65 Jack Suwinski Pitchers 89 Hunter Barco 43 Ryan Borucki 57 Bubba Chandler 41 Carson Fulmer 78 Thomas Harrington 61 Isaac Mattson 27 Tanner Rainey 49 Yohan Ram\u00edrez 68 Yerry Rodr\u00edguez 80 Ryder Ryan 54 Burch Smith 75 Anthony Solometo 63 Hunter Stratton 79 Sean Sullivan 70 Eddy Yean Catchers 91 Omar Alfonzo 73 Abrahan Gutierrez 92 Aaron McKeithan Infielders 83 Jack Brannigan 85 Konnor Griffin 45 Darick Hall 81 Termarr Johnson 74 Malcom N\u00fa\u00f1ez 72 Alika Williams Outfielders 76 Matt Gorski 59 Bryce Johnson 46 Nick Solak 29 DJ Stewart Manager 17 Derek Shelton Coaches 16 Tarrik Brock (first base) 82 Jordan Comadena (bullpen catcher) 86 Radley Haddad (game planning/strategy) 12 Don Kelly (bench) 90 Raul Hernandez (bullpen catcher) 96 Mendy L\u00f3pez (infield) 47 Oscar Marin (pitching) 88 Christian Marrero (assistant hitting) 95 Stephen Morales (coach / translator) 87 Miguel P\u00e9rez (bullpen) 58 Mike Rabelo (third base) 56",
      "Louis Cardinals. JUN 30 2025, 1:00 PM MON. 15212, Pittsburgh, Pennsylvania, US. PNC Park. Prices from $25. St.",
      ", now white with camo green wordmarks, numbers, piping, and patches. [ 51 ] Ahead of the 2020 season , the Pirates revived the script \"Pittsburgh\" wordmarks on their gray road and new black alternate road jerseys, which were unveiled on January 24, 2020. Script wordmarks had previously been seen on the road jerseys from 1990 until 2000. The alternate road jersey also features a Pirate wearing a re-colored bandana, yellow to match the theme of the jersey, and is worn with a black cap featuring the \"P\" logo outlined in black and yellow. [ 52 ] In addition to these road uniforms, the Pirates continue to wear their white uniforms, the black alternate with the gold \"P\", and the camo alternate for games played at PNC Park. In 2023, the Pirates retired the camo home alternate to comply with the new \"4+1\" rule, restricting teams to a home, away, two alternate uniforms and a City Connect uniform. The Pirates continued to wear the camo cap on occasion with the home white uniform. They also unveiled their City Connect uniform, featuring a gold top and black pants with a gold \"P\" cap with black brim. The jersey itself features the abbreviation of Pittsburgh \"PGH\". A closer look of the jersey feature the Three Elements. The inverted \"Y\", representing the three rivers that meet in Pittsburgh ( Allegheny , Monongahela , and Ohio ). The astroid, or the diamond shape star represents the famous \"Steelmark\" logo and the Check or the Checkbox, represents the Seal of Pittsburgh. [ 53 ] Rivalries [ edit ] Philadelphia Phillies [ edit ] Main article: Phillies\u2013Pirates rivalry The rivalry between the Philadelphia Phillies and the Pirates was considered by some to be one of the best rivalries in the National League until 1994. [ 54 ] [ 55 ] [ 56 ] It began when the Pittsburgh Pirates entered the NL in 1887, four years after the Phillies. [ 57 ] The Phillies and the Pirates remained together after the National League split into two divisions in 1969. During the period of two-division play",
      "Date: 02/27/24\n\nDescription: CDylan Shockleyassigned to Pittsburgh Pirates. Date: 02/27/24\n\nDescription: 3BJackson Glennassigned to Pittsburgh Pirates. Date: 02/27/24\n\nDescription: SSJavier Rivasassigned to Pittsburgh Pirates. Date: 02/27/24\n\nDescription: OFLonnie White Jr.assigned to Pittsburgh Pirates. Date: 02/27/24\n\nDescription: RHPJ.C. Flowersassigned to Pittsburgh Pirates. Date: 02/26/24\n\nDescription: SSAaron Shackelfordassigned to Pittsburgh Pirates. Date: 02/26/24\n\nDescription: SSJesus Castilloassigned to Pittsburgh Pirates. Date: 02/26/24\n\nDescription: RHPChris Gauassigned to Pittsburgh Pirates. Date: 02/26/24\n\nDescription: RHPCameron Junkerroster status changed by Pittsburgh Pirates. Date: 02/26/24\n\nDescription: RHPCameron Junkerroster status changed by Pittsburgh Pirates. Date: 02/26/24\n\nDescription: RHPCameron Junkerassigned to Pittsburgh Pirates. Date: 02/25/24\n\nDescription: CFJase Bowenassigned to Pittsburgh Pirates. Date: 02/25/24\n\nDescription: CFHudson Headassigned to Pittsburgh Pirates. Date: 02/25/24\n\nDescription: CGrant Kochassigned to Pittsburgh Pirates. Date: 02/24/24\n\nDescription: OFTres Gonzalezroster status changed by Pittsburgh Pirates. Date: 02/24/24\n\nDescription: LHPCam Alldredassigned to Pittsburgh Pirates. Date: 02/24/24\n\nDescription: LHPNick Dombkowskiassigned to Pittsburgh Pirates. Date: 02/24/24\n\nDescription: RHPIsaac Mattsonassigned to Pittsburgh Pirates. Date: 02/24/24\n\nDescription: CFMatt Fraizerassigned to Pittsburgh Pirates. Date: 02/24/24\n\nDescription: RHPJustin Meisassigned to Pittsburgh Pirates. Date: 02/24/24\n\nDescription: OFSeth Beerassigned to Pittsburgh Pirates. Date: 02/24/24\n\nDescription: LHPNick Dombkowskiroster status changed by Pittsburgh Pirates. Date: 02/24/24\n\nDescription: LHPGeronimo Franzuaassigned to Pittsburgh Pirates. Date: 02/24/24\n\nDescription: OFTres Gonzalezassigned to Pittsburgh Pirates. Date: 02/24/24\n\nDescription: SSMike Jarvisassigned to Pittsburgh Pirates. Date: 02/20/24",
      "Event:\n\nTime: 7:05 pm EDT\n\nDate: Apr 2 (Wed)\n\nOpponent: Rays (TB)\n\nType: vs vs. Event:\n\nTime: 1:10 pm EDT\n\nDate: Apr 4 (Fri) Pirates home opener Opponent: Yankees (NYY) Type: vs vs. Event: Time: 4:12 pm EDT\n\nDate: Apr 5 (Sat)\n\nOpponent: Yankees (NYY)\n\nType: vs vs."
    ],
    "answer": "Louis Cardinals",
    "reference_answer": "The Pirates will face the Tigers (DET)."
  },
  {
    "question": "Question: Which team is the Pittsburgh Penguins playing on April 3, 2025?",
    "context": [
      "URL: https://www.nhl.com/penguins/news/game-preview-03-02-25-vs-toronto-maple-leafs\n\nTITLE: Game Preview: 03.02.25 vs. Toronto Maple Leafs | Pittsburgh Penguins\n\nCONTENT:\n\nThe Penguins take on the Toronto Maple Leafs at PPG Paints Arena. Puck drop is set for 1 PM, and doors open at 11:30 AM. This game will be available to watch on TNT and Max. Fans can listen to the game on 105.9 the X and on the Penguins app. Today, we are excited to celebrate Her Hockey Day presented by 84 Lumber, which aims to recognize the incredible passion of women fans during the NHL\u2019s Celebrating Women\u2019s History Month. In addition to information tables throughout the concourse, the game will feature a special Her Hockey Auction. Fans can text HERHOCKEY to 76278 or visit herhockey.givesmart.com today at 12 PM through March 10 at 12 PM to join the auction. All proceeds will support the Pittsburgh Pennies, a girls' ice hockey program established to increase the number of girls who play hockey and to promote gender equality in the sport. Team Records: PIT (24-28-9), TOR (37-20-2)\n\nThe Penguins have gone 21-14-3 in the last 38 games against the Maple Leafs. Pittsburgh is 5-2-0 in their last seven home games against Toronto dating back to Nov. 16, 2019. The Penguins have points in three of their last 5 home games (2-2-1). Related Links\n\nRecent News\n\nGame Notes",
      "first overall pick for the 2004 NHL entry draft ( Alexander Ovechkin ), which went to the Washington Capitals. However, Ovechkin's countryman, center Evgeni Malkin , was similarly highly regarded, and Pittsburgh took him with the second overall pick. However, a transfer dispute between the NHL and the International Ice Hockey Federation (IIHF) delayed his Pittsburgh debut. [ 22 ] By this point, the Penguins had collapsed financially since the Stanley Cup-winning years of the early 1990s. Their home venue, the Civic Arena, had become the oldest arena in the NHL, and Lemieux had tried unsuccessfully to cut a deal with the city for a new facility. With Pittsburgh uninterested in building a new hockey arena for the struggling Penguins, Lemieux began looking into the possibilities of selling or relocating the team to Kansas City, Missouri . [ 23 ] [ 24 ] [ 25 ] [ 26 ] A lockout prompted the cancellation of the 2004\u201305 NHL season . One of the many reasons for the lockout included disagreements on resolving the financial struggles of teams like the Penguins and the Ottawa Senators , which had filed for bankruptcy protection. [ 27 ] During the lockout, the Penguins' players dispersed between the club's American Hockey League (AHL) affiliate, the Wilkes-Barre/Scranton Penguins , and to European leagues. [ 6 ] Crosby\u2013Malkin era (2005\u2013present) Sidney Crosby during his sophomore season with the Penguins. He was drafted first overall by the team in the 2005 draft . With the lockout resolved in 2005, the NHL organized an unprecedented draft lottery to set the 2005 NHL entry draft selection order. The draft lottery, which was held behind closed doors in a \"secure location\", resulted in the Penguins being awarded the first overall pick. [ 28 ] [ 29 ] [ 30 ] Quebec Major Junior Hockey League (QMJHL) superstar Sidney Crosby (who had been training with Lemieux over the summer) [ 28 ] was the consensus first overall pick, with many referring to the draft lottery process as \"The Sidney",
      "^ Rorabaugh, Seth (May 15, 2022). \"Penguins drop Game 7 in overtime despite returns by Sidney Crosby, Tristan Jarry\" . TribLIVE.com . Retrieved May 16, 2022 . ^ Crosby, Wes (November 23, 2022). \"Penguins honor Malkin for 1,000 games with pregame ceremony\" . NHL.com . Retrieved April 5, 2023 . ^ \"Penguins to Honor Kris Letang's 1,000th Game Milestone on Sunday, April 2\" . NHL.com . April 2, 2023 . Retrieved April 5, 2023 . ^ Rosen, Dan (April 13, 2023). \"Penguins eliminated from playoff contention, 16-year postseason run ends\" . NHL.com . Retrieved April 12, 2023 . ^ \"Penguins fire president Burke, GM Hextall after missing playoffs\" . NHL.com . Retrieved June 4, 2023 . ^ \"Penguins hire Dubas as president of hockey operations\" . NHL.com . Retrieved June 4, 2023 . ^ Satriano, David (August 6, 2023). \"Karlsson goes to Penguins in 3-team trade with Sharks, Canadiens\" . NHL.com . Retrieved August 6, 2023 . ^ \"Canes Acquire Guentzel, Smith From Penguins\" . NHL.com . March 7, 2024 . Retrieved March 7, 2024 . ^ Guise, Michael (April 16, 2024). \"Pittsburgh Penguins to miss Stanley Cup Playoffs for second time in 2 years\" . CBS News (KDKA) . Retrieved April 16, 2024 . ^ Jump up to: a b c d e \"Penguins Uniform History\" . National Hockey League . August 13, 2018. Archived from the original on May 9, 2018 . Retrieved May 8, 2018 .",
      "Retrieved January 16, 2016 . ^ \"Penguins top Lightning 2\u20131 to advance to Stanley Cup final\" . Associated Press . May 26, 2016. Archived from the original on March 30, 2019 . Retrieved January 27, 2019 .",
      "URL: https://en.wikipedia.org/wiki/Pittsburgh_Penguins\n\nTITLE: Pittsburgh_Penguins\n\nCONTENT:"
    ],
    "answer": "Toronto Maple Leafs",
    "reference_answer": "The Blues."
  },
  {
    "question": "Question: Which team is the Pittsburgh Pirates playing on April 1, 2025?",
    "context": [
      "The teams played six games in 2020 as MLB instituted an abbreviated schedule focusing on regional match-ups. Beginning in 2023, the teams will play a three-game series each season as a result of the new \"balanced\" schedule. The Pirates lead the series 21\u201318. [ 64 ] Roster [ edit ] Pittsburgh Pirates 2025 spring training roster v t e 40-man roster Non-roster invitees Coaches/Other Pitchers 67 Braxton Ashcraft 51 David Bednar 53 Mike Burrows 6 Bailey Falter 64 Caleb Ferguson 0 Andrew Heaney 35 Colin Holderman 37 Jared Jones 23 Mitch Keller -- Justin Lawrence 18 Tim Mayza 50 Carmen Mlodzinski 66 Kyle Nicolas 60 Dennis Santana 84 Chase Shugart 30 Paul Skenes 44 Peter Strzelecki 34 Joey Wentz Catchers 14 Joey Bart 32 Henry Davis 55 Jason Delay 5 Endy Rodr\u00edguez Infielders 71 Tsung-Che Cheng 25 Billy Cook 15 Oneil Cruz 26 Adam Frazier 39 Nick Gonzales 13 Ke'Bryan Hayes 2 Spencer Horwitz 7 Isiah Kiner-Falefa 31 Liover Peguero 19 Jared Triolo 48 Enmanuel Valdez 38 Nick Yorke Outfielders 3 Ji-hwan Bae 22 Andrew McCutchen 77 Joshua Palacios 28 Tommy Pham 10 Bryan Reynolds 65 Jack Suwinski Pitchers 89 Hunter Barco 43 Ryan Borucki 57 Bubba Chandler 41 Carson Fulmer 78 Thomas Harrington 61 Isaac Mattson 27 Tanner Rainey 49 Yohan Ram\u00edrez 68 Yerry Rodr\u00edguez 80 Ryder Ryan 54 Burch Smith 75 Anthony Solometo 63 Hunter Stratton 79 Sean Sullivan 70 Eddy Yean Catchers 91 Omar Alfonzo 73 Abrahan Gutierrez 92 Aaron McKeithan Infielders 83 Jack Brannigan 85 Konnor Griffin 45 Darick Hall 81 Termarr Johnson 74 Malcom N\u00fa\u00f1ez 72 Alika Williams Outfielders 76 Matt Gorski 59 Bryce Johnson 46 Nick Solak 29 DJ Stewart Manager 17 Derek Shelton Coaches 16 Tarrik Brock (first base) 82 Jordan Comadena (bullpen catcher) 86 Radley Haddad (game planning/strategy) 12 Don Kelly (bench) 90 Raul Hernandez (bullpen catcher) 96 Mendy L\u00f3pez (infield) 47 Oscar Marin (pitching) 88 Christian Marrero (assistant hitting) 95 Stephen Morales (coach / translator) 87 Miguel P\u00e9rez (bullpen) 58 Mike Rabelo (third base) 56",
      "Louis Cardinals. JUL 01 2025, 1:00 PM TUE. 15212, Pittsburgh, Pennsylvania, US. PNC Park. Prices from $25. St.",
      "URL: https://en.wikipedia.org/wiki/Pittsburgh_Pirates\n\nTITLE: Pittsburgh_Pirates\n\nCONTENT:",
      "Event:\n\nOutcome: W,\n\nDate: Feb 24 (Mon) Canceled: Inclement Weather Opponent: Phillies (PHI) Type: vs vs. Event: Outcome: T,\n\nDate: Feb 25 (Tue)\n\nOpponent: Braves (ATL)\n\nType: vs vs. Event:\n\nOutcome: L,\n\nDate: Feb 26 (Wed)\n\nOpponent: Braves (ATL)\n\nType: vs vs. Event:\n\nOutcome: L,\n\nDate: Feb 26 (Wed)\n\nOpponent: Orioles (BAL)\n\nType: vs vs. Event:\n\nOutcome: W,\n\nDate: Feb 27 (Thu)\n\nOpponent: Twins (MIN)\n\nType: vs vs. Event:\n\nOutcome: W,\n\nDate: Feb 28 (Fri)\n\nOpponent: Rays (TB)\n\nType: vs vs. Event:\n\nOutcome: W,\n\n=== 03/2025 ===\n\nDate: Mar 10 (Mon)\n\nOpponent: Orioles (BAL)\n\nType: vs vs. Event:\n\nTime: 6:05 pm EDT\n\nDate: Mar 11 (Tue)\n\nOpponent: Yankees (NYY)\n\nType: vs vs.",
      "Pirates seasons Green Weenie References [ edit ] ^ \"Pirates Uniforms and Logos\" . Pirates.com . MLB Advanced Media . Retrieved June 22, 2019 . 1948: The team replaced the traditional blue and red with the present day black and gold. ^ Berry, Adam (January 8, 2021). \"Why Pittsburgh's teams wear black and gold\" . Pirates.com . MLB Advanced Media . Retrieved January 11, 2021 . ^ Castrovince, Anthony (May 17, 2019). \"Players poll: Who has MLB's best uniforms?\" . MLB.com . MLB Advanced Media . Retrieved June 22, 2019 . The Steel City's steadiness in team tints is something to be celebrated. Be it on the ice at PPG Paints Arena, on the gridiron at Heinz Field or within the picture-perfect confines of PNC Park, Pittsburgh is bathed in black and gold. And because even the most garish styles tend to go and come around again, the bumblebee yellow jerseys, striped black pants and pillbox-style hats of the 1970s made a recent return as the go-to Sunday throwbacks. ^ \"Front Office Directory\" . Pirates.com . MLB Advanced Media . Retrieved April 16, 2023 . ^ \"Most consecutive Major League Baseball losing seasons, team\" . GuinnessWorldRecords.com . December 24, 2012 ."
    ],
    "answer": "the Pittsburgh Pirates",
    "reference_answer": "The Rays."
  },
  {
    "question": "Question: Which kind of injury happened to Tommy Novak on Sun Mar 9 2025?",
    "context": [
      "According to the initial police report, a\u00a0male victim was answering the front\u00a0door of the house and was shot as he walked onto the\u00a0porch. The victim suffered a gunshot wound to the ankle and was transported to the hospital in stable condition. Other people were inside the residence\u00a0at the time of the shooting but\u00a0were not injured. The investigation continues.",
      "Event: First Full Squad Workout\n\nDate: Feb 22 (Sat)\n\nOpponent: Orioles (BAL)\n\nType: vs vs. Event:\n\nOutcome: W,\n\nDate: Feb 23 (Sun)\n\nOpponent: Twins (MIN)\n\nType: vs vs.",
      "It's exciting. I'm excited to get going, for sure.\u201d\n\nTommy Novak is ready to get started \ud83d\udc4f pic.twitter.com/d1dZtruMht\n\nNovak adds some center depth to the group, lining up in the middle behind Sidney Crosby and Evgeni Malkin, with Danton Heinen on his left and Emil Bemstrom on his right in Pittsburgh\u2019s 4-0 loss ( full recap here ). \u201cYou can see the skill level he has,\u201d Head Coach Mike Sullivan said. \u201cHe gets a Grade-A look on a 2-on-1. Just misses his mark. But he made a few plays. He has good tight-area skills. I think he skates well. There\u2019s a lot to like there.\u201d\n\nPittsburgh\u2019s Hockey Operations group was thrilled to bring Novak into the mix. At 27 years old, he\u2019s a younger member of this particular group. He has good size at 6-1 and 179 pounds, and produced some solid campaigns in Nashville, who drafted him in the third round back in 2015. After four years of college hockey at Minnesota, Novak made his NHL debut in 2021. Since then, only three Predators have scored more goals or notched more points than Novak. His best season came during the 2023-24 campaign where he set career highs across the board in goals (18), assists (27) and points (45). While this year has been a relatively down one for Novak, he still picked up 13 goals in 52 games before the trade. \u201cI think as a puck carrier, I see the ice well and try to make plays offensively,\u201d Novak said. \u201cThis year, it's been a little hard to come by, but I think just making plays offensively, I move my feet, get my feet into it, and just try to create some chances for my teammates and for myself.\u201d",
      "Survive. Keep in mind, this is a guy who had to fight back from a torn ACL while in college at Purdue. And it's the same guy who lost his father, Cory Trice, Sr., who was shot and killed when his son was just 10 years old. If he survived that, he could get through anything.",
      "Jacob Martin, 24, of Highland Park\n\nJesse Groves, 24, of Bloomfield\n\nMichael Peterson, 25, of Larimer\n\nNoah Wilkerson, 24, of Morningside\n\nFOR IMMEDIATE RELEASE\n\nPITTSBURGH, PA (April 26, 2018) - Around 8:36 p.m. Zone 3 officers were dispatched to the 400 block of Woodruff Street for an accident involving a motorcycle and a vehicle. According to the initial police report, the operator of the\u00a0motorcycle\u00a0was heading northbound on Woodruff Street when he apparently crossed into oncoming traffic and collided with a car. The motorcycle driver was thrown from the bike onto the road. The\u00a0motorcyclist\u00a0suffered\u00a0numerous injuries and was\u00a0transported to UPMC Mercy hospital in critical condition. One person inside the vehicle was\u00a0evaluated and treated by medics on the scene for minor injuries."
    ],
    "answer": "torn ACL",
    "reference_answer": "Lower Body."
  },
  {
    "question": "When did Carnegie Museums in Pittsburgh become known as \"The Carnegie\"?",
    "context": [
      "URL: https://carnegiemuseums.org/about-us/our-history\n\nTITLE: Our History - Carnegie Museums of Pittsburgh\n\nCONTENT:\n\nOur History\n\n>\n\nThe history of Carnegie Museums is bookended by two periods of fantastic growth and diversification. It all started in November of 1895 with the founding of Carnegie Institute, known today as Carnegie Museums of Pittsburgh. Andrew Carnegie called the original Oakland building\u2014which included Carnegie Library of Pittsburgh\u2014his \u201cmonument,\u201d and he considered it the chief satisfaction of his life. That\u2019s saying a lot, considering that this son of a poor Scottish weaver grew up to become one of the world\u2019s most successful entrepreneurs and philanthropists. A year later, Carnegie Museums held the first Carnegie International , second only to the Venice Biennale as the world\u2019s oldest and most prestigious international exhibition of contemporary art, and the museum\u2019s collection of art quickly grew as a result. Two years later, in response to news that the bones of \u201ccolossal\u201d prehistoric creatures were being found out west, Carnegie sent a scientific crew to Wyoming, where they would discover the first of many world-famous dinosaurs. The first Carnegie International , 1896",
      "Museum: Carnegie_Museum_of_Art",
      "Pittsburgh long has been one of the nation\u2019s largest inland ports, and it remains a leading transportation centre. By Chick-fil-A\n\nMuch of the Golden Triangle has been rebuilt and includes Point State Park (containing Fort Pitt Blockhouse and Fort Pitt Museum), the Gateway Center (site of several skyscrapers and a garden), and the David L. Lawrence Convention Center. The University of Pittsburgh was chartered in 1787. Other educational institutions include Carnegie Mellon (1900), Duquesne (1878), Point Park (1960), Chatham (1869), and Carlow (1929) universities and two campuses of the Community College of Allegheny County (1966). Central to the city\u2019s cultural life is the Carnegie Museums of Pittsburgh (formerly Carnegie Institute), an umbrella organization consisting of a number of institutions. Its museums include those for the fine arts and natural history (both founded in 1895), the Carnegie Science Center (1991), which now also houses the Henry Buhl, Jr., Planetarium and Observatory (1939), and the Andy Warhol Museum (1994), which exhibits the works of the Pittsburgh-born artist and filmmaker. Other institutions affiliated with the organization are the Carnegie Library of Pittsburgh, which contains more than 3.3 million volumes, and the Carnegie Music Hall.",
      "URL: https://carnegiemuseums.org/carnegie-magazine/carnegie-magazine-archive\n\nTITLE: Carnegie magazine Archive - Carnegie Museums of Pittsburgh\n\nCONTENT:\n\nCarnegie magazine Archive\n\nWe\u2019ve been publishing the amazing stories of Carnegie Museums since 1927. Originally titled the Bulletin of the Carnegie Institute , today\u2019s Carnegie magazine is delivered quarterly and brings the wonder, fun, and creativity of the four Carnegie Museums to the doorsteps of our 35,000 member and donor households. The magazine office and Carnegie Library of Pittsburgh maintain a complete archive dating back to 1927. An online archive is available starting in 1996 . For inquiries, contact carnegiemagazine@carnegiemuseums.org . Winter 2024\n\nFall 2024\n\nSummer 2024\n\nSpring 2024\n\nWinter 2023\n\nFall 2023\n\nSummer 2023\n\nSpring 2023\n\nWinter 2022\n\nFall 2022\n\nSummer 2022\n\nSpring 2022\n\nWinter 2021\n\nFall 2021\n\nSummer 2021\n\nSpring 2021\n\nWinter 2020\n\nFall 2020\n\nSummer 2020\n\nSpring 2020\n\nWinter 2019\n\nFall 2019\n\nSummer 2019\n\nSpring 2019\n\nWinter 2018\n\nFall 2018\n\nSummer 2018\n\nSpring 2018\n\nWinter 2017\n\nFall 2017\n\nSummer 2017\n\nSpring 2017\n\nPast Issues\n\n2016\n\n2015\n\n2014\n\n2013\n\n2012\n\n2011\n\n2010\n\n2009\n\n2008\n\n2007\n\n2006\n\n2005\n\n2004\n\n2003\n\n2002\n\n2001\n\n2000\n\n1999\n\n1998\n\n1997\n\n1996\n\n================================================================================\n\nURL: https://carnegiemuseums.org/carnegie-magazine/contact-us\n\nTITLE: Contact Us - Carnegie Museums of Pittsburgh\n\nCONTENT:\n\nContact Us\n\nWe\u2019re waiting to hear from you. Do you have feedback on a story or an idea for a future issue? Write to us at carnegiemagazine@carnegiemuseums.org or Carnegie magazine 4400 Forbes Avenue Pittsburgh, PA 15213\n\nOr Call Us:\n\nMike Kainaroi Art Director 412.578.2244\n\nPlease send ADDRESS CHANGES to: membership@carnegiemuseums.org Or Membership Department 4400 Forbes Avenue Pittsburgh, PA 15213\n\n================================================================================",
      "J. Holland, LL.D., \"The Carnegie Museum\", in Popular Science , May 1901. ^ Jump up to: a b About Carnegie Museum of Art: History Archived October 13, 2008, at the Wayback Machine ^ Memorial of the celebration of the Carnegie Institute at Pittsburgh, Pa., April 11, 12, 13, 1907. ^ Ellen S. Wilson, \"The Continuing History of the Scaife Galleries\", in Carnegie Online , July/August 2003 \"Carnegie Online\" . Archived from the original on 2008-09-07 ."
    ],
    "answer": "1895",
    "reference_answer": "The name \"The Carnegie\" was adopted for Carnegie Museums in Pittsburgh in 1986."
  },
  {
    "question": "When was the exhibition of Gertrude Abercrombie's works held at the museum?",
    "context": [
      "More than 80 ancient Egyptian objects\n\nEvery Egyptian object in the museum\u2019s care has stories to tell, about its creation and original use, its journey to Pittsburgh, and about the lives of those in ancient Egypt. The Stories We Keep invites visitors to see these objects\u2014cared for by the Museum for more than a century\u2014in a new light and to witness the work that will preserve them for future generations. Jan. 18\u2013June 1\n\nGertrude Abercrombie: The Whole World Is a Mystery\n\nFeaturing loans from important institutional and private collections, this exhibition is the most comprehensive museum presentation of the works of Gertrude Abercrombie, a critical figure in the mid-20th-century Chicago art scene from the 1930s until her death in 1977. Through Aug.",
      "Museum: Elmer_H._Grimm_Sr._Pharmacy_Museum",
      "After her husband\u2019s death in 1919, Adelaide divided her time between their New York home (now The Frick Collection), their summer home Eagle Rock, and their Pittsburgh home, Clayton. Upon her death, October 4, 1931, her daughter Helen inherited the Pittsburgh home and the summer home and its contents. ================================================================================",
      "Museum: Frick_Fine_Arts_Building#University_Arts_Gallery",
      "1930, Carnegie Museum of Art, Gift of Mr. and Mrs."
    ],
    "answer": "Jan. 18\u2013June 1",
    "reference_answer": "The exhibition of Gertrude Abercrombie's works was held at the museum from Jan. 18 to June 1."
  },
  {
    "question": "What did Tosca use to kill Scarpia?",
    "context": [
      "the soldiers fire and depart. Tosca urges Mario to hurry, but when he fails to move, she discovers that Scarpia's treachery has transcended the grave\u2014the bullets were real. When Spoletta rushes in to arrest Tosca for Scarpia's murder, she cries to Scarpia to meet her before God, then leaps to her death. Adapted from Opera News",
      "================================================================================\n\nURL: https://pittsburghrestaurantweek.com/restaurants/winter-2021-restaurants/scarpino TITLE: Scarpino \u2013 Pittsburgh Restaurant Week CONTENT: Scarpino Scarpino Restaurant Week Special Menu: $40.21 Dinner Dine-In First Course: Choose one of following Arancini Saffron, Goat Cheese, Rosemary, Red Sauce Scarpino Salad Radicchio, Endive, Arugula, Pepperoncini, Cured Tomato, Pecorino, Lemon Caper Vinaigrette Calamari Frito Red Sauce, Roasted Giardiniera Hand Pulled Mozzarella Oil Cured Tomatoes, Bagna Cauda, Basil, Crostini Second Course: Choose one of following Pasquale Parmesean Pennsylvania Amish Chicken, mozzarella, basil, cured tomato, provolone picante, bucatini, arugula Cacio Pepe Bucatini, Pecorino, Ricotta Whey, Smoked Pepper Veal Ossobucco Veal Shank, Red Wine, Tomato, Carrot, Parmesan White Corn Polenta Third Course: Choose one of the following Zeppole Mascarpone and Ricotta Canoli Cream, Chocolate, Pistachio Moscato Berries Macerated Mix Berries, Chocolate, Sweet Cream\n\n================================================================================\n\nURL: https://pittsburghrestaurantweek.com/restaurants/winter-2021-restaurants/senti-restaurant TITLE: Senti Restaurant \u2013 Pittsburgh Restaurant Week CONTENT: Senti Restaurant Senti Restaurant Restaurant Week Special: $40.21 Dinner, Dine-In or Takeout APPETIZER Tomato Bisque Soup Brussel Sprout Salad caesar dressing ENTREE Spaghetti al Pomodoro tomato, basil Pork Ossobuco mash potatoes, gremolada DESSERT Tiramisu mascapone cream, espresso, lady fingers Olive Oil Almond Cake (GF) carmelized orange slice, vanilla ice cream\n\n================================================================================",
      "Scene 1: A dark, forbidding grove, with a large myrtle tree. Rinaldo, aware that the myrtle tree holds the secret to Armida\u2019s powers, enters the grove to destroy it. Zelmira and a group of nymphs appear, attempting to persuade him to return to Armida. As Rinaldo raises his weapon to strike the myrtle, a disheveled Armida emerges from the tree and confronts him. Unable to kill Rinaldo despite her fury, she watches as he strikes the tree, causing the magic wood to fall lifeless. As Rinaldo tries to escape, he declares to still love her. Armida, consumed by fury, turns into a monster of rage, destroying all in her path. Courtesy of Pinchgut Opera\n\nDETAILS & RESOURCES\n\nWe want you to have the best experience possible at our performances!",
      "Also visit ourOpera FAQsor ourAccessibility page. CHILD POLICY:\n\nPREVIEWS & REVIEWS\n\nBENEDUM SAFETY AND SECURITY STATEMENT\n\nThe Pittsburgh Cultural Trust has implemented new security and bag policies, effective starting October 1, 2016, at the Benedum Center and their other venues. You can\u00a0read theirSafety & Security statement, which includes anupdated list of prohibited items,\u00a0andread their Bag Policy, ontheir website. TOSCA | Pittsburgh Opera\n\nTOSCA\n\nMusic by Giacomo PucciniLibretto by Luigi Illica and Giuseppe Giacosa \u2022 OCTOBER 5, 8, 11, 13, 2024\n\nShe lived for art. Would she die for love?When painter Cavaradossi\u2014the lover of Rome\u2019s enchanting diva Floria Tosca\u2014decides to harbor a fugitive of the law, he makes himself and his beloved Tosca a target of the corrupt Chief of Police, Baron Scarpia. Now it is up to Tosca to free both her lover and herself from Scarpia\u2019s clutches by making a horrific bargain that will have consequences for them all.Puccini\u2019s whirlwind political thriller packs high romance, dark motives, love, betrayal, murder, and intrigue all into a plot that unfolds over only 24 hours. See why Tosca is one of the most powerful operas ever written.These performances are sponsored in part\u00a0by The Gailliot Fund. (photo credit: David Bachman)\n\n(photo credit: David Bachman)\n\n(photo credit: David Bachman)\n\n(photo credit: David Bachman)\n\n(photo credit: David Bachman)\n\n(photo credit: David Bachman)\n\n(photo credit: David Bachman)\n\nPERFORMANCE DATES/TIMES/LOCATION\n\nWhere:Benedum Center, at the corner of 7th Street and Penn Ave, downtown Pittsburgh\n\nWhen:\n\nCAST AND ARTISTIC TEAM\n\nFloria Tosca:Ana Mar\u00eda Mart\u00ednez+\n\nMario Cavaradossi:Jonathan Burton\n\nBaron Scarpia:Kyle Albertson\n\nCesare Angelotti:Erik Nordstrom*+\n\nSpoletta:Fran Daniel Laucerica*\n\nSacristan:Brian Kontes\n\nSciarrone:Matthew Soibelman*+\n\nShepherd boy:Shannon Crowley*+\n\nJailer: J. Patrick McGill",
      "Iphig\u00e9nie tries repeatedly to perform the sacrifice, but she cannot bring herself to harm the stranger and cries out angrily against Diane (\u201cJe t\u2019implore et je tremble\u201d). Oreste is brought in (\u201cQue ces regrets touchant\u201d). Touched by Iphig\u00e9nie\u2019s sadness and her concern for him, he tries to encourage her to do her duty, calling out in the final moment, \u201cIphig\u00e9nie, beloved sister, thus also did you perish at Aulide.\u201d Sister and brother realize the truth. Thoas bursts in: Iphig\u00e9nie\u2019s plot has been discovered. He orders the Greek killed immediately and is about to sacrifice Oreste himself when Pylade returns with Greek soldiers to save his friend. Thoas is killed in the fray, which is halted when Diane herself appears to pardon Oreste, set the Greek women free, and send prince and princess home to Myc\u00e8ne\u2014and the first happiness they have known since before the Greeks set sail for Troy. (excerpt from the Metropolitan Opera)\n\nPREVIEWS AND REVIEWS\n\nVIDEO EXCERPTS\n\nEnjoy these video excerpts of our production ofIphig\u00e9nie en Tauride. Videos created and edited by RLG Creations unless otherwise noted. View all ourIphig\u00e9nie en Tauridevideo excerpts onour special\u00a0YouTube playlist. Find out what opera goers have to say about the opening night performance. Video editing by Abbie Whitehurst; performance video by RLG Creations; photos by David Bachman Photography; audience interviews filmed by Chris Cox. 'Dark forebodings and endless terror' oppress the soul of Thoas, the King of Scythia (Evan Lazdowski). Pylade (Fran Daniel Laucerica) tries to console Oreste (Brandon Bell) about the deadly fate which awaits them."
    ],
    "answer": "bullets",
    "reference_answer": "Tosca used a knife to kill Scarpia.Context: The Carnegie Museum of Natural History in Pittsburgh, Pennsylvania, was founded by Andrew Carnegie in 1896. The museum is home to a diverse collection of artifacts, including the first known dinosaur eggs in the Western Hemisphere. The museum also has a significant collection of fossils, including the largest T. rex skull ever discovered. The museum was designed by architects Brinton C. Davis and Henry Hornbostel. The Carnegie Museum of Natural History is a part of the Carnegie Museums of Pittsburgh."
  },
  {
    "question": "When was the Carnegie Museum of Natural History founded?",
    "context": [
      "Museum: Carnegie_Museum_of_Natural_History",
      "URL: https://carnegiemuseums.org/about-us/our-history\n\nTITLE: Our History - Carnegie Museums of Pittsburgh\n\nCONTENT:\n\nOur History\n\n>\n\nThe history of Carnegie Museums is bookended by two periods of fantastic growth and diversification. It all started in November of 1895 with the founding of Carnegie Institute, known today as Carnegie Museums of Pittsburgh. Andrew Carnegie called the original Oakland building\u2014which included Carnegie Library of Pittsburgh\u2014his \u201cmonument,\u201d and he considered it the chief satisfaction of his life. That\u2019s saying a lot, considering that this son of a poor Scottish weaver grew up to become one of the world\u2019s most successful entrepreneurs and philanthropists. A year later, Carnegie Museums held the first Carnegie International , second only to the Venice Biennale as the world\u2019s oldest and most prestigious international exhibition of contemporary art, and the museum\u2019s collection of art quickly grew as a result. Two years later, in response to news that the bones of \u201ccolossal\u201d prehistoric creatures were being found out west, Carnegie sent a scientific crew to Wyoming, where they would discover the first of many world-famous dinosaurs. The first Carnegie International , 1896",
      "\u201cIt seems very doubtful to me that any other institution would have then molded the entire composite skeleton and distributed the resulting replicas to 10 or so prominent museums throughout Europe and Latin America,\u201d he says. \u201cFor one thing, that required financial support that very few, if any, other institutions had at the time, or even today.\u201d\n\nNot to mention Carnegie\u2019s chance meeting with the king of England. \u201cI highly doubt that many other natural history museum founders were hosting powerful monarchs at their personal residences in 1902,\u201d Lamanna says. Support the museum\u2019s paleontology research with a gift. Receive more stories in your email\n\nTags:\n\n================================================================================\n\nURL: https://carnegiemuseums.org/carnegie-magazine/winter-2020/125-years-objects-stories\n\nTITLE: 125 Years: A History in Objects - Carnegie Museums of Pittsburgh\n\nCONTENT:\n\n125 Years: A History in Objects\n\nAndy Warhol\u2019s dental molds and a shot of homemade lightning. And the dinosaur and the painting that started it all. To celebrate 125 years of Carnegie Museums, Carnegie magazine published the stories of 125 iconic, quirky, and sometimes little-known pieces of museum history\u201425 objects at a time throughout our anniversary year. Explore the tales of these unique wonders of art, science, and the natural world, as well as a few other unforgettable markers of Carnegie Museums past and present\u2014randomly, by museum, or by object type. |\n\nText Size:\n\nSelect objects by thumbnail or filter objects\n\nDinosaur Hall\u2019s T. rex Mural",
      "and Carole L. Kamin Director of Carnegie Museum of Natural History. In conversation with the manager of the Buhl Planetarium & Observatory. In conversation with the chair of the Carnegie Museums of Pittsburgh\u2019s Board of Trustees\n\nIn conversation with Carnegie Museum of Art\u2019s director of education and public programs. ================================================================================\n\nURL: https://carnegiemuseums.org/tag/science-nature\n\nTITLE: Science & Nature Archives - Carnegie Museums of Pittsburgh\n\nCONTENT:\n\nTag: Science & Nature\n\nThe job of a museum curator has never been more complex\u2014or interesting. A new exhibition honors ongoing cultural traditions of the Quapaw Nation and its deepening relationship with Carnegie Museum of Natural History. Carnegie Museums is home to some of the most significant collections in the world. Here we showcase some of the most compelling objects. A new perspective on familiar offerings at Carnegie Museums. How a transformative $65 million gift from Dan and Carole Kamin is bolstering Carnegie Science Center\u2019s plans to become a top-tier leader in community-based science. Dan and Carole Kamin have a long history with Carnegie Museums, but their relationship with Carnegie Science Center Director Jason Brown began a little over five years ago at a garden party. It was May 2019, and Carole\u2019s famous tulips were in bloom. Brown, who had recently been named as the Science Center\u2019s director, was \u2026 Continued\n\nThe Science Center\u2019s popular sub is now one of Pittsburgh\u2019s most popular escape rooms. Fascinated by outer space, one couple wants to keep inspiring young people to look at stars. In conversation with the director of collections care and access at Carnegie Museum of Natural History. ================================================================================\n\nURL: https://carnegiemuseums.org/tag/stem\n\nTITLE: STEM Archives - Carnegie Museums of Pittsburgh\n\nCONTENT:\n\nTag: STEM",
      "by traveling to schools all around western Pennsylvania. The museum gained prominence in 1899 when its scientists unearthed the fossils of Diplodocus carnegii . [ 1 ] Notable dinosaur specimens include one of the world's very few fossils of a juvenile Apatosaurus , the world's first specimen of a Tyrannosaurus rex , [ 2 ] and a recently identified species of oviraptorosaur named Anzu wyliei . [ 3 ] Research teams including former Carnegie scientists made critical discoveries such as Puijila darwini , Castorocauda lutrasimilis , and Hadrocodium wui . Portion of the dinosaur exhibit. Fossil fish Fossil specimen of Anaethalion knorri from the Solnhofen limestone Mummies from the Walton Hall of Ancient Egypt. Other major exhibits include Hillman Hall of Minerals and Gems , Alcoa Foundation Hall of American Indians, Polar World: Wyckoff Hall of Arctic Life, Walton Hall of Ancient Egypt, Benedum Hall of Geology, Dinosaurs in Their Time, and Powdermill Nature Reserve , established by the museum in 1956 to serve as a field station for long-term studies of natural populations. The museum's active curatorial departments are: Anthropology , Birds , Botany , Herpetology ( Amphibians & Reptiles ), Invertebrate Paleontology , Invertebrate Zoology , Mammals , Minerals , Mollusks ( Malacology ), and Vertebrate Paleontology . These departments work collaboratively under strategic centers created to re-frame how the museum leverages its research, exhibitions, and public programming to meet the challenges and issues of today. In late 2013, however, the museum's parent organization and interim administration eliminated multiple scientific positions, seriously reducing its capacity to conduct original research. Scientific publications [ edit ] Gift shop inside Carnegie Museum of Natural History Carnegie Museum of Natural History publishes scholarly journals and books including Annals of Carnegie Museum , which offers peer-reviewed articles in organismal biology, earth sciences, and"
    ],
    "answer": "1895",
    "reference_answer": "The Carnegie Museum of Natural History was founded in 1896."
  },
  {
    "question": "When was the plans for the Pittsburgh Glass Center changed from Elizabeth, Pennsylvania to Pittsburgh?",
    "context": [
      "Glass gallery in Pittsburgh, Pennsylvania Pittsburgh Glass Center Pittsburgh Glass Center logo Location within Pittsburgh Established 2001 [ 1 ] Location 5472 Penn Avenue Pittsburgh, Pennsylvania 15206 Coordinates 40\u00b027\u203251\u2033N 79\u00b055\u203259\u2033W \ufeff / \ufeff 40.464187\u00b0N 79.932919\u00b0W \ufeff / 40.464187; -79.932919 Website www .pittsburghglasscenter .org The Pittsburgh Glass Center is a gallery, glass studio, and public-access school dedicated to teaching, creating and promoting studio glass art. [ 1 ] [ 2 ] It is located on Penn Avenue in the Friendship neighborhood of Pittsburgh . It has features works by Paul Joseph Stankard and classes taught by Dante Marioni , Davide Salvadore, and Cesare Toffolo. [ 3 ] The origins of the Pittsburgh Glass Center date to 1991, when David Stephens, then visual-arts officer of the Pennsylvania Council on the Arts , approached glass artists Ron Desmett and Kathleen Mulcahy, then a professor at Carnegie Mellon University , about the idea of a center for studio glass. [ 3 ] It was originally to have been the Elizabeth Glass Center in Elizabeth, Pennsylvania . [ 4 ] However, by 1999, the plans had changed and the center was re-oriented to Pittsburgh. [ 4 ] It was officially opened in 2001. [ 1 ] The current facility in Friendship is LEED-certified . [ 5 ] Its development has aided the growth of Garfield , especially with the adjacent Glass Lofts residential development. [ 5 ] In fall 2010, the Pittsburgh Glass Center entered into talks with Pittsburgh Filmmakers / Pittsburgh Center for the Arts . [ 6 ] By May 2011, the talks had failed, with the Pittsburgh Glass Center withdrawing from negotiations. [ 6 ] In 2012, the Glass Center purchased residential housing adjacent to its main gallery space to be used as student and artist-in-residence housing . [ 7 ] By 2012, the center had a $1 million budget, with 10 full-time employees. [ 5 ] References [ edit ] ^ Jump up to: a b c \"About Us\" . pittsburghglasscenter.org . Pittsburgh Glass Center. Archived from the",
      "During this period, Pittsburgh also became a national model for community development, through the work of activists such as Dorothy Mae Richardson, who founded Neighborhood Housing Services in 1968, an organization that became the model for the nationwide NeighborWorks America. Activists such a Richardson shared the aim of Landmarks to rehabilitate Pittsburgh's existing built landscape rather than to demolish and redevelop. In 1985, the J & L Steel site on the north side of the Monongahela river was cleared and a publicly subsidized High Technology Center was built. The Pittsburgh Technology Center, home to many major technology companies, is planning major expansion in the area soon.[27] In the 1980s, the \"Renaissance II\" urban revitalization created numerous new structures, such as PPG Place. In the 1990s, the former sites of the Homestead, Duquesne and South Side J&L mills were cleared.[27] In 1992, the new terminal at Pittsburgh International Airport opened.[27] In 2001, the aging Three Rivers Stadium was replaced by Heinz Field and PNC Park, despite being rejected by voter referendum. In 2010, PPG Paints Arena, replaced the Civic Arena, which at the time was the oldest arena in the National Hockey League.[93]\n\nAlso in 1985, Al Michaels revealed to a national TV audience how Pittsburgh had transformed itself from an industrial rust belt city.[94]\n\nPittsburgh today",
      "to 3 p.m. | Museum Activities\n\nAdmission\n\nAdmission is $10 for adults and free for kids, thanks to the generosity of community sponsor UPMC and UPMC Health Plan . Admission includes access to all activities, including the author presentation. The tea party is now SOLD OUT. The tea party and the author presentation will take place in the museum\u2019s Mueller Center on the fifth floor. The paper-doll making activity will take place in the museum\u2019s Multipurpose Room, located inside Discovery Place on the third floor. Reserve tickets\n\n================================================================================\n\nURL: https://www.heinzhistorycenter.org/event/history-uncorked-2025\n\nTITLE: Events for March 2025 \u2013 Heinz History Center\n\nCONTENT:\n\nEvent Calendar\n\nMarch 12\n\nGut Yontif: A Patchwork Holiday Experience\n\nThe Heinz History Center\u2019s Rauh Jewish History Program & Archives will celebrate the Jewish holiday of Purim with a one-night only, participatory experience that blends hand-crafted art and tradition. Tickets Required\n\nMarch 15\n\nNational History Day Pittsburgh\n\nJoin the History Center for the region\u2019s National History Day competition. March 16\n\nMarch 22\n\nAmerican Girlhood: A Window into History\n\nCelebrate the joy of girlhood during a multigenerational celebration of storytelling and history. March 29\n\nVietnam Veterans Day 50th Anniversary Commemoration\n\nJoin the Veterans Breakfast Club on National Vietnam War Veterans Day. April 5\n\nVintage Pittsburgh\n\nOld is new again at the Heinz History Center\u2019s 11th annual Vintage Pittsburgh retro fair! April 28\n\nSpring Educator Open House\n\nExplore the museum and learn about History Center teacher resources. June 5\n\n32nd Annual History Makers Award Dinner\n\nSave the date! ================================================================================\n\nURL: https://www.heinzhistorycenter.org/event/national-history-day-pittsburgh-03152025\n\nTITLE: National History Day Pittsburgh - Heinz History Center\n\nCONTENT:",
      "City of Pittsburgh 414 Grant St. Pittsburgh, PA 15219 (Accessibility entrance on Ross St.) View on Map 412-255-2621\n\n## Compliment-an-Officer.txt\n\nIn This Section\n\nCity of Pittsburgh 414 Grant St. Pittsburgh, PA 15219 (Accessibility entrance on Ross St.) View on Map 412-255-2621\n\n## Zoning-FAQ.txt\n\nIn This Section\n\nThe OneStopPGH Counter is currently closed. All applications will start at the OneStopPGH online portal . subdivisions@pittsburghpa.gov: mailto:subdivisions@pittsburghpa.gov\n\nplanningcommission@pittsburghpa.gov: mailto:planningcommission@pittsburghpa.gov\n\nhistoricreview@pittsburghpa.gov: mailto:historicreview@pittsburghpa.gov\n\nMost building permits, which are issued by the Department of Permits, Licenses, and Inspections, require zoning approval , also known as the Record of Zoning Approval or ROZA, including those for interior renovations when changing the use of the structure. However, only some will require a site plan (new parking, additions, HVAC, etc.). See Site Plan Requirements for details. Please note: This document only covers work not requiring a Building Permit and/or a ROZA. A Certificate of Appropriateness may still be required for work on locally designated historic structures or structures in locally designated historic districts. Revised: 8/17/2020\n\nPlease note: This document only covers work not requiring a Building Permit and/or a ROZA. A Certificate of Appropriateness may still be required for work on locally designated historic structures or structures in locally designated historic districts. Revised: 8/17/2020\n\nPlease note: This document only covers work not requiring a Building Permit and/or a ROZA. A Certificate of Appropriateness may still be required for work on locally designated historic structures or structures in locally designated historic districts. Revised: 7/5/2019",
      "Use the hashtag #PghCCB to share your photos! In 1794, the newly formed Borough of Pittsburgh established a Public Market House in the current location of Market Square. Aside from creating the public market tradition that continues there today, this location was also home to the very first Pittsburgh Municipal Hall. As Pittsburgh continued to grow, so would the space required for government services. The Market House quickly became obsolete and the cornerstone of a new City Hall was laid at Smithfield Street and Oliver Avenue in May of 1869. The County, which first courthouse was also in this location moved to its current location on Grant Street in 1836. The Smithield Street City Hall would serve until the completion of the City-County Building in 1917. It would sit abandoned for 50 years before sold for a redevelopment in the 1950's. The first City Hall at Market Square. The second City Hall on Smithfield Street. Mayor David Lawrence strikes the first blow for the demolition of the second City Hall. In 1911, a City of Pittsburgh Commission was formed by unanimous resolution of Council for the construction of a new City Hall. The Commission, which by 1913 had been joined by the appropriate members representing Allegheny County, employed New York architect Cass Gilbert to arrange a competition for the design of a new municipal building. Of the 16 entries, the winning design was submitted by the firm Palmer, Hornbostel, & Jones of New York, who were represented locally by Edward B. Lee."
    ],
    "answer": "1999",
    "reference_answer": "The plans for the Pittsburgh Glass Center were changed from Elizabeth, Pennsylvania to Pittsburgh by 1999."
  },
  {
    "question": "What email address should I contact to opt-out of promotional emails from the Carnegie Museums?",
    "context": [
      "If you receive a membership promotion from Carnegie Museums, please make sure that the offer has not expired. If the offer is still valid, make sure that you are typing in the web address exactly as found on your offer. I received multiple discount offers from Carnegie Museums. Can I use them all at once? Only one discount can be applied per membership purchase. However, you are more than welcome to select which offer you would like to use. Will I receive renewal information before my membership expires? Your expiration date is printed on your membership cards. We will send renewal notices starting at least two months before your membership expires to give you plenty of time to renew. Please let us know about any address or email changes, so that you receive renewal notices. Update your information by contacting us . I already renewed. Why am I still receiving notices? Due to processing time, some materials will cross paths in the mail. This should end once you receive your card(s).",
      "the Internet generally and may lead to targeted advertising, visit the Network Advertising Initiative web site and the Digital Advertising Alliance web site . Options you select are browser- and device-specific, and there is no guarantee that these industry-provided opt-out tools will prevent all targeted advertising. As noted previously in this Policy, it is possible that certain third parties may receive information through the Services. Since some of these third parties may respond differently than Carnegie Museums to \u201cdo not track\u201d requests, you should consult the applicable privacy policies of those third parties for that information. Information Security",
      "Erin Kenavey Director of Human Resources 412-622-3180 KenaveyE@CarnegieMuseums.org\n\nJoan Kennedy HR Manager 412-353-4610 KennedyJ@CarnegieMuseums.org\n\nGeneral Reporting Principles\n\nAll complaints are investigated promptly, thoroughly, and objectively. Confidentiality will be maintained to the extent practical and permitted by law.",
      "Museum: Carnegie_Museum_of_Art",
      "Additional membership-level benefits may include:\n\nBecome a Corporate Member\n\nLearn more about membership levels and how becoming a Corporate Member can work toward your advantage by calling 412.622.5771 or email CorporateMembership@carnegiemuseums.org\n\nIf you are a Pennsylvania business, the Educational Improvement Tax Credit (EITC) program could be beneficial to you. By participating in the program, you would receive a substantial tax credit and impact the community through your support of Carnegie Museums of Pittsburgh. How does EITC impact our youth? EITC gifts help our museums provide innovative, informal education programming in the arts and sciences to as many as 10,000 public school students through virtual and in-person programs such as:"
    ],
    "answer": "Erin Kenavey Director of Human Resources 412-622-3180 KenaveyE@CarnegieMuseums.org",
    "reference_answer": "membership@carnegiemuseums.org"
  },
  {
    "question": "When was the first iron furnace in Pittsburgh established?",
    "context": [
      "Despite many challenges, Pittsburgh had grown into an industrial powerhouse. An 1857 article provided a snapshot of the Iron City:[31]\n\nSteel City (1859\u20131946)\n\nThe iron and steel industry developed rapidly after 1830 and became one of the dominant factors in industrial America by the 1860s. Scots Irish leadership\n\nIngham (1978) examined the leadership of the industry in its most important center, Pittsburgh, as well as smaller cities. He concludes that the leadership of the iron and steel industry nationwide was \"largely Scotch Irish\". Ingham finds that the Scotch Irish held together cohesively throughout the 19th century and \"developed their own sense of uniqueness.\"[36]\n\nNew immigrants after 1800 made Pittsburgh a major Scotch-Irish stronghold. For example, Thomas Mellon (b. Ulster 1813\u20131908) left northern Ireland in 1823 for the United States. He founded the powerful Mellon family, which played a central role in banking and industries such as aluminum and oil. As Barnhisel (2005) finds, industrialists such as James Laughlin (b. Ulster 1806\u20131882) of Jones and Laughlin Steel Company comprised the \"Scots-Irish Presbyterian ruling stratum of Pittsburgh society.\"[37]\n\nTechnology\n\nIn 1859, the Clinton and Soho iron furnaces introduced coke-fire smelting to the region. The American Civil War boosted the city's economy with increased production of iron and armaments, especially at the Allegheny Arsenal and the Fort Pitt Foundry.[33] Arms manufacture included iron-clad warships and the world's first 21\" gun.[38] By war's end, over one-half of the steel and more than one-third of all U.S. glass was produced in Pittsburgh. A milestone in steel production was achieved in 1875, when the Edgar Thomson Works in Braddock began to make steel rail using the new Bessemer process.[39]",
